id,author,rating,title,content,version,date,country,platform,vote_count
a5c3b8df-8590-4427-9cf2-eab512410556,Joi Poulin,1,,horrible app support! I have been trying to remove an old printer so I can get a subscription started for my new printer without being charged double for months now I keep having to go out and buy ink cartridges for my printer because instant ink won't allow me to change my email address or change my device I keep following their prompts and going in and doing what they tell me to do and it doesn't work I don't even have access to the email account that's listed for my old printer anymore!,20.2.0.6076,2026-02-04T20:15:28,us,Google Play,1
d073056d-e146-40fd-ae50-619b0913fa3e,Ganioul Pierre,5,,Really good,20.2.0.6076,2026-02-04T20:09:52,us,Google Play,1
6b8b200c-c0db-4404-9cd3-5e72bf86e8d7,MC Dowdy,1,,Worst printer setup. Just purchased this printer & and HP laptop. I'm ready to take it back. shouldn't have to jump through all these loops to setup a printer and/or laptop.,20.2.0.6076,2026-02-04T20:02:41,us,Google Play,0
566a2a37-f37e-4fb6-be34-a5d8d043382d,Christian Pembroke,5,,"great app for both printing and scanning, easy to use and navigate",20.2.0.6076,2026-02-04T19:53:15,us,Google Play,0
2cd36fca-226d-4b05-b4de-7451b373c1f0,Curtis Thompson,1,,app and support are garbage. along with printers. stay as far away from HP as possible. they are just out to fleece you of your hard earned money.,20.2.0.6076,2026-02-04T19:20:28,us,Google Play,0
00d494bf-02e1-46e5-8c7c-c8c71819224e,robert warren,1,,"HP Instant Ink is garbage. its like you don’t actually own your printer anymore.. HP controls how much you can print and charges you extra if you go over some made-up limit. If you cancel, they can disable ink you already paid for. That alone tells you it’s about control, not convenience. Terrible deal for anyone who prints occasionally. I’ll never buy another HP printer again.",20.2.0.6076,2026-02-04T19:02:35,us,Google Play,0
d3b21c7e-5770-45a4-a94f-3ea5354d30e1,Jack Moon,1,,"Utterly unusably terrible in almost every regard. Fails to connect, interface is awful, can't be used after hours of attempts, if you make it work do not ever touch it because you'll never get back to that point ever again. Garbage. Buy something else.",20.2.0.6076,2026-02-04T18:20:44,us,Google Play,1
4a530ee6-04af-47ef-b61a-d6d4e2a11ddc,Melissa Ward,1,,not working,20.2.0.6076,2026-02-04T18:00:51,us,Google Play,0
5ca0d022-9b1a-42d1-b5c2-885f0e8c2e34,Tim Winslow,5,,"Never thought I could send a fax from home, this is a great app.",20.2.0.6076,2026-02-04T17:52:57,us,Google Play,0
8592346a-7660-4ceb-9417-1d30a3876506,Sarah Dilts,1,,"update: yet again another problem with the app and the freaking printer. Had to pay for the printer and pay for the insta ink and the thing only work when it wants to. They will gladly take you money though... this app is useless. I've been trying for almost a week to print 2 pages and the damn thing can't do it. keeps telling me that it's printing and that it ""finished"" but nothing comes out of the printer.",20.2.0.6076,2026-02-04T15:51:13,us,Google Play,129
8bdce575-1f59-4f17-a777-f4585f381325,Kunal Gandhi,1,,worst app and features. can't understand how a company like HP is still in the market.,20.2.0.6076,2026-02-04T14:58:42,us,Google Play,0
8d7f9f77-da84-4011-b795-e56cd07ec8ff,Dmitry Demin,1,,The app is basically useless without an account,,2026-02-04T13:36:18,us,Google Play,0
eb5db142-3d3f-44c5-abe4-2362f520e34b,Indicationleft,1,,"END TO ANTI CONSUMERS AND BIG CORPORATIONS LIKE HP! How dare you start a service where you cant really own the printer, you cant own the ink always asking people to buy and subscribe. what a bs printing place. I hope FTC brings you down. for those wondering watch on YouTube business insiders owning nothing is expensive. BIG SCAM OF A COMPANY SHAME ON HP.",9.6.2.3732,2026-02-04T13:22:20,us,Google Play,0
e0c1cd39-3d93-4004-af93-8c68f6514184,B.A. Baracus,5,,great app,20.2.0.6076,2026-02-04T12:48:54,us,Google Play,0
39234a46-c402-4fbd-a50a-d76e66726433,Paul B,2,,try it very good,20.2.0.6076,2026-02-04T11:58:11,us,Google Play,0
7f138cec-6aaa-4f1e-b650-9c912acec0c7,Vuyo Ninzi,5,,I love it although it sometimes takes a while to connect the printer to the device during the setup,20.2.0.6076,2026-02-04T09:26:58,us,Google Play,0
7266f44a-39dd-4e49-8422-81e400ce2084,Shelly Whitaker,5,,"The App allows fast, convenient access to faxing from any location.",20.2.0.6076,2026-02-04T03:13:01,us,Google Play,0
1f240c4b-fba6-4038-a823-7f0d916d7dbf,binay kumar,5,,Very useful and easy to use.,20.2.0.6076,2026-02-04T03:08:35,us,Google Play,0
f1e6645b-acc8-4ace-b161-edd8dd19bdee,Juan Bonilla (Tony),2,,is hard to print out from email and file,20.2.0.6076,2026-02-04T01:37:40,us,Google Play,1
b9993f9b-42e2-4e68-9b48-b09ae1780455,Nick Lanser,1,,I can't find promo code and printer is stuck on the qr code.,20.2.0.6076,2026-02-03T22:44:38,us,Google Play,1
a35f102e-47cc-4889-bebb-7667b47bf15b,Ojuolape Smith larry,1,,can't find what I want,,2026-02-03T21:59:39,us,Google Play,0
2ab93367-118f-4aae-9da9-ceb11ef8d573,Emily Johnston,1,,the print que is unavailable in the app unless you get a notification meaning I cannot manage what I am printing. this is driving me up the wall.,,2026-02-03T20:07:49,us,Google Play,1
cbaa245c-e73b-4db5-9745-6cf2abe36e5b,Jayra D.C,1,,"Got taken to a different app that wasn’t even part of HP, this is what charged my account back in 2024 and HP won’t investigate claiming they got nothing to do with it, now I have a printer I can’t use because since it’s been more then a few month of no service I can’t reconnect my account and am really mad about this BS  google *smart print ai g.co/helppay#, ca, us 34.99 stolen by some scammers using the HP app I had down loaded on Google play and even Google play won’t refund my money either",18.10.0.5530,2026-02-03T19:57:17,us,Google Play,1
cf56a20e-89c0-44ed-96e7-04c32087b7e0,Yanik Eggenschwiler,1,,HP Smart ist nicht Linux fähig.,20.2.0.6076,2026-02-03T19:49:44,us,Google Play,1
6ed4abb0-befb-4009-8d98-cb20e5bfbc3b,Tom Robinson,1,,"runs you in circles, doesn't help in any way",20.2.0.6076,2026-02-03T19:46:38,us,Google Play,1
37f27030-3b4f-4b96-9260-69a0d747ed37,Joseph Faulkner,1,,can't get in,20.2.0.6076,2026-02-03T17:10:22,us,Google Play,1
939f4a54-d04b-451b-b885-c073ec477341,F Jones,1,,The printer refuses to work. Frustrating. Can you tell us why?,20.2.0.6076,2026-02-03T15:59:20,us,Google Play,1
530f26fd-0c61-427e-b095-233b002e25ec,Abraham Tafavoti,1,,"It doesn’t work at all, which is honestly surprising. The previous app was far more efficient—at least for me. With the Wi-Fi–enabled MFP4103fdw all-in-one printer, it just doesn’t work. Very frustrating. Even HP doesn’t seem to read user feedback or take any action.",9.2.0.70,2026-02-03T15:28:32,us,Google Play,1
ddea4381-9556-48b8-ba94-f845f3e6f239,Christopher Gallatin,1,,"Poor execution. I see they spent more time on selling their services and not making the app work properly. I will be getting rid of my HP printer, which means I won't be buying their ink anymore, and move to a different company that focuses on being able to print from any device.",20.2.0.6076,2026-02-03T15:21:36,us,Google Play,1
4a61e8cd-843f-4592-813c-460edea0b3b7,indu sandeep,3,,my printer sreen shows 00 is it normal,20.2.0.6076,2026-02-03T13:54:54,us,Google Play,1
05c93ab7-21fa-43c4-b8bd-eb35f1b7721e,Aɢɴιυѕ,1,,can't print anything without account,,2026-02-03T13:35:31,us,Google Play,1
a7faa7a5-5680-4a21-a8e5-dede9bf6e594,Con Brod,1,,"up to date app and can't sign in apparently has issues with chrome and android they suggest you download Firefox, maybe fix the issue just a thought.",20.2.0.6076,2026-02-03T13:18:04,us,Google Play,1
df247bf4-ebf4-480d-926f-6d76d1829906,Dale Brown,1,,simply awful can't complete set up you get to a page mentioning HP+ you can't scroll down the page to continue and if you exit then attempt to continue set up it won't load .,20.2.0.6076,2026-02-03T13:15:42,us,Google Play,1
dcdad6b4-c8e5-4924-9746-3e9ca2b6cbd8,Nev Haskins,1,,having a copy limit of 5 is stupid especially if your claiming some of these printers to be for small offices,20.2.0.6076,2026-02-03T13:04:48,us,Google Play,1
a0113d44-77ab-43d2-a3b8-64802e03835e,ܔRamij - Mondal__Official,5,,best application,20.2.0.6076,2026-02-03T12:58:19,us,Google Play,0
a31c702f-993f-4ad3-86dd-2c3b69210a36,L,5,,"camera scan is great, especially when my real hp scan wont work. hp sucks.",20.2.0.6076,2026-02-03T12:57:27,us,Google Play,0
530858be-b2da-4cb9-95c7-7ba76d9828ab,Timm,1,,It was Impossible to set up a m140w by wifi on both the android app and windows app. I experienced so many different error modes and randomness that i have to wonder whether hp had this junk put together by an LLM. The Android app sometimes does not detect the printer at all (until you force restart it). Sometimes its just fails during device config (saying use the windows app instead). Windows app requires location services which is disabled via policies. Never again HP junk,20.2.0.6076,2026-02-03T12:01:36,us,Google Play,0
b6e0832e-b897-4ff8-9348-b379ea2455e9,Heather S,1,,my brand new printer has yet to print for me however I have a bill for excess copy usage!! many failed attempt's with support and troubleshooting!!!,,2026-02-03T11:19:58,us,Google Play,1
f6670f28-b10a-4e51-81b9-7093eb0e2c0d,Ivonna-Alicia,5,,Very essential,20.2.0.6076,2026-02-03T06:53:07,us,Google Play,0
ccb92d06-801f-4dbe-b06d-dcf928dd8873,Sayyed Faizan Hussain,5,,best of all,,2026-02-03T05:31:47,us,Google Play,0
cd629933-a1b1-447b-b7bb-898fc21a5409,Nate Pollard,1,,"constantly prompts you to rate, which interrupts work all the time great app.",20.2.0.6076,2026-02-03T04:09:49,us,Google Play,1
91c6724b-6abe-40a9-aa57-d5165e0a6afb,ELIZABETH BOEHMER,5,,quick efficient and effortlessly easy to navigate app.,20.2.0.6076,2026-02-03T03:43:33,us,Google Play,0
c2d06d2d-32e1-4ee7-b678-840022972df6,Josh Frifeldt,1,,"I have never in my entire life felt more frustrated or exhausted trying to set up a printer. HP printers are actual garbage. Just save yourself hours of pain and buy something else. If you did buy one and unfortunately can not return it just buy a cable to plug directly into your computer. Absolutely the worst. Update: I solved the ""Hold information button"" problem. HP app lies to you directly and has chosen to make it's app like Dark Souls makes it's enemies. You have to tap it and not hold.",20.2.0.6076,2026-02-03T01:23:09,us,Google Play,2
e8b29371-bd8b-4d5f-8177-b004febd26e1,Jason Bowen,5,,great,17.20.0.4770,2026-02-03T01:03:20,us,Google Play,0
7dda5772-21f6-4c44-ac7c-6d3aa8316d5d,Judith Bock,4,,HP keeps telling me that I am not using their print cartridges. I want to continue using my less expensive ones.,20.2.0.6076,2026-02-03T00:34:02,us,Google Play,0
42f20ef9-ded8-4915-b397-6bf0aec84695,Gary Stein,1,,"The whole app is totally illogical. Nothing works simply or in a straightforward manner. The third fax I sent included the previous two from fax history. To quote Froderick Frankenstein, this app is doodoo!",20.2.0.6076,2026-02-03T00:24:23,us,Google Play,1
b199b204-0eb5-43f6-af27-f95af04b4e74,Joni Spiro,5,,Excellent Service ⭐️.,20.2.0.6076,2026-02-03T00:03:44,us,Google Play,0
867ac3e1-1020-43ba-afe6-29b3f2f18130,mahogany Shields,1,,not faxing,20.2.0.6076,2026-02-02T21:32:14,us,Google Play,1
1e71208b-b161-4d09-a97f-9ce71b2f7ff9,Carissa Reyes,1,,WORST PRINTER AND SERVICE I'VE EVER EXPERIENCED. NEVER BUYING OR PROMOTING THIS COMPANY'S PRINTERS EVER AGAIN. The ink is ridiculously expensive. The quality is inconsistent. The demand to make sure ALL ink cartridges remain full to complete print jobs is unreasonable. The subscription is not worth the price and deliveries do not come on time. The time and resources required for this printer to operate on a basic level are wasted on this company. Zero stars would be a more accurate rating.,20.2.0.6076,2026-02-02T21:02:03,us,Google Play,1
b482b1f6-a796-44b5-9672-4bded1a01714,LaTanyia Williams,1,,trying to install this printer is impossible.,20.2.0.6076,2026-02-02T20:53:27,us,Google Play,1
6c6c6789-da2f-4bcc-8976-59b5d1ddcc29,P,1,,HP customer service representative could not answer my question and then hung up on me. My new printer- smart tank 7602- could not connect via Wi-Fi. yes I could not use it at all HP representatives were not helpful and not honest about this problem. I tried numerous times to reboot and reinstall and call customer service twice seller never worked.,20.2.0.6076,2026-02-02T19:34:45,us,Google Play,1
23126475-5f17-4df3-bf17-779916324ccc,shaan kastuar,1,,literally always disconnects. app crashes on my pixel 9. need to repair every time. takes an hour every time I need to print something. garbage product and app,20.2.0.6076,2026-02-02T18:58:18,us,Google Play,1
eb05b843-839f-4644-b581-d908c46e5861,Sandra McMullan,1,,absolutely rubbish that you only can print pdf!!,20.2.0.6076,2026-02-02T18:39:58,us,Google Play,1
4f600646-42af-4348-bcdd-2ec0f8b52de8,Peytrienna Davis,5,,"It is good, but I can't get my printer set back up with my Chromebook.",20.2.0.6076,2026-02-02T17:53:56,us,Google Play,18
d69c292a-6e47-4444-be35-8127f0aaf003,Dorothy Patton,5,,great so far,,2026-02-02T16:54:17,us,Google Play,0
23119378-7374-4ca9-9bc9-a54916ac1544,Valentine Scott,3,,A comfortable performance but exhibit difficulties with more than one air attachments.,20.2.0.6076,2026-02-02T16:23:00,us,Google Play,0
3fe4c43e-fb41-4988-ae6d-ae38f9c98934,Ahleizah Moore,1,,fax is never working correctly,20.2.0.6076,2026-02-02T15:05:01,us,Google Play,1
5d60cac8-6930-42a8-b0aa-9f7dc7423625,Lindy Lou Schwarze,1,,soo temperamental,20.2.0.6076,2026-02-02T12:54:07,us,Google Play,1
e6ec260e-5804-456e-ad6a-c6a56c94c76b,Brendan McGrath,5,,Simple to use and great value for money,20.2.0.6076,2026-02-02T12:50:54,us,Google Play,0
c2c0f9f8-1551-4a14-b926-54420aebd8ed,Dariela Escobedo,1,,"it never works. it's very annoying, really.",,2026-02-02T12:45:21,us,Google Play,1
688fbbb0-c456-45c0-9892-48305e884174,Vijay Verma,5,,very nice printer 5*,20.2.0.6076,2026-02-02T12:27:06,us,Google Play,0
449cbb4c-779f-4600-8539-adacc1fffdb6,Calvin Marriott,4,,Great app very helpful.,20.2.0.6076,2026-02-02T11:56:29,us,Google Play,0
1c09ec11-c411-47f1-947e-1523528ad32a,V vv,1,,doesn't work,20.2.0.6076,2026-02-02T10:59:01,us,Google Play,1
721d607a-935c-4083-bbb6-6776a1456f12,Alexander Mack,1,,"The worst piece of software, getting worse over time. From regularly loosing connection (showing printer offline), over switching paper formats, not being able to scan either despite showing the printer online, until sending a document to the printer for printing, just not doing anything then ""preparing"" and stopping without any indication what the problem is... And all that ""functionality"" for an annoying push to register, data collection and other stupid useless nonsense noise.",17.20.0.4770,2026-02-02T08:46:20,us,Google Play,2
3cf054aa-16e3-413e-8e8c-504052346aa0,Carol Bentley,5,,easy to use with plenty of print options,20.2.0.6076,2026-02-02T08:38:43,us,Google Play,0
e804277e-4569-4a71-8091-f256c6cb63bc,Joshua Allen,1,,"won't let you print without creating an account, and then after making an account it has technical problems preventing it from printing.",20.2.0.6076,2026-02-02T03:43:49,us,Google Play,1
d86349b1-528a-4033-85de-8d864389425a,Heri Triwidiantoro,3,,"I have trouble after update the newest HP mobile app. My printer always ""not connected"" if open from Internet. Previously everything is OK and great.",20.2.0.6076,2026-02-02T00:51:58,us,Google Play,0
6b833c87-9fa3-4af7-a270-ffb24d151ff2,Leroy Jaramillo,1,,unable to get it to work. spent hours trying,20.2.0.6076,2026-02-01T22:59:43,us,Google Play,1
278bec2b-9659-4398-a528-8a467449604e,Eman Jum (Emi),5,,★★★★★,,2026-02-01T22:09:38,us,Google Play,0
f4b3e8b4-3819-43af-aa1c-c46fc90d50e9,Stephanie Weis,1,,"worst printer ever. I typically print from both my Samsung phone and my HP laptop, and I have the worst time printing from my phone. The printer takes up to 1 hour to print anything from my phone. I have gone through all the troubleshooting steps, uninstalled and reinstalled, cleared the cache, and nothing works. I have every plug-in app as well, without resolution. Tech support doesn't help because they can't chat with you while also using the app. Tell me how that makes sense. Going in 🗑️.",20.2.0.6076,2026-02-01T18:55:12,us,Google Play,132
b51e72ad-3c59-4c5a-b876-a23645e39d18,shahira hordijk,1,,worked fine first. now when i open the app it says loading in progress. for three days now i try to print out somthing for my sons school i reinstalled the app aboud three times now bud still same problem. i dowloaded hp smart app bud you have to pay for it. and me na pay for using a printer that i bought. HP used to have such a good name bud i am very disappointed now,20.2.0.6076,2026-02-01T15:07:42,us,Google Play,1
1e0fcc50-1347-4b40-9fc8-eb59f55a1806,Deb Loy,1,,No easy way to update your wifi connection if you change providers. This is ridiculous because it's a common occurrence.,,2026-02-01T13:12:46,us,Google Play,1
1e387638-27e9-4e7a-9e9d-d632283672b3,rose london,3,,"Sometimes it works well sometimes it doesn't because it needs wifi,a cell phone AND and hp account. I hate that it needs all 3 on order to work properly. I will not buy a product with those requirements again.",20.2.0.6076,2026-02-01T13:00:11,us,Google Play,1
ddd0eed1-e0cc-42b7-83e7-9a27ab7c94e5,J M,1,,make more paper size option or edit paper size on app.,20.2.0.6076,2026-02-01T12:57:07,us,Google Play,1
5d8ac034-9190-4a6b-9575-b8005fa5635a,morena madupe (King),5,,it's the best,20.2.0.6076,2026-02-01T12:12:52,us,Google Play,0
9ff1ef9c-4bfa-4e0f-bc0c-094ddff7c515,Shrikant Kumar Ravi,5,,very good,,2026-02-01T11:58:24,us,Google Play,0
744341a2-4500-4d32-926b-c0a07aa1b02b,Marvin Marcos,5,,"Excellent Printer, intuitive and easy to use controls. Best printer for its price.",20.2.0.6076,2026-02-01T08:25:35,us,Google Play,1
3f78ed42-53b3-4914-a9af-1bdfaeb2e8c5,Joey Jermer,4,,works good,20.2.0.6076,2026-02-01T01:24:06,us,Google Play,0
80534bc0-de67-48c2-8970-1b64a8de6d13,Leila Phelps,1,,May or may not work...you never know! sure can't count on anything except being billed for ink and pages not used because it doesn't work 75% of the time! constantly pressing to buy a new printer because they no longer support the one you have! update: nothing but WORSE! I'VE PAID FOR A LOT OF INK THAT I'VE NEVER BEEN ABLE TO GET OR USE BECAUSE NO MATTER HOW MANY TIMES IT SAYS ITS WORKING....IT'S NOT! I'VE PUT MY CODE NUMBERS/ PASS WORDS IN MULTIPLE TIMES...ZILCH! NADA! NOTHING! NO PRINTING!,20.2.0.6076,2026-01-31T23:11:10,us,Google Play,1
648c591f-43ca-4219-a00d-013bba0e7b58,Renee Dillon,5,,good,,2026-01-31T23:03:01,us,Google Play,0
470a0691-9d48-4b60-89fa-6d5ee85fe2d4,Ethan Hart,1,,Total trash; wasted loads of time getting my printer set up.,20.2.0.6076,2026-01-31T21:23:38,us,Google Play,1
6fdd205b-b916-425a-842a-503f4e25eb6d,Serge Meloche,5,,good,17.30.0.4993,2026-01-31T20:20:27,us,Google Play,0
e65d100e-c06f-4ed8-82e3-7e045f35fc12,DTM_Panda,1,,"This app is a complete waste of time, I brought a HP deskJet 2910 to help me print my policies and contracts for my company and found out that I can't install this app onto my chromebook because it's incompatiable, i need to get a 2nd ethernet cable and hopefully do it that way since my main office computer hasn't got bluetooth installed but to think that for anyone who wanted a printer, this app would be available for all devices right, i tried to use this on mobile but even on mobile i can't.",20.2.0.6076,2026-01-31T20:05:51,us,Google Play,4
a0bdd84c-22ae-46e8-b0ca-c2582eef0472,Ashley Lopez,1,,this printer is always dropping connection and god himself couldn't connect back to it I hate this printer this app worse possible investment but it definitely makes sure it takes out its monthly subscription payment with no problems,20.2.0.6076,2026-01-31T19:33:05,us,Google Play,1
dfb73d94-5b04-4863-9d6c-34433852e15f,Alfredo Maldonado,5,,Great printer app and tools,20.2.0.6076,2026-01-31T18:18:36,us,Google Play,0
ba1ba841-c134-48da-9945-520bbaf9e8ed,SeAnne Woods,2,,print takes hours to print remotely,20.2.0.6076,2026-01-31T16:27:41,us,Google Play,1
3cb7bde2-aa26-4b75-945a-cfbc9ceb34d8,Gábor Vincze,1,,"Without an online account is it good for nothing. No scan, no copy, even your printing will go through the HP servers.",20.2.0.6076,2026-01-31T11:39:14,us,Google Play,0
af01d375-25ad-4cf3-bd40-df4b1f7e8674,Shaly Shaly,5,,Wow Nice experience with this app 😍👏,20.2.0.6076,2026-01-31T06:36:31,us,Google Play,0
dbc9831a-59c9-4e41-a81c-f387ae4fd5f0,A Google user,5,,good,20.1.2.5988,2026-01-30T22:47:30,us,Google Play,0
f20859a9-0922-48d5-8fb1-69ed97369af4,Darlene Harris,1,,don't like it. I can't print from my phone now.,20.2.0.6076,2026-01-30T19:30:19,us,Google Play,0
0a6f0aa8-70d1-4d62-b719-d53d0ed84865,Amy Gabbert,1,,"When it prints, it's ok! Usually I have a connectivity issue and nothing prints. It locked me out when I bought generic ink refills. I had a subscription for a time, but did not appreciate being told I was printing too much. Why did own a home printer if it's often useless???",20.2.0.6076,2026-01-30T19:22:22,us,Google Play,0
49f0ec16-8c97-4fdc-b2d0-adb48a36a730,Gary Bilton,1,,"So far, completely useless. after a couple of introductory screens just goes to a blank screen (Samsung phone and Tablet) Recent reviews suggest the app is broken. shame as the printer appeared half decent. Printer returned. I should have checked the app reviews before purchase",20.2.0.6076,2026-01-30T18:23:54,us,Google Play,0
10446a28-387f-48ec-b27e-29311cb4c345,Angie Cornell,5,,super easy once you find the right area to go to (needed to scan to phone),20.1.2.5988,2026-01-30T18:09:08,us,Google Play,0
9d88c0a4-dbd2-4ad1-b898-65f91af980a4,Brendan McCabe,5,,"I found it difficult to setup. Once successfully installed it is excellent. January 2026, after changing the modem and new password, the printer and the app don't recognise each other. I am at this now for 4 hours and have decided to delete the app. 🤔",20.2.0.6076,2026-01-30T18:08:28,us,Google Play,9
2578ecf7-317a-4fc6-903b-d8a09c3e53bd,Luisa Galindo,1,,"BAD APP, it won't even open and I've uninstalled it 3 times already. NOTHING. I AM NOT HAPPY WITH HPs printers anymore, they used to be so much better ten years ago. They are getting worse to setup and connect and keep connected & reconnect to the internet. And the ink runs out too fast, then it starts streaking and stops printing even though the you've replaced the darn ink. But yes, this new app won't even open, at least the hp smart app would open up, geez! And this is happening when I need!",20.2.0.6076,2026-01-30T18:05:34,us,Google Play,103
76db8bd5-cb83-484b-88ea-14bdeddca50d,Dub Williams,1,,"Not sure what's going on but I'm trying to open the app and all I'm getting is a blank white screen...and yes, I've closed tasks/apps, reset phone and checked for updates. Please help!",20.2.0.6076,2026-01-30T17:58:46,us,Google Play,0
29972f70-90e8-48a0-b61a-94cf2317edbf,Preeti Kasturia,1,,does not work even after uninstalling and reinstalling multiple times.,,2026-01-30T17:56:30,us,Google Play,0
a7671551-2a1d-481c-929a-33737d02db4c,Dawid Opalka,5,,great help with the office,20.2.0.6076,2026-01-30T17:55:33,us,Google Play,0
3a32fb12-b3aa-4e41-8812-2329c05b8010,Andrew Sargent,1,,won't open,,2026-01-30T17:53:36,us,Google Play,0
731fb7be-52c2-433c-a799-d914fff1cdf4,Mytreal Triplett,1,,"Updated app now it won't even work, literally just a blank white screen. Absolutely terrible",20.2.0.6076,2026-01-30T17:52:01,us,Google Play,0
7b6386ee-2abd-4418-b64a-05df3c16ca71,xTiffanyx,1,,The app is broken. Nothing even pops up anymore even after the update. Fix it!,20.2.0.6076,2026-01-30T17:37:19,us,Google Play,0
e1bd3205-989d-4a21-a790-43dec0a90290,Jennifer Foster,1,,Downloaded the app. App wouldn't load. Reinstalled it. Still didn't work. Finally uninstalled the useless app,,2026-01-30T17:28:40,us,Google Play,0
16d4d71a-5068-4f14-b568-b4856748267c,mtxn,4,,404 error on some printer's manual pages,20.2.0.6076,2026-01-30T15:52:26,us,Google Play,0
6fef3394-b034-4327-afd5-11a1a31abd63,Candy tulipano,1,,terrible will not let me fax this thing has a mind of its own I don't think I will be buying another hp,20.2.0.6076,2026-01-30T15:38:56,us,Google Play,0
5025fc4b-b136-4797-a7f5-6800b9e1a4ed,kishore kumar,1,,"completely irritating application. never expected this kind of service from hp. It literally always shows something went wrong, this error is so common that the customer support made a video on this mentioned same error. but still the error continues, better the tech support works on this in solving this error, app is dependent on browser, it would be good if it is made a complete application instead of depending on the browser",20.2.0.6076,2026-01-30T12:14:33,us,Google Play,0
6a1c9b7f-22af-4985-9b68-ae3cf831c787,Hafiz BahaUdDin Ch,1,,"worst app, compex system to connect. asking to turn on location which is already on. so you can not use your printer due to their error and shity app. just making things complex. i am gonna sale my new printer just because of their system and poor connectivity",,2026-01-30T11:21:12,us,Google Play,0
