id,author,rating,title,content,version,date,country,platform,vote_count
5b24814c-7077-4fa8-a08c-0fa6e805b02b,Jorge Ricardo Miguel,5,,Excelente y muy fácil de usar y configurar. Lo que faltaría es poder cambiar el tamaño de fotos y documentos,26.1.2.6449,2026-05-08T23:52:33,global,Google Play,1
bb9f7807-6904-4917-9476-5d626835255d,Charlie Williams,3,,new,20.2.0.6076,2026-05-08T23:12:20,global,Google Play,0
a90df537-f33c-46b2-954c-a44543106a45,Elizabeth Avila,5,,Excelente !,20.2.0.6076,2026-05-08T22:59:33,global,Google Play,0
ffd10b83-49b7-4107-acc9-8c44d06b9868,Uwe Peter Weu,5,,funktioniert zuverlässig,26.1.2.6449,2026-05-08T21:55:07,global,Google Play,0
3408bafe-6846-416e-8bca-2b626f931246,Danielle Fries-Stafford,3,,"There used to be an option to customize the size of your photos, in case you had something like a locket you wanted a photo for. That option isn't available anymore and I want that option back.",20.2.0.6076,2026-05-08T21:53:38,global,Google Play,0
472e325c-f51a-436e-9d0f-6d13aa34f2d8,Danny Marsh,5,,great,26.1.2.6449,2026-05-08T21:30:22,global,Google Play,0
852df6e2-4a85-426c-898b-2cc658321c6f,Alvaro Pisani,1,,muito ruim. comprei ontem e amanhã vou devolver a compra.,26.1.2.6449,2026-05-08T21:19:37,global,Google Play,0
7cb069ab-a0c1-4b85-b403-9be5c1e0a4ca,Gábor Bilicz,2,,"Error connecting to server, old-school app.",26.1.2.6449,2026-05-08T20:38:20,global,Google Play,0
53e96520-c004-47ba-9de2-f7ffec959960,dragonloverlord,5,,works as intended.,20.2.0.6076,2026-05-08T20:20:14,global,Google Play,0
6a0bde4a-a20d-45b2-9fa0-b8b070820faa,Dee Showstopper,4,,Great,26.1.2.6449,2026-05-08T18:25:30,global,Google Play,0
7d7a3fc7-09c7-4011-94b4-dcbd6f3c9a13,Alex,4,,In general good app. But why there is no option for scaling? Only full page or fit the page. No option to print on half of the page or 2 pictures on one page.,26.1.2.6449,2026-05-08T18:16:25,global,Google Play,1
92a38f84-a0b5-469c-bba5-85da9150a07a,Otto Bruno Schmidt,1,,Ich wollte eigentlich Drucken und habe gelernt das mein Kugelschreiber wertvoller als ein HP Drucker ist.,20.2.0.6076,2026-05-08T18:12:32,global,Google Play,1
c29b4389-14af-4ac9-8679-ec0af2f2075f,Alejandra Juárez,5,,Genial,20.2.0.6076,2026-05-08T18:05:54,global,Google Play,0
46a55bc3-d95f-49c9-ac08-06d478608b46,Tino Maurus,1,,"Dass ein Hersteller seine eigenen Fehlercodes nicht transparent aufschlüsselt oder der Support nur Standard-Skripte vorliest, fühlt sich in solch einem Moment tatsächlich eher nach Arbeitsbeschaffungsmaßnahme als nach Hilfe an. Nach dem ich das Wort Verbraucherzentrale erwähnte, lief eine Minute später der Drucker. Das spricht für sich. Dennoch nach drei Stunden HP-Suport gibt es einen Stern. HP sollte seine Mitarbeiter schulen, das erhöht die Akzeptanz.",26.1.2.6449,2026-05-08T17:45:43,global,Google Play,2
212a4e4b-776c-4c97-af22-8c862edec457,Cindy Poteau,5,,super,26.1.2.6449,2026-05-08T17:38:36,global,Google Play,0
f0cd82d3-c61f-4c24-aeaf-bc6c7ecbd635,Md. Nayem Arafat,1,,not working in scaning,20.2.0.6076,2026-05-08T17:19:02,global,Google Play,0
285cdd11-00ae-42d7-bd2c-7a890ec629cb,Nona Perriman,1,,hard to use,20.2.0.6076,2026-05-08T17:04:52,global,Google Play,0
c64c3279-3c42-4375-bd28-6316cfa9ff07,Jorge Pulgarin,5,,muy completa e intuitiva,20.2.0.6076,2026-05-08T16:38:03,global,Google Play,0
192173a6-dc26-4365-9c58-e6098b438937,A Google user,1,,doesn't open,,2026-05-08T16:18:44,global,Google Play,0
453cc52d-afd4-4e21-bcc0-36b417d031f7,Eric M,1,,instable. Depuis quelques jours au lancement de l'application un cercle tourne indéfiniment,26.0.1.6280,2026-05-08T15:46:58,global,Google Play,0
56fccd1e-3807-4ecc-8e9e-63fc7383d21c,Viky,1,,"if I could give less stars I will, I don't have an apple device, make this fully friendly and compatible with all devices, the setting of the printer took my hours is dumb, gets stuck through all the process.",20.2.0.6076,2026-05-08T15:29:10,global,Google Play,0
b05ce707-2fe7-48d4-8350-13de7e337289,s. moore,1,,it stop pulling up for me to use on my phone,26.1.1.6403,2026-05-08T14:15:45,global,Google Play,0
765b8985-6fd9-45c9-a9e4-ad533aa0a0c9,Ibrahim Salur,1,,"funktioniert nicht auf dem neusten Samsung, keine Verbindung möglich",,2026-05-08T14:02:37,global,Google Play,0
b8bfc1b9-2ec4-43e9-82e4-a0bd7992abfb,Wilco M,1,,wees verstandig en koop een printer met een kabel. Werkt voor geen meter. verschrikkelijk traag en erg onhandig. deze printer gaat retour of richting het grofvuil.,,2026-05-08T13:17:09,global,Google Play,0
637acbc9-a1b1-4c19-bb8f-f1437d42617c,Jade Batchelor,1,,doesnt work or allow me to print,20.2.0.6076,2026-05-08T13:04:40,global,Google Play,0
7c84d3cc-2494-49c2-a93d-fa1c93f7eff4,Gulasch,1,,"Warum ist das anmelden für drucken und scannen so ķompliziert, warum kann man nicht einfach Scannen ohne sich anzumelden",,2026-05-08T13:00:15,global,Google Play,0
72d91127-3b29-4ae5-8421-002df48687f8,Rohith Raghav,1,,worst app,20.2.0.6076,2026-05-08T12:58:58,global,Google Play,0
b1591368-aad5-408c-b81d-72180d104dc0,Bernard M.,5,,Nice scanning UX,20.2.0.6076,2026-05-08T12:22:43,global,Google Play,0
73a450c2-09f9-4c0d-989c-80564445db79,Lynn dugdales,5,,so easy to use,20.2.0.6076,2026-05-08T11:05:59,global,Google Play,0
3be3bc88-f9dd-4d2e-9ad9-000d84d46227,geremiasmota geremias_43@hotmail.com,4,,gosto muito. ótima ótima impressora,20.2.0.6076,2026-05-08T11:05:46,global,Google Play,0
278f62f5-93af-4559-aabc-78d14a0d86a3,John Greenwood,1,,just messed about all the time backwards forwards ridiculous,26.1.2.6449,2026-05-08T10:20:13,global,Google Play,0
de0eafa3-47d3-4fd6-a78b-b4a08137cd1c,Franz Bolkens,1,,"seit dem Wechsel von HP Smart zur HP App ist es so schlimm geworden, ich schmeiß den Drucker jetzt in den Müll und kaufe mir einen von einer anderen Marke.",20.2.0.6076,2026-05-08T10:08:06,global,Google Play,2
dc9956ac-79c6-4c59-8ae3-97321ec7d33b,Munawar Ahmed,4,,nice scan,26.1.2.6449,2026-05-08T09:00:42,global,Google Play,0
28716107-4a6f-43dd-874c-c720a7968f19,Rolf Sieber,1,,Drucken per App: Wahnsinn und Glücksache Nie mehr HP,20.2.0.6076,2026-05-08T06:55:36,global,Google Play,1
866983ba-8f7b-4e0b-9b41-260f8645edd2,Metallifux1888,1,,Garbage. The printer isn't available 99% of the time.,20.1.0.5822,2026-05-08T06:50:06,global,Google Play,0
58505158-78e4-4afb-adac-f28c493f05b2,Mau V Tavera,1,,The printing menu is bugged and it doesn't allow you to reach the box to select which pages you want to print or not,26.1.2.6449,2026-05-08T05:45:42,global,Google Play,0
c98e3342-11eb-4009-ba37-e90365460608,Pamela Pc,5,,Me parece excelente! práctica! facilita la vida,26.0.2.6338,2026-05-08T05:43:14,global,Google Play,0
f3b99bbc-33fb-412f-8912-e6a3cf40c37e,antua cruz,1,,pésima no se puede entrar no te permite usar tu impresora es un fraude,,2026-05-08T03:12:44,global,Google Play,0
73709623-1cb4-479b-8134-4d19f765ef31,Susana Paez,5,,I didn't have any trouble using the app.,26.0.0.6234,2026-05-08T02:20:32,global,Google Play,0
7cea4964-e4af-4f84-a42b-83db0ee9dea6,Lynn Welch,1,,sucks!,26.1.2.6449,2026-05-08T01:48:30,global,Google Play,0
5f369b5d-88e1-43f3-991e-e54ad4252880,John Humphrey,1,,It won't tell me the status of my printer!,26.1.2.6449,2026-05-07T23:39:18,global,Google Play,0
7910d6e5-e804-4e43-9156-925ac64491db,Diego Mota,1,,Muito limitado. não permite imprimir documentos do tipo docx,20.2.0.6076,2026-05-07T22:10:01,global,Google Play,0
f9487bbc-5c9a-4a1e-a04e-1654b3c6df12,engineer gaming,1,,imagina que la burocracia fuese una app seria esto,20.2.0.6076,2026-05-07T21:51:12,global,Google Play,0
59d203d8-b13d-4e40-bcaf-628de4e0773f,Eliza Davis,1,,scrappy,,2026-05-07T21:39:35,global,Google Play,0
0a116cce-7dc9-48b3-ba96-c1019d309390,ABEL DEL FABRO,5,,ok,26.1.2.6449,2026-05-07T20:54:35,global,Google Play,0
c13bff7e-96af-4246-a2b9-f747477787eb,Ioana Witty,1,,"Complete trash. No printer queue, random printing errors without explanation or troubleshooting. I honestly cannot tell if it's the printer or the app or just the sublime combo. Really appreciate wasting a couple of hours trying to make this work.",26.1.2.6449,2026-05-07T20:28:51,global,Google Play,1
078709ff-4904-4769-8afe-30843b46a0b2,Alisson David,1,,this is the worst app I ever used. How can you sell a printer with such a horrible printing experience?,20.2.0.6076,2026-05-07T20:06:35,global,Google Play,0
c012bd50-e6ab-4f16-9fd1-8ed02fd05dad,Jorge Fernandez,1,,imposible encontrar la impresora... en iPhone funciona a la primera,26.1.2.6449,2026-05-07T19:43:18,global,Google Play,0
7113b73e-6a5c-4772-a996-8f7033e98dfe,Shar Arancibia,2,,"cada vez funciona peor la aplicación.. no imprime y tarta muchísimo tiempo en conectarse. el internet funciona bien,pero la app cada vez funciona menos",20.1.2.5988,2026-05-07T19:24:36,global,Google Play,0
60dd1044-1db1-435c-8b1a-61e48a3ad4a0,Marta Ramos,4,,un poco confuso,20.2.0.6076,2026-05-07T19:19:27,global,Google Play,0
e215ba2d-aa5f-4d17-873d-c0a92e9661ae,Juana,1,,It never works. Can't even connect wifi thru this app.,,2026-05-07T18:07:27,global,Google Play,0
f524e99c-d6fc-4a29-93c6-c564f3041b95,Gloria Silos,1,,"Antes aparecia uma caixinha para desmarcar as páginas excluídas da impressão, porém agora alça de opções está cobrindo essa parte de excluir páginas e isso faz com que as páginas desnecessárias sejam impressas gastando papel.",26.1.2.6449,2026-05-07T18:00:59,global,Google Play,0
e94b5696-112b-4037-8886-5202579c2948,Clive Davenport,2,,"I'm not sure whether it's the app or the printer (envy pro 6432), but there are quite a lot of bugs. I very often need to restart the printer to be able to print or scan documents.",26.1.2.6449,2026-05-07T17:08:08,global,Google Play,0
00605524-3b7a-4b5d-a754-fb92e7e1be46,María Isabel Ramírez Gil,1,,"Me parece fatal que no haya version para chromebooks, siendo herramientas bastante comunes hoy en dia para el trabajo y los estudios.",20.2.0.6076,2026-05-07T16:50:17,global,Google Play,0
8fcfce15-28f7-4b8a-a892-f867d54cdf18,Peppers Todd,1,,poor reliability and a scam to make you buy ink,26.1.2.6449,2026-05-07T16:42:29,global,Google Play,0
ae522f05-93a8-42c0-88ae-56a50b535278,Michelle Baker,3,,at times.es not working to scan.,26.1.2.6449,2026-05-07T16:10:51,global,Google Play,0
7eda5acf-9fd4-4dcb-828d-e995adbb86f6,Alison Harding,1,,no idea why you would tell me this and then send more to the review page?,20.2.0.6076,2026-05-07T15:45:20,global,Google Play,0
a88809a9-e186-471e-8721-02d7a74e9454,Donna Cannon,5,,Works Great!,20.2.0.6076,2026-05-07T15:03:00,global,Google Play,0
613acc58-3df9-45ff-a014-4e6aa0d61a71,G P,1,,"NO FUNCIONA , QUIERE QUE CREE UNA CUENTA , ES INNECESARIO ESO.",26.1.2.6449,2026-05-07T14:02:30,global,Google Play,0
ba2967fe-c567-42cc-b683-fcdc2c8a3fe0,Jeff,1,,"This has to be the most offensive printer & printer app in human history. Setup process is clunky & non-working. Stalls on printer head installation every time. cannot even use on Chomebooks. Contacting support does nothing except frustrate you. 2 days and still unable to print. Subscription for ink is ridiculous. Doesn't even include a standard printer cable. HP is absolutely the worst printer manufacturer ever. I will never use again. Do not use or buy, you will not be able to print anything.",26.1.2.6449,2026-05-07T13:34:27,global,Google Play,0
e7bad248-3985-4158-8dbd-c6f38647e39a,BRAHMANAND KAMBLE,5,,hp printer 🖨️ and scan good working,26.1.2.6449,2026-05-07T13:32:07,global,Google Play,0
18e4df85-df4e-4c45-ae6e-ab29c82c30c7,GroundDwellerStudioS,1,,Basically useless: barely able to use it to help connect to wifi.,26.1.2.6449,2026-05-07T13:27:54,global,Google Play,0
b38e389d-9d8f-47bf-a303-fec64454fd51,Domingo Jesus Del Hoyo,1,,"una asco de impresora y de aplicación, se bloquea, se desconecta, poco intuitiva y sin capacidad de resolver problemas. No me vuelvo a comprar una HP en la vida",26.1.2.6449,2026-05-07T12:04:02,global,Google Play,0
8db93915-18b8-463f-94d7-d38c8c4d28a7,Adri Fago,2,,"non riesco più a collegare la stampante col PC, cosa succede?",20.2.0.6076,2026-05-07T11:26:13,global,Google Play,0
a1997bf7-7ab2-4ea5-b350-ce29c96f660c,Miguel Goncalves,3,,Well though out but painfully slow and fails at times. It's a wasted marketing opportunity to show off HP servers...,26.1.2.6449,2026-05-07T11:20:04,global,Google Play,0
84fb2a41-ffe1-4940-9ce0-7ca6d5711ef8,Pierre Dudouyt,5,,impeccable,20.2.0.6076,2026-05-07T11:07:19,global,Google Play,0
04b2deab-c7ab-42e8-8920-b9450dee1e70,Andre Bertrand,2,,"Problème pour s'inscrire sur l'application. La connexion rame, la double authentification ne passe pas, le temps de rechercher le code de sécurité vous êtes déconnecté et il faut recommencer la connexion au début et vous tourner en rond.",20.2.0.6076,2026-05-07T11:05:38,global,Google Play,0
a3286358-1c04-4f02-a8bf-422336a406fd,memo00o,1,,"Eine App die man nur installiert um sie schnellstmöglich wieder deinstallieren zu können. was ein unübersichtlicher unfunktionaler Schrott. WiFi direct, air print, Energieeinstellungen anpassen und den Drucker vielleicht ins eigene WLAN einbinden und dann schnell wieder runter vom Telefon damit.",9.2.0.70,2026-05-07T10:05:21,global,Google Play,0
c64b0705-2fc0-42f9-9c8e-2cb76baac456,Ger,2,,ok,20.2.0.6076,2026-05-07T08:43:56,global,Google Play,0
8e5233bd-612d-4bcb-8071-227cc0244e48,AMRIT LAL CHANDEL,1,,"Not interested,",26.1.2.6449,2026-05-07T05:58:25,global,Google Play,0
194b970e-fc9b-4352-8311-218d489f20f0,Mohadev Mondal,1,,very very very very Bad,26.0.1.6280,2026-05-07T05:51:51,global,Google Play,0
e31befff-999b-4641-9d49-ba9dbdcf9a22,Román Romanoff,5,,excelente producto!,20.2.0.6076,2026-05-07T04:17:13,global,Google Play,0
d239067c-bfa6-450e-9fd5-7cb223a917e0,Esmeralda L,1,,Horrible experience! Cannot set up printer. I already returned one and I'm now having the same issue with the new one. Same error code.,26.1.2.6449,2026-05-07T04:01:05,global,Google Play,0
37d86f30-b77a-4011-afaf-37a3235dc5a5,Vinay Jaiswar,1,,thes is warking,20.2.0.6076,2026-05-07T03:00:14,global,Google Play,0
2a64b8b2-dc12-4333-8134-081a7e31284d,kennedh suira,5,,Excelente app,26.1.2.6449,2026-05-07T02:15:13,global,Google Play,0
58aefad2-4147-4772-8591-32538864ab30,Danii,1,,"mexeram no layout nessa ultima atualizacao, não da mais para selecionar qual pagina imprimir e qual não, péssimo, consertem logo",,2026-05-07T02:05:41,global,Google Play,0
c85f9488-99b5-4d26-8b38-deb814ad79ad,Gabriel,2,,"Me perdoem, mas já foi bom esse aplicativo! infelizmente tá sendo um inferno entrar ou usar essa aplicativo no celular! sempre fica desconectando ou o aplicativo não abre!!",,2026-05-07T00:55:50,global,Google Play,0
3d12fd15-2304-4df4-bd80-6384e66e2dab,alessandro abreu,1,,"sempre dá erro, nunca funcionou direito em 1 ano!",26.1.2.6449,2026-05-07T00:11:50,global,Google Play,0
300aa2db-1db7-4781-a2b8-51905b33743e,Alejandra Moctezuma Amaya,2,,"Siempre tienes que salirte mil veces para que cargue, no detecta el Internet aunque estés a un lado",26.1.2.6449,2026-05-06T21:41:10,global,Google Play,0
5dbdd38e-ad45-4c5a-960f-217f018e4c34,Gabriel Barros,1,,huevada,,2026-05-06T21:25:57,global,Google Play,0
05d3593f-f1d5-431e-a20d-1f009ffc8483,Michele Simone,1,,"Aggiornamenti su aggiornamenti, ma fate sempre più pena! la stampante la butterò nei RAEE. Per fare una stampa, s'impiega anche mezz'ora, se ti va bene! VERGOGNOSI!!!",26.1.2.6449,2026-05-06T20:33:08,global,Google Play,0
64642aa6-dfe4-4cb4-b584-bde2d2ba75fb,lennys salcedo,5,,me encanta 😌 lo seguiré usando,26.0.2.6338,2026-05-06T20:22:31,global,Google Play,0
61b1460b-2f83-4c22-866d-d98876d84d61,Dee,3,,I'm almost out of ink and I keep trying to get into the app to order more since I dont see it's auto shipped since I updated my payment method but then it just spins and says something's wrong with the service. This is a day after I couldn't get on the app at all & it would just spin. Annoying.,26.1.2.6449,2026-05-06T20:02:58,global,Google Play,0
b4e578ab-8b01-493f-bb6c-111cefc89418,ricky sharma,1,,you guys need to work on your app it just doesn't give the next option after printer install instructions,,2026-05-06T19:50:47,global,Google Play,0
942c74af-bd5e-4d43-94b6-d91f823317c7,Mercio Bernardo Matosse,5,,muito bom,20.2.0.6076,2026-05-06T19:23:40,global,Google Play,0
6539dafc-e42e-49ed-aba4-2e5af29a3755,Sarah Evans,2,,I can't set up my new printer,17.0.0.4492,2026-05-06T19:15:56,global,Google Play,0
21e0c8c7-eefb-4e56-8d68-d957dea229ff,Héctor G. Benedí,4,,Muy completa e intuitiva. El escaneo con móvil es ideal. Solo cuesta desvincular algún dispositivo que se haya cargado anteriormente.,26.1.2.6449,2026-05-06T18:48:56,global,Google Play,0
984fcaaa-38f5-40b8-9595-c1e88586adc9,Kyle Kieliszewski,1,,"never able to print, always offline, pop ups, multiple apps they want you to download. pops up to buy ink but I can never print so I always have ink",20.2.0.6076,2026-05-06T18:34:22,global,Google Play,0
4a3de026-85d3-4c7e-bb64-adcfbe1149f8,Dayse Leite,5,,Perfeito,20.2.0.6076,2026-05-06T18:32:07,global,Google Play,0
6a5c816c-0b71-4320-aafa-5c3e564db9ad,Lopal Lopal,1,,HP no compres nunca . una estafa. te bloquean vía Internet los cartuchos compatibles de marca blanca. PRIMERO TE VENDEN UNA IMPRESORA QUE FUNCIONA CON CARTUCHOS COMPATIBLES Y DE REPENTE HACEN ACTUALIZACIONES SIN TU CONSENTIMIENTO POR SEGURIDAD PARA LA CALIDAD Y TE BLOQUEAN LA IMPRESORA PARA QUE SÓLO FUNCIONE CON HP. TODO GRACIAS A ESTA APP. UNA VERGÜENZA Y UNA ESTAFA,26.1.2.6449,2026-05-06T18:05:08,global,Google Play,0
79d04b8a-b4eb-4824-b8b9-75cb8b394085,Lucien SIMELYN,5,,tof toestel veel mogelijkheden,26.1.2.6449,2026-05-06T17:03:01,global,Google Play,0
22a08b05-1a4d-4bf7-a325-89fd58c7d539,Santiago Cerna,5,,muy efectivo,20.2.0.6076,2026-05-06T16:55:01,global,Google Play,0
18cbadeb-a184-49a8-bef2-bb3a7f60ab1a,Nicole Hartwig,1,,"Nie wieder HP. Nachdem ich Instant ink gekündigt habe (in zwei Jahren erst ein Patronen Wechsel aber schon fleißig gezahlt) und jetzt neue Patronen gekauft habe, blockiert der Drucker munter sämtliche Dokumente die ich drucken möchte. Keine der angegebene Möglichkeiten funktioniert, wie man ihn dazu zwingen soll.",26.1.2.6449,2026-05-06T16:51:59,global,Google Play,0
fe2059ed-2801-4b41-833a-d793e3f5825c,Edward Olmos,1,,Embarrassment of an app. Can't even use the functions unless you create an HP account.,26.1.2.6449,2026-05-06T16:22:38,global,Google Play,0
6b220a2b-5aad-44c2-82c4-dc6d92a8060c,Sarah Carter,1,,"brought one of your printers, can't use it because i need to buy a subscription. so you want me to buy the printer then monthly pay you to use the printer i already brought? better idea was i took your garbage back to the store and brought a printer from another company that isn't out to rob me. garbage is what uour selling!",,2026-05-06T16:13:15,global,Google Play,0
74365446-7028-4691-9271-03094f39ea69,Christian Tietgen,5,,"Funktioniert, wenn der Drucker ""Drucks-Apps"" aktiviert hat. Muss man wissen.",26.1.2.6449,2026-05-06T15:31:09,global,Google Play,0
46bfd679-6d97-4da8-9258-e76e83c22684,Philipp,1,,"Warum muss ich ein HP Konto erstellen, nur um scannen zu können?",20.1.2.5988,2026-05-06T15:02:24,global,Google Play,1
543afb43-dfe9-4482-938d-58c421c03da2,ARDpurestar,1,,"works less than half the time now. the new update makes it work less than half the time if your even able to make it connect. it shouldnt take 5+min to load just to hopefully connect to be able to even select print every new update, same and new problems added, annoying app god damn app works once out of every 20 30 god damn print request. Forces you to make an account just to print and constantly collecting your data while messing up every print job one way or another. each ""update"" breaks it",26.1.2.6449,2026-05-06T14:35:11,global,Google Play,0
c9fac8c1-7275-4b32-b783-e2126517124c,Mama Erin,3,,"for 2 days, I've been trying to verify an order I placed. I have talked to 10-12 people who keep transferring me to different departments... I just want to know the details of an order. it should NOT be difficult. all of the people in the HP offices and all I get are transfers. for 2 damn days. find my order details, or I'm done with the whole sorted mess. it just shouldn't be complicated.",,2026-05-06T14:31:52,global,Google Play,0
37ac1317-889a-42c0-b316-d2402d40fde1,E Alejandro RM,5,,excelente,26.1.2.6449,2026-05-06T14:16:58,global,Google Play,0
84ae17ba-39f4-4eff-83df-8ae8bc9a77ab,Sven,1,,worst brand in this world,26.0.1.6280,2026-05-06T13:22:07,global,Google Play,0
6fcdfb1c-54a0-4888-b756-085a69b22382,Sonia Tasnim Putul,5,,ok,20.2.0.6076,2026-05-06T13:13:10,global,Google Play,0
6694c0a2-576b-49ed-af53-0ebe23746304,Rosanna Mancini,1,,non si capisce nulla,26.1.2.6449,2026-05-06T13:07:47,global,Google Play,0
550e0a62-07cb-4506-ba56-c764e004b996,D Sanz,1,,this is a horrible app. too many bugs. all files scanned end up empty or corrupted.,20.2.0.6076,2026-05-06T12:43:55,global,Google Play,0
0be65840-17e2-458c-8dc8-695531907ddf,Connie Beekman,3,,glitchy... hopefully the update fixes this. My monthly subscription bill was due and A week later I finally was able to log in! It just would not load and I could not get the website to work either I don't know what was going on. It's also a little confusing to navigate once you get into the app it takes you to the website for a lot of things and it's a little scattered it's annoying honestly,26.1.2.6449,2026-05-06T12:37:57,global,Google Play,0
68498bb8-1d43-4dc7-80d1-3495f36a60e4,GIN LOLA,5,,great,26.1.2.6449,2026-05-06T10:10:17,global,Google Play,0
e7b73320-b91b-49b1-9a3b-32353aa4c90f,young heart,5,,"Ich kann nur für mich sprechen. Ich bin mit der App voll zufrieden. Das Öffnen funktioniert einwandfrei und flüssig. Dokument, Scannen, und Photos bearbeiten läuft einwandfrei. Die App nutze ich jeden Tag.",20.2.0.6076,2026-05-06T07:14:52,global,Google Play,0
fc4b1669-842f-4314-932e-4b277bdbb478,YGAPPARAO,5,,super,26.0.2.6338,2026-05-06T06:42:53,global,Google Play,0
4ebc7728-e166-45db-8453-2e8f0cd81484,Brewce's Roofless-E46,5,,I ❤️ the HP print APP. I run it on my OfficeJet Pro 9010 andd its endless options. Super EZ to navigate,26.0.2.6338,2026-05-06T02:02:58,global,Google Play,0
aad96935-0746-40cd-9898-a4b722df01db,Ornella Fermi,3,,"Está buena, se puede imprimir desde el celular, además de ser una impresora inalámbrica, aunque conviene más conectarla por cable para que sea más estable porque el wifi no es garantía de nada. Lo que si me parece pésimo que no encuentro el software de mantenimiento, si quiero hacerle una limpieza de cabezales o alinear los cabezales, no puedo, porque no aparece ni en la app, ni en la computadora. Tengo pocos caracteres porque sino, haría un listado de las cosas que me han pasado.",26.1.2.6449,2026-05-05T23:14:33,global,Google Play,0
ad5088c8-8e2e-4d1c-ae86-1b1c4ed1634b,tiffinie pierce,2,,I used to be able to choose the scale option I wanted now it only gives me the option to fill page or fit to page. I also cannot get it to work on my laptop I can only print from my phone. I used to be able to print from both.,20.2.0.6076,2026-05-05T22:49:07,global,Google Play,0
dff272ea-8e6f-4623-8cbc-c605de6f9e31,Daniela Daniela,1,,no anda esta aplicación de mi...,26.1.2.6449,2026-05-05T22:21:25,global,Google Play,0
fecbfb34-1427-4552-9ae5-2b590924bb06,Aldo Zanchin,1,,Está impossível fazer login.,26.1.2.6449,2026-05-05T21:42:19,global,Google Play,0
11d74a4f-1b10-4c97-8c2b-ee0f06131a52,Toni S,1,,nichts funktioniert,20.2.0.6076,2026-05-05T18:47:20,global,Google Play,0
a8a57690-eeaf-44ba-a6a3-8165af3bb2bb,Neerav Vora,1,,worst app and worst printer,26.1.2.6449,2026-05-05T18:26:43,global,Google Play,0
faf598e1-d5c1-4d16-9172-bf613c112109,Brian Yu,1,,hp fax doesn't work. always says no internet connection.,26.1.2.6449,2026-05-05T17:34:12,global,Google Play,0
151d557c-9fdd-459d-8be2-3031f5a3e7f0,Rach Spooner,1,,"Trying to access printer settings to sort out a bad ghosting problem but the app won't even open. Just the loading circle of death then an app can't be used right now message. Tried reinstalling, updating, different device, same result each time. Pretty rubbish really from a $bn company.",26.1.2.6449,2026-05-05T17:26:18,global,Google Play,0
abea057a-723c-4b7a-be9e-6963a4ffb51d,Badger,1,,absolute shite,,2026-05-05T17:23:57,global,Google Play,0
db28b9a8-4dc3-4d74-8a2e-0f859188dd58,Sandy Auerswald,1,,seitdem die App überarbeitet wurde funktioniert sie nicht mehr,26.1.2.6449,2026-05-05T17:22:49,global,Google Play,0
faf95f77-755a-4e3f-b901-232603726fb9,Peter Heinemann,1,,Nach Update startet die App nicht mehr. No way!! Deinstallation sofort.,26.1.2.6449,2026-05-05T17:21:24,global,Google Play,0
70d4ce35-cca1-4692-a65c-3a49c55faf9e,Taylor Stevens,1,,Does not work at all anymore wont even open left me unable to print anything,18.10.0.5530,2026-05-05T17:21:17,global,Google Play,0
eea4602b-466f-4831-8a94-222484642931,Guillermo Eduardo Argüelles Frutos,1,,No abre la aplicación,20.2.0.6076,2026-05-05T17:21:06,global,Google Play,0
902b0cad-8c41-43de-a357-f240d8950c36,Alex,1,,"03/25 An sich war ich relativ begeistert von der Bedienung und Anwendung der App. Neuerdings benötigt man für alles einen Account, das nervt und mindert das Vertrauen. So langsam funktioniert gar nichts mehr. 05/26 Nach wie vor grottig. schon das Prinzip ist abartig und wenn es nicht mal funktioniert...",26.1.2.6449,2026-05-05T17:17:23,global,Google Play,17
b2f47820-3ce8-4b3c-aaf9-092fa67f3b1e,Brandon Baumgartner,1,,can't even get past the data agreement screen to start the app,26.1.2.6449,2026-05-05T17:16:21,global,Google Play,0
e3e70e8e-33c4-4dd9-8e87-e4e36905bf1e,S to the O,1,,Was das ist mit der App los? Die Datenschutzbestimmungen lassen sich auf keinem Gerät akzeptieren.Weder Android noch IPhone,26.1.2.6449,2026-05-05T17:16:02,global,Google Play,0
