id,author,rating,title,content,version,date,country,platform,vote_count
457c39ea-c58b-46b0-8dd7-1eecaa5b7cb3,Günther Buchebner,1,,Cloud Print funktioniert mit Meinen HP OfficeJet Pro 8122e Drucker immer noch nicht (HP Drucker - Print Anywhere mit der HP app funktioniert immer noch nicht egal was was man macht das ist absolut Kunden Unfreundlich Alte App war viel besser),20.2.0.6076,2026-02-27T18:43:06,de,Google Play,1
0f1880cb-612f-4567-b4b1-4670bea932ef,Iraiz Arias,5,,Me gusta la app es muy práctica,26.0.0.6234,2026-02-27T18:15:15,es,Google Play,0
eb39c5a5-7720-4e21-89b9-991224421323,antonio finizio,5,,ottima app,20.2.0.6076,2026-02-27T17:54:45,it,Google Play,0
2bdb7ed3-d3aa-4e5c-a6d7-abef1a23d12f,omotayo sunday,4,,great!,20.2.0.6076,2026-02-27T17:18:51,sg,Google Play,0
eced598f-1447-4f56-815a-c15d5b732211,Noemi Alca,1,,Osea una compra la impresora y tiene que pagar para usarla es una webada,26.0.1.6280,2026-02-27T17:18:35,es,Google Play,0
b662201a-17c4-48ce-a014-f2e4268cea74,Beni Charmant Yao,4,,"Bien, même très bien mais ne prends pas de fichier Word, Excel .... directement sur téléphone. doit-être amélioré",26.0.0.6234,2026-02-27T15:51:21,fr,Google Play,1
63b7e8d9-3780-4161-bed8-dd1267913f5e,Isidro Garcia,3,,tiene dias fallando. se queda pensando al abrirla. tengo que deinstalar e instalar de nuevo,,2026-02-27T15:12:19,es,Google Play,0
51a3647c-2e08-4679-b0d6-a07fa4185d67,Cíntia de Paula,1,,"Aplicativo péssimo, não acha a impressora mesmo eu seguindo todas as instruções conforme é descrito, e quando finalmente conecta a internet perde o sinal e não conecta mais. A última atualização ficou absurdamente pior, por favor arrumem isso o mais rápido possível.",26.0.1.6280,2026-02-27T14:47:28,br,Google Play,2
d6fcdac5-ce0b-4e8d-a38a-eef7d2c8e1d0,Dallas Davidson,5,,works well,26.0.0.6234,2026-02-27T14:46:11,sg,Google Play,0
f574139d-7dbd-46e5-b2c6-4c467ebaa882,bethserenagoble,1,,Non si apre e non funziona,26.0.0.6234,2026-02-27T14:45:54,it,Google Play,1
43499bd4-c9c5-488e-ae03-01386adaadda,Patricia Le brigant,2,,votre imprimante n'existe pas,20.2.0.6076,2026-02-27T13:53:56,fr,Google Play,0
d736f8fc-5019-4ffb-bf45-1d11f934e1d2,dmbraz1973,2,,Sometimes it works and sometimes it doesn't. Really annoying with a brand new printer when you need to print something important and you can't.,26.0.0.6234,2026-02-27T12:33:30,sg,Google Play,2
68fc482c-2c6f-4b8c-907f-c958754a4840,Dhanush,4,,good,26.0.0.6234,2026-02-27T12:03:40,sg,Google Play,0
3ef2f019-c260-48fb-90b2-054dcf8b343a,Cléo Benoit,2,,"beaucoup de bug, l'appli prend 10 minutes à s'allumer, ne retrouve pas toujours l'imprimante, se déconnecte tout seul... insupportable",26.0.0.6234,2026-02-27T11:06:36,fr,Google Play,1
83ca580c-5189-46c1-8905-e00b95968d82,Teresa Capano,1,,"sono più di due settimane che resta in carica e non si collega mai , non riesco a stampare non è un problema di connessione è l app.che non va lo volete risolvere il problema...?!",26.0.0.6234,2026-02-27T10:55:54,it,Google Play,1
a0ef739b-30da-4ef5-a24c-c047f389a33a,Theonomous,1,,"Forced to download this app, forced to create an account just to print things off the printer I own, I hate HP products, consider this the final straw",20.2.0.6076,2026-02-27T10:18:28,sg,Google Play,1
0cd4be41-804b-4731-b867-d661d1ec62b5,katrina slinger,1,,"Bad - stuck on colour, only usable when paying annual subscription",20.2.0.6076,2026-02-27T10:10:29,sg,Google Play,0
eb51a4f4-528d-439c-a14b-713b0e639399,Adityaraj Gupta,1,,very bad app nothing works not the printer not the app,20.2.0.6076,2026-02-27T09:33:22,sg,Google Play,0
203f7e23-d55a-4998-a7f0-ec62afe0e4d4,Zaid,5,,"Printers are notoriously hard to work with, but this app takes out all the friction. Good tools are underappreciated because they don't really give you friction to think about, but I really appreciate the effort put into this app. Nobody forced them to add the ability to create documents from batch scans with the ability to replace and edit pages, or other useful non-essential features, but they did. Thank you.",26.0.0.6234,2026-02-27T09:27:31,sg,Google Play,11
a29067c6-a643-4a28-b949-b2ced5c75355,jean marc tribout,1,,impossible à connecter à mon chromebook,26.0.0.6234,2026-02-27T09:13:00,fr,Google Play,1
4135ad1d-512a-45fb-acf5-7fa55bd2dc1a,Jan M,1,,Online- und Accountzwang für einen lokalen Drucker - lächerlich.,20.1.2.5988,2026-02-27T08:13:21,de,Google Play,2
330f43f6-c284-44d6-9e9c-624ad8e9befc,fabio quartarone,5,,ottimo adesso funziona,26.0.0.6234,2026-02-27T06:26:22,it,Google Play,0
547eacc8-efcf-463b-b2bf-6868c702f265,Dawn,1,,"App is trash now. Won't even open. Tried uninstalling, making sure it's updated, closing it and opening it, clearing the cache and nothing works. Fix your app HP!!!!",26.0.1.6280,2026-02-27T05:38:03,sg,Google Play,1
1ca67b66-a749-4e2f-b6b6-a14af93f86e1,Oleksandr Kostenko,1,,if you have choice buy something other than hp,20.2.0.6076,2026-02-27T03:34:29,sg,Google Play,0
fce306e4-29cf-4cad-8932-2be2e9bbd11e,Romy Mansilla,1,,"Te vuelve loca esta app y la impresora, no abre, hay q instalarla, desintalar a cada 2 x 3. No tiene para ajustar hojas en el tamaño q uno quiere. Imprime a veces x la mitad. Un desastre",26.0.1.6280,2026-02-27T03:12:08,es,Google Play,1
5aa7c68f-d771-423e-9bed-65fa8f5ada33,Rene Avila,1,,la peor impresora que puede existir cada con los cartuchos no la recomiendo para nada estafadores,18.5.1.5470,2026-02-27T01:58:35,es,Google Play,0
6079444e-4074-4237-a41d-30fbb159fa4d,Govany Arenas,2,,Es demasiado lenta siempre se batalla para abrirse,26.0.0.6234,2026-02-27T01:45:04,es,Google Play,0
36136e8e-fce8-4478-81a4-5c04db308660,Gustavo D'avila,5,,mt boooom,20.2.0.6076,2026-02-27T01:06:05,br,Google Play,0
2854c010-505c-4693-845b-2b19a9f316c4,Lorena Miranda,5,,funciona excelente 👌,26.0.0.6234,2026-02-27T01:01:04,es,Google Play,0
c68e80c2-2081-4d35-9141-033f4da25b7b,Tiffany Bullard,1,,horrible app and horrible printer. it couldn't be any harder to use.,26.0.0.6234,2026-02-27T00:35:38,sg,Google Play,0
9ddc3851-7a08-4cd5-9649-c4f16e0951ed,valerio henrique pereira de araujo,1,,pior experiência que já tive,26.0.0.6234,2026-02-26T23:42:42,br,Google Play,0
8e038e66-f939-4eed-9884-b839990893c9,jorge esteves,1,,Não é compatível com tablet Lenovo Idea tab Pro,26.0.0.6234,2026-02-26T23:32:17,br,Google Play,0
fb1d749c-2347-4c83-b4c0-4dd2c2d02416,Moirali Perez,5,,Bien,20.2.0.6076,2026-02-26T23:20:36,es,Google Play,0
9eb21728-d5b3-4fd8-bace-01a59560102c,Karissa Ann,1,,was working okay up until a couple days ago. now it won't even connect to the printer.,26.0.0.6234,2026-02-26T22:30:45,sg,Google Play,0
4aff8889-7ca9-4d03-95d5-8a5cf0cad11d,JUAN CARLOS ALVES,5,,"Me permite imprimir y escanear documentos sin problema, me es de mucha ayuda.",26.0.0.6234,2026-02-26T22:28:11,es,Google Play,2
af7fb466-ee85-4b31-bd86-d53ccc1de0bd,Milagros Boscatto,3,,"podría mejorar bastante, siertamente tiene funciones muy buenas y de edición solo para las fotos (jpg) en el tema de los archivos como documento o pdf estaria bien que tambien se puedan seleccionar el tipo de papel ya sea el normal o el fotografico, el tamaño de papel y poder recortar, editar o agrandar la imagen como se puede hacer cuando se selecciona que lo que se va a imprimir es una foto. la app funciona bien, creo que lo que se deberia mejorar en ese aspecto",26.0.1.6280,2026-02-26T22:24:42,es,Google Play,3
435faacd-4335-4ecb-8edc-84e2c7bc5b74,Rafael Romero,5,,Excelent to manage your computer HP,20.2.0.6076,2026-02-26T22:02:22,es,Google Play,0
93d6bd22-967e-4299-ad97-5cfb2ca8e550,Matt,2,,this keep losing my hp printer. the app is over complicated. I know exactly where my printer is on my network via the IP address But this app cannot even see that!,26.0.0.6234,2026-02-26T21:37:26,sg,Google Play,2
877b45d0-0ab0-491c-8cd8-e72dbb146ac1,maria ines,5,,"Fácil de usar, excelente",20.2.0.6076,2026-02-26T19:38:44,es,Google Play,0
faaa8a33-5e58-4f4b-9302-8f4f1194f996,Michael S,1,,leider werden viele Daten abgefragt ohne die Notwendigkeit zu erklären,26.0.0.6234,2026-02-26T19:33:53,de,Google Play,1
83abdd0f-fd12-4cff-9c46-a93cfb75ecd6,Natalia Monroy,5,,"Can't print anything, my printer is blocked now .",26.0.0.6234,2026-02-26T19:23:12,sg,Google Play,0
450977fa-6ad7-4978-beb0-6635c69741a5,Josias fs Ferreira da Silva,1,,"Simplesmente horrível, muito lento, sempre tem que estar logando novamente só piorou",20.2.0.6076,2026-02-26T19:07:51,br,Google Play,1
a52f73fb-8a08-4935-b587-f78196fba3f0,Luis Ramirez,1,,"Del navo, HP es una basofia",26.0.0.6234,2026-02-26T19:00:00,es,Google Play,0
392cb749-ea5e-4d8f-9b7c-23aa2b4c3fe7,Alexandra Bastos,5,,Muito fácil e intuitiva.,26.0.0.6234,2026-02-26T18:58:48,br,Google Play,0
39c99ffc-7ff0-47e5-be23-870d97df836f,Shubham Gulati,1,,"such a trash update, I cannot connect my printer now, please fix it fast",,2026-02-26T18:24:51,sg,Google Play,1
ceec623f-b4a3-4266-91cc-a59e79ec14b1,Husein Brkic,1,,Si blocca e non si apre con l'ultimo aggiornamento.,26.0.0.6234,2026-02-26T18:09:09,it,Google Play,0
e75464b8-aecd-4c4c-bdd2-6f17783be1f5,Vilma Demichelis,5,,genial 👍,20.2.0.6076,2026-02-26T17:18:35,es,Google Play,0
e68dff1f-05b6-45d4-bc48-d1654008ea20,Irv Lafferman,1,,"I had an IT tech look my ""brand new 8120e printer"" and it will not scan or print. But HP wants to change me 50$ to fix it. So HP has no customer service support. My suggestion is to stay away from this product.",20.2.0.6076,2026-02-26T16:51:03,sg,Google Play,1
572ab821-2fd9-4ecd-87b2-210b86af5712,Sacha Hofer,1,,"App installiert (mich hinreissen lassen durch 'Empfehlung in 'HP-Print Plugin'. 1ter Screen: ""Anmelden / Als Gast fortfahren'.. Gast √ Drucker hinzufügen Wifi-direct √ Die meisten Optionen verfügbar √ "" Weitere Optionen"" → ""Anmelden / Konto erstellen"" (no 'Gast' anymore).. "" Konto erstellen"" √ "" FEHLER"" (in rot)..... hp halt... Entspricht der Firmenpolitik bez 'Nachhaltigkeit' - Toner/Patronen von Fremdhersellern etc (Drucker streikt, Druckkopf defekt...",20.2.0.6076,2026-02-26T16:41:38,de,Google Play,1
7bce7a96-d50a-40fa-8888-c860a9aaa2cf,Bruna Adeodato,1,,"o que aconteceu?? do nada o aplicativo parou de funcionar. ele abre, aparece a logo hp e depois fica numa tela branca. já tentei de tudo, mas não sai disso",26.0.0.6234,2026-02-26T16:19:35,br,Google Play,4
3119a841-e1aa-4699-8c81-6ff1910695ba,Manuel F.Cepeda,1,,sin poder conectar mi impresora a red,20.2.0.6076,2026-02-26T16:00:48,es,Google Play,0
6a9fb6d5-83ee-424d-927a-7b9e8b1fb409,Charlie Harrison,1,,My printer was not listed as being one I wanted to add the app to!,20.2.0.6076,2026-02-26T16:00:39,sg,Google Play,0
32e87f49-3223-40e7-9871-d632b6618c86,Malin S.B.,3,,"Doesn't even start since last update, 2026-02-25, for Android 14, OnePlus 9 Pro",26.0.0.6234,2026-02-26T14:22:35,se,Google Play,0
5549ace4-76fc-4005-b127-f97848918636,Krish Gupta,1,,rubbish app,,2026-02-26T14:09:58,sg,Google Play,0
bc172213-1389-4e27-8fc7-ecf82d9ceb21,Alan H,1,,Kept loading on the main screen with the blue ring. Waste of time. previous version was easier to use. Now it is just pure rubbish!,26.0.0.6234,2026-02-26T14:03:02,sg,Google Play,2
8a6b6302-745d-4f01-a378-905e0873fa76,Ashley N,1,,my printer is saying it not connected but it is. unable to troubleshoot,26.0.0.6234,2026-02-26T13:26:21,sg,Google Play,1
3b876628-b20e-4cce-abda-8f911d6f6cbf,Relyn Jungco,1,,using mobile I can't connect to printer. it always say connected but no internet,26.0.0.6234,2026-02-26T13:01:27,sg,Google Play,1
2a558f34-ce9f-4919-882b-03d622d10daf,Sukhwinder Singh,4,,very nice,20.2.0.6076,2026-02-26T10:13:13,sg,Google Play,0
0cf6ceb3-d68b-40fc-956f-e2eb23e5bdeb,Jeremiah Newland,5,,HP keeps me moving allowing me to do so much from my mobile device.,20.2.0.6076,2026-02-26T10:07:59,sg,Google Play,0
4dfbc094-dfad-4829-bfa5-1b26cc1d2f23,Oliver,5,,Sehr gut,20.2.0.6076,2026-02-26T10:04:54,de,Google Play,0
40673f6d-cb24-4e49-a8be-f52c985bd8db,Marcellius Bonar,1,,"not support for direct USB printing,so dissapointed!!",,2026-02-26T09:40:40,sg,Google Play,1
dab3513f-f489-4d21-9743-ba6649b5f146,Bret Martin,1,,This app is terrible I cant even get it to load anymore would give no stars if I could pretty much in agreement your products are gettibgnworse abs this app is atrocious,26.0.0.6234,2026-02-26T07:58:31,sg,Google Play,2
f12d4907-e519-482b-a22c-9cc8792a8a8b,Technical Stars,1,,very bad interface lag and non coperative,26.0.0.6234,2026-02-26T05:38:52,sg,Google Play,0
0b661538-b25a-45d8-b199-a04f38664888,Jesus Reyes,5,,excelente,20.2.0.6076,2026-02-26T05:05:10,es,Google Play,0
47abdc1c-86ca-4fdd-9eb5-c16016ca21c0,Alan Andreasen,1,,Must sign in to print! I'm not creating another login and password just to print one page. HP SMART was a much better app and you didn't need an HP account to use it. Do yourself a favor and throw away all your HP (printer) products.,,2026-02-26T04:37:56,sg,Google Play,1
490d0c35-82e7-4543-8dba-1a9571f96452,mégane schaefer,1,,"première imprimante HP pour moi, se sera la dernière et je vais la renvoyer .. appli inutile , problème de connexion et on ne peut pas faire grand chose , je retourne chez espon",,2026-02-26T04:15:30,fr,Google Play,0
8ba83867-854f-4212-a24a-b63c9d49a8aa,Trash Boii,1,,"Garbage fire service and garbage fire printers. Not only does the app not properly track your ink levels but when you try to print anything at all it forces you to go through a SERVER that then sends it to your printer. If that server is down, good luck printing! The app constantly disconnects from printers and customer support is worthless! I have been fighting my printer for 3 years and today I smashed it on the ground after 5 errors. Do not use HP printers. Get a refund.",17.35.0.5115,2026-02-26T02:52:30,sg,Google Play,3
9e7bb260-2fae-4417-9de4-7d16a33ef698,Rosa Alvarez,4,,ayuda no puedo conectarla con el wifi y el celular como es alguien me explica,20.2.0.6076,2026-02-26T00:25:09,es,Google Play,0
fbcfc1da-24ea-404a-bcfd-ebd86fe31b8d,X,1,,"This app sucks, spent all day on it and still can't figure it out.",20.2.0.6076,2026-02-26T00:00:00,sg,Google Play,0
14a37734-3e8e-427b-9424-9ebdb1207672,edenilson lisboa,5,,"boa , só atinta que não dura muito",26.0.0.6234,2026-02-25T22:25:46,br,Google Play,0
9da92b2d-727f-448a-803f-c11d90fd35d9,Grevis Jafet Mendoza Velasquez,1,,"If the printer is already on my network, why do you want to know my location? silly dirty way of doing things and being intrusive",26.0.0.6234,2026-02-25T22:00:04,es,Google Play,0
3c09ff5b-3c0b-43c4-b0ce-1032ac700400,Michael Knerr,1,,Exakt nichts funktioniert. unbrauchbar.,26.0.0.6234,2026-02-25T21:32:10,de,Google Play,1
cac9c02a-c6ac-4d61-9dc2-64d0bfdaab28,Monica Broughan,1,,this app no longer works,26.0.0.6234,2026-02-25T21:20:57,sg,Google Play,1
0a826129-ef2b-4b75-9960-84603f73d1c8,Saddan Valdez,3,,"cumple con lo requerido pero es un poco lenta, tal vez vendría bien quitar un poco de íconos , vendría bien algo más de fluidez.",26.0.0.6234,2026-02-25T21:02:31,es,Google Play,0
6a646d85-7da6-4ada-b31c-327547a92ee5,A. Köhle,1,,"Ich bin sehr unzufriedenmit dem hp Drucker. Er druckt nur gelegentlich. Dauernd soll ich mich anmelden. Eine 5 seitige PDF, von der ich nur eine Seite brauche, druckt er natürlich 5, damit die Druckertinte schneller alle wird. Alles ist komplizierer geworden. Dann soll ich die hp app einrichten, obwohlich sie scho auf dem smartfone habe. Empfehlen kann ichmeinen Drucker nicht. Wenndie Druckertinte leer ist, kauf ich mir einen anderen. Große Enttäuschung mit hp.",20.2.0.6076,2026-02-25T21:01:00,de,Google Play,1
42cfe6bc-078c-4529-afbd-f5c4f22d5f9e,Janine „Nani“ B.,1,,"Man kann nichts mehr drucken, ohne jedesmal die App neu Installieren zu müssen 😤 😤 😤 man will nur schnell was Drucken und brauch jedes mal 15 Minuten für ein Blatt... Kriegt die App in den Griff! Es ist schon schlimm genug, dass der teure Drucker sein Geld nicht wert ist...",26.0.0.6234,2026-02-25T20:52:48,de,Google Play,1
defcf907-9e16-4414-addc-52b99f3cb34c,T.lusitano Tony,5,,parfait,20.2.0.6076,2026-02-25T20:50:11,fr,Google Play,0
ad2ee11c-e706-4a78-81d8-3b8678b921df,Pedro Dominguez,4,,very good printer,20.2.0.6076,2026-02-25T20:36:40,sg,Google Play,0
7394ff96-1b9d-4f63-91d0-1d82ffb44b5c,James Lee,1,,The app updates don't work for all printers and it essentially locks people out from accessing their printer. there needs to be the same functionality on desktop.,26.0.0.6234,2026-02-25T19:59:09,sg,Google Play,2
e287332a-fce9-4d2a-82c8-591a6ae4e5a3,P K,1,,Couldn't get the app to open.,,2026-02-25T19:34:38,sg,Google Play,0
96d592f4-2560-42fd-8dc0-63d7f0a30e23,Carlos de Obaldía Pastor,5,,Es una aplicación fácil de utilizar y sencilla de maniobrar y que a la vez no escatima en funciones y calidad. Felicidades al equipo desarrollador.,20.2.0.6076,2026-02-25T19:28:30,es,Google Play,3
b4f01903-cd53-437a-827d-ab96f085ad10,Sandra Stevens,1,,App does not open.,26.0.0.6234,2026-02-25T19:28:09,sg,Google Play,0
74c8ba13-a739-4d2a-8ea1-152c841318f9,Andrea Rossoux,1,,"L'application ne se charge pas, les pages A4 partent sur le côté droit. L'encre bave et le temps d'impression est de 3 minutes par page. Terrible ! Je ne recommande pas les imprimantes deskjet et cette application ne fonctionne pas bien. Merci d'améliorer rapidement ces conditions désagréables.",,2026-02-25T19:03:43,fr,Google Play,1
d2605a90-043e-42a2-aaad-3773e826d8ae,Karsten Bansemer,1,,"Nach zwei Wochen geht der Drucker zurück. HP einfach Schrott. ständig Abrüche mit der Verbindung, ob per PC oder Handy. Zehn Jahre Epson, dafür werde ich mich jetzt wieder entscheiden.",26.0.0.6234,2026-02-25T18:57:04,de,Google Play,1
7d5b7f1b-50fe-4cd1-9a2a-f0b82244633a,Teresa Sorlí,1,,"La descargué, configuré todo,y ya no la he podido volver a abrir.",26.0.0.6234,2026-02-25T18:40:14,es,Google Play,0
9b86fa4d-831a-4a7b-961b-94df13a169ad,Ben Legge,1,,only prints pdfs and images.,20.2.0.6076,2026-02-25T18:33:04,sg,Google Play,0
5edcb49d-1d06-4542-a739-7fbe61424dc4,Genniene Widiger,1,,I don't know what happened but I can't use my printer anymore. The app looks totally different and I can't print anything. When I go into the app it is a white screen and nothing appears. I am incredibly frustrated because I have never had any issues until now. I need my printer to work because I use it alot,26.0.0.6234,2026-02-25T17:55:32,sg,Google Play,2
42618ceb-28d1-42c6-91e8-abd19016a8e8,Samuel Laborde,1,,mala,26.0.0.6234,2026-02-25T17:51:53,es,Google Play,0
d32ffb86-d015-4289-865e-ededa2df01d8,Carl davis,1,,"Lately app is never consistent upon opening and or staying signed in, seems to happen way to often to have confidence in opening this app !!",26.0.0.6234,2026-02-25T17:42:50,sg,Google Play,56
3a1855a3-27fe-4f0e-bb9f-9bc819e4b97d,Nikey,1,,not helpfull,26.0.0.6234,2026-02-25T17:42:22,sg,Google Play,0
c34c80d2-d49c-4ce1-a369-53b5f55ed9d1,dydao77550,1,,N'ACHETEZ PAS HP,,2026-02-25T17:33:41,fr,Google Play,0
3aef8243-43e1-4c3d-accc-12c517075204,lauret lozada,1,,no me funciona le doy a agregar impresora y se queda en blanco,26.0.0.6234,2026-02-25T17:31:33,es,Google Play,0
92ec9978-6723-4d42-afe1-4b82cac6ac84,Max,1,,2024: Es gibt nichts schlimmeres als Drucker von HP. Update 2026: Suchen Sie sich professionelle Hilfe wenn sie erwägen einen Drucker von HP zu kaufen.,18.10.0.5530,2026-02-25T17:19:05,de,Google Play,1
8f4157c5-4c95-47e3-af21-a8b4ec10a92e,Joanna Polok,4,,"Delighted with this printer and not having to order ink yourself is great. The printer ink levels are sent to HP and they contact us when the levels are low. Payment is not taken until we have been asked whether we want to order at the time. Never having ""printer ink low"" when you need something printed quickly.",20.2.0.6076,2026-02-25T17:04:24,sg,Google Play,0
a77c3c3f-95ee-4cbe-81bc-611a452fb09a,Harisky BOUYAHIAOUI,2,,"Ne fonctionne plus vraiment depuis la dernière version. Exemple : si il n'y a pas de papier dans les 2 bacs, l'impression est impossible. Si l'imprimante est en veille, elle est considérée comme hors ligne. Très décevant...",26.0.0.6234,2026-02-25T17:04:19,fr,Google Play,1
73f5c3e9-3673-4db9-a1bc-fcefc552347b,Pilar Garcia,1,,"Estoy harta de tener una impresora en casa que cada dos por tres me da problemas para imprimir, que hay que apagar y encender, que se desconecta del wifi, y todo esto pagando una suscripción porque si no no puedes ni imprimir. Ahora me dice que mi impresora es antigua, lo que me faltaba. No recomiendo hp para nada porque a cambio de que te manden los cartuchos a casa dependo de su aplicación y sus normas para utilizar MI impresora",20.2.0.6076,2026-02-25T16:58:04,es,Google Play,6
3d41ab13-ea58-4188-8407-ca2ed48eb204,Elena,1,,I changed my internet provider and can't even find how to change the wifi network on my Tango printer on my desktop. so complicated.,,2026-02-25T16:54:11,sg,Google Play,0
5e548547-129f-4843-8e9b-e5cdfc5787d3,Stephanie C.,5,,lifesaver,26.0.0.6234,2026-02-25T16:03:33,sg,Google Play,0
7c42de1b-44a8-49d6-a5a3-386a65d5ae71,Trevino Vasquez,5,,excelente gracias,,2026-02-25T15:27:17,es,Google Play,0
99efa3ca-9cfd-4fac-807a-3dacaf150137,gravityTattdrumr11,3,,"app won't load up to print my shipping labels on time,",26.0.0.6234,2026-02-25T14:02:09,sg,Google Play,0
808d42f8-a33d-4aae-ac4b-45a5cdd0b43d,Ashley Harrison,3,,This app is super slow and laggey,,2026-02-25T13:26:52,sg,Google Play,0
2c4fdf00-2bad-4899-9f5d-77c6c736f13c,Ayasha Hollinshed,1,,Can't even get to the main screen. Just loading.,,2026-02-25T13:04:59,sg,Google Play,1
64b767a9-3251-4edc-8309-c8f68e2b47ba,aleikus sultan,5,,bene,26.0.0.6234,2026-02-25T12:51:52,it,Google Play,0
ad8fcaa6-661c-4db7-80a9-645694e77225,Rahman Kamal,1,,Tidak boleh bersambug dengan printer,20.2.0.6076,2026-02-25T12:22:19,sg,Google Play,0
0d96d606-4f00-40cd-b4b0-7bc2944f5ad4,Simon Ses,1,,have hp 2700 and both the printer and app are abysmall working when they find it fit. never again hp,26.0.0.6234,2026-02-25T12:20:27,sg,Google Play,0
16c5dc8a-a1c3-4202-816d-5bd420a8bef8,Mehdione mehdi,1,,vraiment de pire en pire HP. avec des applications tiers je trouve tout de suite mon imprimante avec l'application officielle on trouve rien apprenez à faire des applications vous êtes tellement nul.,,2026-02-25T12:15:38,fr,Google Play,0
4f45ba6f-a9fb-410a-9627-cd1e52289932,Umar muniyon,1,,worst one.. why I go with HP..,26.0.0.6234,2026-02-25T11:14:00,sg,Google Play,0
ed7071fb-5fe0-4149-8523-119d7eb26e2c,Yanko Greshkov,1,,"Words cannot describe how bad this is. I really enjoy not being able to just turn it on, connect it. and then print. I love having to make an account and manually set up a new printer every time I need something done and then manually entering my Wi-Fi password. I love the blinking of the Wi-fi icon only to tell me the printer cannot be added, but it's clearly recognised by the app. Just love it. I love selling my data, I love making new accounts, I love having to take me half an hour to print.",20.2.0.6076,2026-02-25T10:12:27,sg,Google Play,13
71d99992-f4f8-4ae6-a6b3-8648df1863e9,James Truesdale,1,,Can't add printer.,26.0.0.6234,2026-02-25T09:52:40,sg,Google Play,0
120cfc59-465d-477a-bafb-19b3e3b9a63e,Yelitza Abreu,5,,excelente 👌,20.2.0.6076,2026-02-25T09:51:07,es,Google Play,0
ee159f1c-73d4-40d1-a095-577f77d87528,Abdul Rahim Hassan,5,,Is so happy,26.0.0.6234,2026-02-25T08:57:02,sg,Google Play,0
a8fc3ea3-909b-4d2a-a327-53429c0da4e6,Sergio Ceresini,1,,Non funziona nulla... Meglio un insalata,17.20.0.4770,2026-02-25T07:32:53,it,Google Play,0
be709de1-f1d7-4132-a9b9-9848c96fece5,Kirk,1,,Why do I have to sign in just to scan a document,20.2.0.6076,2026-02-25T05:16:02,sg,Google Play,0
79cb5d5e-32a7-465b-ba5b-645da26e205e,Benny Canez,5,,so easy to connect with my printer,20.2.0.6076,2026-02-25T04:13:08,sg,Google Play,0
582fd1d6-a479-4056-9d50-857059cf5085,Erik N,1,,"Absolute trash after the update. I open the app as it loads the spinning blue wheel of death. Clear the cache, blue wheel of death. Uninstall and reinstall, blue wheel of death still",26.0.0.6234,2026-02-25T02:56:20,sg,Google Play,2
fce790c0-8fd6-4015-b7c6-94128ea86698,Edilmar del carmen Ramirez villarreal,4,,buenisima la recomiendo,26.0.0.6234,2026-02-25T02:55:19,es,Google Play,0
1c71e35e-6ead-4250-a818-9227ba9c6cec,a,1,,sehr schlecht die letzte App Update . hat mir größ Probleme gemacht werde ich nie wieder von HP kaufen,20.2.0.6076,2026-02-25T01:52:32,de,Google Play,1
c0b59ec8-0b8c-4545-a832-fea0c3a02e5b,Fernando Rincon,5,,excellent printer. I recommend for people who like to print pictures and documents. .,26.0.0.6234,2026-02-25T01:19:43,sg,Google Play,1
776f32bd-7d38-4bb0-a232-9b50aaa63ea0,Antonio Latiniyeltini,5,,excelente,26.0.0.6234,2026-02-25T01:16:35,es,Google Play,0
9815f3cc-ef13-413b-816f-3daa7464f895,Emma Sandoval,1,,"worst printers ever can't print without logging into the app, but the app doesn't work, so this renders the printer unless unless you are scanning something.",,2026-02-25T01:09:04,sg,Google Play,0
cd75b8b2-a118-41e2-b0eb-27fe203fc7fe,Jenni Burlison,1,,Got a new internet provider now printer won't connect to wifi and tried loads of things but it's not coming on just blue wifi light flashing,20.2.0.6076,2026-02-24T23:59:26,sg,Google Play,0
02e6f37a-03ac-4262-9d0e-ab11f31d76ba,Hugo de Jesús Pacheco Barrera,5,,Buenas noches. Desde hacer días las aplicaciones me aparecen en blanco.,,2026-02-24T23:46:36,es,Google Play,0
fd970278-b624-4a41-aa27-2f0c9ce2b7a5,Mohamad Leipold,5,,Top app kann alles machen kostenlos,26.0.0.6234,2026-02-24T23:45:16,de,Google Play,0
d3026c2c-880f-4e10-8c85-6652e9508117,omar perez-cohen,5,,Excelente,26.0.0.6234,2026-02-24T23:41:10,es,Google Play,0
25edaa8e-4095-4ac1-955c-d728e1825115,Ana Vianna,5,,Excelente,20.2.0.6076,2026-02-24T23:36:21,br,Google Play,0
