id,author,rating,title,content,version,date,country,platform,vote_count
d43757cd-646d-49dd-bb5d-a8d4e3754353,David Mozart,1,,"CAN YOU ALL BELIEVE THIS??? Lawyers, this HP DeskJet 2742e Printer has ruined and taken another night of my life... just to print several documents!!! It's like I'm taken prisoner to agree to terms and payment to ANOTHER COMPANY for terms and COSTS before I can print this??? HORRIBLE!! I FINALLY want payback for all of the distress and time taken... just to print!!",,2026-03-24T06:19:14,sg,Google Play,0
a670a771-02c0-43cf-ac72-d2945dc0efd0,Rubina Vinti,1,,si blocca sempre e non si apre quelle rare volte che mi serve di stampare un foglio,26.0.2.6338,2026-03-24T06:15:57,it,Google Play,0
35b6d337-69e3-4622-8de9-226b2a4857dc,Nasser Seliman,1,,Non funziona,,2026-03-24T06:12:15,it,Google Play,0
87464873-df14-480a-81f1-92c88e5db593,Patrick Heil,1,,"Die App startet nicht mehr, wie auch andere berichten nur noch der Ladering, der sich zu Tode dreht.",26.0.2.6338,2026-03-24T06:10:27,de,Google Play,0
503e0484-0c0b-4089-8feb-d2dbbb5d1ae2,Mikołaj Mazurek,1,,"miałem kiedyś sprzęt HP i zrezygnowałem z niego ze względu właśnie na tragicznie jakości, nigdy nie działający poprawnie software. Teraz znowu zmuszony byłem podjąć próbę korzystania ze sprzętu HP i również teraz nie można przebrnąć przez konfigurację urządzenia bo wyskakuje error odsyłający do supportu i nara. 0/5 gwiazdek, bo równie dobrze mógłbym próbować połączyć się ze sprzętem HP apką kompasu.",20.2.0.6076,2026-03-24T06:08:12,sg,Google Play,0
d05db653-dd88-4a3f-8f98-0392c6779c81,08-NSM HARTINI BINTI JAAFFAR,5,,ok,20.2.0.6076,2026-03-24T06:07:10,sg,Google Play,0
cf44dfa8-25b2-4756-a47b-89340bcb2823,Luciana Coronel,1,,No sé abre la aplicación,26.0.2.6338,2026-03-24T04:55:38,es,Google Play,0
ffb867be-d16d-461f-b7db-4ae8267fa384,abdellah nassib,5,,muy buenos,20.2.0.6076,2026-03-24T04:39:13,es,Google Play,0
63682cb4-d8cd-42be-8ea4-6bd8ad2837ea,Jessica Güssow,1,,geht nicht mehr zu öffnen,26.0.2.6338,2026-03-24T04:34:51,de,Google Play,0
e034767b-9dd3-4685-95c3-a6a71034f95a,Leanne-Marie Gilmore,2,,keeps freezing having to install uninstall and still doesnt work half the time,18.10.0.5530,2026-03-24T02:40:29,sg,Google Play,0
b59f4969-59e8-4d64-86bf-4152e65f171d,Marisa Pinheiro,2,,"App ótima no meu ver a mais antiga, pois desde a nova atualizacao, fica rodando rodando mas sem abrir. acabo por ter de ir ao computador na mesma. resolvam isso por favor. obrigada",,2026-03-24T01:35:53,br,Google Play,0
9689c541-72c8-43d5-89c9-885d0c95690a,Frederic Jonnard,5,,Bien et facile d'utilisation,18.10.0.5530,2026-03-24T00:30:00,fr,Google Play,0
c4cdf5d3-dc89-41d2-95ff-991aba23587d,Papelería DBell,1,,"ya no me funciona la app, solo se queda en blanco y no pasa de ahi",,2026-03-24T00:14:22,es,Google Play,0
a119f633-f335-410c-a9eb-d6bf9e6d3534,damian curry,3,,"pretty reliable when it's set up, however wifi direct printing is unnecessarily difficult, 3 stars",26.0.2.6338,2026-03-23T23:22:23,sg,Google Play,0
dc88f24d-16b4-4d6a-9283-c4ade8d92c66,Melo Fornero,2,,"Super lenta. Acabo de actualizarla creyendo que era el problema y no. No abre, queda cargando y la app jamas abre.",26.0.2.6338,2026-03-23T23:10:23,es,Google Play,1
73305495-82e5-4d21-81c6-28268e4ffe1a,Hernan Wuest,1,,anda cuando quiere! muchas veces no deja cambiar el tipo de tamaño de papel y deja Tamaño Carta como única opción. Ahora directamente no carga! es basura pura,26.0.2.6338,2026-03-23T22:24:03,es,Google Play,0
f562f500-1937-4a42-91a5-315442a267ec,Manuel Millet Sánchez,2,,"Lenta, tediosa y poco intuitiva. Pasado un tiempo sigue igual de lenta y tediosa.",26.0.2.6338,2026-03-23T22:16:54,es,Google Play,0
93502617-a006-4e4e-bde5-8c9f926c484c,Pam S Roy,3,,it would never stay online for use!,20.2.0.6076,2026-03-23T21:54:02,sg,Google Play,0
8a43d312-c302-4da0-8742-cca194354923,anderson ferreira barboza,2,,Tem que ter mais recursos como almentar a resolução da imagem da impressora atualiza e colo a com figuração de imagem ficaria top,20.2.0.6076,2026-03-23T21:35:09,br,Google Play,0
d0b82bde-15fa-4f57-bedb-f9a7979d725c,Michael Rody,2,,"in this current version, the app won't use the ADF on my ENVY 6400 All-in-One Printer to scan multiple pages. It only uses the flat bed. This is rather useless. If I'm going to scan only one page at a time, I will just use my phone and forego the app. Now that I think about it, I'll just put 2 stars instead of 3.",20.2.0.6076,2026-03-23T21:30:24,sg,Google Play,0
63bcf649-7176-4eb5-8a31-398aa78620a5,Chuck McIntyre,1,,Stopped working latest update. No option to send feedback. No usable support. Just hp failing me,26.0.2.6338,2026-03-23T21:17:57,sg,Google Play,0
1336032b-c214-460f-879c-e3539dee6be7,camar6 16,5,,"Good Apps. few thing to upgrade this apps. 1. viewing angle, this apps doesn't has landscape view. tablet user will be a bit difficult. 2. paper option, please put more paper option, such as A5 paper, overall this apps is good.",20.2.0.6076,2026-03-23T20:14:35,sg,Google Play,3
7e4df104-82fa-4ca7-8b7f-1fbb30183116,melvin acevedo,1,,Muy mala aplicación igual que la versión de escritorio fallan mucho para los escaneos y se atonta cuando uno más las necesita. está fallando en mi teléfono no abre,26.0.2.6338,2026-03-23T19:53:42,es,Google Play,2
d6cf24c9-cc84-4b3a-bd31-f9b097f66594,Vishnu Navale,4,,good,20.2.0.6076,2026-03-23T19:29:18,sg,Google Play,0
1166ee8b-b935-4fd7-bdfe-3e538bd7c7b9,Duarte Higino,1,,muitas vezes está indisponível.,17.0.0.4492,2026-03-23T18:57:53,br,Google Play,0
958ef8cb-30b5-4457-8ac0-c9b68de97ab1,Beksy Marquez,5,,oki,26.0.2.6338,2026-03-23T18:43:30,es,Google Play,0
99250ff3-85b7-4c8b-bf1d-f24a8b6c4b44,marciacfreitas,1,,o aplicativo não abre,26.0.2.6338,2026-03-23T17:22:34,br,Google Play,1
d67c07a3-d4e2-4388-821c-6a01376dc2c8,Joao Paixão,2,,"não está abrindo o aplicativo faz dias , voltando , aplicativo sempre tá dando bug e não abre , tenho que desinstalar e instalar novamente pra pegar uns dois a 3 dias depois fazer tudo novamente",,2026-03-23T17:18:31,br,Google Play,0
a5d472f0-f3fd-4360-90bc-665a615b399a,Dasana Redondo,4,,a veces no me deja entrar a la aplicación,26.0.2.6338,2026-03-23T16:10:54,es,Google Play,0
f7497365-a124-4ef1-97da-34f98b97d3b0,Rhonda Hailey,1,,"whatever the update did, it no longer works. Just get the cicle of death.",26.0.2.6338,2026-03-23T14:18:00,sg,Google Play,0
00664c74-cbaf-4208-b1dd-37487848261e,Fayçal Mehdi,1,,Impossible d'afficher la liste des réseaux pour connecter l'imprimante à un appareil mobile.,20.2.0.6076,2026-03-23T14:11:30,fr,Google Play,0
76e361cf-2fb3-4ff5-b02c-b77052fcd31a,Sergio,1,,Nunca mais vou comprar nada da hp na minha vida,,2026-03-23T13:57:48,br,Google Play,0
9a6df211-adaf-4281-b2ff-f15b6b80dac8,Andreas Wenisch,5,,Perfekt,20.2.0.6076,2026-03-23T13:52:14,de,Google Play,0
06b8e67f-b9e1-46ea-a94c-aa7b07778f9d,Evelin Kontras-Krämer,1,,Also ich nutze diese App mit meinem Drucker HP Leser Jet Pro MFP m 28w. Hölle. Ist immer Glücksache wenn sie miteinander funktionieren. Nie wieder. Gerade tut es mal wieder nicht,26.0.2.6338,2026-03-23T13:25:50,de,Google Play,0
d7cd6ca7-390b-4958-8c03-eec1cfee5f3b,Nicolly Palomeque,1,,Esse app é horrível demora horas ou até dias para conseguir entrar nele as vezes não contigo nem fazer outras funções como scanear olha que estresse isso,26.0.2.6338,2026-03-23T12:53:12,br,Google Play,0
f71ab64b-4418-44aa-9ad7-7df1d66221d7,Alberto Galleano,1,,dopo l ultimo aggiornamento l'app non funziona più,26.0.2.6338,2026-03-23T12:43:57,it,Google Play,0
28840719-7962-4e72-b66b-dd8addfbcdc3,Christina Stein,1,,This app is not working. It does not recognize My printer. Why?,26.0.2.6338,2026-03-23T12:40:48,sg,Google Play,0
f75105da-f9e9-4afb-8a66-30e509609503,Henrique Gonçalves,1,,"o aplicativo tem uma função principal: gerenciar impressoras e ele cumpre pobremente com a proposta. aplicativo hiper mal otimizado, com pouquíssimas funções, MUITO peso e pouca funcionalidade, além de péssimo suporte(eu fiquei 3 horas tentando resolver um problema sem solução). eu tive problemas com desempenho do aplicativo, com a funcionalidade (não consegui imprimir o que eu precisava) e com a raiva q eu passei com essa bomba ai",,2026-03-23T12:11:16,br,Google Play,0
4543a6be-e148-44ef-9e95-fe7d6259a3a4,ignacio elicagaray,5,,"super facil de controlar, rapido y sencillo a",16.5.1.4270,2026-03-23T11:53:57,es,Google Play,0
c6de2e69-3640-4cf5-8aaa-6ed96730c105,Dhrubojyoti Halder,5,,good,26.0.2.6338,2026-03-23T11:34:19,sg,Google Play,0
ce1c307c-ddc6-42cc-ac55-a36ba2d9d769,Monique Correa,5,,I've read the recent reviews. I too have used hp Smart for some time now and it used to work just fine until recently where it just stay on the loading page but never opens. So what I did was uninstall and the reinstall the app and IT WORKS! Just like it used to before. I believe they updated and changed the app since it went from HP Smart to just HP. I'd advise anyone having issues with the app to delete the app and reinstall it.,26.0.2.6338,2026-03-23T10:48:50,sg,Google Play,2
8f0e95f0-eb00-4b48-8076-4b9263956ada,Christopher “CanaryFan” Impey,3,,"I've just tried to sign into the HP Smart App and all I kept getting was the Loading Circle, I had to uninstall the app then reinstall the app for it to work I only wanted to check on my Ink status, after looking through the other Reviews for this App I have noticed I'm not the only one that has had this same issue I'm hoping that this won't happen again.",26.0.2.6338,2026-03-23T10:07:07,sg,Google Play,0
37c223fe-5f3b-4beb-b2ec-4cb3eb15c5c3,Luana Lorenzetti,1,,"Da diversi giorni ormai l' app non funziona, carica all' infinito senza mai aprire veramente 👎🏻",26.0.2.6338,2026-03-23T09:53:07,it,Google Play,1
d082397b-955f-4bb0-b133-a6e8cb173568,ORION DA COSTA SOUSA JÚNIOR JÚNIOR,5,,excelente,20.2.0.6076,2026-03-23T09:33:14,br,Google Play,0
f37f8c59-fdfa-421f-82f2-490018a1558f,Tarun Joshi,1,,mobile se print dene me page per sheet ka option kaha hai isme??,26.0.2.6338,2026-03-23T08:38:50,sg,Google Play,0
5964f512-c36f-452e-bfbf-861c6a2924ff,morosan ionela,1,,"Buongiorno,da piu d' un mese che non funziona piu questo app.per favore sbrigatevi a metterla aposto. grazie",20.2.0.6076,2026-03-23T08:34:09,it,Google Play,1
e86175b8-86ea-4f17-ba04-316d87d15cc8,Ottavio D'ignazio,1,,"app scandalosa, non si apre... gira gira e nulla... che facciamo? risolviamo questo problema, dato che paghiamo un abbonamento. grazie.",26.0.2.6338,2026-03-23T08:19:00,it,Google Play,1
cbe84774-7b68-4d34-842c-f5efcf36406b,C. A.,1,,App öffnet sich seit Tagen nicht und hängt sich auf,26.0.1.6280,2026-03-23T07:52:17,de,Google Play,0
8d2e93dd-1153-478e-81a5-cdd3dc503417,Jan Murdoch,5,,love the new phone scanner option!,26.0.2.6338,2026-03-23T07:45:26,sg,Google Play,0
baaa28db-749c-437e-b877-c3ec1d19a08f,Brian Cooley,1,,I can't even open the app now I have a print job that keeps telling me that there's a print job that needs to finish but when I go to open the app it's on my phone doesn't work I'm about to send the printer back,26.0.2.6338,2026-03-23T07:19:20,sg,Google Play,0
ff9fb711-7cb1-4862-a14c-cd7535f7902d,G F,2,,Difficult to use,20.2.0.6076,2026-03-23T07:16:17,sg,Google Play,0
71cccea7-e0fa-415e-9b39-2d26c8dd364c,Dipenkumar Rathod,5,,good,,2026-03-23T07:07:23,sg,Google Play,0
f848268e-8457-428a-b3da-641408aff4e9,e. castro,1,,"Algumas coisas não mudam nunca. Impressionante como os aplicativos da HP passam por um loop infernal de não conectar, pedir senha, processar... desistam. O setor de v6 não tem competência para algo funcional. Mandem um tutorial por escrito ou comecem a fabricar máquinas de escrever.",,2026-03-23T06:25:17,br,Google Play,0
af834066-722e-420c-b089-1a26b84a2f82,Papyjeannot,5,,super,20.2.0.6076,2026-03-23T06:04:31,fr,Google Play,0
d207a47d-90db-40f4-82dd-120787b06d73,Emanuele Di Iorio,1,,"pessima, l'applicazione è lentissima e nella maggior parte dei casi non si avvia",26.0.2.6338,2026-03-23T05:31:59,it,Google Play,1
2bfd6831-ecff-4540-8efe-9d68de22d980,Joaquín Guizan Vila,1,,"no funciona correctamente,es una pena porque antes funcionaba muy bien",,2026-03-23T05:07:39,es,Google Play,1
2dbea807-8faa-4ab0-bb4a-7e712be60afe,Sabine Hinz,1,,"Ring des Todes, keine Nutzung der App möglich. Seit einiger Zeit öffnet sich die App nicht mehr. Nach dem Öffnen erscheint kurz das Logo, danach Lade Anzeige die nicht aufhört (selbst nach 4 Stunden nicht). Neustart des Handys (Fairphone 4 mit aktuellen Android) hat nicht geholfen.",26.0.2.6338,2026-03-23T04:44:01,de,Google Play,3
906dd57f-6144-4f83-bc4e-0102c8709265,Abdul Hak Kassali,1,,its not working,26.0.2.6338,2026-03-23T04:25:41,sg,Google Play,0
61f1c405-9ea8-4f2b-9375-e6e6696f812d,Ann Williams,1,,worst printer ever. constantly losing connection. hp support are useless. AVOID. UPDATE. hp is still useless. I'd give zero stars if I could.,17.30.0.4993,2026-03-23T04:22:34,sg,Google Play,0
05da4e21-de0c-4dc1-b9f4-36c4e8b4f4de,Sam,1,,"App not loading. Loads up blue screen with HP logo, spinning circle with no progress for minutes.",,2026-03-23T03:26:42,sg,Google Play,0
11891832-5499-497e-8f3d-12d1ffb4665c,Willy Gabriel,1,,"péssimo app, n só o app como a marca é pessima. n deixa vc imprimir dois paginas por folha, só imprir se fizer login e configurações limitadas",,2026-03-23T02:28:22,br,Google Play,0
bb4802b9-5ceb-4ff6-b8c9-9b9dedcbc5f3,Maria Luisa Vieira,1,,"péssimo. ultimamente eu tenho que desinstalar e reinstalar se eu quero abrir e aplicativo e imprimir alguma coisa. funciona bem por duas semanas, mas se eu não Imprimir todos os dias, quando eu reabro o aplicativo, ele buga",26.0.2.6338,2026-03-23T00:59:36,br,Google Play,0
204fa7c2-ac16-48c3-896f-01160eeca45c,Shanskhem Syiem,1,,"bad experience , I try opening the app it still in loading screen even waiting for an hour, previous it work so well with my hp printer now , I cant even open the apps",,2026-03-22T23:46:15,sg,Google Play,0
23155288-1547-4bc8-a582-b8531ff05016,Marion Sigler,1,,nothing is working,20.2.0.6076,2026-03-22T21:49:40,sg,Google Play,0
4a2eb69a-b941-49d4-a182-d75212420167,Stephanie Ladouceur,1,,The absolute worst user interface. 100% not user friendly. Hopefully your not in a rush to print because it takes over an hour once you update your payment method to be able to print and do anything. Honestly a waist of time and money.,20.2.0.6076,2026-03-22T20:39:30,sg,Google Play,1
7a0a8b20-3159-4889-b9dd-85562bca20ba,Sunshine Wilson,1,,Crapped out. The app was never really good. It took forever to load. It took a minute or longer at app start up and each feature selected afterwards. The app totally stopped working for me after the most recent update. I've had issues with my printer itself for months - driver seems to be corrupted or something - but system scan doesn't show any issues. I've had to uninstall my printer from my computer and use the app to reinstall multiple times. Now I can't do that since the app stopped.,17.35.0.5115,2026-03-22T18:12:02,sg,Google Play,5
1ffcd891-4621-4b01-9d9e-1a63b36cb633,Regina Blackman,1,,It does not work!,26.0.2.6338,2026-03-22T16:46:18,sg,Google Play,0
19733fa6-0799-410b-92e0-36f00a25cf41,Yesisney Méndez,5,,excelente aplicación,20.2.0.6076,2026-03-22T16:42:46,es,Google Play,0
597def82-5677-4eaa-b821-4ecdd3aa98b0,Dave Sutherland,3,,"As much as it's a hassle, if your app is broken, like mine was for 3 weeks. I finally dug in, cleared the cache, cleared the Data, did a force Stop and then logged back in and Re-added the printer.. It's now working again..",26.0.2.6338,2026-03-22T15:41:35,sg,Google Play,1
10191612-0bdd-49c7-b0dc-a6a58d5b3133,Thomas E Jackson,5,,Awesome,26.0.2.6338,2026-03-22T15:20:17,sg,Google Play,0
9bd6f5f7-af02-4c07-9b02-14b39e90c5ff,deb G,1,,it never opens just a white page,26.0.2.6338,2026-03-22T14:38:12,sg,Google Play,0
0c38201d-f5e9-4c3d-94b7-2aa210606141,Césare Scheid Winck,1,,"Lento demais, mesmo com S25",26.0.2.6338,2026-03-22T14:36:19,br,Google Play,0
4a4f7e89-988b-4f62-b693-5ea6b8b35993,Bobbie Jones,1,,HP app sucks. it lost my printer and now it cannot find it. HP app sucks. It lost my printer and not it cannot find it.,26.0.2.6338,2026-03-22T14:05:08,sg,Google Play,0
fe1b543d-aa22-42a5-b95a-3b5ad004def9,Oscar ortiz,1,,doesn't work at all,26.0.2.6338,2026-03-22T14:02:58,sg,Google Play,0
576ff4d2-7f99-4243-8c4c-f28490401b53,Joshua Alexander,1,,"By far the worst printng service you will ever have. Do not buy this printer. Sure it connects to wifi to connect but passes through multiple servers to get information to your printer, buffs, processes, fails and doesn't even print well or have an ability to do as you suggest or desire. The ""unlimited"" ink service is by paper and if you cancel they can lock your ink cartridge from being used because you canceled and if you pause service good luck getting anything done because of these factors.",26.0.2.6338,2026-03-22T14:01:34,sg,Google Play,1
310262f3-050f-435e-9f46-ae81ad7cd189,Jean Collins,5,,Great app,26.0.2.6338,2026-03-22T13:26:01,sg,Google Play,0
d5bceb03-2aa9-48d0-b8de-d0fd1bf48628,Mark Hernandez,1,,Hp used to be reliable... not anymore... I can NO LONGER print Anywhere/Remotely after the last update early in March 2026.. it automatically tries to send print job to Private printing... and the printing from the HP through my Android Smartphone works about 90% of the time... looks like I will be forced to replace HP with Epson or Brother where YOU DON'T Have to create a Account etc...,20.2.0.6076,2026-03-22T13:19:07,sg,Google Play,0
6cfaf044-14ef-421f-b72c-7e190045aa2b,M L,1,,App does nothing except have a spinning blue circles. This is on multiple different devices,26.0.2.6338,2026-03-22T12:54:56,sg,Google Play,0
f77f9760-5e37-4398-aecb-eaa6f6dc9942,Maurice Lynch,1,,The app will not open. I am very dissatisfied with the app and it's features.,26.0.2.6338,2026-03-22T12:42:53,sg,Google Play,0
e835c890-9b2f-4deb-bd1c-d1bc95866986,Jane,1,,"No longer opening just circle going around. Cleared cache, restarted phone, still not opening",26.0.2.6338,2026-03-22T12:42:32,sg,Google Play,0
460b55f4-dabf-4e95-9f5a-4ab0baa934a0,Angela,1,,"not loading. hasn't been for weeks. can't print. this happened last time and I had to get a new printer! It's not my printer. I think its the app, the troubleshooting takes me round in circles.",26.0.2.6338,2026-03-22T12:19:29,sg,Google Play,1
41cf6159-6c4d-4cb2-bbe4-963cec3e5f2a,Banibrata Mandal,1,,This HP app is not compatible with Asus Chromebook. I cant install it.,26.0.2.6338,2026-03-22T12:09:11,sg,Google Play,0
98cfdd7c-0cc9-4ed8-9476-876015060899,Valeria Abigail García Morales,1,,"es muy buena app pero cada que intento entrar me pasa lo mismo, no se carga ya he intentado reiniciar el celular o esperar por mucho tiempo pero una vez que ya no cargo ya no puedes volverla a usar",,2026-03-22T11:36:05,es,Google Play,1
912d89bf-dc4b-4f73-aa58-4d9877aa508b,Eduardo Bato,3,,easy& convinient,17.35.0.5115,2026-03-22T11:28:02,sg,Google Play,0
4d04ada3-3706-4df0-a3b9-725282e0be62,patterson.elnora81@gmail.com Classy49,1,,won't open,26.0.2.6338,2026-03-22T11:02:37,sg,Google Play,0
e0d48bb5-8522-4b59-afc9-9d3b12d90482,kelly bennett,2,,app not loading,,2026-03-22T09:53:55,sg,Google Play,1
2c6900b5-d1cc-4e64-ac1d-eaa84c56d858,Jo Jo,1,,Ständig wird der Drucker nicht gefunden weil angeblich offline obwohl online. Nervt einfach nur noch!!,26.0.2.6338,2026-03-22T09:41:53,de,Google Play,0
5855ffe5-0f61-4f32-b334-867da90af1aa,Chris,1,,"Boah ey, warum muss ich mich bei HP anmelden wenn ich bei mir zu Hause wo ich vor dem Drucker sitze was zu drucken will.",,2026-03-22T08:42:02,de,Google Play,1
34580ca2-9a8d-46e1-9a7a-a5bb58b77efc,Luca Vettorello,1,,Vergognoso che serva accedere con un profilo per scansionare un foglio con la stampante. A cosa serve accedere al profilo se non per permettere ad hp di raccogliere dati sull'utilizzo del dispositivo? è una scelta che all'utente finale non giova in nessun modo e rallenta solo l'immediatezza d'uso della stampante. Dispositivo che dovrebbe essere il più plug and play possibile.,20.2.0.6076,2026-03-22T08:16:58,it,Google Play,1
0271831e-5ca1-426b-82b6-f4cdd39fcd62,Gary Wood,1,,app just spins.. Smart app worked well...,26.0.2.6338,2026-03-22T07:52:28,sg,Google Play,1
4b31e0c6-a455-4844-9de4-f8d3c16b5aa3,Laurent Voisin,1,,nécessite une authentification pour fonctionner. nul,26.0.2.6338,2026-03-22T07:40:07,fr,Google Play,0
f05b6bf9-db27-44ed-957a-e92ddb3e2c42,Ron Buchanan Jr,5,,Love the ease of use of this app. I use it several times a week and it's flawless every time.,20.2.0.6076,2026-03-22T07:30:00,sg,Google Play,2
2d97d45e-5c9f-4c9d-a29f-74a844fdd520,Meriel Cirene,2,,"Debo decir que esta aplicación de (HP) no la recomiendo para imprimir. Es una app donde podés imprimir desde el celular a través del wifi para un uso más práctico. Sin embargo, me he encontrado con la decepción de que la aplicación es muy lenta para realizar las impresiones, a veces cuando quiero imprimir me llega la notificación de ""imprimiendo"" y no imprime o tarda mucho, o cuando quiero imprimir un PDF a veces imprime tres veces las mismas páginas y tengo que reiniciar todo. Ojalá la mejoren.",26.0.2.6338,2026-03-22T07:15:20,es,Google Play,5
3fd5064c-b32f-4d56-9f0b-1d8d3a383a0b,Greta Nahary,5,,Very Good,26.0.2.6338,2026-03-22T06:46:10,br,Google Play,0
0b98128e-b2d5-423f-81ae-24c9a716eb8b,Betül Dede,1,,"Really unpredictable and full of bugs and glitches this thing! You never know when will the workflows will change or will it work at all or not. Too cumbersome, plug in, this and that too much to keep up with. You simply want to just print a piece of paper and you pull the app it turns and turns and turns to no avail.",26.0.2.6338,2026-03-22T06:35:06,sg,Google Play,3
314ac5bf-f5be-4b4d-8a43-27d507e18adc,Vitória Dias,1,,só fica carregando e não abre,,2026-03-22T06:28:23,br,Google Play,0
42e843d8-538c-485d-85d5-c6a69900c1bf,Luis,1,,"I can't even scan my files it shows I'm connected to my printer. After that, I get into the scaning section, and it says I can't find my printer? what kind of app is this? it doesn't even help it just stresses you out, and it is worse when you really need this to work. Not everyone has the time to try to figure out how it works.",26.0.2.6338,2026-03-22T06:14:51,sg,Google Play,2
969e87b6-3b64-46eb-9621-a185a39afcea,Vanina Vidal,5,,completa eficiente. muy útil y práctica .súper recomendable.,20.2.0.6076,2026-03-22T05:54:22,es,Google Play,0
1bc95364-1902-49ea-aaec-d20ad83862c0,Frank Möller,5,,"App deinstalliert und wieder installiert, jetzt geht's wieder 👍",26.0.2.6338,2026-03-22T05:43:48,de,Google Play,0
a3fed755-cd42-4d5a-829c-0b89e7b34795,erion sinanaj,1,,Non funziona più,26.0.2.6338,2026-03-22T05:43:30,it,Google Play,1
28d4127a-b0a3-4305-8e73-3948e179275c,Thiago Jovelino Ferreira,1,,trava direto e não faz login deixa a deseja,,2026-03-22T05:24:12,br,Google Play,0
3d6fc85f-fc30-427d-b026-c5c2dc7b1fc1,Marcus,1,,"Die App öffnet sich leider nicht mehr, seit paar Tagen schon.",26.0.2.6338,2026-03-22T05:12:14,de,Google Play,0
02cc03e7-7dfc-4cfd-9274-9eb18856aba3,Eric Gerber,1,,"The app is frustrating. The app offers basics and is not as automated as the HPSmart app. The HP smart app was the only way that we were able to get our HP printer to connect to our devices. Without it, we're back to square one and have nothing more than a heavy paperweight.",20.2.0.6076,2026-03-22T04:47:00,sg,Google Play,1
c21c44e8-d8b1-4102-9c6b-acca4edd6d4d,jatin mandanka,5,,nice application,20.2.0.6076,2026-03-22T03:39:42,sg,Google Play,0
bce829dc-e479-419c-850c-18bc05907611,piyush arora,1,,"The application is not opening, and I’m unable to carry out my operational work. Could you please check what the issue is?",,2026-03-22T03:25:14,sg,Google Play,1
83ae33d4-f977-46f2-b7b0-d28e17840b2e,Fabienne PAUL,1,,"depuis la maj du 10 mars, mouline et ne s'ouvre plus",,2026-03-22T02:51:44,fr,Google Play,1
d4681367-7d62-4290-ba45-30103e0be905,Lucia Pelizzari,1,,"Un cesso di app non funziona, ogni volta che cerco di stampare dice stampante off line, mentre il WiFi è collegato in Diretta alla stampante...",17.20.0.4770,2026-03-22T02:47:13,it,Google Play,1
e1ca42a0-4abf-4488-b925-1a55bfc98518,Michael Kent,1,,"Constant problems, often won't start and just keeps loading",26.0.2.6338,2026-03-22T00:40:47,sg,Google Play,0
856c834b-a5de-423e-ac00-299fc8688928,Kimberly Sturms,5,,"Every time I start my phone up, I get an error report saying that the printer's not working, with an exclamation point, even though it is. it does eventually go to the app, and I'm able to print it, and the exclamation point goes away for a moment and then comes back on when it's done. Is there a way to fix this please?",20.2.0.6076,2026-03-21T22:27:29,sg,Google Play,0
f42ae455-a306-4cac-88fa-3d466fd384b3,Sharath Arva,1,,not connecting to Wi-Fi every time same problem repeating after the new update,20.2.0.6076,2026-03-21T21:24:53,sg,Google Play,0
f982344f-843b-44f5-8a34-d3e65915c8a1,Jherson Sanz,5,,Es una maldita belleza,20.2.0.6076,2026-03-21T20:33:18,es,Google Play,0
821d58cc-bc01-46a1-9c8d-d73286cc789b,Phillip Joseph Ona,1,,Very bad. Not working.,26.0.2.6338,2026-03-21T19:42:51,sg,Google Play,0
b352e43c-54b1-42e0-81a1-6a360f4e19d3,DARREN MCGLENN DARIO,5,,this app can make me print my photos using wifi,20.2.0.6076,2026-03-21T19:28:49,sg,Google Play,0
08e5be42-aaf4-406f-9ab3-cf5caefef5c4,Gerardo Moyano,1,,no sirve para nada,26.0.2.6338,2026-03-21T18:06:09,es,Google Play,0
63b41ee0-4eeb-4d57-b1b2-7c05c067393a,DESIGNARE STUDIOS,5,,I Like hp congratulations we are happy,26.0.2.6338,2026-03-21T17:57:15,sg,Google Play,0
