id,author,rating,title,content,version,date,country,platform,vote_count
60e47637-c3cb-471c-8609-d2e0a3875f88,Sravani Palley,4,,many adds in between,20.2.0.6076,2026-02-12T11:13:15,us,Google Play,0
ef90c039-eabb-4e99-addb-b7c10e3a5090,Damodar Reddy,1,,new version is not detecting the printers. Also not able to connect printer with mobile. no use with this app. older version of app is user friendly and easy to connect.,20.0.1.5732,2026-02-12T09:49:17,us,Google Play,0
f200871b-bf69-4c14-a56b-562ed0ee6bc1,David Coldwell,1,,can't find printer,20.2.0.6076,2026-02-12T09:25:10,us,Google Play,0
f5f878b4-5e58-4bf0-9f3b-aa257ba5dd34,Kim Jo,5,,Excellent 👌,20.2.0.6076,2026-02-12T07:53:30,us,Google Play,0
b16dde9e-92bf-435c-9498-958fc62f0db9,Tom Parker,1,,does not work,20.2.0.6076,2026-02-12T06:34:47,us,Google Play,0
21b8c8ca-6400-4a56-a4ce-42b917d6838c,Sreelekshmi V,5,,good,20.2.0.6076,2026-02-12T06:14:57,us,Google Play,0
9ff76859-ccdb-45f6-8435-918031507913,Vinay Kumar Yadav,5,,ok,,2026-02-12T05:15:11,us,Google Play,0
a97b7512-1e93-4aef-9ef7-96034e404822,Kichu Anandh,2,,very bad application,20.2.0.6076,2026-02-12T05:04:23,us,Google Play,0
091ad117-5235-4826-b5cd-f23f9bcfe1a8,Carlos Correa,1,,this printer is a nightmare!!!!,20.2.0.6076,2026-02-12T04:10:52,us,Google Play,0
1e8d2e67-ad32-44d6-b784-6e9365396abd,Boyce Duncan,1,,I cannot stand this app the wrost,20.0.1.5732,2026-02-12T02:59:34,us,Google Play,0
e2425984-4eb1-46e6-9c92-ec363c206534,Javier Richards,1,,wdym I need to create an account to print?????,20.2.0.6076,2026-02-12T02:54:33,us,Google Play,1
0ae1f95e-c3f4-4adc-a8d9-01e930cb8705,Lance Evans,1,,please go back to hp smart app this new app doesn't work with an android device,20.2.0.6076,2026-02-12T01:52:01,us,Google Play,1
2c856200-64d8-4d13-b14f-f69cd1478d50,Sindy Martinez,1,,awful update from HP Smart,20.2.0.6076,2026-02-11T23:28:34,us,Google Play,0
a0a479c8-4cfe-4c08-bf44-bd8b14cc7ab0,Humberto Hernandez,5,,very good very useful saves a lot of time,20.2.0.6076,2026-02-11T22:54:02,us,Google Play,0
429f375d-6f10-4e4f-96ff-b18c1743929a,Jonathan Hernandez,2,,doesn't scan images to the pepper size and it doesn't scan multiple pages as one file. For me the mobile app is unusable. I use the PC app and it works just fine. this mobile app needs a lot of tweaking.,20.2.0.6076,2026-02-11T21:52:27,us,Google Play,0
15e07451-d6e6-41a7-95e6-82db5ea3d6a7,Amina Laassiri,5,,"printer app, extremely easy to use and very intuitive",,2026-02-11T21:14:30,us,Google Play,0
3f149028-94a5-4c6d-aa6f-969a18cb460a,Mary Thomas,1,,awful,20.2.0.6076,2026-02-11T20:38:33,us,Google Play,0
f2ad756c-1449-47f1-aaf0-964aece4baaf,Sharon Sims,5,,Great,20.2.0.6076,2026-02-11T19:30:46,us,Google Play,0
6dae3c1d-f271-4217-a5a1-1839d971a96a,Sagar Choudhari,5,,good app,20.2.0.6076,2026-02-11T17:57:14,us,Google Play,0
0f3fdddc-75d7-4581-a8ef-f9d8e537cd70,Reekapp Photography,3,,Whats up with this app not supporting Wifi-Direct? Whats worse is it's wifi direct on an HP printer. Please address this issue ASAP,20.2.0.6076,2026-02-11T15:37:09,us,Google Play,1
0e8ac11f-c60b-47e7-8dcc-4f178caee39f,sachin ayre,1,,बहुत बेकार है,18.10.0.5530,2026-02-11T14:19:49,us,Google Play,0
3707b363-bcd9-48e9-9ee6-cb9640b6265c,Mohammed Feroz Khan,5,,awesome,20.2.0.6076,2026-02-11T07:48:19,us,Google Play,0
edbbadbe-5760-4134-a75c-cb2751d279ce,Akrawat Siripattanachok,1,,"Bad printer app ever, I can use this app for printing for a while, but right now it fails to connect my printer without reason. HP Laser MFP136w I expect HP to make the printer easy to connect, but it is not at all. Completely different to EPSON",,2026-02-11T05:51:03,us,Google Play,0
d1ac1cd2-7a7a-4702-b4ac-47ab15a33e59,Erin Teague,1,,"Do not buy! I have been trying to print an extremely important document for days! I'm literally in tears. I go through all the steps, it starts to print and stops after 2 pages. or jams on the first page. I'm currently rage crying and I want to hit this brand new printer with a baseball bat.",20.2.0.6076,2026-02-11T03:40:36,us,Google Play,1
6965935c-9730-4a8b-8ee2-6643de4d9c0e,Mike V,1,,I am trying to fix a problem to connect my printer back to the wireless network and this app keeps trying to sell me ink.,20.1.2.5988,2026-02-11T01:49:41,us,Google Play,0
3d06c328-6e27-4383-9dfb-7c63a7ddd9cf,Tom Coleman,1,,HP is horrible.,18.10.0.5530,2026-02-11T01:43:01,us,Google Play,0
c59f1c15-4dc0-415d-8d33-2dc628ccc516,Cynthia Shaw Spencer,5,,I love my printer I like the way I can print my pictures and print paper and scan them,20.2.0.6076,2026-02-11T00:31:10,us,Google Play,0
8c97adfd-b8bb-42a8-80f0-ee1c950e940a,David Z,1,,You have to pay to print??? I will never buy an HP printer now.,9.0.1.3,2026-02-11T00:21:07,us,Google Play,0
811be8eb-bcad-4158-a305-6f371b3748bb,Tom Keyes,5,,"top quality App, one that gives true and precise assistance and accuracy.",20.2.0.6076,2026-02-10T23:17:22,us,Google Play,0
4d952885-ff3c-4b96-b085-ed814e567f61,Luan Kaziu,1,,what is wrong with this printer losing his Wi-Fi I got to turn it on and off on and off try to reset it it works then it loses you have to fix your program,,2026-02-10T21:13:50,us,Google Play,0
a5bbef3b-1a04-4a65-981f-6557d9a90100,Aubrey_ chrys Eroom,5,,Great app.,20.2.0.6076,2026-02-10T20:45:57,us,Google Play,0
9f4a1efa-431f-46d2-a596-3f99059d7fba,Nelia Kleiven,1,,some of the buttons doesn't work (adding a new printer),,2026-02-10T20:22:08,us,Google Play,0
81281691-f244-401c-bb66-80095f214527,Sagar Adhav,1,,absolutely sluggish interface. options are selected but the responsiveness is terrible.,20.2.0.6076,2026-02-10T20:19:29,us,Google Play,0
10bde8af-9a23-4f10-a27f-e973aef87aa4,B Carroll,1,,Won't work from phone,,2026-02-10T19:35:40,us,Google Play,0
0ac54eab-9e2a-4d1a-a42e-95e6b05a2120,Paulette Ford,2,,i called a couple of weeks ago to give my new card number for billing. told to call back and talk to billing. the helper i got told me to go to a store and he would hang on. got to dollar general and the hp guy told me to put 500 dollars on my card. thats when i said to put my new card number on my acct. now my printer wont work. please have a billing rep call me asap something is wrong with this and i need it resolved. call me please. a real live person please. thank you.,20.2.0.6076,2026-02-10T18:19:50,us,Google Play,0
746159e6-bc79-44d6-9bb8-c7e0b0de7a5b,Hugo Lozano,1,,why do i have to keep configuring the printer every freaking time i used it as if it was a new printer?,20.2.0.6076,2026-02-10T17:59:58,us,Google Play,1
99480b97-684f-4f54-8bb1-6d4c9a191b43,Prerak Shah,1,,"something suddenly was changed in the hp smart internet printing system. the hp 589 printer is shown offline, despite hp eprint (via email) working instantly. have stopped and started webservices for the printer and re added the printer. the printer will show online to HP smart or hp app only when connected to the same wifi. but not over the internet.",20.2.0.6076,2026-02-10T15:46:59,us,Google Play,1
c65afd71-5880-49c2-9c0a-cfd3789ac660,Alven Aranzado,2,,"You will waste a lot of time trying to troubleshoot the problem everytime you are trying to print/scan. Even though, you follow all the instructions like connecting to the same wifi, the printer would keep saying it's offline. You will take about 30 minutes to 1 hour foguring out how to produce a file from this app. So utterly useless.",20.2.0.6076,2026-02-10T15:17:15,us,Google Play,2
8b87cd05-7abb-4ac8-96aa-a73374a78ee8,Ray Flickinger,1,,horrible. can't find hp envy printer. app should be straight forward but can't even find their own printer. can't understand why 3rd party apps can work and hp's own app can't. geez.,20.2.0.6076,2026-02-10T14:50:49,us,Google Play,1
45967804-eec3-4c8f-a898-9143828bad13,Hower11 Fan Official,5,,Best one and my HP DeskJet 2875 is very good printer and i can print everything from all papers.,20.2.0.6076,2026-02-10T13:26:57,us,Google Play,0
9586508b-d716-4221-9349-591596692433,Kenneth Haw,5,,Good to setup.,20.1.0.5822,2026-02-10T12:27:17,us,Google Play,0
4b2795fc-34da-4022-a28f-892227936e29,Shadin Computer,5,,very nice 👍👍,20.2.0.6076,2026-02-10T06:45:09,us,Google Play,0
dd340f04-3187-4d71-83a8-f499b379b08b,Loretta Powell,5,,great work,20.2.0.6076,2026-02-10T02:53:43,us,Google Play,0
bb8ada03-14ed-48cb-ad9c-6e34926c1cba,Chassity Thornton,1,,why should I have to pay a weekly fee to use my own printer. negative,20.2.0.6076,2026-02-10T01:36:06,us,Google Play,1
fba85c01-e1af-4c80-9c8b-23637c844115,Erick Flesey,5,,amazing software and ux experience,20.2.0.6076,2026-02-10T00:52:55,us,Google Play,0
02119d32-8ebf-46c3-abbb-749a31d1a7ee,emily medina,1,,It's always an issue!!,20.2.0.6076,2026-02-10T00:46:47,us,Google Play,0
c75c0afa-6965-4c41-97cb-3c16b27c9b79,Mr. Nonamanadus,1,,"Do not buy HP printers. They need internet connection and it demands WiFi, not direct to the PC. The app is useless and I just wasted money on two cartridges for my Deskjet 2855e. This is a real scumbag trick to pull on customers.",20.2.0.6076,2026-02-09T22:32:32,us,Google Play,0
61f0c1b5-a3bf-4079-a279-3365366e8c88,GT & Shell McClain,1,,Terrible app. Terrible setup. I hate having an HP printer now.,20.2.0.6076,2026-02-09T21:19:51,us,Google Play,0
2cfa2bd7-ef5c-4c12-9ae3-49cdef8c5bf2,Ruth Cooper,1,,"As a well established brand, I expect the best. However, the printer, Deskjet 2710 series, keeps disconnecting from my WiFi, is often unavailable or asleep, hardly prints from my phone and when it does, it goes through multiple servers, which is no good when printing confidential documents. Disgraceful.",20.2.0.6076,2026-02-09T20:19:17,us,Google Play,0
51545750-cf28-4969-bed7-827a8a3c86e9,Ibrahim Khan,1,,"It's alright it gets the job done, But the app feels slow and buggy and it feels frustrating to use to the point where I feel like I want to pull my hair out of my head",,2026-02-09T19:03:11,us,Google Play,0
60e474f7-9e15-4759-89c9-4c8bb60a0c3c,Tommy Trisdale,5,,good app good products. very happy. yes,20.2.0.6076,2026-02-09T18:49:33,us,Google Play,0
b4252d1e-314c-4995-820a-d4437a422c1e,ma col,1,,can't get anything to work called 800 # and all I got was a sales pitch on a life saving device I DON'T NEED!!! WORTHLESS & A WASTE OF MY TIME!!!,20.2.0.6076,2026-02-09T18:23:35,us,Google Play,0
9ef011aa-a3b8-4ba6-b3c6-18a84c9b2f62,Andrea Giles,3,,great printer. still learning how to scan n fax from phone. the program was much easier before but I can adjust.,20.2.0.6076,2026-02-09T15:40:55,us,Google Play,0
c6a0f931-4f61-4b91-b99e-8e494280418a,Sudhir Dhunde,5,,good,20.2.0.6076,2026-02-09T14:31:17,us,Google Play,0
f4b60e62-115a-43fe-849e-f6ed0e0876da,Megha Dewat,5,,good,20.2.0.6076,2026-02-09T14:31:15,us,Google Play,0
b3a7c7bb-e6d8-4040-8afd-36cdda102a88,Ronn G,1,,"Does not work...support not found. still being billed. poor customer service, poor experience",20.2.0.6076,2026-02-09T12:56:34,us,Google Play,0
a61d71e4-04cb-4f2e-8819-c1bf7c62b985,Maunick Koloko,5,,works wonderful 👍🏿,20.2.0.6076,2026-02-09T12:08:28,us,Google Play,0
d7259ece-3383-451a-bdad-cbdec3173927,Emmer O'Connell,2,,really annoying to use. hit and miss if it works 1st time,20.2.0.6076,2026-02-09T11:30:34,us,Google Play,0
254888fc-a7a1-45b6-8366-fbc2a8ba3cfb,Hari Reddy,5,,good,20.2.0.6076,2026-02-09T11:16:37,us,Google Play,0
91436ff4-d415-4166-8dfc-7b8f9ec77974,Michelle Hartley,2,,I don't know if it's the app or the printer but I can't get anything to line up and I can't get the pages to where it needs to print the whole page right. the power plug won't stay in the machine it keeps falling out.,20.2.0.6076,2026-02-09T08:40:33,us,Google Play,0
0808ffee-a517-4964-8b02-5267d5757464,Scruff Arino,1,,"HP Smart is a scam. My HP 8720 can print, scan, and fax — but the app blocks everything and turns it into an ink-level monitor. Non-stop ads. Subscription pushes. On Android, scanning and faxing are useless. This is deliberate, anti-consumer nonsense. HP, you made a fully capable printer worthless unless we pay extra. Shame. NEVER EVER HP AGAIN. EVER!",,2026-02-09T02:50:59,us,Google Play,0
21847a3b-0ade-4bc6-9960-1436645f692f,Santi Liz,5,,thumbs up,20.2.0.6076,2026-02-08T23:02:31,us,Google Play,0
afda8777-42e7-46e2-82ee-c24c68406389,Ron Sinc,1,,printer app should be free after purchasing a printer,,2026-02-08T21:44:16,us,Google Play,0
4159ed8c-2f31-4bb0-9738-decd17d1cdd7,Nonyah,2,,"I was scared my printer would never print anything on the phone. I restarted both devices and reput the wifi on the printer. Still ""your phone found printer"" but never printed. Then I decided to uninstall and install the app. That worked. I was almost at a loss. I run a business and I'm also a college student. Printer is just an essential in my life. If it ever stops working I'd be devastated.",20.2.0.6076,2026-02-08T21:09:24,us,Google Play,2
ba634ae3-0773-46f3-84df-4ac149f2a969,Denise,1,,wont wok on phone,20.2.0.6076,2026-02-08T20:48:07,us,Google Play,0
bb5b40fe-f34d-4d5e-a298-ed7374b17fb6,Amine,1,,you need an app in order to use a printer. ridiculous..,9.7.1.3820,2026-02-08T18:39:14,us,Google Play,0
63fe9ff4-d9e5-4f53-953f-33b3d5ab3035,Dr Manish Kr Pillai,2,,App stop working in between,20.2.0.6076,2026-02-08T18:15:57,us,Google Play,0
23e4937a-4f45-485f-916b-a71b1cfecedc,Simon Crowder,2,,Ich habe die App benutzt um einen HP Drucker einzurichten und das hat soweit ganz gut geklappt. Die App macht aber sehr viele Verbindungen auf zu bekannten Tracking Servern und für einen großen Teil der Funktionalität öffnet die App dann wieder Seiten im Browser. Die Bedienung ist schwerfällig. Dauerhaft möchte ich so etwas nicht auf meinem Smartphone haben. Habe die App also wieder deinstalliert.,,2026-02-08T17:12:23,us,Google Play,0
cd69838a-d2b1-49ae-a513-c6eb6617286a,C Harkness,1,,"frustration. new printer replacing 15 year old one from brother could easily print anything to it. new HP printer when using app to print items says you can print documents, PDF etc but when you click print it only comes up with options to print PDF or photos. not documents. very frustrating can't figure out what to do.",20.2.0.6076,2026-02-08T16:43:38,us,Google Play,0
5ed5d834-dca4-47d8-85ba-5dc2b9a8778b,Linda Southern,1,,app is useless don't build half printers hard wire driver,20.2.0.6076,2026-02-08T15:34:09,us,Google Play,0
58ef5945-8095-4c3f-8d03-5c9bbfc0bfb2,Dibble FPV,1,,cancerous. makes something easy exceptionally slow and difficult.,20.2.0.6076,2026-02-08T15:21:17,us,Google Play,0
6ec77a12-6b0a-44e9-8693-864255c18409,Carol Rodney,3,,not coping from my phone,20.1.2.5988,2026-02-08T14:21:43,us,Google Play,0
9c3ef657-a169-4e13-b431-4d4f58c30ea2,LB,1,,"Absolute trash. Can't bulk copy documents from the copy tray and it forces you to individually scan documents with the scanner. Yet on my wifes iPhone, the bulk copy function works fine. Using an S23 Ultra. There is not even a menu option to choose copy from copy tray. Can only select scanner.",20.2.0.6076,2026-02-08T14:12:10,us,Google Play,1
e0ee223c-dd25-4b77-befd-29cea627aa4c,Eng.Aslam Shaikh,5,,excellent,20.2.0.6076,2026-02-08T14:10:20,us,Google Play,0
195dbb7d-fb86-47ec-939f-2d1d2930c6ea,Dan Kunce,4,,inputting my Wi-Fi password was tough and would be easier with a full keyboard.,20.2.0.6076,2026-02-08T14:04:08,us,Google Play,0
3a1603fb-05fe-40d1-b8cb-aaf9fc63804a,Akshay Tyagi,5,,do much more than the older version.,20.2.0.6076,2026-02-08T11:31:43,us,Google Play,0
9c6349fc-a1a1-4c4d-8610-aaaf173ce184,Jihad Shomaly,1,,Very complicated and apology to say this but it is the worst app ever,,2026-02-08T09:39:41,us,Google Play,0
39f7b5e8-f804-4524-bbd6-7c256697e681,Sanju Devi,5,,it's a good app overall but please make a option for Android too. that can print both side on a page too it wastes too much of pages just due to that reason .,,2026-02-08T08:31:14,us,Google Play,0
8a82bbee-d72b-4077-92a8-354dc36c1be6,Sandra McKinney,1,,Should be free. I paid for the printer. Why should I have to pay to use it?,7.2.32,2026-02-08T07:01:18,us,Google Play,0
265b28ce-79ff-4df3-86aa-53faddb74aa8,Rajeev Jayaram,1,,very bad. does give a clue on why error happened. I wish I did not buy this junk,20.2.0.6076,2026-02-08T06:32:57,us,Google Play,0
9ec96fce-fb48-4db1-a3eb-704875ce451a,B Zunaid Sardar,1,,very bad always showing problems,20.2.0.6076,2026-02-08T05:57:45,us,Google Play,0
584b766f-cf66-4eb6-ac09-8ca2d93d8176,M L Garcia,1,,"I used the mobile fax once. After that, I couldn't get the fax screen to come back up to check the status of the fax or to send another fax. No options appear to navigate a way back to the mobile fax screen. Disappointed in what I thought was going to be an easy and fast way to send a fax from my phone and looked forward to eliminating the time consuming trips to the library to send a fax.",20.2.0.6076,2026-02-08T03:05:55,us,Google Play,0
929276ce-ae6f-4ece-9d0d-cbb1dc3bda35,Karen Neff,3,,"not enough on cartridge loading, didn't instruct to remove cardboard in paper tray. 6th",20.2.0.6076,2026-02-07T23:40:15,us,Google Play,0
121c13c5-9253-4cc9-8bf3-45c6578634be,Priscilla Piacente,1,,hard to install software with android devices,20.2.0.6076,2026-02-07T21:40:54,us,Google Play,0
7a90388e-2de4-492d-bdb1-5a67f13ec9d6,Joan Small,1,,I have been trying to connect my new printer to wifi for 2wks and it keeps telling me I have to use this app. It just takes me in circles over and over. I am sending the printer back. This is ridiculous.,20.2.0.6076,2026-02-07T19:08:36,us,Google Play,1
2d0ef27a-5cb4-45d5-b966-336e50ad450a,Nahcole Faust,2,,got jankey after last update,20.2.0.6076,2026-02-07T18:36:31,us,Google Play,1
af4bc2dd-e19c-4913-b9fa-3a46d4d2f18d,Michel Galante,1,,The new app is horrible my printer keeps going offline cannot print from word. or from the printer. Say no printer added or connected when it is.,20.2.0.6076,2026-02-07T17:35:12,us,Google Play,1
f9656b97-66e1-4f22-95ad-44feb59b5396,Shirnice Villano,2,,"The app is only working with my phone and no longer working with my tablet since the update, making my productivity VERY difficult.",20.2.0.6076,2026-02-07T17:23:10,us,Google Play,0
230c0abf-25ed-435d-85a2-a0014222140b,Adi,1,,the absolute worst,20.2.0.6076,2026-02-07T17:16:03,us,Google Play,0
5f8365cc-dff7-46f5-9549-14473d4f2caf,Louise Kenton,1,,your app is not friendly can't get my printer up and running,20.2.0.6076,2026-02-07T16:43:00,us,Google Play,0
ec323849-aa6e-46e8-bad7-9890d4a6e7bd,Earlston Layne,5,,very useful indeed,20.2.0.6076,2026-02-07T16:15:13,us,Google Play,0
8dcd306e-55af-46d4-b5d7-3684df75beb7,Oyo Trading,1,,Not user friendly and useless app,20.2.0.6076,2026-02-07T15:32:28,us,Google Play,0
412a89e5-d129-4dfa-8905-b851f088b9fa,David Allen,1,,Ever since the app changed not too long ago... I can no longer print from my phone... constant issues! PLEASE FIX BUGS!!!!!!!,20.2.0.6076,2026-02-07T13:28:31,us,Google Play,1
603f30ae-8e93-481d-bef8-ccdfa802fa9b,Paul Jones,5,,Brilliant 👌,20.2.0.6076,2026-02-07T11:20:12,us,Google Play,0
cc77e567-9666-44a8-b17c-97ffd0c1b8f8,Sasikumar Thala,5,,good,20.2.0.6076,2026-02-07T11:14:45,us,Google Play,0
0583abda-73eb-4a0a-8237-b3b69ba4f390,Matt Simpson,5,,Fool proof scanning using mobile devices.,17.35.0.5115,2026-02-07T10:28:50,us,Google Play,0
bbb61db6-58a0-4b37-8802-3bfe137a899f,shobhit kuril,1,,worst feature & worst printer,,2026-02-07T05:25:49,us,Google Play,0
5abf88dd-2cb4-4656-ac63-56094ef5afac,Leo Shurtleff,1,,Deleted the app immediately as they require you to create an HP account. There is no legitimate reason to have to create yet another account with another company just to scan a document. I will just scan from my Chromebook that doesn't require any apps to scan or print.,20.2.0.6076,2026-02-07T00:20:57,us,Google Play,1
1c788e55-5c7d-498f-889f-bf8ff2e908b2,Ashley,3,,Just set up a new printer and nothing will print. I keep getting a message that says the app has a bug. printer is connected to wifi. so is phone.,20.2.0.6076,2026-02-06T21:23:16,us,Google Play,0
32a67b36-072a-4d94-b497-f9f38432f0c6,Nonhlanhla Ntamo,5,,great experience,20.2.0.6076,2026-02-06T20:28:58,us,Google Play,0
8a2233ad-2ebd-4614-8e2d-6e9680efa9d7,Lisa Buchan,1,,"if I could give it 0 stars I would. i like the other app better, my printer won't connect to this one even though it says it's compatible with the app. i have the Deskjet 2562 and now it won't connect. Fix it. this app is horrible.",20.2.0.6076,2026-02-06T17:26:41,us,Google Play,1
da1bdc38-110d-4851-aafa-1f89ac25897c,Steve Hewitt,1,,not compatible even though I have a hp printer!,17.20.0.4770,2026-02-06T16:42:20,us,Google Play,0
2b6a6ea6-41e7-4d6d-a5bc-5657ab7c3623,amr ibrahim,1,,pls I have Configuration Model Name : HP Color Laser 150a Machine Serial Number : CNB2QCGZBF Product Number: 4ZB94A the application cannot define my printer,20.2.0.6076,2026-02-06T16:04:41,us,Google Play,0
bae08a5d-ff30-4eef-955c-854ed2ae8f5b,Ismail Hasnain,1,,you guys should add a feature for wired printers as they can be connected using a USB to type C converter.,,2026-02-06T13:02:43,us,Google Play,0
f97bd6eb-ed91-4304-8389-67005119e832,Benedicta Senyo,4,,great 👌,20.2.0.6076,2026-02-06T10:36:05,us,Google Play,0
007576cf-a288-4bc3-a823-277751678817,Kaarel Kaljura,1,,The worst! First off why does it require me to log in to print on a local network. Added the printer just fine but was unable to print for some bs.,20.2.0.6076,2026-02-06T10:35:17,us,Google Play,1
beaadbcf-00d5-405f-96ca-24de34c9178b,Jolke Balt,1,,"STAY AWAY from HP. I have a laser printer that showed issues from the start. HP customer service is dreadful and completely unwilling to do anything about it. Even though I have printed less than a 100 pages and everything in the printer (including cartridges etc.) are official HP products, customer service advises me to buy a new printer. I will, but I'll never get an HP again. This one will go straight to the landfill.",20.2.0.6076,2026-02-06T08:49:04,us,Google Play,0
3f75cf29-1749-4e7f-8c09-4d2a12951c54,Roy Wilson,1,,bought ink and nothing is working,18.10.0.5530,2026-02-06T02:59:26,us,Google Play,0
e279b419-8dcb-441b-8a58-1358eed775a9,Ryan Knol,1,,"garbage, doesn't connect",20.2.0.6076,2026-02-06T02:13:36,us,Google Play,0
22014148-e41c-46f9-85d1-6cd532a0440d,Barbara Jones,1,,I can't get to update my payment. It keeps sending me to this page. I HATE THIS APP!!,20.2.0.6076,2026-02-05T23:55:31,us,Google Play,0
66c3fb0a-be5c-4bb9-a763-82f2953526a4,Paula Hamlin,1,,this printer bill no connect to my new samsung s25,20.2.0.6076,2026-02-05T22:54:53,us,Google Play,0
930675a0-0a7a-48b3-ad17-60e0c66db975,Ralph Anderson,4,,easy to use,20.2.0.6076,2026-02-05T21:29:41,us,Google Play,0
5c645e82-86b9-4cbe-a99b-299b3a22dcb4,Michele Pierce Nichols,1,,Printer and support sucks,20.2.0.6076,2026-02-05T19:58:52,us,Google Play,0
302d74a8-f4a2-487e-ba51-db7c87fc4567,Ken Sharbutt,1,,terrible,20.2.0.6076,2026-02-05T18:57:29,us,Google Play,0
7b222a2e-2090-4e43-af64-d635ad70a31e,Teresa Mcgervey,1,,Stopped recognizing printer even when right next to it. They'll make excuses for its amnesia but I've got better things to do than sit on hold with their support for an hour.,20.2.0.6076,2026-02-05T17:28:55,us,Google Play,0
8d09826b-f069-40d1-8c09-f3843ac42f1f,Manorama Saxena,5,,this app is basically the mini version of the printer app it provides so many options with too much explanation,20.2.0.6076,2026-02-05T15:23:11,us,Google Play,0
08c6a4e4-ea6d-424a-9383-3a7169352370,Blayney Hamilton Nogueras,5,,functional as it should be 👍,,2026-02-05T14:11:44,us,Google Play,0
e7ecb986-58ec-47ed-ae1a-73e6bae7b6b2,Danielle Cornett,5,,yup I love my HP ENVY 6100,20.2.0.6076,2026-02-05T10:42:09,us,Google Play,0
f25a6660-4033-4a49-905e-4632dfdbf02f,Digital Zone,1,,ghatiya,20.2.0.6076,2026-02-05T07:32:31,us,Google Play,0
404195b8-dcee-4589-866f-375d93ed7338,Simon Taylor,1,,Absolutely atrocious. The ENVY 6000 only makes me envious of people who have a cheap non-HP printer that stays connected to a WiFi network and actually allows printing via WiFi network.,20.2.0.6076,2026-02-05T06:50:41,us,Google Play,0
568dc82b-978c-4822-b9d2-933740abc632,leonardo robil,4,,good,20.2.0.6076,2026-02-05T05:03:02,us,Google Play,0
780d7218-a89f-40cb-8ce1-a98f5073b812,aaron Ipock,1,,This app is not necessary to print. it's for data collection and privacy violating,20.2.0.6076,2026-02-05T04:22:02,us,Google Play,0
f80a0060-a04b-4a46-8b4c-1a4cfeb9d08e,Rajesh Shah,1,,IT DOESN'T WORK COMPLETELY,20.2.0.6076,2026-02-05T03:42:34,us,Google Play,0
70a875a0-d515-4ae6-8080-388be336d1d4,Janelle Clarke,5,,So easy to use and set up.,20.2.0.6076,2026-02-05T02:27:37,us,Google Play,0
2e65d78e-782c-417d-81a5-30f041e10743,Kaiye Jover,2,,Not fucmnctioning,20.2.0.6076,2026-02-05T00:08:40,us,Google Play,0
69928b10-7f13-44fe-9bae-a16bb4ccdcf0,Nurse08,1,,"This app has only made everything worse. Half the time it doesn't acknowledge the printer has completed set up, and when it does it says the printer isn't connected to the internet, even when I can clearly see it's connected. I don't understand why setting up an account was necessary. If I had known these would be the requirements before I'd purchased it I would have bought a different printer.",20.2.0.6076,2026-02-04T23:46:21,us,Google Play,20
d127e913-e2eb-4ee5-a029-98fef5ba9040,Leonie Degoes,1,,it is not connecting to my printer,20.2.0.6076,2026-02-04T21:53:19,us,Google Play,0
7cd6a64e-9ee8-4773-9ab6-3d796d6b00ed,Shelia Brinyark,5,,tring to set up,20.2.0.6076,2026-02-04T21:40:54,us,Google Play,0
868ae4cb-611e-401f-8076-72a9e380b814,Andy Fang,1,,Cant Sign In. I've tried the troubleshooting and still can't sign in.it doesn't work with Android for some reason,20.2.0.6076,2026-02-04T21:23:00,us,Google Play,0
b51650c1-d7d8-4f99-9768-e26874418e37,Sarena Graham,4,,Awesome!! Mobile fax is genius!!,20.2.0.6076,2026-02-04T21:04:35,us,Google Play,0
