id,author,rating,title,content,version,date,country,platform,vote_count
9abafd8b-5d6e-433f-84e0-81687ff26dbb,Mrs Boocock,2,,This app started off good but lack of maintenance has taken its toll. This app has slowed down ALOT. it's struggles to load anything and at times won't load at all and you have to force close the app and try start again. it takes about 10-15 minutes to do something on this app that should only take a couple minutes if that.,26.1.2.6449,2026-05-12T23:02:47,global,Google Play,1
8e81907a-0f3d-4550-a8a3-4276287716bf,Eva SaCz,1,,"Nunca puedo conectar mi impresora a la aplicación. Se supone que es mediante WiFi pero nunca se conecta aunque el celular y la impresora tengan buena recepción de WiFi. No puedo hacer nada desde el celular, TODO debe ser desde alguna laptop porque en caso contrario no hace nada.",26.1.2.6449,2026-05-12T23:02:38,global,Google Play,0
06d7c306-c12d-45d7-8bc7-9d94dcf397cc,Manoel Maria Oliveira Dias Dias,5,,super recomendo impressora hp,26.1.2.6449,2026-05-12T22:45:32,global,Google Play,0
1c173a0f-2811-4c05-8b4a-bec1d4fc692f,Willie Hammonds,5,,The ease is incredible,26.1.2.6449,2026-05-12T22:06:18,global,Google Play,0
3b21c568-e1d1-4a5c-91a4-1372395e26cf,John Cantalupo (Widmer Wonderland),2,,"This app is barely OK. I don't understand why my preferences are not saved. If I scan a document the default save method should be PDF. I have to change it every time I use it. The file structure always sorts by date, even though I sort from a to z every time I use it. Nothing is remembered. These simple things make this app extremely aggravating to use.",26.1.2.6449,2026-05-12T22:00:39,global,Google Play,1
ac004e87-d181-42ca-89bd-5e18c5973462,Luiz Guilherme,5,,app excelente ❤️,26.1.3.6477,2026-05-12T21:37:49,global,Google Play,0
7e4cf5db-b828-4fb8-ab80-f6448e45eaba,P.J. O Donoghue,1,,useless,26.1.2.6449,2026-05-12T21:15:14,global,Google Play,0
3f162ac5-3a22-4f2e-a910-5381d7f10484,Thiago BG Guarin,1,,"está aplicación es super mala,llevo como 15 días tratando de instalar y no es posible",,2026-05-12T19:51:17,global,Google Play,0
a401cd35-1e15-4d45-b629-db79ac04941d,Livexys Leonardez Mendoza,5,,me encanta,26.1.2.6449,2026-05-12T19:48:27,global,Google Play,0
f3360593-1cb3-4c42-9f6f-f29afecb2c47,Johannes Rendering,2,,"Een misser dat alleen maar foto's en pdf-bestanden via de app geprint kunnen worden. Waarom geen word-bestanden??? De melding dat de printer niet verbonden is, verschijnt wel erg vaak!",26.1.2.6449,2026-05-12T19:11:36,global,Google Play,0
28f7e8f2-97ac-4e77-b319-f50c5e3380c0,Dominik Zeus,1,,"Es ist Klasse das ich eine App installieren muss um Scannen zu können und noch besser das jede einzelne Sache die man bei Einstellungen verändert dich sofort auf eine Website wirft. Da macht die App echt Sinn falls man mal das Internet nicht findet. Und das beste ich kann keinen Pfad hinterlegt, das heißt bei jedem Scann brauch ich mein schei... Handy, anstatt es an eine Email zu senden oder auf einen festen Ordner am PC zu verknüpfen. Extra eine App runtergeladen und keine Einstellmöglichkeit",26.1.2.6449,2026-05-12T17:14:35,global,Google Play,1
70b57663-4bc1-494e-b252-e615bcbf5270,Karlheinz Gross,1,,"Wirklich der letzte Dreck! wenn man eine Rechnung für die Buchhaltung ausdrucken will, muss man sich zweimal (!) anmelden umd gefühlt 50-mal rumklicken. Schon vor dem jüngsten Update waren viele Funktionen umständlich und Glückssache. So bedurfte es einiger Suche, Anmeldung und Klicks, um eine ordentliche Monatsrechnung vom Abo auszudrucken. Nun führt das gleich zu einer Fehlermeldung. Nachtrag: Jetzt läuft es wieder, aber halt nie richtig rund, geschweige denn schnell.",26.1.2.6449,2026-05-12T17:08:07,global,Google Play,0
29cee2a6-98cc-4253-9e22-7856e5577139,Ser Sabio,1,,garbage customer service,26.1.2.6449,2026-05-12T16:22:54,global,Google Play,0
bc5ad11a-34ca-4b37-8533-c5283af17a96,Maria Ester Zuñiga Valenzuela,1,,no me toma wifi para imprimir,,2026-05-12T15:51:48,global,Google Play,0
b0e7304c-58b2-41e9-a6e8-9a0ce1120839,Wolfgang Hahn,5,,Seit 1 1/2 Jahren nutze ich die App einschließlich Drucker mit 3 Handys und 2 Tablett durch 4 Personen und wir sind sehr zufrieden.,,2026-05-12T15:28:11,global,Google Play,0
21bde124-e0be-46e5-aac9-872f5e897ca0,Thomas Steinicke,1,,Das ist so ziemlich die mieseste App die mir untergekommen ist. Die App ist Schrott und funktioniert überhaupt nicht. Bitte überlassen das erstellen von funktionierenden App's den Chinesen. Drucken ist nur vom Notebook im W lan möglich. Auch die Vielfalt der App läßt zu wünschen übrig. Mich wundert es ehrlich nicht das hier eine Patronenhaltbarkeit von bis zu drei Jahren versprochen wird. Der Kasten druckt einfach nicht. Ich Drucken zur Zeit wieder auf meinem alten Samsung 1860 da läufts !,26.1.2.6449,2026-05-12T15:23:54,global,Google Play,1
2a047969-0e61-4a51-9e10-7519e10f931c,Yvan Broux,4,,installation imprimante avec hp smart OK,26.1.2.6449,2026-05-12T14:31:33,global,Google Play,0
10693103-42e1-4c4a-9b30-d5103f83e518,Gleb ES,3,,Very slow. Why do I need to wait for an internet connection to be established to work with the app? Are you using iframes?,26.1.2.6449,2026-05-12T14:29:52,global,Google Play,0
de4082d9-1ddf-4d11-b1f1-873d0144328f,Marcello Usai,2,,"Avrei necessità di fare la pulizia delle testine ma dall'app pare impossibile, il caricamento del comando è infinito e non va mai a buon fine. Ciò mi costringe a non poter stampare a causa di questo disservizio, e non posso sentirmi costretto ad avere un pc per una semplice stampante",26.1.2.6449,2026-05-12T13:59:09,global,Google Play,0
c36754b2-b702-4da1-9d1a-19549d99998b,Bashe Abdille,5,,super,20.2.0.6076,2026-05-12T13:42:55,global,Google Play,0
44cd5894-a21c-4f94-8f12-1cb108efeda9,Robert Kosynsky,3,,kan terug installeren printer installeert niet de Pin van de printer?.,,2026-05-12T12:53:59,global,Google Play,0
68de4511-318b-4da4-a9cd-98c7492bdfd5,Sabin Dimitrov (Karakachan),1,,"Yo, I have no idea what in the whole world you guys did in the last update but I cannot detect my printer and I cannot send faxes or scan things remotely. I don't know what is going on but please fix this.",26.1.2.6449,2026-05-12T11:58:38,global,Google Play,0
e38a17c3-5979-4673-8e36-03a95b6050f3,Jan Douven,1,,Werkt niet meer op telefoon na vakantie App moet elke keer vialaptop geimstaleerd worden voor afdruk,26.1.2.6449,2026-05-12T10:42:16,global,Google Play,1
6d1c5239-5a39-44cd-8024-ce608cd387b2,Elodie Maréchelle,1,,"mon imprimante peut faire du recto verso en manuel, cela fonctionne bien sur pc. Mais ici ce n'est pas proposer. et si je fais plage par plage, j'ai eu un ordre inverse la première fois puis ordre normal la deuxième... du coup mon document est dans le désordre. ce serait utile que le recto verso manuel soit pris en charge pour qu'il n'y ait pas d'erreur. et comme j'ai pratiquement que des docs de plus d'une page, cela ne mérite qu'une étoile pour mon utilisation souhaitée.",26.0.2.6338,2026-05-12T09:10:58,global,Google Play,1
59fd274c-5bfa-4c26-8a48-dd09dfcfd3dc,Syukri Yusoff,3,,cannot find where button for files and photos,26.0.2.6338,2026-05-12T09:06:17,global,Google Play,0
446f7131-3a2a-4b6c-b829-e6c70c667d93,Ariff Nordin,5,,Nice. So easy to use,26.1.2.6449,2026-05-12T07:44:43,global,Google Play,0
32fb133e-9c74-4178-92af-24c856ab62ca,Fabio Gozzoli,1,,non funziona bene,26.1.2.6449,2026-05-12T03:23:00,global,Google Play,0
7dc68c54-124e-4337-922c-31625b39d4fb,Dehiler Gutiérrez,1,,no sirven,26.1.3.6477,2026-05-12T03:17:53,global,Google Play,0
98104082-dcf0-40ce-99ed-21a4689e864f,Susan Knudson,1,,troublesigningin.,,2026-05-12T02:34:47,global,Google Play,0
ff4d3eb3-6fe7-455c-acc6-5075ea5c4d80,Richard Arauz,1,,"Demasiados errores, cuando más ocupo imprimir, no imprime.",26.1.2.6449,2026-05-12T02:05:10,global,Google Play,0
5a1510f8-30cc-48fc-aca0-32e3ff638692,roesler gonçalves,5,,muito bom,26.1.2.6449,2026-05-12T01:06:32,global,Google Play,0
5d19677a-45be-44ee-b547-e9d9173a1230,Dê,1,,Começou o aplicativo a dar erro .,26.1.2.6449,2026-05-12T01:00:59,global,Google Play,0
ea294052-06ed-47d4-9b59-3ac6c883f54e,Francisco Neto,1,,"Que app ruim. Claro que depois da repaginada ficou bem melhor, porém uma coisa que tá me deixando muito irritado é que quando coloco pra imprimir documento as vezes dá pra escolher o tipo de papel (fotográfico, por exemplo) e na maioria das vezes não, o que é isso? Dá umas travadas e as vezes é lento.",26.1.2.6449,2026-05-11T23:51:02,global,Google Play,0
b4e40e90-317d-43ea-b933-96d6f87005b6,J W,1,,"FRUSTRATING!! Trying to print pictures on photo paper. Tells me the paper source is incompatible, picture keeps going to black and white, after selecting print it doesn't print so I need to cancel and start over. Several times after going through all that it just reverts back to the starting page. What absolute hot trash. Made me so freaking angry! Ended up sending the 10 pictures to Walgreens.",26.1.2.6449,2026-05-11T23:33:43,global,Google Play,2
2bd91f48-0ea4-472c-90f0-7ae92eea43a3,Gon FB,1,,"falla constantemente. unos años después, sigue fallando, HP timais a la gente con vuestras impresoras, no se conectan la app no encuentra la impresora, luego si añades por número de serie tampoco valen todas las opciones, será mi última HP, a la basura",26.1.2.6449,2026-05-11T22:13:02,global,Google Play,0
de7e41da-7de4-4962-92ed-2c3cef513b1f,Elissadrina Rodrigues,5,,facilita o acesso. obrigadaaaa,,2026-05-11T20:17:06,global,Google Play,0
4da12d7b-03d1-4d2a-86d2-13add3cb28e6,Acylleconducteur Benkara,5,,"très intuitif, marche super bien",26.1.2.6449,2026-05-11T19:29:01,global,Google Play,0
f8e03364-e61a-4330-9656-b75dcaaaa82a,Yasir Iqbal,5,,needs fixing,26.1.3.6477,2026-05-11T19:16:51,global,Google Play,1
b39bbeeb-eda6-40e7-a9dd-8f458066b4c0,Alejandroo Ga,1,,just can't find the printer no matter what I do,26.1.2.6449,2026-05-11T18:33:20,global,Google Play,0
59c684ed-e843-4db8-b794-a91cc1a30476,Juan Carlos Valbuena Espeso,5,,muy buena app,26.1.2.6449,2026-05-11T18:16:20,global,Google Play,0
4226f3a6-00f5-4a20-83dd-e07645542069,mohamed hicham ennaciri,1,,il marche pas car il veut,26.1.2.6449,2026-05-11T18:02:37,global,Google Play,0
23a5a677-381d-4e4a-b30f-38f99e2c2d7d,Carolyn Doyle,1,,not scanning properly in my fax,26.1.2.6449,2026-05-11T16:41:39,global,Google Play,0
c29d6845-e145-4628-a938-f0e64c06d08b,Eric Estevenon,1,,NE FONCTIONNE PAS,,2026-05-11T16:36:41,global,Google Play,0
904e6aa0-5c41-4e01-aea5-cf18d7d15c9f,J C,5,,cool,26.1.2.6449,2026-05-11T16:18:19,global,Google Play,0
69d51580-429a-445a-8c4e-bf6699eee554,P. René,2,,war schon mal deutlich besser.,20.2.0.6076,2026-05-11T14:42:11,global,Google Play,0
f28cb61a-2bd3-401f-9a43-2d7ad0f8f9a0,Couric Dssign,1,,"One of the most useless and poorly designed apps I've had the displeasure to encounter, makes the printer basically unusable, crashes constantly, the ux is trash...hobestly, not one good word I can find. All they look for is money and more product placement. Embarrassing. I'm giving away a new HP Printer, if anyone is interested, for free.",26.1.2.6449,2026-05-11T14:13:29,global,Google Play,1
3cad6aab-f20d-437d-af6f-ceca4ba42924,MaraCGJ,2,,"nao consigo ir adiante na configuração da impressora. As orientações levam sempre a repetir os mesmos passos, não levam para frente por link. estou com o mesmo status após inumeras tentativas",26.1.2.6449,2026-05-11T14:06:20,global,Google Play,0
fbeb4a77-2231-435e-b8ed-0c6045636af7,Lincoln Lee,5,,Very convinience,20.2.0.6076,2026-05-11T13:33:20,global,Google Play,0
faec89b1-4a88-40d6-8dab-6aee9092356a,jean pierre delava,1,,ne marche pas,26.1.3.6477,2026-05-11T13:20:13,global,Google Play,0
6e9cb6f6-1762-488f-baa5-1a08a201a5c7,tnfcrl,2,,L' app non funziona più e quando vi decidete a provvedere? Una persona non può ritrovarsi a non poter utilizzare la propria stampante per colpa vostra 🤦‍♀️🤦‍♀️🤦‍♀️....Ma non vi vergognate nonostante le recensioni negative a non provvedere a far funzionare nuovamente l'applicazione?? è più di un mese che non funziona🤬🤬🤬🤬.... aggiornamento recessione: Finalmente l' applicazione è tornata a funzionare 🥳,26.1.2.6449,2026-05-11T12:42:38,global,Google Play,0
37259d99-bd53-4120-a9d1-e32664bd371b,Sarah Le Guerinel,1,,On ne peut plus paramétrer le nombre de pages par feuille (exemple 2 pages d'un PDF sur une seule feuille imprimée).,18.10.0.5530,2026-05-11T12:09:38,global,Google Play,0
48fbf1c0-da7c-47b2-ab35-e7315838c0a6,luca,4,,peccato che la mia multifunzione sia solo a caricamento manuale,26.1.2.6449,2026-05-11T11:34:57,global,Google Play,0
0590487a-635f-4662-85f5-9751876d6e59,BOOSHALAA BOOSHALAA,1,,برنامج حقير تافه لا يعمل كلما حاولت الإتصال بالطابعة فشل تام. سىراق,26.1.2.6449,2026-05-11T11:06:02,global,Google Play,0
4fc42b7b-8065-46a6-b22f-c72c4079213b,Andrew Szadkowski,1,,"Jedna z najgorszych, aplikacja widzi stan twojego tuszu (kup instant ink) ale jak chcesz drukować, magicznie nie widzi twojej drukarki.",26.1.3.6477,2026-05-11T09:21:21,global,Google Play,0
ac20e445-d614-4a51-a950-92ad44b3fab9,Dun,1,,"No puedo seleccionar las hojas a imprimir, una decepción, antes si me dejaba pero ahora el menú no baja y no lo permite",26.1.2.6449,2026-05-11T09:02:54,global,Google Play,0
92d9d63f-d626-43fc-ad5b-e292b3497530,K. M.,4,,Langsam...,26.1.2.6449,2026-05-11T09:00:43,global,Google Play,0
eb0a70fd-2c93-4e86-9709-e05f0251054a,Armando Castañeda,1,,te cierra la sesión todo el tiempo y ya no te deja volver a iniciar a menos que descargues Firefox,26.1.2.6449,2026-05-11T07:29:49,global,Google Play,0
7099c84e-ea90-443a-9f81-0dd479318f82,Carl davis,4,,"App in the past was not opening unless I un-installed and re-installed, however since around the 1st of May it has corrected itself and or developer made some adjustments, so far,so good, let's hope it stays consistent and functional, new look is great !!",26.1.2.6449,2026-05-11T05:43:27,global,Google Play,56
fd580664-8cb8-4768-b2b6-ed009885c34e,Diane Fortin,1,,"always getting connectivity problems, error messages , very difficult to manage ...always when I need it. I cancel the print jobs and resend it only to find out it will print out anyway...or partial document...horrible to use",8.9.0.56,2026-05-11T00:09:49,global,Google Play,1
2d8e62e8-8a3b-438f-8182-23b674b61412,Gabi Nogueira,1,,"Ultimamente o aplicativo tem dado cada vez mais erros, mais falhas, me deixou na mão várias vezes.",,2026-05-10T20:47:17,global,Google Play,0
ccca5f49-4b97-4412-a464-d9f2e83da1de,Mark “EliteChaos” Davis,2,,The more HP keeps getting hacked and dug into and all their customers info keeps getting stolen and I think it's something that keeps reoccurring about once a month it just keeps making their products harder and harder to connect to and dealing with all Passwords and numbers and WPS and serial numbers and I tell you what it just took me almost an hour and a half to connect to a little tiny printer that shouldn't have had that many problems and let me tell you guys if you agree to the cartridge,26.1.2.6449,2026-05-10T20:05:53,global,Google Play,1
bcaab9bb-1086-4325-9a22-3523cf260462,Tony Günther,1,,"Ich begreife nicht wieso ich mich in dieser App anmelden muss, wenn ich etwas im Heimnetzwerk drucken will. HP der schlimmste Druckerhersteller für mich. Katastrophale Software.",26.1.2.6449,2026-05-10T19:48:40,global,Google Play,1
dce598eb-78af-472a-88ae-e10126bdca23,LOLITA RUBIS,5,,simple d'utilisation et tellement pratique.,26.1.2.6449,2026-05-10T19:43:09,global,Google Play,0
f4a45031-fa30-4e02-a5fe-e223b1f96b30,Warren Fox,3,,"This is a decent enough printer when it works. Every month or so the printer gets locked up requiring a reboot to fix it. None of the HP help articles will suggest a reboot, instead the blame is put on the user to reboot your router and other unlikely sources of trouble. Just reboot first and remember you bought a cheap item.",26.1.2.6449,2026-05-10T19:32:04,global,Google Play,1
9308fd4f-a286-42ce-ae49-0dfb890ae1c6,Jose De Jong,5,,super Gaat heel snel Ben er blij mee,26.1.2.6449,2026-05-10T18:11:54,global,Google Play,0
ff304b0e-055a-4ed1-902c-1598209fb207,HoooV cz,1,,"penso non esista un servizio peggiore di hd, app non funzionante, servizio clienti inesistente, non parliamo della stampante. una volta funziona 5 volte no. abbonamenti e attivazioni incomprensibili, magheggi per non farti capire nulla. se potessi mettere -1 stella lo farei ora. solo una parola, schifo",26.1.2.6449,2026-05-10T16:53:56,global,Google Play,0
8eaab378-d9fe-4d72-bb8f-a69e5098c591,Sven Weiss,1,,"eigentlich nicht nutzbar, funktioniert zu 80 Prozent nicht",26.1.2.6449,2026-05-10T14:45:36,global,Google Play,1
4a9d5966-17a6-4e26-ac37-ac13a46f7180,RYAN HIDAYAT DAHLAN,1,,there always have a problems,26.1.2.6449,2026-05-10T14:05:12,global,Google Play,0
0290d84d-4c42-4175-aad8-d933853a9228,R Parthasarathy,5,,very nice device very useful for home scan and emergency print,26.1.2.6449,2026-05-10T13:36:25,global,Google Play,1
dd2bb8c2-20e9-449a-a1d5-0c7648ed5d89,Charles Dooley,1,,Does not support my printer,26.1.3.6477,2026-05-10T12:52:02,global,Google Play,9
54d0f0ff-58c4-47e9-be60-dee12f318ff6,Lutz Liebau,1,,sehr schlechte App kein HP wieder,26.1.3.6477,2026-05-10T12:25:49,global,Google Play,1
08b66841-ca1f-4b2a-aeaf-016e3c56e561,Andrea Veggo,1,,era meglio prima. non riesco a mettere le scansioni s foglio pieno,26.1.2.6449,2026-05-10T10:32:52,global,Google Play,0
65d5c36a-a838-47ce-8a1b-8fc3bbc76de6,Jo,1,,"L'Horreur pour connecter l'imprimante a n'importe quel support (téléphone, pc, tablette). L'imprimante est allumée, on voit son réseau wifi mais l'imprimante n'est pas détectée par l'application hp smart. Du coup impossible d""imprimer....",,2026-05-10T09:47:55,global,Google Play,0
d58448c0-767f-4257-84b5-0499711b91aa,Marino Pascal,1,,It works fine if you have wifi. I only tried it for a couple of pages. But if you don't have wifi is Hell. it's impossible to connect to the printer HP laserjet M110w with Android or Mac. And yes I found the admin password under the lid. It returns an error. I've spent 3 hours so far and I work in IT.,26.1.3.6477,2026-05-10T09:33:29,global,Google Play,1
a6a17d43-53c5-4e4b-929d-d9212839565d,Ooi Yufei,1,,废物设计app 没次都有问题,26.1.2.6449,2026-05-10T08:13:55,global,Google Play,0
5e523b3b-6d36-42a0-9a70-1cff4944ffe3,Jalisa,1,,works half the time. It takes 20 minutes to load just for it to freeze when you hit to print.,26.1.2.6449,2026-05-10T06:50:32,global,Google Play,0
57d55a74-ef47-4950-9eff-d9b2c1b00680,michel lepetit,5,,WiFi direct entre le smarphone et l imprimante 🖨 fonctionne bien 🙂,26.0.0.6234,2026-05-10T06:14:42,global,Google Play,0
80810b9f-6efe-4cd6-9a7b-2661964848b6,Ventura,1,,antes le daba 5 estrellas ahora no me deja ni iniciar sección,26.1.2.6449,2026-05-10T04:06:00,global,Google Play,0
d8fe5531-7b8c-49c2-adc3-d9b29d3acfac,Jose Manuel De Los. Santos Ventura,5,,excelente aplicación recomendada,26.1.2.6449,2026-05-10T02:06:02,global,Google Play,0
bc30577b-8ee1-4ba4-9283-1f5ff8c34af2,Airton Souza,1,,horrível. depois dessa obrigação de fazer login na conta pra fazer ações no meu próprio celular ou na minha impressora no meu computador ter que fazer isso. isso é o quê? ver o que digitalizamos???,26.1.2.6449,2026-05-09T23:07:44,global,Google Play,0
9a18f659-8e2e-4142-a20a-39efe0c430d3,Markus P.,1,,3x aufgehängt. Schade.,,2026-05-09T21:13:24,global,Google Play,0
77efb91a-c523-4f45-9780-8d7e002742bb,Superbowl 52 & 59 Champions,1,,"1. Slow App, sometimes when you click on something and it loads, it will randomly reload. A lot of things you can't do on the app, so it will open it in a browser. Also, did i mention that this app is SLOW and will randomly reload after loading. 2. This app got renamed after an update, that update messed the app up, i had to set everything back up, and haven't been able to re-connect my printer since. This is called ""Planned Obsolescence"", & your next Printer Purchase should not be an HP Printer",26.1.2.6449,2026-05-09T20:55:13,global,Google Play,24
59cac6a8-bbc2-43ff-a5bb-b4fe680051a6,Carlo Sorrentino,3,,funzione balbuziente. prima efficientata poi sparita funzionalità motivi?,26.1.2.6449,2026-05-09T20:20:02,global,Google Play,0
670f6a8f-7871-4b07-b9ab-987f1b3042d1,Damian Enrique Cetina Canul,5,,excelente,26.1.2.6449,2026-05-09T18:59:57,global,Google Play,0
e07a079d-f09b-4782-9229-1290eff32356,Valentin Haut de France,1,,"bonne application de merde, une heure pour imprimer une feuille, l'application ne fait que de beuguer et c'est comme ça tout le temps",26.1.2.6449,2026-05-09T18:58:16,global,Google Play,0
b25feb68-0179-4e62-b3c2-07dd27a36f18,Noella Unl,5,,parfait,20.2.0.6076,2026-05-09T18:19:42,global,Google Play,0
00c2957a-187e-4a61-ae8b-f1b5dffe6913,Maricela González zuluaga,1,,siempre se traba y se sale en mi cel y no funciona sin wifi,26.1.2.6449,2026-05-09T17:38:32,global,Google Play,0
693e1f3f-e7a2-45f9-b3ae-612f8d485eca,B,1,,"impossibilité de supprimer une imprimante que je n'utilise plus, ceci depuis plus d'un an. 👎😡",26.1.3.6477,2026-05-09T17:29:40,global,Google Play,0
963fd0d8-438a-4020-90fc-34bf089e5ad7,Almir Rodrigues,1,,simplesmente impossível de loggar,26.1.2.6449,2026-05-09T16:04:36,global,Google Play,0
d4a89cfe-6e07-4af1-9fde-21a40246f83c,Randy Brown,1,,"my M140w looses wifi signal constantly and wifi shows a very strong signal, garbage never again",26.1.2.6449,2026-05-09T14:36:44,global,Google Play,0
eccecb98-88f4-455b-b473-afbc578b36c3,Leticia Franco murcia,5,,excelente servicio,26.1.2.6449,2026-05-09T14:29:20,global,Google Play,0
0e24bf5c-904c-4519-9598-6ac7c830071c,Will Nedds,1,,"No, HP. I do not want to download an app. I do not want to create an account. I do not want a subscription to premium services. I do not want a subscription for ink. I do not want a subscription to replace the printer I just bought. I want to plug in my laptop and print a file the same way I've been able to FOR 30 YEARS.",26.1.3.6477,2026-05-09T13:31:35,global,Google Play,1
03de4d4f-b5a3-43ff-9332-9e25219c5637,Jessica David,4,,super pratique surtout pour scanner via son tel mais des fois de gros beugue,26.1.3.6477,2026-05-09T13:08:21,global,Google Play,0
3cadcaf8-3fc4-4a5d-8599-66dd1f0b7424,YADRAM MEENA,5,,good,20.2.0.6076,2026-05-09T12:54:39,global,Google Play,0
7fe740ca-9887-4b81-b32e-cb482ae9e579,Klaus Hauschild,1,,Nothing but:.....buy now.....Blabla Very limited functions I can't recommend this app at all.,18.5.1.5470,2026-05-09T12:53:48,global,Google Play,0
5e51ce8b-7af0-4916-9a1d-68db59afdc49,ramirocha rodrigues,5,,Boa Experiência,26.1.2.6449,2026-05-09T12:45:48,global,Google Play,0
6a44fc0b-edc3-4747-9277-c459d6793127,mick stearne,5,,great app,26.1.2.6449,2026-05-09T12:31:22,global,Google Play,0
d72b355a-8daf-4586-bb48-0ae88ffa0482,Padamagouda Patil,5,,it's well performance.....,26.1.2.6449,2026-05-09T12:26:50,global,Google Play,0
70fc83d1-a2d6-45f3-89e5-6cc671b8f0ae,Rodrigo nw Rocha de Souza,1,,"impressora e app, não recomendo so serve se ja tiver com a impressora na rede q acabou de sair da caixa",26.1.2.6449,2026-05-09T12:23:10,global,Google Play,0
f917e0ca-73d5-4ffb-b1e7-e4148e1312e1,Rafael Zanella,1,,"Surreal, you need an account to scan a document.",,2026-05-09T09:43:35,global,Google Play,0
b85a3308-4eb5-4e84-8a5c-e3440d70471f,Oded Snir,1,,"terrible experience, prevents me from printing with my own printer unless I create another useless user, wouldn't recommend you download.",,2026-05-09T09:43:31,global,Google Play,0
2599d67f-85bd-4b4c-b05c-a31f0a0cd902,girish bharambe,1,,the worst app i ever seen. Nokoprint app is better than this app don't install this app,26.1.2.6449,2026-05-09T09:25:35,global,Google Play,0
0eebb1fa-38c6-4767-a2d1-b70cad53b666,Jean louis Minck,3,,amélioration de l’application,26.1.2.6449,2026-05-09T09:24:47,global,Google Play,1
218bd751-f5a9-40ee-913d-b3beb79c2188,Md Adil,1,,app kharab ho gai hai ab kam nahin kar rahi theek tarah Se A4 size ko Chhota kar rahi hai aur Sahi Kam nahin kar rahi PDF bhi nahin nikal Pa Rahi Sahi tarike se 👎👎👎👎👎😡😡😡😡😡🍌🍌🍌,,2026-05-09T07:23:36,global,Google Play,0
a6c40ab2-9ea9-4c25-9eb2-c50be7545838,Patrizia Ciliberti,1,,"mai piu HP, ogni volta per stampare qualsiasi cosa, ci devo perdere due ore, non é mai in linea, tutte le volte devo spegnere il modem, spegnere la stampante e riavviare l'applicazione.... ma è normale tutto questo?",26.1.2.6449,2026-05-09T06:59:49,global,Google Play,0
d6a8cbf9-2543-4939-afdc-1687a954dfa7,Paolo Di Giampaolo,3,,lenta,26.1.2.6449,2026-05-09T06:47:49,global,Google Play,0
1d871ad7-6825-4383-af7a-45859bf147db,Dale Ferrell,3,,I like but could be more user friendly,20.2.0.6076,2026-05-09T02:44:29,global,Google Play,0
f2f20e3f-6f4d-4247-8ebe-b82fe79d784a,Willian Abreu,5,,bien,20.2.0.6076,2026-05-09T02:36:40,global,Google Play,0
5d21ca15-35d6-44a5-a65f-97ead8ae51b7,Al Kojay,1,,"Masih bagus aplikasi sebelum update. Setelah update skr, hasil scan document dalam format pdf malah jadi amburadul, dalam 1 file hasil pdfnya ada yg kecil ada yg gede. Kacau!",26.1.2.6449,2026-05-09T00:34:46,global,Google Play,0
44a7c2eb-2f45-415d-8d4e-e05bd668765d,Carlos Eduardo Balestero,1,,"muito ruim, sempre perde a conexão com a impressora",20.2.0.6076,2026-05-09T00:23:03,global,Google Play,0
d6348189-848f-4177-80f5-bf716900dbe5,Kim Smale,1,,this used to be great from my computer or laptop or phone anytime now it is very fussy and only prints when it feels like it not happy,26.1.2.6449,2026-05-09T00:08:25,global,Google Play,0
2e8c5aff-565e-472a-ba36-08dbb399a7c6,Nathan Oyama,2,,This app can show push notifications for seasonal promotions 😡👎🏻,,2026-05-09T00:03:58,global,Google Play,0
