id,author,rating,title,content,version,date,country,platform,vote_count
6ec8c219-eec7-4767-a661-7496957e6432,Gloriannie Bravo,5,,excelente,26.0.0.6234,2026-03-05T05:27:42,es,Google Play,0
fb7d08f3-715e-4262-9b63-b7a9b02cef3a,Joseph Romero,1,,hp 2855 useless piece of garbage. Do not waste your money on this product.,20.2.0.6076,2026-03-05T02:51:23,sg,Google Play,1
3f9b81e4-8170-4e48-94f8-c655776dacd3,A O,5,,awesome,,2026-03-05T02:43:52,sg,Google Play,0
d83c759e-7ee6-40b6-9ffc-ef17270ee16b,José de Jesús Salinas Martínez,2,,👻,18.10.0.5530,2026-03-05T01:30:17,es,Google Play,1
bc7fa656-aefc-4c34-a844-05b5cbcd31eb,Wilbert Jimenez,3,,muy buena... solo que ya no habré la aplicscion,26.0.1.6280,2026-03-05T00:52:57,es,Google Play,0
d0b6b2d5-f5da-4d0e-8fe5-f5c7fc3b7e3d,Papelería Tikititos,1,,"no tiene absolutamente ninguna función para realizar impresiones, si se trata de una aplicación para impresoras mínimo debería tener herramientas para modificar impresiones",,2026-03-05T00:48:25,es,Google Play,0
31ec0574-db17-4f1e-9831-ee75f8ff22db,Josmir Rangel,5,,excelente,,2026-03-05T00:06:49,es,Google Play,0
7d909813-15bb-4f90-8400-cf1ca4a03f43,roberto sacchetto,1,,stampa fronte retro non funziona. pessima app,26.0.1.6280,2026-03-04T23:40:27,it,Google Play,1
191c8f97-b57a-400e-8ecf-dd8ab5045c3d,Daiane castro,1,,horrível de Mecher!!!!,26.0.1.6280,2026-03-04T22:47:16,br,Google Play,1
9c2fcf8d-83d7-46c5-8de7-0e45f5de1b9b,Autumn,1,,"oh. my. DAYS. I literally almost had a panic attack tryna work this app. I have a printer (deskjet 2800e) that's been out of use for half a year. finally got new ink for it just to find out not ONLY had the whole UI been changed and now was superrr confusing... but it had DISCONNECTED FROM MY PRINTERS WIFI AND NOW IT DOESN'T SUPPORT MY WIFI!! I tried direct wifi.. but now it says the printer is ""blocked"" when there is NOTHING stopping it from printing!! please make this easier..",26.0.1.6280,2026-03-04T22:35:09,sg,Google Play,1
97a7fd7c-5a3e-4e0c-ba2b-95a029fa72ab,Iliana Hernandez,3,,"scanner, even when wifi is set up always an issue when scanning, don't connect or the app don't scanning all pages.",20.2.0.6076,2026-03-04T22:31:06,sg,Google Play,1
99f8866d-d750-4be6-9e15-c7d827c43038,ATOMSOCKE,1,,Wenn ich könnte würde ich negative Sterne geben. Diese App muss von Satan persönlich entworfen worden sein um meine Zeit zu verschwenden. Von unerkannten technischen Problem zu Druckvorlage kann nicht an Drucker gesendet werden ist alles dabei. Selbst wenn du es mal schaffst was zu drucken dann findet diese anabolische App beim nächsten Mal wieder einen Weg deine Zeit zu verschwenden. Mein Rat wenn ihr schon so einen Drucker habt dann druckt per Kabel am Pc.,20.2.0.6076,2026-03-04T22:16:58,de,Google Play,2
8d398f9e-99e5-4b6c-a9df-839963a60a09,peter Smith,5,,excellent,26.0.1.6280,2026-03-04T22:03:51,sg,Google Play,0
9081d808-c119-4f68-bc52-cfcde937a702,Claudinei - Clau Jesus God,5,,muito top,26.0.1.6280,2026-03-04T21:05:10,br,Google Play,1
252bf50f-4439-4114-9459-c5892833092b,Frédéric,1,,jamais vu une appli qui bug autant. laserjetpro mfpm227fw avec pixel 9 pro,26.0.1.6280,2026-03-04T20:42:56,fr,Google Play,1
ab562562-b6f0-449d-9f64-0e1ac20a2caa,Ernesto G.L,5,,funciona perfectamente,26.0.1.6280,2026-03-04T20:42:05,es,Google Play,0
9f332a45-9847-456e-abd3-5f57ee2ed0b1,Shannon,1,,TRASH. NEVER works and it is impossible to get help from HP when your product is not under warranty anymore. I guess it's in HP's interest to make trash software and then make it impossible to resolve issues on 3 year old printers so that you have buy a NEW one every 2 years!?!?!? NOT reputable software or products.,,2026-03-04T19:54:57,sg,Google Play,0
bfef5497-de8f-4da8-98a4-f5306dbfc53f,Karina Gc,2,,"la app funcionaba muy bien en el celular o mi tablet, pero ahora, no abre, no imprime, ya la desinstale y volví a instalar y nada, ojalá lo corrijan pronto",26.0.1.6280,2026-03-04T19:41:28,es,Google Play,1
4244b381-ae7b-4665-b5a7-ebada5c89e7e,Massimo Lista,2,,perso collegamento wifi durante scansione più volte,20.2.0.6076,2026-03-04T19:37:46,it,Google Play,1
6f927ebb-cdae-4430-ab4b-1a02256ceb3a,Vapor- Madrid,1,,"no he visto en mi vida una aplicación más mala que esta, y lenta es horrorosamente lenta. no me deja agregar mi impresora porque supuestamente está desactualizada, pero me contabiliza todas las páginas que imprimo y llega la factura a tiempo siempre al final lo desinstalo y compro de otra marca",26.0.1.6280,2026-03-04T19:24:25,es,Google Play,4
8e981ff4-6e2d-4617-8047-c36ada327dae,Sharon Davies,2,,it is exceptional easy and I like how it tells you how much level of ink you have although my app said it had no color ink when the ink was Brand new and I checked it many times but the other reason is it needs to have easier connection wifi takes AGES TO SET UP !!!!!!! 😭🤕😤,26.0.1.6280,2026-03-04T19:04:15,sg,Google Play,0
b72dce89-d5bd-4367-9891-936e8685bdb0,Daisy Bordon,1,,tem hora que não abre o app,26.0.1.6280,2026-03-04T17:42:09,br,Google Play,0
777f9e33-48e6-490d-b079-b814c62e10ee,Gabriel Fanaru,1,,"Utile avere una stampante ""smart"" quando 9 volte su 10 non puoi stampare perché l'app non funziona.",26.0.1.6280,2026-03-04T17:41:57,it,Google Play,1
d5cac4c2-75c4-4916-ace2-fe8267c22cfa,Oscar Palacios,2,,no abre la app se queda pensando y no me permite scanear desde el celular,26.0.1.6280,2026-03-04T17:12:33,es,Google Play,0
eff78f60-3bea-44ee-9c8e-a9fea8500c6f,Elvira Silveira Pratti,5,,excelente qualidade. sempre que preciso utilizo esse App,26.0.0.6234,2026-03-04T17:04:05,br,Google Play,0
e252f655-ef3d-4b2e-b602-0d7669d9d70e,WEE SIANG LAU,1,,the stupid protection account become unending loop. keep asking you to verify even you did correctly. never ending and never ever login. stupid app design and stupid verification.,20.2.0.6076,2026-03-04T17:02:54,sg,Google Play,0
9ffb66a9-24f8-4c24-935a-fa4ef5afe496,Ino G,5,,bien,20.2.0.6076,2026-03-04T17:00:50,es,Google Play,0
6b4ce786-f09b-48c1-b69a-c0f694cdc7e9,Dianas,1,,it wants me to pay why,17.0.0.4492,2026-03-04T16:58:57,sg,Google Play,0
803103aa-45a0-43d7-829e-d696aaeae6c6,Alexander Ott,1,,Garbage. Firmware update will come out every once in a while and the app will knock your printer offline whenever you try to connect to print. Very vexing experience,20.2.0.6076,2026-03-04T16:37:54,sg,Google Play,0
317c8dfa-2810-4db9-b9ef-0e4f38fe6248,Eduardo Maçaneiro,1,,"Tenho uma smarttank581, o app não abre, muito ruim, mas muito ruim, se vc depende do celular ou tablet para imprimir, esqueça, QUANDO...o app abre, não imprimi, uma tragédia! O suporte então... não existe... comprei achando que era melhor que a EPSON, mas é uma bomba! não instalem e nem comprem HP, não compensa!",26.0.1.6280,2026-03-04T15:51:08,br,Google Play,2
2b4fd1ae-ddb4-4502-97ec-5c1a6178c1b9,Niccolo Ramirez,5,,simplemente es una maravilla,20.2.0.6076,2026-03-04T15:49:14,es,Google Play,0
3285bab3-45ae-4421-b256-b4a94f965a5e,Néstor Sebastián Coneti,1,,la ultima actualización anda mal,26.0.1.6280,2026-03-04T15:37:03,es,Google Play,0
6372cf79-660c-49dd-aaca-1f4ee4e25f95,Luigi Genocchio,1,,son più le volte che non funziona,26.0.1.6280,2026-03-04T15:31:12,it,Google Play,1
63886959-26a1-461f-9c31-5c12d36ec47b,Julian,4,,It works. Only thing I've noticed is that when app restarts you need to add printer again. Doesn't save it on your account.,20.2.0.6076,2026-03-04T15:30:03,sg,Google Play,0
3029fa18-e7fa-44cd-937a-e3ae8b776e6c,Guillaume Guerle,1,,nulle c'est un vrai calvaire de se servir de cette appli. pour faire un scan il faut y passer une plombe. l'application n'est pas du tout intuitive et c'est la galère pour la connexion wifi. dernière fois que j'achète hp. En plus collecte nos données perso. A FUIR,17.10.1.4636,2026-03-04T15:16:45,fr,Google Play,1
b21342f4-52c2-410e-80bb-9339e5332cf7,Alejandro Odin Cartujano Tepozteco,1,,White screen. crashing. one plus Nord n10. al instalar y reinstalar la app no se puede visualizar solo quedando una pantalla en blanco. se tiene el complemento sin efecto beneficioso con la app.,20.2.0.6076,2026-03-04T14:24:50,es,Google Play,0
bf4b3043-e0f2-4be5-b6c4-b59fc1c0928e,Helenice Bernardo,5,,ele é rápido e correspondeu as minhas expectativas de forma simples e rapida,26.0.1.6280,2026-03-04T12:29:55,br,Google Play,0
303c4496-438a-4b13-85de-439cbd0688a8,Ajmal Favas,5,,it's very nice application ♥️,26.0.1.6280,2026-03-04T12:29:04,sg,Google Play,0
69be16b7-a60d-48d5-b95d-bf3d79165d7f,Vicente Lima,5,,muito bom.,20.2.0.6076,2026-03-04T11:59:38,br,Google Play,1
f7eacdce-868c-454d-a3bd-65b687cac882,Bhushan Nikam,5,,good,20.2.0.6076,2026-03-04T11:32:15,sg,Google Play,0
7733e812-0856-4620-a159-1b24f65ef1b3,Marc Stroobant,2,,Kan de app niet meer openen op tablet Samsung A9+ maar werkt wel met gsm Samsung S23+.,26.0.1.6280,2026-03-04T10:45:13,nl,Google Play,1
a4101316-e1d4-4b78-9530-8faa589f7f61,Eunice Mansan,1,,ruim,20.2.0.6076,2026-03-04T10:27:45,br,Google Play,0
8e9f356d-25ed-488f-b040-64dd99e68237,sarah langmaid,2,,"the app is very slow and complicated unless you great with technology, which I'm not that great with",26.0.1.6280,2026-03-04T10:03:32,sg,Google Play,1
f7b00f35-7619-4674-9ef8-478709012395,Julien Thierry,1,,obligé de créé un compte d'activer la localisation et le bluetooth pour imprimer c'est un scandale n'utilisez pas.,,2026-03-04T10:02:51,fr,Google Play,0
b8fef099-893c-4b0e-97ac-55297eef2069,FAURE Serge,5,,"application intuitive, efficace et facile à manipuler.",20.2.0.6076,2026-03-04T08:30:26,fr,Google Play,0
9d6a47e9-54a2-4c6d-baa9-b98e9ba13afc,Peque Luna,1,,terrible. cambiaron el módem. y es un problema.para poder conectarse inalambricamente. que dolor de cabeza,20.2.0.6076,2026-03-04T06:27:24,es,Google Play,0
517dcbb0-4b92-49da-b78a-40b04ddb315a,Peter Pouwels,1,,Sinds de laatste update start de app niet meer op.,,2026-03-04T06:27:06,nl,Google Play,0
e824ff9e-a5db-4941-b31b-987d08de8c60,marian swanson,1,,terrible,26.0.1.6280,2026-03-04T06:07:08,sg,Google Play,0
d8e2460a-a526-4c92-8f2c-eefd7c37c306,Kathy Close,1,,I agree you should not pay per page or or subscription for a printer you've just paid cash for. and you expect to be able to get pages printed,26.0.1.6280,2026-03-04T04:15:30,sg,Google Play,1
56fee6f1-9b7b-44e7-bceb-9d2aec256881,Fernando Arael Vargas,5,,"Muy buena aplicación, con todo lo básico para imprimir y escanear",20.2.0.6076,2026-03-04T03:59:38,es,Google Play,1
2ad3ffbd-5846-41d5-8966-5aba0be123f6,Omar Moreu,5,,good,20.2.0.6076,2026-03-04T03:00:11,sg,Google Play,0
ca0fecbb-fde1-41ab-a2ff-385a3b9ace21,Charene Day,5,,great app,26.0.1.6280,2026-03-04T02:51:20,sg,Google Play,0
3d20b6d3-913a-41c6-b9ea-b8a535bd911a,Laura isabel Perez hervias,5,,Excelente,26.0.1.6280,2026-03-04T02:41:11,es,Google Play,0
c108d94f-b150-4871-b74c-3d1ddc93cfb0,Maria,1,,This is the worst printer app combo I've ever owned. At six months I was promised I would get a delivery of ink that never showed up. If you don't buy your ink through their service they lock up your printer so you can't use it. I've tried calling and going through all the available options on the app and there's has been zero ways to resolve their issues offered to me.,20.0.1.5732,2026-03-04T02:35:25,sg,Google Play,5
8f4a846d-8742-4c09-aabf-ca2ecebca5bf,Rodrigo Dinelly,1,,"Esses caras deveriam ir para a NASA! Tem que ser muito inteligente para criar um APP para o celular aonde eu tenha que estar online e criar ou logar em uma conta, para imprimir na minha impressora de forma offline! POR QUE MOTIVO EU VOU QUERER ESTAR ONLINE E CONECTADO A UMA CONTA, SOMENTE PARA IMPRIMIR UM SIMPLES DOCUMENTO QUE JÁ ESTÁ SALVO NO MEU CELULAR? E SE EU ESTIVER SEM INTERNET? Vocês reenventaram o sentido da palavra OFFLINE! GÊNIOS, GÊNIOS! APRENDAM COM A EPSON!",20.2.0.6076,2026-03-04T02:21:11,br,Google Play,0
77a05390-4978-4524-91b4-40810368cafb,Oscar Balderrama,5,,es muy buena,20.2.0.6076,2026-03-04T01:07:03,es,Google Play,0
1fccb2ed-a8db-4d8a-bcb5-d0f60d0f5fce,Gilvando Alves,1,,"O aplicativo já era ruim para imprimir fotos agora ficou pior. comunicação do aplicativo com a impressora é horrível não adianta ser smart e ter bluetooth se é tão ruim. não pagaria nunca uma versão paga, e escolheria outra marca se eu soubesse antes que é horrível os produtos HP. Esse aplicativo atrapalha muito quem trabalha esse é o significado do que é ridículo.",20.2.0.6076,2026-03-04T00:55:55,br,Google Play,8
a92a52c9-98b5-4d46-8fdf-b8f2668a068a,Sharon Patricia Ingaroca Tejeda,3,,la versión previa era mas amigable,20.2.0.6076,2026-03-04T00:47:06,es,Google Play,0
fb9210ce-4fab-4880-9b4c-b63fdcdf4c43,Hector Garcia,5,,excelente app,20.2.0.6076,2026-03-04T00:26:38,es,Google Play,0
6dbc23b2-0ee6-433a-be65-3db4ee0d70b3,Melinda Stovall,1,,Not Compatable with Chrome. SERIOUSLY WHY IS IT NOT ANYMORE? I'll not recommend this. I'll get rid of it and get something different.,20.2.0.6076,2026-03-04T00:11:11,sg,Google Play,0
94dcb5ed-3e38-423b-8b2e-485995557300,Matheus Kenzo,1,,o app trava n abre vive dando erro,26.0.1.6280,2026-03-04T00:01:15,sg,Google Play,0
244c8fb8-4c4e-4877-9d07-f1c2f7ace552,Teresita Velazquez,5,,muy satisfactorio,20.2.0.6076,2026-03-03T23:58:33,es,Google Play,0
33298912-43a3-451f-af45-1f447f2b3188,Soni-d Pullen,1,,"just couldn't get the printer to be active. Despite adding the info, just wouldn't recognise it at all????? Carnt the public just go back to using a printer without adding app, passwords etc 😑!",20.2.0.6076,2026-03-03T23:33:11,sg,Google Play,1
4f130854-2341-4316-9bf7-6952592013b0,Javier Zurek,2,,"no encuentra la impresora cuando se quiere imprimir o escanear desde la aplicación, cuando se envía desde otra aplicación funciona",26.0.1.6280,2026-03-03T23:22:40,es,Google Play,0
1c2acbbf-bdec-44a1-8143-47656e4434d9,Mauricio Da Silva cruz,5,,Aplicativo é muito bom,26.0.1.6280,2026-03-03T22:58:47,br,Google Play,0
1c2efa39-d95c-4d41-83a5-7c030cc9c326,Lindsey Long,1,,App never works. Can't update the wifi after we upgraded our router. This app just spins!,26.0.1.6280,2026-03-03T22:35:16,sg,Google Play,2
6cd503e8-916b-4546-b22b-c6a148bf8850,Ha Ba,2,,05/2024 - 03/2026 - No Update-Infos,26.0.0.6234,2026-03-03T22:02:37,de,Google Play,26
30ab8e54-5a82-4f35-8985-a662d412d62c,Cynthia Burch Horton,1,,Won't print from my phone even though it's a wireless printer! Always says printer unavailable! My computer is too slow so it's almost pointless to print from it!,20.2.0.6076,2026-03-03T21:58:17,sg,Google Play,0
8b0ddacc-4010-4564-bc97-59f7d329b7ce,Joelma Pinheiro,1,,"nunca consigo conectar, está sempre offline, quando eu comprei era muito bom agora está péssima",26.0.1.6280,2026-03-03T21:56:55,br,Google Play,2
a41f4a0f-32e2-464a-8a03-108d59c9068b,Amandine Cantin,1,,"Je vais devoir changer d'imprimante car votre application l'a rend inutilisable. Une fois sur deux l'application me dit que l'imprimante est hors connexion, les impressions s'arrêtent après la première page et restent bloquées. La je dois scanner des papiers très importants mais dès que j'appuie sur numériser, l'appli me dit instantanément ''numérisation réussi'' alors que rien n'a bougé. J'ai voulu réessayer 2 jours plus tard mais l'appli charge indéfiniment sans démarrer.",26.0.1.6280,2026-03-03T21:49:23,fr,Google Play,3
d9029b0e-44b7-41b0-acc0-e7b220271276,Grant Hutzel,1,,The app works about as well as their printers... rarely.,20.2.0.6076,2026-03-03T21:30:14,sg,Google Play,0
c3c875f8-a9ec-4a3e-969f-6f7297cdc8bf,Grace Forrest,1,,Just got an hp.printer and this app and its soo hard to use. the app is constantly loading .its awful.,26.0.1.6280,2026-03-03T21:21:47,sg,Google Play,1
19ab952b-f58e-4875-ba2c-e2d7ab506cc0,Andrew E,1,,This is an absolutely terrible app. Used to be the only part of the HP experience that was tolerable but now they've HP'd this app too. Won't start anymore. Spinning circle of doom. Maybe one in 10-15 times it will actually start. Absolutely dreadful app but nicely complements the HP experience I guess.,26.0.1.6280,2026-03-03T21:10:46,sg,Google Play,1
412ec505-fe27-4dda-a8ff-7bf993349025,Gilles St-Pierre,5,,very efficient and easy to operate,26.0.1.6280,2026-03-03T20:43:33,sg,Google Play,0
e5191da4-0139-44a0-a2d0-cad59fe60d3e,Gena,1,,"Größter reinfallen, HP bitte was soll das? Für was brauch ich ein Account um ein Dokument im meinem Netzwerk von einem Gerät das ich erworben habe zum Scannen???",20.2.0.6076,2026-03-03T20:36:10,de,Google Play,3
c66be84a-2700-48f7-b4e9-6687a8f3efa5,Mandy M W,1,,UNUSABLE. Stuck on loading screen. the PC version is also slow and faulty. Scanning quality is poor,26.0.1.6280,2026-03-03T20:34:34,sg,Google Play,1
825b8d8c-5fb2-4b16-91b5-ea2b0b903b27,Daniel Kraft,4,,buena,20.2.0.6076,2026-03-03T20:22:11,es,Google Play,0
323a107b-0975-40e8-b5f3-707ca6a86a66,Markus,1,,läd nur noch,26.0.1.6280,2026-03-03T20:17:03,de,Google Play,0
09f0ab36-998a-4663-98e8-c4722be09405,David Ponce,1,,"la aplicación no abre, la impresora no se conecta a Internet, desastre total, que decepción",26.0.1.6280,2026-03-03T19:56:08,es,Google Play,1
a62ba1a8-6096-4859-8666-8e1373a17dae,Tsambikos Leventis,1,,"Ich bereue es sehr, einen HP gekauft zu haben. Der Drucker wird nicht gefunden, obwohl im selben WLAN verbunden und am Drucker die Verbindung in Ordnung scheint. HP sagt ""der Drucker ist offline"", Neustart bereits durchgeführt, App neu gestartet... HP sagt ""der Drucker ist offline"". Ok HP... dann ist er halt offline, du hast recht. Ich kauf mir einen Brother.",20.2.0.6076,2026-03-03T19:45:22,de,Google Play,2
145408db-3c45-4a9e-876c-5b5be13f7d7e,Hanae El Khayati,5,,está application funciona muy bien,,2026-03-03T19:38:37,es,Google Play,0
d19d2f4c-b5d2-4a05-918e-37be5be960ba,Anthony Cooper,4,,I have set it up and it works good 😊💯,26.0.1.6280,2026-03-03T19:27:06,sg,Google Play,0
088a243c-72c8-4da8-b2c1-d2e5386334f1,Charles,4,,having issues but it's my fault,,2026-03-03T19:21:10,sg,Google Play,0
cb961923-f004-4967-ae92-59fc444bd5d1,Nicole Rosser,1,,"Terrible, hours spent uselessly for copy and scan setup, with no result.",,2026-03-03T19:06:36,sg,Google Play,0
249c4162-4665-4bd5-b633-f188c1c60791,Woschbea,1,,"wieso eine app für drucker? schlechtes designe, unnötig kompliziert, dauernde anfrage für abopläne für tinte... echt reudig",26.0.1.6280,2026-03-03T18:36:21,de,Google Play,2
8cc485fd-73ec-4ed2-808c-d1d1dc1f6c6d,J B,1,,cannot login with the app,26.0.1.6280,2026-03-03T18:09:05,sg,Google Play,0
3e08a3fd-c521-41e0-8bbf-979d8557f9f7,Felix Erhart,1,,warum braucht man einen account um etwas zu scannen,26.0.1.6280,2026-03-03T17:50:07,de,Google Play,1
1ac450c7-0050-4e92-a6f1-395dcec874f6,iris taller servidores Ramos,4,,me dio mucho trabajo,20.2.0.6076,2026-03-03T17:42:32,es,Google Play,0
cb0c2ec7-9e52-4e07-9d7c-d3ca3ede52ec,Dor Heili,1,,GRAUENVOLL,26.0.1.6280,2026-03-03T17:25:43,de,Google Play,1
fa39507e-3c0e-4c61-9005-fa056a7cf7bf,Tracey Harris,1,,app is super slow to open. often gets disconnected super frustrating,26.0.1.6280,2026-03-03T17:11:26,sg,Google Play,1
bd88b5d7-a14d-4d15-8b32-d5a66a00919b,Zethmara Amador,5,,exelente,20.2.0.6076,2026-03-03T16:35:33,es,Google Play,0
821d12ab-6d89-418a-b9ed-10b6fa31e718,Armand Krief,5,,im primante Hp 2700 e impossible à installer quand on est relié à un réseau publique.il faut ne box pour qu'elle soit initialiser.ée. Hp était une marque de qualité désormais hp est un gros problème pour tous les utilisateurs. il faut boycotter cette marque. .rien dans les modes d'emploi ne prévoit cette obstacle insurmontables.,26.0.1.6280,2026-03-03T16:10:41,fr,Google Play,0
f2f6547c-a0b2-4017-8d17-820880611513,Jonathan Otero,5,,espectacular,20.2.0.6076,2026-03-03T15:01:58,es,Google Play,0
b883353b-3c5a-4ee8-a6e8-c4423737bff4,Paco Barter,1,,Tienes que crear una cuenta en HP para poder imprimir en tu impresora. Vaya estafa.,,2026-03-03T15:01:08,es,Google Play,0
83efd11b-c8a6-4176-8b98-be2a74b53fb8,Azzam Asad,1,,تطبيق فاشل وبطيء جدا,26.0.1.6280,2026-03-03T14:46:31,sg,Google Play,0
01568df1-5c52-4839-b76c-5117f250c796,Bipin Bihari,1,,not working just loading for 2days,26.0.1.6280,2026-03-03T14:45:37,sg,Google Play,0
44b599e5-c463-4c48-b5f4-08e49b9c2aba,Vivian Molina,5,,HP la mejor marca,20.2.0.6076,2026-03-03T14:38:55,es,Google Play,0
4ed2df7d-4e4f-4312-b85e-41c8b15e8f53,José Fernando Oliveira,1,,Lixo de aplicativo não entra no login só dá erro. lixo de impressora compra cartucho caro 90 e dá erro . Compra Hp e não consegue imprimir pelo celular para que tem wi-fi HP é lixo,26.0.1.6280,2026-03-03T14:36:09,br,Google Play,1
9b0c6ed6-6f9b-428e-b289-cbd61ffeca2e,Planos R.,1,,"pésimas impresora con un pésimo sistema para escanear, compre una smart tank 530 y cada vez que necesito scanear un plano me pide iniciar sesión. por eso me cambie a una samsung, hace el trabajo y sin tener que conectarme a WiFi, ni darle autorización a mis datos ni mi ubicación. un decepción",,2026-03-03T14:35:11,es,Google Play,0
f6ea9773-26a3-44c9-ae76-6bba40a5ecd1,ESM,1,,no abre,26.0.1.6280,2026-03-03T14:25:52,es,Google Play,0
4498ece0-e7c7-4cf5-858c-e4f897461343,Becaman Ramirez,5,,Bueno,26.0.1.6280,2026-03-03T14:18:11,es,Google Play,0
2203d61b-dfa4-4a46-aed9-6ddf187695fd,rodrigues tem,2,,e só instalar e no fim não é nada de que eu queria instalar 😞,20.2.0.6076,2026-03-03T13:40:23,br,Google Play,0
03741ecf-6106-4b1b-8599-d5f7767536a0,THASSIO NERDISSE! (Nerdisse comercial),1,,"15 anos usando produtos HP e é incrível como nada da hp é simples ou funciona de forma prática, tudo lento e feito para te irritar, essa é a marca registrada da empresa, irritar o usuário. quando vc migra para outra marca, descobre que passou raiva durante anos sem necessidade. esse App é a mesma coisa, vc demora muito pra fazer algo simples,imprimir uma página pode ser a tarefa mais demorada do seu dia. quer imprimir em uma impressora HP? use um iPhone com o app nativo do aparelho.",26.0.1.6280,2026-03-03T13:33:14,br,Google Play,1
100059ca-4c9e-422a-a1af-4a735f3c56a6,Ilzamara Pachêco,1,,"Meu Deus, o que está acontecendo com esse aplicativo? Impossível de usar, simplesmente não abre.",26.0.1.6280,2026-03-03T13:31:31,br,Google Play,0
787dd720-d535-435f-9f79-952120e8d377,Glitz Oride,1,,"je ne sais pas qui a eu la bonne idée de passer de ""HP Smart"" à ""HP"" mais virez le svp et redonnez nous notre application qui était autrefois utile et ""smart"" :)",20.2.0.6076,2026-03-03T13:14:06,fr,Google Play,1
7bb35d2e-514c-4e98-b6ed-a7201c7394e3,Gonzo Chaosman,1,,Man wartet ewig auf die App. jeder Schritt dauert Minuten. Absolut unkomfortabel,,2026-03-03T13:13:47,de,Google Play,1
200c43ef-11df-4e94-ba84-51f0d4892269,Michael Palin,2,,I rarely rate apps but this one is bad. So often that this is just opening but never opens. Or never prints once opened. Such a bad experience,26.0.1.6280,2026-03-03T12:24:11,sg,Google Play,1
5a24cf34-e095-4dc9-8f98-0cdb1187a39e,Robpd,5,,Works great. Prints docs to my wifi printer with no problems and reasonable speed.,26.0.1.6280,2026-03-03T10:36:59,sg,Google Play,1
a706ca74-cc78-4533-9e98-794ca55b69fd,Julius Kincses,1,,"nichts geht, ausser einem blauen etwas, dass im Kreis läuft. Hat die app bei HP auch jemend ausprobiert? Wenn man bedenkt, was andere im Smart home oder im KI Bereich schaffen und HP nicht mal eine Printerapp zum Laufen bringt. Arg, wie sich die Qualität zum negativen entwickelt hat....",26.0.1.6280,2026-03-03T09:18:41,de,Google Play,1
95097902-ca7d-465f-9063-1ca7b4b0cd12,Apachekids Warriors,5,,I love this app,20.2.0.6076,2026-03-03T08:41:18,sg,Google Play,0
bfe2560b-92a8-473e-9bb2-3d769507b32b,Kurt mit Helm und Gurt,1,,Absolute Frechheit in Verbindung mit Hermes und DHL Versandlabels zu drucken.,26.0.1.6280,2026-03-03T08:27:16,de,Google Play,1
1ab27c4c-66f4-43eb-ae2d-e412599a3ee1,Marlon Calderón,5,,Muy bien,26.0.1.6280,2026-03-03T07:33:12,es,Google Play,0
4fb943af-0ac7-4611-9dd8-2985d649cfcf,Daniel Smith,1,,"usually good but recent weeks my app wont even load, just loads into a white screen with a blue spinning load bar and thats all I get wont load on my pc either, uninstalled and reinstalled still wont work, essentially cant use my printer 🙃",26.0.1.6280,2026-03-03T06:11:46,sg,Google Play,1
d3edad39-7de4-42f5-9b10-71dce14656cc,Jan Jan,1,,discusting to want 60USD per month to print. its an app written with ai in 5min.,20.2.0.6076,2026-03-03T05:47:15,sg,Google Play,0
bb95a741-54b2-4bcd-ac63-c96cbefcc3c7,Mario Hernandez,1,,App not working anymore.,26.0.1.6280,2026-03-03T05:15:41,sg,Google Play,0
36b4b348-71c9-4e7a-9777-a549f8109111,Ismail Al Qassabi,5,,excellent,26.0.0.6234,2026-03-03T05:14:48,sg,Google Play,0
5efe9b8f-9ce1-433d-b0cf-76d689add70e,Enri Suryanata,5,,Amazing.. Love it a lot. Very user friendly and useful.,26.0.1.6280,2026-03-03T05:13:46,sg,Google Play,1
8c84303e-bba1-4a31-b396-d148ffba03c1,Gaming Screen,1,,worst junk that ive ever seen.,,2026-03-03T04:18:15,sg,Google Play,0
3f63f024-b9eb-4b7f-afe1-0527eb849f6c,Albert,1,,shocked at how many times this software crashes. probably one of the worst apps I've ever seen. totally unacceptable for a company like HP,20.2.0.6076,2026-03-03T04:06:03,sg,Google Play,0
789c68b2-a731-480a-9060-496bf65de251,Eric Armstrong,1,,stop buying hp they are part of the problem. all your printers are garbage 🗑️,,2026-03-03T04:01:50,sg,Google Play,0
f3db0607-821f-4377-a61d-4cf386377d9a,Samanta itzel Mariscal Almeida,5,,execelente,26.0.1.6280,2026-03-03T01:22:59,es,Google Play,0
2b30ef70-6d01-45dc-a6e0-b9e7a48be0f5,Mark Finn,2,,"won't let me sign in, keeps going back to sign in.",26.0.1.6280,2026-03-03T00:36:57,sg,Google Play,0
76399d0c-07ec-45fa-88fd-e0f1743c2093,Carlos Enrique Madrigal Lopez,5,,exelente,26.0.1.6280,2026-03-02T23:52:14,es,Google Play,0
