id,author,rating,title,content,version,date,country,platform,vote_count
6a5c816c-0b71-4320-aafa-5c3e564db9ad,Lopal Lopal,1,,HP no compres nunca . una estafa. te bloquean vía Internet los cartuchos compatibles de marca blanca. PRIMERO TE VENDEN UNA IMPRESORA QUE FUNCIONA CON CARTUCHOS COMPATIBLES Y DE REPENTE HACEN ACTUALIZACIONES SIN TU CONSENTIMIENTO POR SEGURIDAD PARA LA CALIDAD Y TE BLOQUEAN LA IMPRESORA PARA QUE SÓLO FUNCIONE CON HP. TODO GRACIAS A ESTA APP. UNA VERGÜENZA Y UNA ESTAFA,26.1.2.6449,2026-05-06T18:05:08,global,Google Play,0
79d04b8a-b4eb-4824-b8b9-75cb8b394085,Lucien SIMELYN,5,,tof toestel veel mogelijkheden,26.1.2.6449,2026-05-06T17:03:01,global,Google Play,0
22a08b05-1a4d-4bf7-a325-89fd58c7d539,Santiago Cerna,5,,muy efectivo,20.2.0.6076,2026-05-06T16:55:01,global,Google Play,0
18cbadeb-a184-49a8-bef2-bb3a7f60ab1a,Nicole Hartwig,1,,"Nie wieder HP. Nachdem ich Instant ink gekündigt habe (in zwei Jahren erst ein Patronen Wechsel aber schon fleißig gezahlt) und jetzt neue Patronen gekauft habe, blockiert der Drucker munter sämtliche Dokumente die ich drucken möchte. Keine der angegebene Möglichkeiten funktioniert, wie man ihn dazu zwingen soll.",26.1.2.6449,2026-05-06T16:51:59,global,Google Play,0
fe2059ed-2801-4b41-833a-d793e3f5825c,Edward Olmos,1,,Embarrassment of an app. Can't even use the functions unless you create an HP account.,26.1.2.6449,2026-05-06T16:22:38,global,Google Play,0
6b220a2b-5aad-44c2-82c4-dc6d92a8060c,Sarah Carter,1,,"brought one of your printers, can't use it because i need to buy a subscription. so you want me to buy the printer then monthly pay you to use the printer i already brought? better idea was i took your garbage back to the store and brought a printer from another company that isn't out to rob me. garbage is what uour selling!",,2026-05-06T16:13:15,global,Google Play,0
74365446-7028-4691-9271-03094f39ea69,Christian Tietgen,5,,"Funktioniert, wenn der Drucker ""Drucks-Apps"" aktiviert hat. Muss man wissen.",26.1.2.6449,2026-05-06T15:31:09,global,Google Play,0
46bfd679-6d97-4da8-9258-e76e83c22684,Philipp,1,,"Warum muss ich ein HP Konto erstellen, nur um scannen zu können?",20.1.2.5988,2026-05-06T15:02:24,global,Google Play,1
543afb43-dfe9-4482-938d-58c421c03da2,ARDpurestar,1,,"works less than half the time now. the new update makes it work less than half the time if your even able to make it connect. it shouldnt take 5+min to load just to hopefully connect to be able to even select print every new update, same and new problems added, annoying app god damn app works once out of every 20 30 god damn print request. Forces you to make an account just to print and constantly collecting your data while messing up every print job one way or another. each ""update"" breaks it",26.1.2.6449,2026-05-06T14:35:11,global,Google Play,0
c9fac8c1-7275-4b32-b783-e2126517124c,Mama Erin,3,,"for 2 days, I've been trying to verify an order I placed. I have talked to 10-12 people who keep transferring me to different departments... I just want to know the details of an order. it should NOT be difficult. all of the people in the HP offices and all I get are transfers. for 2 damn days. find my order details, or I'm done with the whole sorted mess. it just shouldn't be complicated.",,2026-05-06T14:31:52,global,Google Play,0
37ac1317-889a-42c0-b316-d2402d40fde1,E Alejandro RM,5,,excelente,26.1.2.6449,2026-05-06T14:16:58,global,Google Play,0
84ae17ba-39f4-4eff-83df-8ae8bc9a77ab,Sven,1,,worst brand in this world,26.0.1.6280,2026-05-06T13:22:07,global,Google Play,0
6fcdfb1c-54a0-4888-b756-085a69b22382,Sonia Tasnim Putul,5,,ok,20.2.0.6076,2026-05-06T13:13:10,global,Google Play,0
6694c0a2-576b-49ed-af53-0ebe23746304,Rosanna Mancini,1,,non si capisce nulla,26.1.2.6449,2026-05-06T13:07:47,global,Google Play,0
550e0a62-07cb-4506-ba56-c764e004b996,D Sanz,1,,this is a horrible app. too many bugs. all files scanned end up empty or corrupted.,20.2.0.6076,2026-05-06T12:43:55,global,Google Play,0
0be65840-17e2-458c-8dc8-695531907ddf,Connie Beekman,3,,glitchy... hopefully the update fixes this. My monthly subscription bill was due and A week later I finally was able to log in! It just would not load and I could not get the website to work either I don't know what was going on. It's also a little confusing to navigate once you get into the app it takes you to the website for a lot of things and it's a little scattered it's annoying honestly,26.1.2.6449,2026-05-06T12:37:57,global,Google Play,0
68498bb8-1d43-4dc7-80d1-3495f36a60e4,GIN LOLA,5,,great,26.1.2.6449,2026-05-06T10:10:17,global,Google Play,0
e7b73320-b91b-49b1-9a3b-32353aa4c90f,young heart,5,,"Ich kann nur für mich sprechen. Ich bin mit der App voll zufrieden. Das Öffnen funktioniert einwandfrei und flüssig. Dokument, Scannen, und Photos bearbeiten läuft einwandfrei. Die App nutze ich jeden Tag.",20.2.0.6076,2026-05-06T07:14:52,global,Google Play,0
fc4b1669-842f-4314-932e-4b277bdbb478,YGAPPARAO,5,,super,26.0.2.6338,2026-05-06T06:42:53,global,Google Play,0
4ebc7728-e166-45db-8453-2e8f0cd81484,Brewce's Roofless-E46,5,,I ❤️ the HP print APP. I run it on my OfficeJet Pro 9010 andd its endless options. Super EZ to navigate,26.0.2.6338,2026-05-06T02:02:58,global,Google Play,0
aad96935-0746-40cd-9898-a4b722df01db,Ornella Fermi,3,,"Está buena, se puede imprimir desde el celular, además de ser una impresora inalámbrica, aunque conviene más conectarla por cable para que sea más estable porque el wifi no es garantía de nada. Lo que si me parece pésimo que no encuentro el software de mantenimiento, si quiero hacerle una limpieza de cabezales o alinear los cabezales, no puedo, porque no aparece ni en la app, ni en la computadora. Tengo pocos caracteres porque sino, haría un listado de las cosas que me han pasado.",26.1.2.6449,2026-05-05T23:14:33,global,Google Play,0
ad5088c8-8e2e-4d1c-ae86-1b1c4ed1634b,tiffinie pierce,2,,I used to be able to choose the scale option I wanted now it only gives me the option to fill page or fit to page. I also cannot get it to work on my laptop I can only print from my phone. I used to be able to print from both.,20.2.0.6076,2026-05-05T22:49:07,global,Google Play,0
dff272ea-8e6f-4623-8cbc-c605de6f9e31,Daniela Daniela,1,,no anda esta aplicación de mi...,26.1.2.6449,2026-05-05T22:21:25,global,Google Play,0
fecbfb34-1427-4552-9ae5-2b590924bb06,Aldo Zanchin,1,,Está impossível fazer login.,26.1.2.6449,2026-05-05T21:42:19,global,Google Play,0
11d74a4f-1b10-4c97-8c2b-ee0f06131a52,Toni S,1,,nichts funktioniert,20.2.0.6076,2026-05-05T18:47:20,global,Google Play,0
a8a57690-eeaf-44ba-a6a3-8165af3bb2bb,Neerav Vora,1,,worst app and worst printer,26.1.2.6449,2026-05-05T18:26:43,global,Google Play,0
faf598e1-d5c1-4d16-9172-bf613c112109,Brian Yu,1,,hp fax doesn't work. always says no internet connection.,26.1.2.6449,2026-05-05T17:34:12,global,Google Play,0
151d557c-9fdd-459d-8be2-3031f5a3e7f0,Rach Spooner,1,,"Trying to access printer settings to sort out a bad ghosting problem but the app won't even open. Just the loading circle of death then an app can't be used right now message. Tried reinstalling, updating, different device, same result each time. Pretty rubbish really from a $bn company.",26.1.2.6449,2026-05-05T17:26:18,global,Google Play,0
abea057a-723c-4b7a-be9e-6963a4ffb51d,Badger,1,,absolute shite,,2026-05-05T17:23:57,global,Google Play,0
db28b9a8-4dc3-4d74-8a2e-0f859188dd58,Sandy Auerswald,1,,seitdem die App überarbeitet wurde funktioniert sie nicht mehr,26.1.2.6449,2026-05-05T17:22:49,global,Google Play,0
faf95f77-755a-4e3f-b901-232603726fb9,Peter Heinemann,1,,Nach Update startet die App nicht mehr. No way!! Deinstallation sofort.,26.1.2.6449,2026-05-05T17:21:24,global,Google Play,0
70d4ce35-cca1-4692-a65c-3a49c55faf9e,Taylor Stevens,1,,Does not work at all anymore wont even open left me unable to print anything,18.10.0.5530,2026-05-05T17:21:17,global,Google Play,0
eea4602b-466f-4831-8a94-222484642931,Guillermo Eduardo Argüelles Frutos,1,,No abre la aplicación,20.2.0.6076,2026-05-05T17:21:06,global,Google Play,0
902b0cad-8c41-43de-a357-f240d8950c36,Alex,1,,"03/25 An sich war ich relativ begeistert von der Bedienung und Anwendung der App. Neuerdings benötigt man für alles einen Account, das nervt und mindert das Vertrauen. So langsam funktioniert gar nichts mehr. 05/26 Nach wie vor grottig. schon das Prinzip ist abartig und wenn es nicht mal funktioniert...",26.1.2.6449,2026-05-05T17:17:23,global,Google Play,17
b2f47820-3ce8-4b3c-aaf9-092fa67f3b1e,Brandon Baumgartner,1,,can't even get past the data agreement screen to start the app,26.1.2.6449,2026-05-05T17:16:21,global,Google Play,0
e3e70e8e-33c4-4dd9-8e87-e4e36905bf1e,S to the O,1,,Was das ist mit der App los? Die Datenschutzbestimmungen lassen sich auf keinem Gerät akzeptieren.Weder Android noch IPhone,26.1.2.6449,2026-05-05T17:16:02,global,Google Play,0
794b0cb3-0517-46da-ae97-ddb424186efd,clara beatriz gallardo,1,,no pude ni entrar a la app por qué se bloqueo,26.1.2.6449,2026-05-05T17:11:16,global,Google Play,0
f8beb8a2-0afc-4488-8a47-cb495f1959fe,Philipp,1,,nur Abbrüche oder lädt gar nicht erst.,26.1.2.6449,2026-05-05T17:11:05,global,Google Play,0
daf85760-e2b4-4f1a-b1ab-e94b94a460be,Noteplayer,1,,Das letzte Update war ja nur noch ein letzter Schritt in die Tonne.,26.1.2.6449,2026-05-05T17:10:54,global,Google Play,0
12b7482f-6f5b-44ec-a787-161ddc6572e6,Gabriela Chavez,2,,no me deja pasar de aceptar todo,20.2.0.6076,2026-05-05T17:09:04,global,Google Play,0
06e3a717-66e8-4dce-87eb-3582f5c8065d,Wa We,1,,Die App startet einfach nicht. Keine Verbindung zu der App.,26.1.2.6449,2026-05-05T17:08:04,global,Google Play,0
18bd3bbd-e700-42db-be98-6c5ee01ca547,Katharina Arndt,1,,"Ich frage mich immer warum etwas neu gemacht werden muss, wenn es vorher gut bzw. besser funktioniert als das neue. Die App ist unbrauchbar und völlig schwachsinnig, da sie nicht funktioniert",20.2.0.6076,2026-05-05T17:03:44,global,Google Play,0
5e133548-aaaf-4671-afa6-22bb19c6d83c,Ax-Man,1,,"Die App funktioniert nicht – es erscheint lediglich ein weißer Hintergrund mit einem blauen Kreis als Ladeanzeige, und das dauerhaft. HP sollte sich wirklich darum kümmern, dass sich hier etwas bewegt. Wir haben alle viel Geld bezahlt und ärgern uns inzwischen nur noch darüber",26.1.2.6449,2026-05-05T17:00:47,global,Google Play,0
dd14cf0f-2f05-4d5b-8191-f4b7f3eec91f,Antonio Diego Mirone,1,,"Ore perse per tentare di configurare una stampante!!!!App a dir poco penosa,carica a vuoto e di conseguenza non puoi praticamente fare nulla in quanto non si riesce nemmeno ad assegnare la rete wifi....mai piu' un prodotto di questo brand!",26.0.2.6338,2026-05-05T17:00:27,global,Google Play,0
21cb7166-7333-473f-b4bf-fbffe9a845de,zpunk81,1,,will not pare with my deskjet 3755. it works with units older and newer but skips over this one on the list,26.1.2.6449,2026-05-05T17:00:13,global,Google Play,0
3685c0b8-9c03-4db7-8937-8505223379af,Felipe Orozco,1,,I cannot log in,26.1.2.6449,2026-05-05T16:59:48,global,Google Play,0
19d30240-992b-452b-ab67-35a864d71236,holly fields,1,,ridiculous to get it to work conveniently,,2026-05-05T16:54:24,global,Google Play,0
c15bf93e-c292-47b5-b72b-77d14190d31e,Luis Perez,1,,"Tu aplicación a dia de hoy Mayo 5 de 2026 no deja aceptar los terminos y condiciones y no pasa de ahí, ya probé en 2 celulares distintos, con datos y red WiFi dif y nada.",26.0.1.6280,2026-05-05T16:50:23,global,Google Play,0
c647c2ce-6993-4f7e-8a66-9aac6a3c1f4d,Miriam Wolfsgruber,1,,einfach furchtbar. Man kann nichtmal dem Datenschutz zustimmen um überhaupt in die App zu kommen...,20.2.0.6076,2026-05-05T16:49:57,global,Google Play,0
2c9c1843-ea0f-4fe3-94b3-3647df382a50,Jared Kennedy,1,,"Terrible, the app wont let me past the user agreement when it opens regardless of if I accept all or opt out of optional sharing.",26.1.2.6449,2026-05-05T16:46:12,global,Google Play,0
cb3219b7-50c4-4234-8a24-f43234337ada,nadir abdur rahman,1,,app is not opening.. only showing loading please wait,26.1.2.6449,2026-05-05T16:44:47,global,Google Play,1
83c426d0-ab33-4b7b-afe7-9957774b04a3,Angela and Philip Rostance,1,,Would not open,26.1.2.6449,2026-05-05T16:42:33,global,Google Play,0
94861de7-0802-4fce-9770-ff4e8be9e0d8,Victor alberto Montes,1,,no deja aceptar términos y condiciones arreglen la app por favor quiero poder usarla,20.2.0.6076,2026-05-05T16:36:33,global,Google Play,0
a04b5d4b-301c-4e52-8f6e-a576ad67b415,Leonardo Dionizio,1,,"não consigo nem passar da tela dos termos, eu clico e não acontece nada.",26.1.2.6449,2026-05-05T16:33:42,global,Google Play,0
c17b7fed-f563-4898-85e8-61e9c4fec02b,Antonio Osvaldo,5,,isso não abre,26.1.2.6449,2026-05-05T16:19:56,global,Google Play,0
7139caea-d96a-49d3-84c9-bbb7bdb5dd28,Maryeris Lisett Asuaje Herrera,5,,maravilloso 😘,26.0.2.6338,2026-05-05T16:18:33,global,Google Play,0
022c8a65-fc34-41a7-bf5e-b479a53fb898,Sergio Rivolta,1,,"App non funzionante con lultimo aggiornamento, non riesce a tovare la stampante e non permette una nuova configurazione",26.1.2.6449,2026-05-05T16:11:38,global,Google Play,0
32621715-de54-4915-ba08-4c7d85c9e07a,Jason,1,,doesn't work now!!,20.2.0.6076,2026-05-05T16:00:37,global,Google Play,0
2216e2eb-181b-4981-8729-60cb78c81281,Patricia Sánchez Díaz,1,,La aplicación deja mucho que desear. Se queda cargando constantemente y a veces ni se llega a iniciar. Con la nueva actualización no me deja ni aceptar y rechazar las condiciones y no la puedo ni iniciar. Las impresoras dependen de las apps y no funciona bien ninguna. Esto es un servicio DE PAGO (cuando tendría que ser gratuito directamente tras comprar la impresora) y no está a la altura.,20.2.0.6076,2026-05-05T15:50:20,global,Google Play,0
bebf351c-4994-4ebb-8f15-1bcd49a2b832,Thalita Canabrava,1,,"não tô conseguindo acessar a meses, desinstalei e instalei novamente e não consigo nem aceitar os dados e privacidade",20.2.0.6076,2026-05-05T15:39:14,global,Google Play,0
fa1f8548-21eb-4f60-92b7-ff715aeb2cea,So Dly,1,,"mon imprimante HP envy 5531 ne voulant plus scanner, j'ai voulu passer sur l'appli... que j'accepte ou refuse (partiellement) les conditions d'utilisation, l'appli ne s'ouvre pas ! lol....",20.2.0.6076,2026-05-05T15:32:45,global,Google Play,0
63f4a892-cb57-4e9d-ac30-42567a9caac9,Bluecato,1,,Hängt sich ständig auf,20.2.0.6076,2026-05-05T15:22:44,global,Google Play,0
d7e875a9-516e-41db-90ee-32f55d08fd23,Randy S,1,,stopped working for my printer now just prints the protocol text,26.0.2.6338,2026-05-05T15:18:30,global,Google Play,0
92fdbc92-b631-423d-bdac-651ead41ede5,Vivian P,3,,App werkt oke maar kan beter. Hij onthoud de gekozen print instellingen niet waardoor je per afdruk dit moet aanpassen. Ook krijg je de printer via de app niet makkelijk op 'online' terwijl de printer wel stand-by staat en aan zou moeten gaan zodra je wil printen. Ik had wat meer verwacht van HP.,20.2.0.6076,2026-05-05T15:14:08,global,Google Play,0
29dc2f30-fb5e-4360-aa23-97a673b9a9d0,Frieder Seeger,1,,"die App lädt nicht auch nach mehrfachem Neustart, Handy Neustart bringt auch nichts",26.1.2.6449,2026-05-05T14:54:51,global,Google Play,0
24d752fe-104d-47c3-9d50-56aac701f128,Jennifer bendig,1,,wont let me sign in all of a sudden. Gives me an error code of 520- unknown error org aware token failed.,20.2.0.6076,2026-05-05T14:41:39,global,Google Play,0
60df2b43-8869-4fac-baee-75a3760f7260,Nicole Chipman,1,,"the app won't connect to my printer, the website for support is useless, & when you call they want MORE money to assist you! absolutely USELESS!! I never should have bought an HP printer! I'll be disposing of it and buying a Canon after this!!",26.1.2.6449,2026-05-05T14:39:41,global,Google Play,0
60971656-fcc7-4d3f-969d-535f79b8adab,Susana Sanchez,3,,"Lagging. Whatever update was recently done, did not improve. Seems it was smoother before and very convenient.",26.1.2.6449,2026-05-05T14:38:15,global,Google Play,0
76f77b6f-5c11-4d4e-a1d4-82633f3c2cb6,Harold Walma,2,,"app no longer loads. has been completely worthless I would prefer to not need an Internet connection just to print. Everything is on my Local Net, that is all that should be required.🫣🤬",20.2.0.6076,2026-05-05T14:21:45,global,Google Play,0
b401fe59-6b88-4a25-9ba4-eb7b40c5cec4,ssembajjo pius,5,,nice software,20.2.0.6076,2026-05-05T13:58:01,global,Google Play,0
04d6ef21-cb58-4340-97f2-9a619162b84a,S H Lam,2,,"Have been working fine till today when it took 4ever to reach landing pg, then again 4ever to process requested functions. Seems rather uncompatible w newly downloaded Samsung IU software.",,2026-05-05T13:45:13,global,Google Play,0
6e5ec682-aae1-4676-9ccc-3dfd462447a5,Darren Gray,2,,app was working great but now it will not open,26.0.2.6338,2026-05-05T13:42:45,global,Google Play,0
ba000471-8020-4bda-b859-a263f4267ed8,Karsten Tiedemann,1,,"...und lädt...und lädt...und lädt...und öffnet sich nicht. Neuestes Android, neuestes Update. Was für ein Müll.",26.0.2.6338,2026-05-05T13:12:20,global,Google Play,0
746c15a5-6f59-4db8-8615-fb9f93a83b68,Melanie Lüders,2,,"An sich super,leider öffnet sich die App nicht mehr...es ,,arbeitet,, die ganze Zeit der blaue Kreis aber nichts passiert...bitte dringend beheben",26.0.2.6338,2026-05-05T13:11:09,global,Google Play,0
ad48662d-d775-4bd3-a183-c6bd8f6a7744,Maxe Henghuber,1,,"Good approach, but miserable app",20.2.0.6076,2026-05-05T12:58:24,global,Google Play,0
9eb67d72-5c3f-4238-a6dd-18e363456c26,Michael McNulty,1,,"this app never opens up, but I got an email that my bill is past due go-to pay it and they are double-charging me for a late fee.",,2026-05-05T12:23:07,global,Google Play,0
8635a5b1-aa64-4abf-8d6e-5d74b2fce8e1,Resi 1563,1,,Ständig Probleme beim drücken verursacht druckerstau und heute neuen Drucker von hp erhalten das selbe und hp Papier nutze ich hat er das Papier eingezogen wo ich 2 mal den Drucker öffnen musste da das Papier im Drucker festgehangen war und nichts mehr ging,26.0.2.6338,2026-05-05T11:59:54,global,Google Play,14
176dca82-5f3e-4be5-9343-34b7f26014ab,Mole J,2,,"bloated, slow to open if it opens at all the whole hp system sucks. just want a printer to print without jumping through hoops and signing in every other time.",26.0.2.6338,2026-05-05T09:42:43,global,Google Play,0
b53f54e4-7dc2-4246-8a0e-796cb1255fdd,Marco Melodia,1,,"niente imbarazzante, non apre più l applicazione, l unica cosa che mi è rimasta da fare è disinstallare l app... ovviamente una volta fatto e reinstallato è ripartito da 0, ho dovuto fare nuovamente l accesso ( cosa non facile) e OVVIAMENTE ha disconnesso la stampante, che non trovo più nell applicazione... spesa di tempo totale per non avere la stampa, un ora e mezza... gran bel guadagno di tempo grazie",20.2.0.6076,2026-05-05T09:37:32,global,Google Play,0
5ad1fb2e-412e-4e02-aaf5-f34b33eae0ba,solangerocio guerrero,4,,a veces sé tilda pero en líneas generales bien,20.1.0.5822,2026-05-05T09:30:25,global,Google Play,0
e7706e11-d768-4474-ad4e-97d0b4d50b3a,Agnes K.,5,,Bin sehr zufrieden 👍👍 bisher.... mittlerweile funktioniert diese App nicht mehr . 🤡🤡,26.0.2.6338,2026-05-05T08:51:25,global,Google Play,0
0daa522c-445c-4769-afc8-41176abd6b06,Mohammed GHOUINEM,1,,pas satisfait bloqué toujour,,2026-05-05T08:07:30,global,Google Play,0
af9256ee-3596-497a-aa9a-78e90311a133,Vanessa Johanning,1,,Seitdem letzten Update funktioniert die App GAR NICHT MEHR! Ich kann nichts mehr drucken. Dauerladekreis und nichts passiert.,26.0.2.6338,2026-05-05T08:06:08,global,Google Play,0
b27490a6-9c8b-4f7a-bd86-c2cc79327a95,maurizio,5,,Magnificamente ottima,,2026-05-05T07:01:32,global,Google Play,0
a78aca1f-0e5a-4112-8d00-d96dfa6ad54b,Anne Brossard,1,,"bug tout le temps, très long à utiliser et plein de fonctionnalités ne marchent pas",20.2.0.6076,2026-05-05T06:19:11,global,Google Play,0
d5c64c0a-1aef-4440-bea4-0079e348cd9e,Vivian Jessica Elliger,1,,Die app öffnet nicht mal mehr auf mein handy also werde ich mir einen neuen Drucker kaufen und das aufjedenfall nicht von hp,26.0.2.6338,2026-05-05T06:08:32,global,Google Play,0
cb299c20-93ad-499e-b500-d8416a594d79,Matthew Szocka,1,,extremely non user friendly and makes the printer unusable,20.2.0.6076,2026-05-05T02:17:47,global,Google Play,0
c950091e-dcc1-41b9-b99b-a04e409a0ce5,Lenora Shorts,5,,good 👍,20.2.0.6076,2026-05-05T01:22:30,global,Google Play,0
3b230606-c556-4919-906c-25e285c99de6,VSyync,1,,"awful app, so slow lol.i have to use my pc or laptop just to print pictures... terribly slow arse app. one more thing what are these botted reviews LMAO",26.0.2.6338,2026-05-05T00:40:45,global,Google Play,0
8e542856-2f78-46a6-bddc-7306ba78792f,mkrdiir,1,,Cannot use the printer through the app without needing to create an HP account.,26.1.2.6449,2026-05-05T00:32:32,global,Google Play,0
7290f055-957a-4348-9f69-89a341dab47d,Benito Alberto Aburto Gonzalez,5,,buena app pero se daño,26.0.2.6338,2026-05-05T00:04:34,global,Google Play,0
764560f6-47f8-4fbc-aad0-33d14b84617c,Kristy Harmor,5,,Love it 😍,26.0.2.6338,2026-05-04T23:16:14,global,Google Play,0
8ee276fe-04f9-41e5-9777-23a8203a423c,Opal Elgin,3,,"update is failing Every time I open the app to do anything like scan a page it will not perform or load. There is a spinning blue load type sign that just sits and spins. I tried accessing through the plugins portion but it has the same problem. Normally I love this app for all my office management requirements like print, scan, fax from anywhere.",26.0.2.6338,2026-05-04T23:01:25,global,Google Play,0
2b5d82e8-0bc4-42e9-ac5c-8f1a3f9bb207,Fabry sere,1,,com'è possibile che non riconosce più la rete wifi? prima funziona adesso non mi trova più la stampante.risolvete!!!!,20.2.0.6076,2026-05-04T22:50:18,global,Google Play,0
efbdea71-76ad-41b1-931a-3f2c630de12a,Randy Wisneski,1,,doesn't work . just a grey screen,20.2.0.6076,2026-05-04T19:41:53,global,Google Play,0
a35c44d9-d777-4abf-ad3d-00bfbd5a3db4,Noémie Dugay,2,,"appli qui ne démarre pas, je ne sais pas quoi faire...",26.0.0.6234,2026-05-04T19:28:50,global,Google Play,0
a08e1603-c348-4ebb-bcb9-7fe033b7cec2,Tiffany Warman,1,,"My printer is fine, it works great via computer. THIS app though? Trash. App does one of 3 things: -freezes entirely - does nothing goes back to the landing page - says connection error and limited options and can't determine the paper, without saying what the connection error is. Roll the app back a year and it worked just fine without this runaround bullhonkey. update: now that the above problem was sorta fixed, every time I go to adjust a photo before printing, it turns it black & white.",26.0.2.6338,2026-05-04T17:35:57,global,Google Play,20
9003e6b4-e815-4472-8474-1b7fcc04362e,Rose Harrell,1,,HP are crooks I ordered ink from insta ink and paused my subscription because of financial reasons and they blocked the use of the ink!!!! they have technology in the cartridges that blocks you in so done. I will never by anything HP againin life,,2026-05-04T17:03:20,global,Google Play,0
25a22dac-36c9-40e6-bb58-5f839f5288fd,SharpBlade,3,,"funciona muy mal. En determinadas circunstancias el programa no carga, o no reconoce la impresora. Es inestable. Genera mucha frustración ya que es la única app que te permite utilizar el escáner físico de las HPs",17.15.0.4720,2026-05-04T16:14:50,global,Google Play,0
4012e396-5c93-480c-95c6-0c97aef6581b,veronique eng,1,,Jusqu'à aujourd'hui rien à redire contente mais là j'ouvre l'application et c'est blanc,26.0.2.6338,2026-05-04T15:36:39,global,Google Play,0
b5169679-6fcc-4abc-9b41-24e03541df07,Vanice Soriano,2,,"não consigo abrir o app ,fica girando e não entra",26.0.2.6338,2026-05-04T15:20:49,global,Google Play,0
d5f43dac-e1d5-4c45-99fa-5630438a4083,Osvaldir José,1,,"Péssimo! Nada intuitivo, para fazer 4 fotos em uma só folha de papel de foto tem que fazer um curso extensivo para conseguir.",20.2.0.6076,2026-05-04T15:06:18,global,Google Play,0
a6b2c6e2-b934-4074-a8c1-3fef4442dbed,Mate,1,,32€al mese di abbonamento e l'app non si carica nemmeno.,26.0.2.6338,2026-05-04T14:23:36,global,Google Play,0
085d00d2-4dfa-425e-8cd9-5f893c7f4326,Amjad Abdul ghani,5,,Goood,18.10.0.5530,2026-05-04T14:01:34,global,Google Play,0
6b2f5fc3-349d-45f4-aa44-4252b7b046a7,mj capp,1,,"Would leave zero stars if able. Won't connect to internet. Customer service won't do anything to resolve, just transfer 7x repeating same thing that doesn't work now ignoring me and not fixing it. I need a technician. Also shipped me faulty ink cartridges with their auto refill service. Going in trash & never buying hp again, trash service and products.",20.2.0.6076,2026-05-04T13:48:37,global,Google Play,0
329763e5-9d2f-4b83-a8c8-1f40499d6d77,Um usuário do Google,2,,"No início entrava super rápido. Agora, quando preciso abrir o app , fica rodando a vida toda e não abre.",26.0.2.6338,2026-05-04T13:31:56,global,Google Play,0
7facef6b-65e4-41e9-bbfa-68d242912991,maurizia mussato,1,,"Cartucce piene messe, l'app segnala quella a colori quasi vuota! Per poter vedere la stima giusta, devo disinstallare e reinstallare l'app, complimenti a quei geni che hanno progettato quest'app!!",26.1.2.6449,2026-05-04T12:42:46,global,Google Play,1
b9d97956-e6cc-4a5f-af77-468a67608132,Gabriel Casas,1,,"Over 30 years ago, all I had to do was plug my printer in and press a button. 30 years later, I need to create an account, to share my personal data, to download an app, just to end up with an error message when trying to print or scan.",17.35.0.5115,2026-05-04T11:17:18,global,Google Play,0
611db7bd-bf28-40ff-ab71-1aea972e4bd1,D R Given,1,,"Does not open, goes to blank screen.",20.2.0.6076,2026-05-04T11:00:57,global,Google Play,0
f4364f69-48d8-45a4-adc8-e02f18f60d8c,Martin J,3,,Ganska seg och långsam app. Finns förbättringspotenrial.,26.0.2.6338,2026-05-04T10:27:44,global,Google Play,0
