id,author,rating,title,content,version,date,country,platform,vote_count
6a9fb6d5-83ee-424d-927a-7b9e8b1fb409,Charlie Harrison,1,,My printer was not listed as being one I wanted to add the app to!,20.2.0.6076,2026-02-26T16:00:39,us,Google Play,0
5549ace4-76fc-4005-b127-f97848918636,Krish Gupta,1,,rubbish app,,2026-02-26T14:09:58,us,Google Play,0
bc172213-1389-4e27-8fc7-ecf82d9ceb21,Alan H,1,,Kept loading on the main screen with the blue ring. Waste of time. previous version was easier to use. Now it is just pure rubbish!,26.0.0.6234,2026-02-26T14:03:02,us,Google Play,0
8a6b6302-745d-4f01-a378-905e0873fa76,Ashley N,1,,my printer is saying it not connected but it is. unable to troubleshoot,26.0.0.6234,2026-02-26T13:26:21,us,Google Play,0
3b876628-b20e-4cce-abda-8f911d6f6cbf,Relyn Jungco,1,,using mobile I can't connect to printer. it always say connected but no internet,26.0.0.6234,2026-02-26T13:01:27,us,Google Play,0
2a558f34-ce9f-4919-882b-03d622d10daf,Sukhwinder Singh,4,,very nice,20.2.0.6076,2026-02-26T10:13:13,us,Google Play,0
0cf6ceb3-d68b-40fc-956f-e2eb23e5bdeb,Jeremiah Newland,5,,HP keeps me moving allowing me to do so much from my mobile device.,20.2.0.6076,2026-02-26T10:07:59,us,Google Play,0
40673f6d-cb24-4e49-a8be-f52c985bd8db,Marcellius Bonar,1,,"not support for direct USB printing,so dissapointed!!",,2026-02-26T09:40:40,us,Google Play,0
dab3513f-f489-4d21-9743-ba6649b5f146,Bret Martin,1,,This app is terrible I cant even get it to load anymore would give no stars if I could pretty much in agreement your products are gettibgnworse abs this app is atrocious,26.0.0.6234,2026-02-26T07:58:31,us,Google Play,0
f12d4907-e519-482b-a22c-9cc8792a8a8b,Technical Stars,1,,very bad interface lag and non coperative,26.0.0.6234,2026-02-26T05:38:52,us,Google Play,0
47abdc1c-86ca-4fdd-9eb5-c16016ca21c0,Alan Andreasen,1,,Must sign in to print! I'm not creating another login and password just to print one page. HP SMART was a much better app and you didn't need an HP account to use it. Do yourself a favor and throw away all your HP (printer) products.,,2026-02-26T04:37:56,us,Google Play,0
8ba83867-854f-4212-a24a-b63c9d49a8aa,Trash Boii,1,,"Garbage fire service and garbage fire printers. Not only does the app not properly track your ink levels but when you try to print anything at all it forces you to go through a SERVER that then sends it to your printer. If that server is down, good luck printing! The app constantly disconnects from printers and customer support is worthless! I have been fighting my printer for 3 years and today I smashed it on the ground after 5 errors. Do not use HP printers. Get a refund.",17.35.0.5115,2026-02-26T02:52:30,us,Google Play,0
fbcfc1da-24ea-404a-bcfd-ebd86fe31b8d,X,1,,"This app sucks, spent all day on it and still can't figure it out.",20.2.0.6076,2026-02-26T00:00:00,us,Google Play,0
cac9c02a-c6ac-4d61-9dc2-64d0bfdaab28,Monica Broughan,1,,this app no longer works,26.0.0.6234,2026-02-25T21:20:57,us,Google Play,0
ad2ee11c-e706-4a78-81d8-3b8678b921df,Pedro Dominguez,4,,very good printer,20.2.0.6076,2026-02-25T20:36:40,us,Google Play,0
7394ff96-1b9d-4f63-91d0-1d82ffb44b5c,James Lee,1,,The app updates don't work for all printers and it essentially locks people out from accessing their printer. there needs to be the same functionality on desktop.,26.0.0.6234,2026-02-25T19:59:09,us,Google Play,0
e287332a-fce9-4d2a-82c8-591a6ae4e5a3,P K,1,,Couldn't get the app to open.,,2026-02-25T19:34:38,us,Google Play,0
b4f01903-cd53-437a-827d-ab96f085ad10,Sandra Stevens,1,,App does not open.,26.0.0.6234,2026-02-25T19:28:09,us,Google Play,0
9b86fa4d-831a-4a7b-961b-94df13a169ad,Ben Legge,1,,only prints pdfs and images.,20.2.0.6076,2026-02-25T18:33:04,us,Google Play,0
5edcb49d-1d06-4542-a739-7fbe61424dc4,Genniene Widiger,1,,I don't know what happened but I can't use my printer anymore. The app looks totally different and I can't print anything. When I go into the app it is a white screen and nothing appears. I am incredibly frustrated because I have never had any issues until now. I need my printer to work because I use it alot,26.0.0.6234,2026-02-25T17:55:32,us,Google Play,1
d32ffb86-d015-4289-865e-ededa2df01d8,Carl davis,1,,"Lately app is never consistent upon opening and or staying signed in, seems to happen way to often to have confidence in opening this app !!",26.0.0.6234,2026-02-25T17:42:50,us,Google Play,56
3a1855a3-27fe-4f0e-bb9f-9bc819e4b97d,Nikey,1,,not helpfull,26.0.0.6234,2026-02-25T17:42:22,us,Google Play,0
8f4157c5-4c95-47e3-af21-a8b4ec10a92e,Joanna Polok,4,,"Delighted with this printer and not having to order ink yourself is great. The printer ink levels are sent to HP and they contact us when the levels are low. Payment is not taken until we have been asked whether we want to order at the time. Never having ""printer ink low"" when you need something printed quickly.",20.2.0.6076,2026-02-25T17:04:24,us,Google Play,0
3d41ab13-ea58-4188-8407-ca2ed48eb204,Elena,1,,I changed my internet provider and can't even find how to change the wifi network on my Tango printer on my desktop. so complicated.,,2026-02-25T16:54:11,us,Google Play,0
5e548547-129f-4843-8e9b-e5cdfc5787d3,Stephanie C.,5,,lifesaver,26.0.0.6234,2026-02-25T16:03:33,us,Google Play,0
99efa3ca-9cfd-4fac-807a-3dacaf150137,gravityTattdrumr11,3,,"app won't load up to print my shipping labels on time,",26.0.0.6234,2026-02-25T14:02:09,us,Google Play,0
808d42f8-a33d-4aae-ac4b-45a5cdd0b43d,Ashley Harrison,3,,This app is super slow and laggey,,2026-02-25T13:26:52,us,Google Play,0
2c4fdf00-2bad-4899-9f5d-77c6c736f13c,Ayasha Hollinshed,1,,Can't even get to the main screen. Just loading.,,2026-02-25T13:04:59,us,Google Play,1
ad8fcaa6-661c-4db7-80a9-645694e77225,Rahman Kamal,1,,Tidak boleh bersambug dengan printer,20.2.0.6076,2026-02-25T12:22:19,us,Google Play,0
0d96d606-4f00-40cd-b4b0-7bc2944f5ad4,Simon Ses,1,,have hp 2700 and both the printer and app are abysmall working when they find it fit. never again hp,26.0.0.6234,2026-02-25T12:20:27,us,Google Play,0
4f45ba6f-a9fb-410a-9627-cd1e52289932,Umar muniyon,1,,worst one.. why I go with HP..,26.0.0.6234,2026-02-25T11:14:00,us,Google Play,0
ed7071fb-5fe0-4149-8523-119d7eb26e2c,Yanko Greshkov,1,,"Words cannot describe how bad this is. I really enjoy not being able to just turn it on, connect it. and then print. I love having to make an account and manually set up a new printer every time I need something done and then manually entering my Wi-Fi password. I love the blinking of the Wi-fi icon only to tell me the printer cannot be added, but it's clearly recognised by the app. Just love it. I love selling my data, I love making new accounts, I love having to take me half an hour to print.",20.2.0.6076,2026-02-25T10:12:27,us,Google Play,0
71d99992-f4f8-4ae6-a6b3-8648df1863e9,James Truesdale,1,,Can't add printer.,26.0.0.6234,2026-02-25T09:52:40,us,Google Play,0
ee159f1c-73d4-40d1-a095-577f77d87528,Abdul Rahim Hassan,5,,Is so happy,26.0.0.6234,2026-02-25T08:57:02,us,Google Play,0
288dd646-8707-4993-badd-1213ff6eae2b,Jenny Pilotti,1,,difficult to understand instructions,,2026-02-25T06:11:46,us,Google Play,0
be709de1-f1d7-4132-a9b9-9848c96fece5,Kirk,1,,Why do I have to sign in just to scan a document,20.2.0.6076,2026-02-25T05:16:02,us,Google Play,0
79cb5d5e-32a7-465b-ba5b-645da26e205e,Benny Canez,5,,so easy to connect with my printer,20.2.0.6076,2026-02-25T04:13:08,us,Google Play,0
582fd1d6-a479-4056-9d50-857059cf5085,Erik N,1,,"Absolute trash after the update. I open the app as it loads the spinning blue wheel of death. Clear the cache, blue wheel of death. Uninstall and reinstall, blue wheel of death still",26.0.0.6234,2026-02-25T02:56:20,us,Google Play,1
c0b59ec8-0b8c-4545-a832-fea0c3a02e5b,Fernando Rincon,5,,excellent printer. I recommend for people who like to print pictures and documents. .,26.0.0.6234,2026-02-25T01:19:43,us,Google Play,0
9815f3cc-ef13-413b-816f-3daa7464f895,Emma Sandoval,1,,"worst printers ever can't print without logging into the app, but the app doesn't work, so this renders the printer unless unless you are scanning something.",,2026-02-25T01:09:04,us,Google Play,0
cd75b8b2-a118-41e2-b0eb-27fe203fc7fe,Jenni Burlison,1,,Got a new internet provider now printer won't connect to wifi and tried loads of things but it's not coming on just blue wifi light flashing,20.2.0.6076,2026-02-24T23:59:26,us,Google Play,0
73fbb6b6-a154-453e-bbb6-561e7248c1f1,Kate Milic,1,,"this app is trash. can't scan, don't bother",26.0.0.6234,2026-02-24T23:02:30,us,Google Play,0
1c379151-a431-4fe2-8874-24fd37da87a7,David Eads,1,,I'm using an android phone I may need to buy a computer to be able to update firmware.,20.2.0.6076,2026-02-24T21:54:35,us,Google Play,0
bf5074eb-520a-4b84-b9c4-7f32cf8fa7c1,Ashley Ekusaten,1,,"More intrusive screens get added. We used to be able to get to scanning with one tap, now there's screens to navigate and more loading... This app was absolutely broken for no reason. Also, seriously, 1GB? What a nightmare.",26.0.0.6234,2026-02-24T21:13:13,us,Google Play,1
0d69ee9a-ad74-400f-b3b8-9e25bcb9a6c0,Joy Brown,5,,it's great,26.0.0.6234,2026-02-24T20:54:56,us,Google Play,0
ace21fe5-96c0-4b10-8a68-e228363ba3e4,Katrine Gorissen,1,,"Doesn't work, won't connect to printer. useless ap",20.2.0.6076,2026-02-24T18:33:01,us,Google Play,0
95183afe-a8e7-4e10-8194-015a886f5017,Gail Mankovska,2,,Always problems with the Internet connection and printing itself!,26.0.0.6234,2026-02-24T17:56:09,us,Google Play,0
f36aa777-c1e7-46fd-8225-7b330a1bd433,Jarrod Tracy,1,,app will not open now what so Frustrating,,2026-02-24T17:30:47,us,Google Play,0
0368e1b0-1d49-4a9b-b565-0f034b5b8dd1,John Doe,1,,doesn't work cant attach anything to it,20.2.0.6076,2026-02-24T16:30:44,us,Google Play,0
8dc7abcd-04ad-4024-b0e2-f75c4a48e976,Bhavna Khoody,1,,app not opening,26.0.0.6234,2026-02-24T07:34:23,us,Google Play,0
267feabd-ce5d-4cb7-9126-39b78618a9bc,ganojee venkatesh,5,,good,20.2.0.6076,2026-02-24T06:25:33,us,Google Play,0
945272c5-fb06-4d80-91fb-b9e76acd89a6,Bhavik Nakrani,1,,always gets signed out and every time ask for sign in. it's frustrating. old app was better to keep sign in always.,,2026-02-24T05:39:26,us,Google Play,0
1da0348d-f201-4d2f-9823-1a77d9b0cd9b,Zelda,5,,Amazing! Being able to scan from my 🤳🏽 prepare photos to PDFs total game changer😍,26.0.0.6234,2026-02-24T05:14:37,us,Google Play,0
b0bd1d1b-1438-47af-a7a3-42774fbcfc3c,Anshu,1,,very bad aap hp is not good 😡😡😡😡,,2026-02-24T05:04:54,us,Google Play,0
69a53bf5-5d6c-4ffc-91f6-7ba6f96e3e27,romzi ismail,5,,get my things done,20.2.0.6076,2026-02-24T04:07:04,us,Google Play,0
1966a4e1-62d6-4616-bea1-3326b5823890,JJ Romano,1,,"Tons of quirks and connection problems. Among the worst apps I am stuck using and updates over years never fix it...computer, tablet, phone or different router all fail more than work.",26.0.0.6234,2026-02-24T02:00:04,us,Google Play,1
3d8c30fb-54de-4fb3-89d5-1c350d99c99e,Mike Bullard,1,,Dud. wanted time accomplishing nothing. my new HP printer not found,20.2.0.6076,2026-02-23T21:37:56,us,Google Play,0
41ff038f-1717-489b-bbf9-80d9e823f2d9,Zury Rodriguez,1,,i love this! BUT lately the app has been lagging. I have to delete the app then download it again just to be able to use the app!!,,2026-02-23T20:43:59,us,Google Play,0
bd23aacd-8698-43cc-88d8-6ce871b969fe,Local Midlander,1,,"SCAMMM I have maybe printed 20 B&W pages since purchase in Dec 2024 and i am being charged monthly for ink and paper, told how many pages i can print. i tried to cancel my plan and it informed me i would get charged one more time on September 22. i have been sent replacement cartridges but never finished the first ones. do not need any more paper. if you can monitor how many pages i print then you know i do not need more. and i cannot use what i already payed for if i cancel and have to return?",26.0.0.6234,2026-02-23T20:39:41,us,Google Play,0
faacab80-d639-47f6-a4d3-487dabbe8fdd,RiKki,1,,"Cant even print using phone. low tech, dissapointing",20.2.0.6076,2026-02-23T18:49:17,us,Google Play,0
2e946767-ebf3-421f-b47c-ffa378bd68f1,Brenda French,1,,it sucks I can't go anything,,2026-02-23T17:41:36,us,Google Play,0
2df88961-98d1-462f-8ffe-04d43520b6d9,Christopher Norris,1,,This is the worst app I have ever had and bloody Disgusting Service. And it is a Charge for using,4.6.107,2026-02-23T15:27:46,us,Google Play,0
89dc0f9f-c9b7-4b79-9c71-7cceb7c7d473,Rachel Fryberger,5,,I thought I was going to have such a hard time figuring out how to scan to my phone. But it was super simple and I'm very pleased!,20.2.0.6076,2026-02-23T14:32:21,us,Google Play,0
4971ffe1-50f0-4eef-8f4a-c9e092e49ec4,ಸಂಪತ್ ಎಂ (ಕೋಲಾರ),5,,Super 👌,20.2.0.6076,2026-02-23T11:36:52,us,Google Play,0
ff3930d3-c5b3-473f-a117-22160a0b2b67,Travis Duncan,1,,"I wish I knew what a scam the Hp Deskjet 2755e would be. you buy a printer but have to pay per print via ""insta ink"". Then the printer doesn't work for one reason or another. Hp Blames Insta Ink, Insta Ink blames my computer or Internet provider. Also watch ur account they double and triple charge like dirt bags. Otherr than this it is a great product! 👏",20.2.0.6076,2026-02-23T11:34:44,us,Google Play,0
3333db0b-db38-43b8-a7c3-b0d70dfce5df,Chris Wilson,1,,app not working since update,26.0.0.6234,2026-02-23T10:10:30,us,Google Play,0
e4bdebac-8ccf-456d-8e09-fa36822eabe8,Marius Menne,2,,"why do I need to install 2 separate, bloated apps, just to print a basic document from my android phone?",,2026-02-23T01:08:46,us,Google Play,0
209b7ad6-f840-475d-96e1-141ce42c2f5f,MannyKunV,1,,"the app somehow caused Bluetooth on my phone to completely stop working. it won't stay on or off and keeps telling me ""Bluetooth keeps stopping"". Even when I uninstalled this HP app and restarted my phone I still have the same problem.",9.4.1.3,2026-02-23T00:17:47,us,Google Play,0
e3b56b0a-b413-4da8-ba55-9c816d96e9c3,Robert T,1,,Everything about the printer and the company that makes it is garbage.,16.5.1.4270,2026-02-22T23:34:05,us,Google Play,0
9fd19c4b-a474-4746-8e32-5317845cd163,John Peirce,1,,never works. always fails. now I am printing to pdf and emailing myself.,20.2.0.6076,2026-02-22T23:27:56,us,Google Play,0
a44e8957-aa2a-42e2-893c-ec9f7961fb6b,Miss Bobbie,1,,I finally used this printer no more than 20 times now keep showing an E on the screen there is no paper jammed in it whatsoever it is not even a year old,26.0.0.6234,2026-02-22T23:25:33,us,Google Play,0
e81330e3-f566-4acc-b647-aa3b724cfc60,Roi Alexis Florentino,1,,took me 1 hour to scan 1 file with this app,,2026-02-22T23:23:53,us,Google Play,0
809f4a40-775e-4b08-9b84-3fe7e39f42aa,Sab Lued,1,,didn't have the printer I just bought from store. its a 2852e,18.10.0.5530,2026-02-22T23:15:57,us,Google Play,0
823fea4b-ac5d-47ab-aae9-f97745114ea1,Alphy Vee,5,,cool,20.2.0.6076,2026-02-22T22:54:00,us,Google Play,0
6f9316b6-7492-4659-971a-e94f7620c90a,carguy1949,1,,not compatible with Chromebook,18.10.0.5530,2026-02-22T22:53:24,us,Google Play,0
8725b548-67b6-4b70-904e-4dcd6f53eff1,Bart P.,1,,barely ever works,20.2.0.6076,2026-02-22T22:29:14,us,Google Play,0
6eb55206-a221-4023-9f85-cbcd59b52498,linda cothron,4,,can't find website,20.2.0.6076,2026-02-22T21:36:43,us,Google Play,0
18f95adb-3559-4a8a-827e-49e3a7972575,Mikaela gonzales,5,,I love this app,,2026-02-22T20:45:03,us,Google Play,0
18c2096b-30bc-485b-9e04-2420773ad5ba,Linda Robertson,1,,this will not connect to my printer,20.2.0.6076,2026-02-22T20:31:04,us,Google Play,0
e0c02eee-bd78-462b-9376-f93b35587d27,A .s salvi,5,,there is still bugs and new features and add ai in the app it is needed,20.2.0.6076,2026-02-22T19:09:57,us,Google Play,0
43d2d7e1-b4b5-4997-8575-33ce72eeed61,Sherry Naylor,5,,Great for my home office wireless printer. I also subscribe to get the ink replacement plan.,26.0.0.6234,2026-02-22T18:08:03,us,Google Play,0
6ff6787b-5f96-46cd-b6f7-09aeb6c5361f,kevin quilter,2,,does not start blank screen with spinning circle honestly I think this the WORST app I have on my phone won't buy anymore HP printer 🙃,,2026-02-22T17:19:41,us,Google Play,0
6e6e60cf-ea71-4822-b9e1-1e694db67d01,Travis Carlson,1,,hp should be absolutely embarrassed by the quality of their print software. complete garbage 10/ would rather buy something off ali express,20.2.0.6076,2026-02-22T17:02:59,us,Google Play,0
fd4e6e6c-db36-464e-9f53-6e916008a067,Mich Rich,1,,the worst app I've ever tried to use . not smooth sluggish. when tring to log in it won't and when sending a pass code . and you've put the right code in it won't let you confirm it . all im trying to do is set up insta ink . absolute nightmare,20.2.0.6076,2026-02-22T16:52:37,us,Google Play,0
6df7c0fe-34d1-4804-ae75-8b22dee22998,Jason F Lunn,1,,"This app is constatly glitchy, noww last two days it is conpletly down and not working. i am pissed because I have insta ink and without the app, the printer is useful. This will now impact my business. great job HP. its been a problem from day one. the printer is sweet, the must use service and app, is horrible. fix it immediately!!",26.0.0.6234,2026-02-22T16:00:59,us,Google Play,0
640dbef3-d972-43ad-9afd-292f7033377b,Roger & Anne Lamontagne,1,,"2nd HP printer i tried installing with the App, and still can't finish installing always get message (that can't complete install)[",,2026-02-22T15:30:51,us,Google Play,0
d18342a7-1996-41be-bb90-badb6e26cc6f,Mitchell Morgan,1,,Disappointed,20.2.0.6076,2026-02-22T14:44:41,us,Google Play,0
84332b82-cb37-499f-b06d-051e59fe06b1,Guy Rendell,1,,"App and various ecosystems don't work. Can't register for HP Smart+, can't finish setup, can't automatically update printer choice between platforms (Windows, Android, iOS etc)",20.2.0.6076,2026-02-22T14:38:04,us,Google Play,0
9c14d8b6-f1d3-4ae3-9789-3d4ff34bbfb3,Greg,1,,"Will never buy another Hp product as long as I live ...I live out in the bush and have only just brought this printer..since the last update,now no wifi available.... absolute terrible business and for hp to allow this to happen at this day age ..is disspicable...all the NEGATIVE REVIEWS SAY IT ALL .....Not one response to any off the negative reviews on here say it all .there a Multi million dollar company and they don't have to reply to anyone under them . replacing with another brand...",20.2.0.6076,2026-02-22T13:36:35,us,Google Play,0
80460d1d-6be4-439b-ac4d-936a48aedf2c,Monica Whittaker,1,,App not working. used both laptop and my phone and still not working. I hollowed every single step and it's not working!,,2026-02-22T12:55:46,us,Google Play,0
6a808702-fd09-4264-903e-358d03831654,Chanc Gettel,1,,HP makes the WORST printers on the market. I dread everytime I have to print something I instantly get angry knowing it'll take me a good thirty minutes to get your hunk of junk printers working. Shameful,20.1.2.5988,2026-02-22T12:44:31,us,Google Play,0
28557a13-015e-4ff5-9dc3-8de85e1c91df,Potyrzak,1,,doesn't even work,,2026-02-22T12:31:49,us,Google Play,0
2ba54e4a-0e8a-4cf9-bb0e-0a187d637d7e,Miki Yemane,5,,i can print some one,20.2.0.6076,2026-02-22T11:30:45,us,Google Play,0
21a535cb-29cb-4e59-8911-44270f935271,Mpho MASAKONA,1,,"I regret to buy this printer , it is useless ,I wasted two days trying to connect even now m still fighting ,if you're thinking about buying Hp 2320 please think twice, actually don't",,2026-02-22T10:58:20,us,Google Play,0
81b1dd35-7db5-4393-ad7d-7b26ca647515,Vaideeswari Karthick,1,,unable to sign in,20.2.0.6076,2026-02-22T09:20:27,us,Google Play,0
31efbad5-3028-41dc-bd01-903151dd1d6c,Sai Kriti Vurimalla,1,,"absolutely horrible app and printer stops working in the middle of a page being printed, doesn't accept paper n then PRINTS ON AIR 😍 sometimes it's all smooth no problems n sometimes I have to js call it quits n give myself a break",20.2.0.6076,2026-02-22T08:02:37,us,Google Play,0
821341eb-371c-484c-a879-dc9f2c209f44,Kaustubh Jaiswal,1,,"Terrible experience, deserves less than a star. Doesn't mention the errors transparently, user gets stuck with no idea.",,2026-02-22T06:39:42,us,Google Play,0
682a39b6-930c-49a0-95ff-2a768e782b1c,Anton Mamichev,1,,"so, previous version worked perfectly well, and then they redesigned it with all the pretentious words in the description. and it doesn't work. that's common with hp - constantly ruining network functionality. not a single printer works, I can never rely on apps like this - this is awful practice and hateful customer experience.",20.2.0.6076,2026-02-22T04:59:31,us,Google Play,1
a152026a-592f-4853-ba88-ed93642cc327,Ali Rajab,1,,I want to start a genocide after trying to connect to this printer.,20.2.0.6076,2026-02-21T23:28:53,us,Google Play,1
1a4ffaa8-1343-4567-b0a6-4d8e510290de,Colleen Campbell,1,,Worst printing experience ever,20.2.0.6076,2026-02-21T22:30:15,us,Google Play,1
6ceaa558-d182-4d09-b8a9-6d46fa69e566,Dale Mock,2,,"very confusing not user friendly,",26.0.0.6234,2026-02-21T22:21:43,us,Google Play,1
ed7d0548-e199-42f8-95e5-b7fa9a9272e5,Paramjit Bhamra,1,,"printing is so slow now, takes ages to start printing. bought a brother printer, miles better",,2026-02-21T21:28:23,us,Google Play,0
a9f0e73d-8765-4513-ab3d-baa3ef84fe13,Keyvan Malaie,1,,often disconnects from your phone and plays with your nerves,26.0.0.6234,2026-02-21T20:23:14,us,Google Play,1
7ec62193-2c59-4c9a-9da4-6fc25ff4991c,Miranda Dockett,1,,Not compatible with Chromebook.,,2026-02-21T19:31:47,us,Google Play,0
fa61e224-2fa6-4f0d-9bba-8cb214cef6d8,Austin Brown,1,,I don't want to create an account just to print also it just doesn't work at all,20.2.0.6076,2026-02-21T19:28:06,us,Google Play,1
888b1da2-fad5-4e25-af84-c196fedda331,Matthew Carr,4,,Software setup has never worked to get the PC functionality. Still can't scan with it but can with Microsoft scan. Don't know why. At least I can scan with the phone.,20.2.0.6076,2026-02-21T19:05:08,us,Google Play,0
23b985fe-064c-4bb8-9ae0-8f299cb0371f,Sadie Horton,1,,"Don't buy an HP printer. Randomly disconnected from my computer and nothing helps, even HP support rather put the blame on my Internet rather than fix the problem. The app literally doesn't work at all. Removing and adding the printer doesn't help. A huge waste of money. and now I have a clunky printer that I don't know what to do with.",20.2.0.6076,2026-02-21T18:05:11,us,Google Play,1
e6d3c1e7-5a5d-496b-a38c-e122c1784fa5,Deborah Summerford,1,,my printer don't work properly it jams a lot,20.2.0.6076,2026-02-21T17:22:40,us,Google Play,0
0a3c64e1-ffb5-4e28-a82b-496b747b082d,Jumping Jupiter,1,,I shouldnt have to pay for a subscription to use my own printer. Such a time waster. Very disappointed! The scan app doesn't work. It just freezes. Is there a way to simply use this printer with direct connection to one's computer?,17.20.0.4770,2026-02-21T16:25:27,us,Google Play,16
4dcdb1a1-b2a8-4e43-9b18-3ad40988db75,Anonymous Forward,1,,takes the rip at loading and keeps asking for pin for printer even when your type pin in .ask over and over again. doesn't even load properly,26.0.0.6234,2026-02-21T15:27:43,us,Google Play,0
bf4e4430-0cc1-4e6e-9e9e-07c31624e82c,rakesh singh Saini,1,,Not good,20.2.0.6076,2026-02-21T10:34:27,us,Google Play,0
6922cb5c-dfd6-47fd-bd75-1fa6dd2dcb8c,audilon k,1,,just bad..,18.10.0.5530,2026-02-21T07:15:25,us,Google Play,0
d4ee892d-50f9-4b9b-8f9b-0dd94eab3ba3,Liam Krueger,1,,"As usual with HP, nightmare trying to set up WiFi. Phone and computer on same 2.4G network, initially neither could detect printer, however after factory resetting the printer the desktop could see it but mobile still couldn't.",26.0.0.6234,2026-02-21T06:32:28,us,Google Play,0
98c2098f-69f7-4101-a495-68c1218b7a86,Janice Brown,5,,This is great!,20.2.0.6076,2026-02-21T04:12:35,us,Google Play,0
3c48ebb3-1afa-45bf-97d9-c7fd410b4417,Michael Chael,1,,need urgent for scan but the app only showed the blank screen,26.0.0.6234,2026-02-21T03:55:37,us,Google Play,0
ae4fe9de-f938-4d5e-a926-4dfd00d7206d,Ashar Kazmi,1,,Worst! It's just stuck right after installing.,26.0.0.6234,2026-02-21T03:55:29,us,Google Play,0
4ea6757e-5737-4f7c-a0f4-32929a240fcf,Wendy Dodge,1,,I have to keep uninstalling to use it.,26.0.0.6234,2026-02-20T22:48:54,us,Google Play,0
227fc164-5f13-4a7f-b1be-17427d56bc83,LLoyd. Plywood,1,,Never finished installing. would not open. So I must go with one star.,,2026-02-20T21:37:58,us,Google Play,0
36c975d7-7ab6-4544-a043-a26fe3e1bbab,Gene Marsh,1,,summaries on this is not hooking to my printer at all,26.0.0.6234,2026-02-20T20:29:52,us,Google Play,0
3f875276-5baa-4c77-a7da-00a1cc0a241d,Arijeet Paul,1,,very bad app,,2026-02-20T19:16:23,us,Google Play,0
8e208550-05df-43bf-ba03-b51a5f22ee50,Muhammad Ahmad (Ahmad),1,,"It scan just 1 time after that I have to clear data and re-log in and do scan again for just 1 time and repeat process every time for 1 single scan, on second scan it just says scan unsuccessful. kindly resolve this issue!",20.2.0.6076,2026-02-20T17:49:08,us,Google Play,0
0e1b244e-9571-4e2b-99e3-632ac233a9d0,Frank Cottrell,1,,I cant enroll my new printer,20.2.0.6076,2026-02-20T17:05:50,us,Google Play,0
48f47065-0ca2-4681-b009-0713375f7912,Curtis Brown,3,,sometime it jams,18.10.0.5530,2026-02-20T15:00:17,us,Google Play,0
2b832468-c0c5-40fe-95ed-baf75eaa29b2,Berhanu Abebe,1,,hp getting worst and worst I will never buy hp again,20.2.0.6076,2026-02-20T14:02:45,us,Google Play,0
7ba04166-9816-45f1-8f7b-a700da1f72fa,God's First Creation God's First Creation,5,,good,20.2.0.6076,2026-02-20T13:18:39,us,Google Play,0
