id,author,rating,title,content,version,date,country,platform,vote_count
a9d28bd8-01ab-40f1-a162-5047ded3b6a5,Silke,3,,ich komme auf dem Handy nicht in die App.. Support kann ich auch nicht anschreiben !!!!,26.0.2.6338,2026-04-01T03:35:23,de,Google Play,0
66cd6f10-406c-4b0b-b3bc-899447a942f3,Alistair Wilkie,1,,Possibly the worst ! Constantly not connecting with printer and constantly will not even open. Clearing cache does not help. Having to delete the app and reinstall every couple of days just to keep it functioning ! Come on HP you have the resources to fix this surely,20.2.0.6076,2026-04-01T03:13:13,sg,Google Play,0
63dbdf41-52ae-4091-bcef-e1ab482e72a6,Darchy Darchangel,1,,Incredibly unuseable since update.,20.2.0.6076,2026-04-01T02:48:32,sg,Google Play,0
c5cce5f5-e876-4056-867d-df9b8c7a3ac4,jajaprintingservices,1,,Issues with connecting to printer via WiFi or WiFi Direct Please fix. I have recenty bought the printer and it is not connecting. Sorry to say this but I was a test engineer of mobile printing app of a different brand before and never had issues like these.,20.2.0.6076,2026-04-01T02:39:59,sg,Google Play,0
d2e5e596-a2a5-4f3f-b9fa-6e759b03eeab,Rainer Filip,1,,"Seit einiger Zeit kann ich kaum mehr drucken. Ebenso lässt sich die App nicht immer öffnen. Ich muss es ein paar Mal am Tag probieren, bis der Druck endlich funktioniert.",26.0.2.6338,2026-04-01T02:17:05,de,Google Play,0
cf924a73-ffdd-4760-9c2d-eb8314136a0f,christian seewald,1,,"Jedes Mal, wenn man etwas dringend drucken möchte, funktioniert die App nicht, und man muss sie neu herunterladen. Das war sicher mein letzter HP-Drucker.",26.0.2.6338,2026-04-01T02:11:48,de,Google Play,0
4b4c98cd-cf18-4e07-a9bd-59cd7768cea5,Jozette Williams,5,,Awesome app!,20.2.0.6076,2026-04-01T02:02:14,sg,Google Play,0
12150f08-d6fb-4d2e-8117-1cd9b6b48bf1,kalyanchary chinthoju,5,,very good but ink only,20.2.0.6076,2026-04-01T01:52:52,sg,Google Play,0
86cb2964-52b4-4ce4-8ec5-acd2770a6cd1,Francesco Crivello,1,,l'app non si apre più,26.0.2.6338,2026-04-01T00:57:49,it,Google Play,0
1ac8b62a-c51e-4941-b0cc-ce1bc66fd1b6,carla barone,1,,"da un pò di giorni non funziona correttamente , è sempre in caricamento",,2026-04-01T00:49:31,it,Google Play,0
327a110f-6f88-4855-8859-64821ce6b2c3,Anaa Martinn,1,,no começo é bom mas depois mal abre a tela inicial,20.2.0.6076,2026-04-01T00:34:17,br,Google Play,0
b10ca24f-27f9-428e-82f4-a5e12c1e4749,Heike Vollmer,2,,Die App lässt sich Seit 2Tagen nicht mehr öffnen,26.0.2.6338,2026-03-31T23:24:10,de,Google Play,0
9610b79e-7f60-4cad-86a3-61f2137945b9,Aurore Calado,1,,je peux même plus ouvrir l'appli HP donc je paie HP smart encre et feuille mais je ne peux pas imprimer,26.0.2.6338,2026-03-31T22:25:42,fr,Google Play,0
067373d6-6c21-423d-b75e-b2874516561c,José Antonio Hernández,5,,muy bien,20.2.0.6076,2026-03-31T21:00:51,es,Google Play,0
06dd4729-f0a1-447f-8567-41d1daf8148e,Timothy O'Grady,1,,Horrible app. Can't add printer by IP address. Can't find based on mDNS or other discovery over VLANs. also the app looks like it was developed in soviet era.,20.2.0.6076,2026-03-31T20:57:41,sg,Google Play,1
2459e408-81ff-4b57-9ac8-53e3a3c02c79,Ben- mayka Oliveira,1,,"O App está péssimo. Aparece a opção editar no, entando, ela não aparece mais a Opção o para reposicionar a imagem no Formato A4. E ela esta imprimindo com filtro as fotos. Alguns dos apresentados no Atual App Hp.",,2026-03-31T18:42:03,br,Google Play,0
89a46ca1-656c-4918-b1a8-69f76b1118f4,Maxine,1,,can't set up printer,26.0.2.6338,2026-03-31T16:37:52,sg,Google Play,0
b802466f-3850-4d75-8bd1-d90a18269121,T. Bonds,5,,The response time from phone to printer is instant. amazing,26.0.2.6338,2026-03-31T16:24:22,sg,Google Play,1
c0f6e4fe-3574-43d3-b040-967294709057,Evangelist MO Anderson,1,,"wireless printer Stop connecting to WiFi, HP Deskjet 2700 All in One asking for payment, Why?",,2026-03-31T16:07:47,sg,Google Play,0
b07932da-3a18-4377-9ce7-9ad1c00cc335,Alexsander Diniz,5,,funciona bem,20.2.0.6076,2026-03-31T16:04:22,br,Google Play,0
d33e3394-9124-47f4-96d2-cbb447607f71,Luca Angelo,1,,Veramente pessima considerando che devo avere accesso SEMPRE al mio dispositivo anche fuori rete,26.0.2.6338,2026-03-31T15:15:09,it,Google Play,0
7e58131f-3683-4e0d-997d-33fb0e59fa1b,jana beck,5,,very nice.,18.10.0.5530,2026-03-31T14:16:28,sg,Google Play,0
4e6a9bab-59d3-47cd-acc9-83be3b5840be,G. Wittka (witty),1,,"Wenn ich mit dieser App einen HP-Drucker, den dir App sogar erkennt, nicht zum Drucken bekomme, aber eine andere App eines Mitbewerbers, dann zeigt das nur, dass da bei HP Stümper am Werk sind. Ich würde dafür nicht einen einzigen Stern geben wollen!",26.0.2.6338,2026-03-31T13:49:48,de,Google Play,0
02e4e21b-5771-4de8-a71e-a7a7db5df394,Filipa Jacinto,1,,"It doesn't work well on samsung tablets, most of the times doesn't even start. This issue only happens with the new update. Can't use it at all.",26.0.2.6338,2026-03-31T13:26:45,br,Google Play,0
e5fd1099-8f97-43d2-b457-7ba43b9e8eef,Magdiel Rios,5,,AWESOME‼️‼️,18.10.0.5530,2026-03-31T13:15:05,sg,Google Play,0
cce50e87-bd22-411e-a595-29896c0e6311,꧁ღ Marília ღ꧂,1,,"O aplicativo não funciona corretamente, tanto esse quanto o número da impressora! Constantemente me deparo o com a palavra na hora da impressão; PROCESSANDO... PROCESSANDO... PROCESSANDO... E nada acontece, e preciso de urgência,por isso comprei o produto, para utilizá-lo. Insatisfeita com o aplicativo. Toda vez que diminuo a imagem, não funciona. Estou comprando outra marca, pois essa não atende minhas necessidades e expectativas!.",26.0.2.6338,2026-03-31T13:12:23,br,Google Play,15
4e92c7a6-a2d4-42fb-8f29-bfcae55c345c,ANGEL FERMIN CRUZ DIAZ,5,,"Me encanta, en lo personal la recomiendo. 👍🏼",20.2.0.6076,2026-03-31T13:12:17,es,Google Play,1
d4b9e539-f0ef-49fd-bffa-42a67ddaabae,Hercules Barroso,1,,aplicativo fica carregando e não entra.,,2026-03-31T13:11:24,br,Google Play,0
487bdd19-c8b6-4eeb-914a-cf0f65b117e0,Joanna Deltoro,2,,unable to use,26.0.2.6338,2026-03-31T12:57:30,sg,Google Play,0
36639b96-cd2d-48dc-a4c7-2cd8b44503f6,Williams Jiménez Estrada,5,,genial,20.2.0.6076,2026-03-31T12:42:06,br,Google Play,0
071b2385-8a1e-40d7-aa0c-d31d7b9965f7,Rodney Holt,5,,great app for all your needs,26.0.2.6338,2026-03-31T12:22:39,sg,Google Play,0
5544add4-92a8-4fea-8fc6-0035f5206d72,Joe D,1,,"Worst printing experiences of my life. ONLY way I ever get this thing to print is to unplug it, remove the printer from my devices, plug it back in, install as a new printer AGAIN, and try to print AGAIN. The power button simply does not, has never functioned. Print jobs consistently fail! I LOATHE the HP Smart app. It's my printer inside my home on my network. My wife and I are the only ones that use it, and we have to fight it 90% of the time! Absolutely worst user-unfriendly printer.",18.10.0.5530,2026-03-31T12:19:43,sg,Google Play,2
4950abcd-79ea-4719-9dd3-859640a49569,Vojtěch Vybíral,1,,scan from printer does not work,20.2.0.6076,2026-03-31T12:01:46,sg,Google Play,0
42c3c908-6030-4471-9932-90f6b1ac34ed,N,1,,"The March 24 2026 software / firmware update completely bricked my 3830 printer. After 3 hours with tech support, no one can help me. I had two cases opened during that time - both of which the agent closed without my permission. The chat support doesnt even reply. During the last call I was transferred to a closed department. Not pleased. Im not calling again. Ill be recycling the printer and never returning to HP.",26.0.2.6338,2026-03-31T10:39:07,sg,Google Play,0
2e26e3c2-5898-481b-bcb6-93fb196ea9da,Maria Isabel Soares Bueno,5,,Ótimo Aplicativo,20.2.0.6076,2026-03-31T10:35:15,br,Google Play,0
dae7a2f7-eb3e-405d-97b1-e34bc66d612f,Ana Gabriela,1,,"Era muy buena aplicación, pero ya tengo algunos días que no me deja entrar, se queda cargando nada más 😞 ya desinstale varía aplicaciones para desalojar la memoria y sigue igual.",,2026-03-31T10:22:48,es,Google Play,0
f861ca4c-f15b-4237-a658-3716e5ef6d7d,Elda Bauer,1,,it never connects to wifi. i spend more than 1 hours to connect and disconnect devices. horrible.,,2026-03-31T10:10:17,sg,Google Play,0
5ea32843-8db9-46c8-b7b7-51b063bfd319,Antonino Pagano,1,,non funziona più,26.0.2.6338,2026-03-31T09:40:42,it,Google Play,0
df203876-73f3-4e5a-bd31-b9dfebb7fd5e,Star Drop,2,,always stops working after a very brief time!,26.0.2.6338,2026-03-31T08:53:04,sg,Google Play,0
a5a08bc9-70bc-47d9-bb25-a3b7a6c520ac,Alessandra V.,3,,"Con l'ultimo aggiornamento del 10 marzo, l'app sul cellulare non mi si apre.",26.0.2.6338,2026-03-31T08:50:13,it,Google Play,0
23635e15-6856-4478-86c7-4986dfffc7b0,Julio Cesar Leite Peres,5,,Exelente,20.2.0.6076,2026-03-31T07:54:31,br,Google Play,0
083e5a19-613b-4edf-8089-51a07cc2759a,Patron,1,,App start op maar komt niet verder dan laden.,,2026-03-31T07:45:00,nl,Google Play,0
75bd6051-b246-48f3-86f2-2b11cd3c7bd4,Retrotrut Ahmed,1,,doesn't work with HP printers,26.0.2.6338,2026-03-31T07:07:29,sg,Google Play,0
9b2b9a81-f2ce-457f-a0fd-42662bdce899,Jordan “Pacific NorthWest Yetti.” Pawley,1,,last scanning function after last update,20.2.0.6076,2026-03-31T06:35:11,sg,Google Play,0
0c1d9fc6-e285-4d9b-b6ea-5d2d7de94f80,Aleksander Kutycki,1,,can't scan docs with HP Color LaserJet Pro MFP M176n,20.2.0.6076,2026-03-31T06:35:06,sg,Google Play,0
7b1280bc-7bf4-4a62-9182-d186890c5630,G MUTHURAJAN,5,,easy to access and utilise all requirements.,26.0.2.6338,2026-03-31T06:12:05,sg,Google Play,0
0cbb3d17-6ab3-44b7-adad-8da6774d1731,Veronika Blömer,1,,Update nächster Tag White Screen. Es Kann doch nicht sein dass man die App vor jeder Nutzung neu installieren muss!!! -----------------------------------------/ Wollte schnell was drucken. App startet nicht. Rödelnder weißer Kreis. Cache gelöscht. Geht immer noch nicht. Daten gelöscht. Jetzt Anmeldung hurra. Bekomme Code per Email aber Anmeldung nicht möglich. Hätte VPN aktiv. Hä? Prozess wiederholt. Endlich geht es. Fast ne Stunde Zeit verloren.,26.0.2.6338,2026-03-31T05:04:45,de,Google Play,0
79967b37-93bd-4170-8c42-3b16ef2dab8c,bc,1,,doesn't show hp network printer,,2026-03-31T05:02:11,sg,Google Play,0
b955cb82-238a-4a85-9095-d26199ab53d9,Ratish Pindi,1,,"Before it is working fine, I believe now days from 2026 app not responding and very upset on the performance.",26.0.2.6338,2026-03-31T04:30:19,sg,Google Play,0
29df6790-1f54-4a6c-9fdd-4395240647c4,Jürg Maier,1,,funktioniert einfach nur schlecht,26.0.2.6338,2026-03-31T04:22:03,de,Google Play,0
d999f969-9fdb-4dbc-aea4-058069f46eba,Daniele Souto,5,,ótimo,20.2.0.6076,2026-03-31T03:28:44,br,Google Play,0
58601eb3-33cb-4fd3-9fe0-c977bc86e64b,Iamandi Roxana,1,,peggio di questa non ho mai visto!,,2026-03-31T03:20:46,it,Google Play,0
8c6372a8-069d-474c-a6d8-4397a81485d2,Alina Iuliana Hategan,1,,ZERO ASSOLUTO!!!! PESSIMI!!!!! ZERO SERVIZIO E ZERO FUNZIONALITÀ!!!!! MAI PIÙ!!!!,,2026-03-31T02:38:28,it,Google Play,0
4beb3c0b-adb2-4493-a2a7-d76cea2a81fd,T B,1,,"Diese App sollte ich herunterladen, da mit eine andere HP-App ausschließlich mitgeteilt hat, dass ich diese App hier runterladen soll. Mehr macht die andere App nicht. Ich ging natürlich davon aus, dass ich mit dieser App nun endlich meinen Drucker wieder nutzen kann, aber diese App besteht bei mir aus einem weißen Bildschirm. Nicht mehr und nicht weniger. Was soll das? 160 MB für einen nutzlosen, weißen Bildschirm...",26.0.2.6338,2026-03-31T02:25:03,de,Google Play,0
3d343e28-bf02-424a-98a7-927e63ebfe77,Supereddy Ordonez,1,,pessima app non si apre ogni volta reinstallare. prima con la app Canon mai avuto problemi pe tanti anni. succede con tutt gli smartphone.,26.0.2.6338,2026-03-31T01:59:23,it,Google Play,0
ea992175-d058-4a29-afae-556277f29939,Melanie XXX,1,,Seitdem letzten Update funktioniert das Drucken mit der App nicht mehr. Beim Öffnen wird nur noch ein dauerhafter Ladekreis angezeigt.,26.0.2.6338,2026-03-31T01:46:24,de,Google Play,0
b43bf39b-0aed-4e57-b1d4-011639da5dcb,T FAm,1,,app works fine but it often takes a very long time to load,,2026-03-31T01:37:55,sg,Google Play,0
a346d03b-5204-4ecb-b2a3-f8664982630b,Peggy Butsh,2,,"naja die App hat zwar eine gute Übersicht aber wenn ich die Mal ein paar Tage nicht geöffnet habe denn lässt die sich gar nicht mehr öffnen, ich muss die dann deinstallieren und dann neu installieren",26.0.2.6338,2026-03-30T23:50:12,de,Google Play,0
292e302d-9709-44d9-a7fc-762636055bd1,Gena Batalski,1,,"Mehrfachdruck auf einer Seite nicht möglich, daher nur ein Punkt. sobald es nachgebessert wird, gebe ich mehr. schließlich wollen wir ja das Papier sparen und die Umwelt schonen.",20.2.0.6076,2026-03-30T22:59:27,de,Google Play,0
d0c1eeaa-07b4-4239-b394-9d9b01182f3d,ColdVampi,5,,primer dia de uso aun no he podido imprimir ni una hoja le puse un cartucho de tinta la conecte y marca atasco de papel sin tener hojas ya meti hojas y sigo esperando la primera impresion recomendación compren otras marcas a hp no le importa sus clientes ni la calidad de sus productos,20.2.0.6076,2026-03-30T22:59:15,es,Google Play,1
1a5d2d1c-d0c8-461a-834d-92d425902007,Christian Masuchowski,2,,Funktioniert nicht wie sie soll. Einfach nur eine Enttäuschung.,,2026-03-30T22:00:51,de,Google Play,0
124672b6-7827-4d4c-b568-c095b550002c,Belmiro Matos,4,,Excelente parabéns 👏,26.0.1.6280,2026-03-30T21:37:36,br,Google Play,0
545f5dc4-8dbe-48fd-a1e0-7694e79f90f8,JOSE EDILBERTO RIVADENEIRA ABUGATTAS,5,,ok,,2026-03-30T20:55:19,es,Google Play,0
b0dfbf8f-a216-4e5c-829d-53b3d94d5800,leonel tomelin,1,,"Se me traba de la nada, llevo varias horas esperando para poder imprimir un archivo.",26.0.2.6338,2026-03-30T19:51:33,es,Google Play,1
4e9cd1db-38a7-44b1-a384-95f496ea74e6,Melanie Reyes,1,,Since the latest update the app will not load. I have never had any issues before that.,26.0.2.6338,2026-03-30T19:37:58,sg,Google Play,0
bef67ebb-9a20-4244-a190-e237a5849ad8,Sudhanshu Malik,5,,Thanksgivings,17.30.0.4993,2026-03-30T19:15:32,sg,Google Play,0
82612d52-e04a-4321-889b-770f97020e9c,Noramall,1,,"Requires me to do too much to set up a printer, and asks too many time for their stupid subscription services that I don't want or care for. If I could use a different service I would, but they don't exist",20.2.0.6076,2026-03-30T18:43:48,sg,Google Play,0
8ad5bf3a-a745-4b91-94f3-5b7cc9cf8c22,Alan H,5,,No abre se queda tildada,20.2.0.6076,2026-03-30T18:13:49,es,Google Play,1
3307efc2-a3e0-48ab-9ade-8a1d3c8a96f3,David Haugen,5,,good potions to use,26.0.2.6338,2026-03-30T17:39:11,sg,Google Play,0
3c39c3ac-021f-458c-9e21-ec91002c2f14,Wando Passos,4,,falta mais opções de tamanho de fotos. deixa um pouco a desejar em relação a Epson.,20.2.0.6076,2026-03-30T16:26:11,br,Google Play,0
3e02b1a0-24bc-4ce6-b7f8-30be05ba6fdb,Unc Francisco Vdlk,3,,vou ver se ESE app ajuda aqui se e bom memso,26.0.2.6338,2026-03-30T15:42:39,br,Google Play,0
c4c981e7-dff8-4011-8681-a3167f180192,Cortnay Gray,1,,"Update: 3/30/26The horrors persist.App is useless, just spins. What am I paying for? Tried all the things, cache clear, etc. Nothing works. Old Review: First, the recent UI change is trash for all the reasons the other reviews have already given. It needs to be rolled back. Before I had the occasional trouble connecting, now it is just a headache every single time I use it. Even more frustrating is the AD that I have to scroll past everytime I am trying to get this thing to work. Dev team flop.",26.0.2.6338,2026-03-30T15:29:04,sg,Google Play,2
d75a8971-3c42-4636-83ee-26e080b9b872,Alex Marois,1,,confusing and hard to use.,26.0.2.6338,2026-03-30T15:28:21,sg,Google Play,1
7b1a46fe-4317-4b77-8077-c105460bfa6e,Maria Georgieva,1,,I absolutely cannot rely on the app. It constantly just loading and never works.,26.0.2.6338,2026-03-30T15:02:33,sg,Google Play,0
ee8636d2-501f-4f96-9520-2c8950f3a67a,Donna Strickland,5,,These services are so very helpful and reliable.,26.0.2.6338,2026-03-30T14:27:59,sg,Google Play,0
387cc660-4e76-4598-83d0-1507c8bf0d06,Lynn Strickland,2,,"When I first got the app it worked just fine, now after the last update all I get is the circle that never ends and I never get to see anything else. Fix it please!!!!",26.0.2.6338,2026-03-30T14:06:32,sg,Google Play,0
31049cb2-2509-4699-8bda-baf428eca79b,James Steelman,1,,Does not work correctly for Pixel 10 pro fold. I can print from the phone but I am unable to log on to the app. the log in screen has an imaginary button to continue after successfully entering the password. UPDATE: still does not work on pixel 10 fold (03/30/26).,26.0.2.6338,2026-03-30T13:31:57,sg,Google Play,2
3033f547-c4e6-4f99-9ca9-a7036c18ff56,Andrea prada,1,,"No me abre la aplicación, se queda cargando",26.0.2.6338,2026-03-30T13:28:27,es,Google Play,0
5291458f-b9de-47a5-a15d-0fb5c66244d1,Siobhan Wojcik,1,,"if the app doesn't load, you can't print anything lol",26.0.2.6338,2026-03-30T13:23:11,sg,Google Play,0
2a93a48a-6a83-484a-b845-9023c307d699,Salomon Rodriguez,5,,amaxing,26.0.2.6338,2026-03-30T12:56:48,es,Google Play,1
fee0d36b-cc38-4637-9b7c-795f9c95569a,Bethalen,1,,Desde que he quitado el servicio de suscripción no hay forma. No hace más que dar errores y al final la tengo quiere quitar y usar solo las opciones de impresión del móvil.  Creo que comprar una impresora es suficiente para que tenga aunque solo sea una aplicación básica y qué no obligase a tener una cuenta con HP.  La verdad es que ya no estoy nada contenta y dudo mucho qué en caso necesario compre otra de estas marca,26.0.2.6338,2026-03-30T12:48:48,es,Google Play,2
e434b56c-912c-46e9-b191-af30a5c8fbe2,Dalto Fowler,1,,The fact that you have to have an account to print from your own printer at home is insane. Do better.,26.0.2.6338,2026-03-30T12:48:26,sg,Google Play,0
e45cea5c-6ce8-4d02-9ed8-673830eb3c2a,J,1,,"Impossible de me connecter à mon imprimante (OfficeJet Pro 7740 Wide Format All-In-One) depuis les dernières mises à jour, fonctionne toujours avec la v20.1.2.5988",26.0.2.6338,2026-03-30T12:24:41,fr,Google Play,1
5a56f658-96f1-4154-ad2f-0a7c2fb025cc,Nath Gd,1,,site frauduleux. ne pas enregistré vos données personnelles ni téléchargement l'application. l'appli pirate votre temps. vous êtes à vomir!!!,20.2.0.6076,2026-03-30T12:19:35,fr,Google Play,0
1133b943-491f-4b23-a4cd-5c75999d9570,frogger Pond,1,,I shouldn't need an app that harvests personal information to use a simple printer. HP doesn't need to know my location whom I call etc to get a printer to (not) work. every week the printer severs the wifi connection then plays dumb can't find it and won't print. I can't access printer through my phone nor through my laptop but both devices can see the printer just fine.,26.0.2.6338,2026-03-30T12:17:43,sg,Google Play,0
a1e94d5b-4c8b-4b10-bf23-5b9a79e6e496,Pyu Pi,1,,la conexión wifi es inestable y si no tienes una PC es casi imposible de que la encuentres si se desconecta,20.2.0.6076,2026-03-30T12:16:04,sg,Google Play,0
472fed49-ece5-4197-824c-588444b400ac,lisa Nicholson,2,,app just spins and spins does not open,,2026-03-30T11:47:17,sg,Google Play,0
e668b1a0-2b60-45ac-ba08-1ee26655b8e1,dan fadei,1,,"HP un disastro, ogni volta che devo stampare una cosa, devo configurare la stampante, però la App non si apre",26.0.2.6338,2026-03-30T11:16:40,it,Google Play,0
59505026-1003-483f-9669-aa02d5acb23d,rastapasta91 big,5,,ottimo,20.2.0.6076,2026-03-30T11:03:56,it,Google Play,0
2a43d1e0-52f7-40e3-a5c6-1a9d4f031a2b,Andrea De Filippi,1,,L'app non si apre e non si collega più alla stampante. Fatte tutte le prove ma niente da fare. È già da diverse settimane se non mesi. Complimenti ai tecnici incompetenti che l'hanno sviluppata e aggiornata!👍,26.0.2.6338,2026-03-30T10:45:53,it,Google Play,0
ccdf2d8e-9fa0-42c7-83f1-6a7d1cfff5ef,Nicolás C,1,,muy mala. no funciona,20.2.0.6076,2026-03-30T10:05:38,es,Google Play,0
b3e41137-3841-4b6f-b63d-0af7ab68d38b,Alessandra Margani,1,,tutto bene fino a pochi giorni fa l' applicazione non funziona carica all' infinito e non permette niente,26.0.2.6338,2026-03-30T09:50:26,it,Google Play,0
21f69c37-1c65-4d2d-9ae7-029c787fd8b1,Bayram Yilmaz,1,,hp application fonctionne très mal...,,2026-03-30T09:28:25,fr,Google Play,0
313a6ba7-198d-4422-b8cf-8ae93ce28721,Lorenzo “Miticopinna”,1,,Da alcuni giorni la stampante non si connette alla rete.,26.0.2.6338,2026-03-30T08:52:59,it,Google Play,0
b228ae5f-8708-4c7e-a8e6-18e420f211fe,Donna Jo Maki,1,,Buffering will not open,26.0.2.6338,2026-03-30T07:53:17,sg,Google Play,0
a50a6745-af3f-4391-85eb-a85d379e61ae,Taulant (Tao),2,,non si apre piu!,26.0.2.6338,2026-03-30T07:52:22,it,Google Play,0
402c82f4-0ca4-4bcb-bea3-c1878853a24e,sandro run,1,,l'app continua a caricare ma non si apre,26.0.2.6338,2026-03-30T07:35:54,it,Google Play,0
915fb4b4-82d5-4350-b0e0-69e76271da69,Mikel,1,,En serio es legal que podáis secuestrar la impresora si no se paga una suscripción mensual? No tenéis vergüenza,20.2.0.6076,2026-03-30T07:24:57,es,Google Play,0
581f716f-07fd-476a-85f9-955c3c8f1705,K2o K2o,1,,"impossible d'imprimer hors de chez soi, contrairement indiqué en publicité alléchantes, des heures à paramètrer pour rien l'appli ce ferme au moment où je touche le but .. 100€ pour cette horreur, bravo",20.2.0.6076,2026-03-30T07:01:41,fr,Google Play,1
b23f0103-c83b-4387-937a-c607d5196e8e,Luis Luis,1,,no está funcionando compre la impresora lo instale y semanas después la aplicación no abre,26.0.2.6338,2026-03-30T06:59:47,es,Google Play,0
3684977c-0b3d-462a-bf54-c0869121d38f,Emma “Jesus is our only Hope !” Basi Rico,1,,"stopped again to work!! As you click into the icon goes to a blank white page and freeze !! I have already restarted my Samsung S10, but it doesn't work ! I like HP printing quality but the software are so difficult unfriendly and stop at any time... especially when you are in emergency and rushing for something important 😡😡😡😱😱😱",26.0.2.6338,2026-03-30T06:56:17,sg,Google Play,1
b63ec148-5693-4b0b-9da1-4326b1799909,Francy Vitali,2,,"non funziona più, continua a caricare ma non si avvia!!!",26.0.2.6338,2026-03-30T06:37:03,it,Google Play,0
e0f84800-172f-4bf8-8a74-1aebe78a627b,Rolando Reynaga,5,,excelente,26.0.2.6338,2026-03-30T06:22:12,es,Google Play,1
f7b028a5-af35-4bd6-817e-5661a9533915,Gwennaëlle Lep,1,,impossible de se connecter à son compte et créer son instant ink ..... pour du HP C EST PLUS QUE MÉDIOCRE COMME APPLICATION,,2026-03-30T06:22:07,fr,Google Play,1
d4faa819-5f9e-4d6c-a1ed-5905d9157696,MOHAMMED RASHID SHAIKH,5,,Fantastic,26.0.2.6338,2026-03-30T05:24:43,sg,Google Play,0
9fc7bf08-0ecf-438d-a528-b93cadb5b310,Classic Drop Motors,5,,It is very good 👍,9.6.2.3732,2026-03-30T05:07:09,sg,Google Play,1
f3c0aa31-00e7-443e-b5b9-d1d9cd3f52d8,Nancy Chatton,1,,La nouvelle mise à jour à totalement anéanti l'application... plus rien ne s'ouvre impossible d'accéder à l'appli pour pouvoir imprimer où numériser ...,26.0.2.6338,2026-03-30T05:06:48,fr,Google Play,1
4b46fb7c-5fde-4b2b-9f76-0aea797e00cc,Marie Fraling,1,,"Changing from HP Smart to just HP has DEFINITELY made it difficult for me to print now🙄🤦🏾‍♀️. I WISHED that companies would just LEAVE THINGS ALONE🙄!! I've been STRUGGLING to connect my printer now to my wi-fi/router🙄. The app is telling ME that my router password is incorrect and the app now is unable to locate my printer 😤🤦🏾‍♀️. I've had the Smart Tank now for approximately 5 months and up until recently, it's been working perfectly🙄. I definitely dislike this printer now🫩😠",,2026-03-30T04:35:21,sg,Google Play,0
b6c0733c-fa0c-4364-a30b-de39bc724702,Greg Legate,1,,The most frustrating experience trying print.,26.0.2.6338,2026-03-30T04:17:27,sg,Google Play,0
7d4baaf9-bbfa-4daa-873e-f673d66ca8ec,M. Bergemann,2,,"Sagenhaft primitiv diese App. Schlussendlich funktionierts, aber der Weg dahin ist eine Tortur :)",26.0.2.6338,2026-03-30T03:25:02,de,Google Play,2
b14b43e0-0248-47f6-afa9-a45dfbb30ebd,Christian Sattler,2,,macht was es soll. app friert bei wiederholten starten ein bzw ladebildschirm verschwindet nicht. musste App neu installieren.,26.0.2.6338,2026-03-30T03:22:29,de,Google Play,0
c8ce66ea-eaac-4f74-b9dd-44c771ee9869,Mary Ellen Edwards,4,,Not conneting to PC,,2026-03-30T03:21:37,sg,Google Play,0
6c024fd7-6800-418b-89f0-84ccfa97538d,Michael Paul Janke,1,,funktioniert nicht,20.2.0.6076,2026-03-30T02:08:26,de,Google Play,0
09331e47-01d3-46c0-908a-06cceb0ceba3,Kevin Rea,5,,superb printing options. The printer copes with all my needs. I just wish the cartridges were cheaper.,20.2.0.6076,2026-03-30T01:20:42,sg,Google Play,0
12cbfdbc-0cdc-4c73-8c0a-b3ab478a8bd0,Mohammad Sadi,1,,this app is genuinely horrible. ive been trying to open the damn app and just puts me in the loading screen. dont get a printer and install this app. you'll waste your money just get it printer from a library its easier.,26.0.2.6338,2026-03-30T00:55:48,sg,Google Play,0
0f59f8cf-974e-4582-92c8-70da7fda00a7,David,2,,"Like everyone stated, the app just become lagging without end until u re-install it. So troublesome.",26.0.2.6338,2026-03-30T00:31:33,sg,Google Play,0
9064cfbd-d7f1-4d15-94b0-6ec38c590ba2,Nadia Carraro,1,,"non riesco più ad aprire l'applicazione,la stampante non si collega, l'applicazione non si apre, quando riesco a stampare qualcosa non lo fa correttamente,salta pagine,fa uscire pagine non stampate (conteggiate comunque nell' abbonamento immagino) sistemate per cortesia, altrimenti l'abbonamento a che serve??",26.0.2.6338,2026-03-29T23:42:01,it,Google Play,1
9a5faa5c-8e4a-4bf2-a03a-ba29198ccdc6,Vielka Hernandez,1,,Muy lenta se queda cargando la imagen y no avanza,,2026-03-29T23:41:55,es,Google Play,0
e212b8db-2719-4c91-8f4c-742434b4a7f7,Marie Gillespie,1,,stop letting me connect to my printer.,18.5.1.5470,2026-03-29T22:29:38,sg,Google Play,0
