id,author,rating,title,content,version,date,country,platform,vote_count,reply_content,reply_date
67e35084-9d5d-4ddf-8810-b68c6d918975,Amber Dovidio,2,,the app is dumb and doesn't help woyh anything. I hate the new update they most recently did and have nothing but issues with my printer connecting to my computer suddenly. I dont have time to see with customer service chat that continues to just give me articles to read to figure out my issue myself. why is it so hard to just connect to wifi and my computer. the app is useless!,20.1.2.5988,2025-11-18T12:38:38,us,Google Play,11,,
9028e72e-3b65-4832-959c-6144f18aba10,Landon Ochsenbein,1,,"!!!!!NEVER and I mean NEVER BUY AN HP PRINTER POS! This thing has always been a nightmare, it has to be signed in to your account to print, you have to update the app every MF day. I have never hated a product more than my HP printer and I will never buy any of their trash again!!!!!!!",,2025-11-18T11:54:24,us,Google Play,1,,
c03c3967-2180-4b66-af1a-720392b39a61,david,1,,"just let me print, why do I have to make an account.",9.2.0.70,2025-11-18T11:04:01,us,Google Play,1,,
af10e178-b1b9-4bc4-9dab-efb455f8dde6,Bheekharry RAJESS KUMAR,5,,This is such a useful tool!!,,2025-11-18T09:47:36,us,Google Play,0,,
c3687401-1f1c-4f1b-a18d-b05e2020c542,Samantha Rose,1,,After the complete app update I have issues connecting to my printer and the fax doesnt work. Not only is it not easy to find where you can fax on the app anymore (Being in notifications is an awful set up.) Please fix these issues the app was great before.,20.1.2.5988,2025-11-18T08:45:57,us,Google Play,2,,
738ef87e-25ca-414c-8a4a-9770dd422326,Dwight Mateo,5,,OLA! OLA Amiga!!,20.1.2.5988,2025-11-18T08:28:39,us,Google Play,0,,
f9e77165-7b82-4a64-af79-2101c0b0bc55,izzy,1,,I just want to connect my printer to the WiFi why is it so complicated,20.1.0.5822,2025-11-18T08:15:06,us,Google Play,1,,
c00f9ace-fa9b-4993-b131-c0c856a6c2af,Pat Orsban,1,,can't get app to open,20.1.2.5988,2025-11-18T07:38:16,us,Google Play,0,,
f5dd0eab-d24e-4b9e-adde-51fe6bbf4942,Antonio de Rojas,1,,"imposible, terrible. Pesada. Antes en la primera pantalla podía enseguida empezar a escanear. Ahora no más. Tarda en mostrar el splash, luego otra página de carga, luego me presenta mi impresora, tengo que entrar y tarda una eternidad antes de mostrarme una pantalla inútil con anuncios de upsales, y todavía no empezamos a escanear. La UX de escanear y editar es terriblemente cargada lenta, e inútil. ""Enshitification"" total",,2025-11-18T07:05:35,us,Google Play,0,,
1367a400-dff1-4957-9cf9-633c0aea5126,LaChere Griffin-Denton,1,,the product can only be used with a 2.4 wifi. who uses that anymore? my phone has 5. So disappointing,,2025-11-18T07:00:33,us,Google Play,0,,
d8597bb2-5b92-43bd-87c0-405c53b7c06c,Amogh Jayaraj,1,,Horrible app. Horrible printers.,,2025-11-18T06:38:00,us,Google Play,1,,
0388fb8f-0ee2-4222-82bd-75e872d1f8e8,Bernard Mamo,1,,Setting paper size to 6x4 when printing photos still prints to a full size A4. If I tap on layout then resize photo on an A4 layout (with visible white all around in preview) photo gets cropped instwad of resized. Useless piece of brainless software as usual. And to think this company has great developers somewhere writing advert and ink scam software!,20.1.2.5988,2025-11-18T06:18:55,us,Google Play,3,,
40237c0e-e691-4510-8a92-2bc48c512b10,Pradeesh L,4,,app is very slow,20.1.2.5988,2025-11-18T06:04:22,us,Google Play,1,,
4d24aecb-8907-46dc-9fc2-e5ea021d5457,Ndi,2,,Find printer. Connect to printer. Connected. Now choose a wifi to connect to . Thanks. Yes I have 2.4 GHz. No they aren't hidden. PS it worked once randomly and it claims password is wrong. Tested it. Not wrong. Printer diagnosis says it found 16 wifis. Https doesn't work. Needs app.,20.1.2.5988,2025-11-18T05:40:13,us,Google Play,1,,
49ac9206-2791-453f-bb11-a1f7f649428b,Madalina Dobrin,1,,"M28W cannot setup, no wifi found",,2025-11-18T05:32:33,us,Google Play,0,,
96737c71-0401-4889-8a4d-a84344b9e02b,Pete Thadog,1,,"Absolutely useless. The app seems like it works at first. The display works. If you click on links or try to do anything relating to your account, your printer, or anything that involves leaving the display page, then the network doesn't work, there's a server error, you're apparently not in fact connected to wifi, or it's just a white screen. Hp should be ashamed of the quality of not just this app but all their services such as Hp instank ink and customer support. Could not recommend less",20.1.2.5988,2025-11-18T05:19:59,us,Google Play,16,,
5175be39-ef15-4e71-a5f5-49b3cc04e2ad,Johnbhoy Norris,1,,"I lost the wifi connection on ny Envy 6400 so went to the HP Smart app. As I opened the app it made me accept an update. When it was done I went into the app and it had completely changed. There is no screen to help reconnect the wifi. So I tried to reconnect using instructions I got from the printer itself. It should be easy, but its really disjointed. Anyway I persisted but nothing happened. I can't believe HP have made it so difficult. I'm now without a printer. What am I supposed to do!!",20.1.2.5988,2025-11-18T03:05:48,us,Google Play,54,,
39750023-5602-4cf4-a5cd-187fa1e9e2b7,Robbie Eli,1,,"Terrible, not user friendly. The fact that you need an app just scan and do things on the printer is a worry. Wouldn't purchase another HP product for home office again. ink cartridges last less than 50 pages...",20.1.2.5988,2025-11-17T22:49:03,us,Google Play,0,,
b07bc030-388f-4814-9f38-84459c231420,Saint-Juste Sama,1,,can't access any files beyond recent files. useless.,20.1.2.5988,2025-11-17T20:44:25,us,Google Play,0,,
bf0f9e1d-579c-4fba-be95-6cb37ee3c0ab,Charles Steele,1,,difficult to set up.,20.1.2.5988,2025-11-17T13:19:30,us,Google Play,0,,
c5dacee2-d1ae-44e3-8e64-7fcbd5447f00,tiffany j Lawson,1,,how the hell do you print a picture now,,2025-11-17T13:10:44,us,Google Play,0,,
cd37c2d8-7108-41a2-bb2f-71a2d3ced814,Richard “Richie” Hill,1,,"Initial setup ok, now since update won't recognise my printer using WIFI ,nightmare trying to connect to new router..printer now basically a desktop ornament, well done HP.",20.1.2.5988,2025-11-17T11:08:44,us,Google Play,2,,
ed3b5386-02e0-461c-b95e-5ae76f1e0e94,David Longest,1,,I don't want your subscription. Stop nagging me for it. I should not have to go through an entire runaround of pop-ups just to be able to scan a document. I should not need to make an account to scan a document. I will never buy HP again. Printer or otherwise.,,2025-11-17T10:56:37,us,Google Play,0,,
664828e9-77f3-4d19-9452-941b71e4aefe,Shirley Brooks,3,,to many problems with printing,,2025-11-17T10:54:42,us,Google Play,0,,
445a06e0-e625-4ef6-90ee-56b007e8a4f6,Brynie Weinberg,1,,can't scan anymore,20.1.2.5988,2025-11-17T10:08:08,us,Google Play,0,,
e2c4ef0a-aa96-45df-b21d-6bcf1eb99b5f,Iman X,1,,New App Not Working Slow Not User Friendly,20.1.2.5988,2025-11-17T09:55:34,us,Google Play,0,,
2d91b99e-dfa6-4d31-9d86-5ae4959b7d44,Bobbi Lynn,1,,"I cannot connect to wireless after changing my Wi-Fi. I have tried everything. but what it does say underneath I'm not connected, is buy a new printer.. Really? this is by far the hardest printer I have ever tried to get connected after changing my Wi-Fi company. it doesn't have a problem wasting sheets of paper printing out on how to reconnect it. stop wasting my Ink please!",20.1.2.5988,2025-11-17T07:14:40,us,Google Play,16,,
e6303692-db6f-4fb5-a135-5cd4738ba49d,Kelly Douglas,1,,"Terrible app, and even worse printer (smart tank 7305). The app doesn't even tell you which wifi the printer is connected to, just that there are connectivity issues and absolutely empty words on how to resolve it. If you get a new network you need to reïnstall the printer entirely. And it frequently only works after disconnecting the power multiple times.",20.1.2.5988,2025-11-17T06:52:23,us,Google Play,5,,
80103ab5-2d2f-41c2-a759-8313a71210b3,T Marcel,1,,"Does not work, cannot sign it. Stuck on sign in page indefinitely",20.1.2.5988,2025-11-17T06:27:54,us,Google Play,0,,
ee9523ef-ca31-464e-b661-ea888def9713,Christenson Scopoli,1,,"They make you pay every month. If you stop paying you have to go the app yo finsh. it will not let me past the ink setup. I've cleared all my data 4 times, closed windows, unplugged & restarted the printer router and app. It recognizes the printer but will not let me finish setup. I've completed setup 4 times now. Nothing works and I'm still on sqaure one. To add insult to injury the call center robot is a brick wall asking you to find all these serial numbers, etc... NEVER BUY HP",20.1.2.5988,2025-11-17T05:36:20,us,Google Play,2,,
efba33e6-906a-4600-9485-7dab8ff01c21,John Diggs,4,,keep up the good work,20.1.2.5988,2025-11-17T03:35:39,us,Google Play,1,,
e8d1aa74-a0d3-409c-97cb-a6d6d9553f9c,Ritesh Vs,1,,app don't even work hire good developer,20.1.2.5988,2025-11-17T00:59:51,us,Google Play,0,,
84813790-79f0-4f36-9783-403311a53695,Iuliia Zernova,1,,"new app is terrible. it's not loading print/scan page, it's just taking forever! so I'm standing next to my printer for 30 minutes without possibility to scan my documents. what a ridiculous situation!",20.1.2.5988,2025-11-16T23:51:40,us,Google Play,0,,
7a41e2ec-5bbc-4fc5-b2a3-95fdc63ab789,Simon Blair,1,,just terrible and ineffective,20.1.2.5988,2025-11-16T20:13:20,us,Google Play,0,,
1c98e2d4-65b5-4246-a3aa-3c05cc0e2c62,Imad Omeirat,4,,very good,20.1.2.5988,2025-11-16T12:58:48,us,Google Play,0,,
dbcca9f4-c2d2-4f9b-8b13-cfde51d28b3e,P Haskell,1,,unable to print from android phone,20.1.2.5988,2025-11-16T08:53:31,us,Google Play,0,,
d5f5135f-dcbd-478d-8654-0bb48b2b3b37,Ray B,2,,"not working, it has stopped connecting for some reason , i can print from my pc but not my phone 🤔",20.1.2.5988,2025-11-16T08:01:24,us,Google Play,0,,
4b5eb404-bd26-404f-85ee-f5698524ecff,Ashif P,5,,its easy to use,20.1.2.5988,2025-11-16T07:39:45,us,Google Play,0,,
0bb6ae73-13b5-4947-9ae8-4eede73b337e,Dhayalan Annamalai,1,,play store stopped to support,18.10.0.5530,2025-11-16T06:44:33,us,Google Play,0,,
ea0ce98b-e9d5-453a-80e7-55316b0807e2,SweetCakes01 Cakes,1,,I'm disappointed,20.1.2.5988,2025-11-16T06:24:44,us,Google Play,0,,
8ca7796e-042e-483f-a589-c7145b8de234,Zorica Mercadante,5,,"I love the scanning feature on my phone, so easy to upload physical documents, very efficient, good clarity",18.10.0.5530,2025-11-16T06:22:08,us,Google Play,0,,
ee4cd799-40f2-4989-87d5-a1daa784681f,Enyll Balao-as,1,,this update is the worst..the last version is simplier and much better than this,12.0.2.4056,2025-11-16T04:47:08,us,Google Play,0,,
ce807296-099b-4f5b-9bcf-148a363e01ee,Claudia Johnson - Larmond,1,,This app is absolutely useless. It cannot help to reconnect your printer to the internet. It doesn't even deserve 1 star,20.1.2.5988,2025-11-16T04:40:48,us,Google Play,0,,
3c1b9f37-5914-40c2-bdda-94d6ffd1676e,Gaga Osten,1,,"Hp i need ur help i might give 5 stars if u tell me the instructions on how to fix the ""incompatible printheads"" error in app and on printer. Sincere",,2025-11-16T01:20:12,us,Google Play,0,,
641cf83c-52c1-45f7-b473-beb5b696efee,Yasyfi Irham Harish Ramadhani,1,,after update the ui ux getting worse,20.1.0.5822,2025-11-15T23:00:46,us,Google Play,0,,
e755dc08-ed37-483a-9781-c408ed9a6dc2,Sarah needham,1,,no help whatsoever,20.1.2.5988,2025-11-15T19:53:23,us,Google Play,0,,
abc2bef9-2cc3-47a3-8860-e0759e7adb47,Nate w,1,,app doesn't let me print from my phone anymore. it won't find the printer anymore after the update. restarted phone but still nothing,20.1.2.5988,2025-11-15T17:15:18,us,Google Play,0,,
ff9c1798-8a6f-4bca-b53f-a7411699d042,S Palmer,1,,"this app is USELESS. it doesn't work, there's no instructions anywhere, and you still have to go to Google to troubleshoot every problem. there's no menu to utilize. it's poorly designed and literally the most useless app I've ever downloaded",20.1.2.5988,2025-11-15T17:08:26,us,Google Play,0,,
523c3b63-68ce-47fd-b31c-43b1a37088ad,Emma Rotton,1,,"terrible.. idk why they had to switch to this app and delete the other perfectly fine one. I can't even connect to my printer now, and when I try to open the app, its SO slow and just keeps loading. its so confusing",20.1.2.5988,2025-11-15T16:16:21,us,Google Play,0,,
f7be339f-ec25-489f-9162-8460db8e1ed8,Conchita Lai,1,,Does not work!!,20.1.2.5988,2025-11-15T15:00:15,us,Google Play,0,,
8dcf71e5-2753-4c71-b96e-6fd8885f8688,Tihesha Pritchard,5,,Very user-friendly and convenient.,20.1.2.5988,2025-11-15T14:00:26,us,Google Play,1,,
2e9acaaa-9576-4bac-9e72-57f12346ff36,Mario Castillo,1,,"worst printers ever, the app don't work, neither on the pc, you need to open an account and you have to login every single time you need to use it, total trash, oh and the pc or laptops from hp are pure garbage too",,2025-11-15T13:46:49,us,Google Play,1,,
10f859bd-52a5-43e4-a570-c6fc0fe75a8e,Vlad Solokhine,5,,This app has the best mobile scanning for the external scanner that I have tried. And I tried quite a few.,20.1.2.5988,2025-11-15T13:40:40,us,Google Play,9,,
e9a631f4-aead-4947-8855-58a0441b8892,Nishant Singhal,1,,"The new update is useless and full of bugs. It keeps on ""processing"" on every single screen. And when I finally do get to see the print preview, the print job keeps failing, making this app totally and utterly useless to be able to print from my phone. How is it possible that in this age of AI, it's so hard to make a decent, functioning, and performant and appealing app?",20.1.2.5988,2025-11-15T13:14:04,us,Google Play,12,,
259c30c3-72a9-4f61-a6e8-cf1979e4a892,Darren Zolkavich,1,,"horrible, I've always been a fan of HP products, but this app is not user friendly at all.",,2025-11-15T11:32:16,us,Google Play,0,,
bbb1faf3-304b-478f-8616-766ef4d6a5ec,J C,1,,Was never able to connect the printer to my phone using the latest HP app. Had to use my old HP Print Services app and it's working just fine. If it ain't broke....🙄,20.1.2.5988,2025-11-15T08:24:10,us,Google Play,1,,
bea0d191-f781-4473-a48e-8a32510502d5,Emma Wood,1,,"I used the previous app when I first bought the printer a year ago with no problems, now I have got a new phone and updated to this app I can no longer use the printer, am trying to find another app I can use with little success, as this app is so bad it seems I have wasted my money on a printer I can't use seeing as it is wireless so I have no other options than using apps.",20.1.2.5988,2025-11-15T03:43:35,us,Google Play,2,,
27385018-0681-4eda-92df-4076b6966bb3,Tolga Berk,1,,"I only need printer 1/2 times in a years and I can not print when I need, why? HP decides to ruin barely working software 👏🏻👏🏻👏🏻",20.1.2.5988,2025-11-15T02:20:09,us,Google Play,0,,
79ba935c-be4e-4c88-bbf3-6efd737bb5a8,utkarsh bisht,2,,"hp deskjet aio 4675 printer here. the app is not able to search the printer even when on the same wifi. MacBook is able to search printer automatically, windows is able to search. this app could not. old hp apps before this hp app were better, and everything worked until I kept on using old apps without upgrading to this new hp app. and now I can't go back...",20.1.0.5822,2025-11-15T00:57:11,us,Google Play,0,,
8fdb88a7-4e7a-46d9-a744-5413b283e36e,NoFate,3,,This is exactly the way to see in real time how every single update destroys an app by getting worse over the years! Now we get some strange blue disc-things in front having nothing to do with any devices or the app itself... important things after scrolling. But - nice blue discs!,20.1.2.5988,2025-11-14T23:41:09,us,Google Play,2,,
f371e33f-c04f-4dcb-b474-52d6ef837cda,Scott Griffin,4,,"HP please allow your wireless printers to be setup with a 5G wifi network, I'm stuck my printer won't allow me to set it up unless i can connect to a 2.4 ghz network which sucks 😫",,2025-11-14T20:13:16,us,Google Play,0,,
9655683e-95bd-4841-b051-064e689ea039,brijnandan choudhary,5,,nice,,2025-11-14T18:20:11,us,Google Play,0,,
43067f4e-8a4d-4b40-993d-e2e8f46033bf,Krystal Gonzales (Babygirl),1,,"GO BACK TO HP SMART!!!!!! This update is way more basic, way more confusing, and way less reliable!!! Not user friendly at all and the graphics suck",,2025-11-14T16:52:26,us,Google Play,0,,
46ec5f6b-d266-4774-b763-0ae19bd875dc,Tommy Hightower,1,,Not able to install on tablet,20.1.0.5822,2025-11-14T13:57:46,us,Google Play,0,,
3bf5bc4a-8561-410c-98f2-0894ea052329,lashun harris,1,,I have repetitive connectivity issues with this system for my mobile phone and desktop/laptop I've been using HP printers and laptops for at least 10 years this particular one has been an issue,18.5.0.5369,2025-11-14T11:32:33,us,Google Play,0,,
5474937d-f1ea-4edb-8bde-21cb20dc4513,Mohammed Borham,1,,Now the app is forcing color printing even if I'm printing black and white,20.1.2.5988,2025-11-14T10:33:56,us,Google Play,0,,
4375933c-667c-40a0-93b2-b1d60dbc0024,Thoko Masango,5,,it's a good idea,20.1.2.5988,2025-11-14T09:55:11,us,Google Play,0,,
bb3989b4-6e8b-4e15-889b-b582dbba674f,jrsavoie,1,,we don't have wifi. this printer was supposed to be able to scan directly to the phones. it prints but doesn't scan,20.1.2.5988,2025-11-14T09:27:00,us,Google Play,1,,
735c93e5-a7d5-4da6-bb21-275cde9f59d0,Alin Marin,1,,"worst experience ever. 3 out of 10 prints actually gets through but still very slow. settings are burried deep tho ads are listed in the main page. every click refreshes the page and takes a lot of time to proccess unless you click on the ad, that gets opened up instantly",20.1.2.5988,2025-11-14T09:23:30,us,Google Play,2,,
4dc7a5d8-e8ce-498a-89be-cd0d67e095af,ROCKY-TIGER KING,5,,WELL IT IS SIMPLY AN EXCELLENT N VERY USEFUL N ALSO HELPFUL HIGHLY POPULAR TOTALLY FREE HP APP SIMPLY TO CONNECT N ALSO SYNC BETWEEN YOUR MOBILE SMARTPHONE N YOUR ANY KIND OR TYPE OF HP PRINTER 🖨 MACHINE AT HOME 🏡 OR OFFICE 🏢 HIGHLY RECOMMENDED TO HAVE N USE THATS ALL AND THANK YOU ALL SO SIMPLY ENJOY AND SMILE ☺ 😃 😊 😀 😄 😁 😆,20.1.2.5988,2025-11-14T08:34:20,us,Google Play,1,,
aadebadd-aef5-43e9-8954-a8a007640ca6,Will,1,,Much like the printer itself; this app is official trash.,20.1.0.5822,2025-11-14T07:56:29,us,Google Play,0,,
5b9c5ebc-4ade-4dc1-8f1a-4b52ff11b3ca,Richard k,1,,disappointed,20.1.2.5988,2025-11-14T07:30:10,us,Google Play,0,,
f8e62b7e-b986-423f-871e-9ee3f2883bcd,Kathleen Golembiewski,1,,unable to hook up.,20.1.0.5822,2025-11-14T07:16:55,us,Google Play,0,,
881c05b3-9d99-4f72-9661-4dddb318674c,MarcoCacho vlog,2,,"So lees possibility to customization my document, images before printing. I can't even decide if is color or b/w",20.1.0.5822,2025-11-14T06:11:00,us,Google Play,0,,
1af1478a-f4ba-4b12-a482-6a75776e0f28,Laura Gott,5,,"WOW! I've read only ONE positive review on this app. I just got a new Envy Inspire printer with HP's ALL IN plan and am getting ready to set it up. Now I'm afraid to even try since it sounds like I'm in for a real nightmare and hours wasted. Will let you all know how it went when I'm finished. 🙏🙏 Wish me luck plz. . . 11/13/25. Hello all! here's my update: after going thru the setup process thru HP Smart, this printer is working fine and no problems with the app so I am upgrading to 5 stars",,2025-11-14T03:13:47,us,Google Play,0,,
1cba2e37-9653-47e0-8ce6-aacec0608d93,Mihai Vasiliu,1,,You cannot scan without being logged into HP account. You are the worst. Will never buy HP again in my life.,20.1.2.5988,2025-11-14T02:32:55,us,Google Play,6,,
6d27eb41-589d-438c-84a3-7371b9af91ab,Alan Malnar,1,,Could not connect over mobile network Its 2024. Edit. Camera scan is just soooo bad its unusable,20.1.0.5822,2025-11-14T01:54:22,us,Google Play,0,,
99c0c0fd-db9a-4ea8-a57f-212a079d2093,Ladislav Dado,1,,deskjet 3639 is invisible to this app,,2025-11-14T01:36:13,us,Google Play,0,,
f2239331-3fc6-44cc-a5b3-7762c6879129,Hiskii,1,,I liked HP smart. This new update ruined it. This an exemple of a good app turned into trash,20.1.2.5988,2025-11-14T01:16:15,us,Google Play,0,,
bc83a788-51fb-414d-9d8f-59c7b26ec77a,Te Riupawhara Mariu,5,,easy and fast to use great app,20.1.2.5988,2025-11-13T20:55:46,us,Google Play,0,,
143951a3-cba9-4a03-a1bc-5bcbdf0d4d6f,Alfred Allen,4,,"I hate the new updates, I can't find my instant ink account but I got an email that I will be charged soon.",20.1.2.5988,2025-11-13T20:00:21,us,Google Play,0,,
71592fd2-eb5f-4989-8241-f1bd067307c7,Ronald Kennedy,1,,"You are so lucky, I can't even getin the front door. the Site says download from Microsoft App Store - doesn't work - then I find download from Google Play - doesn't work - then go to the HP Website see it is installed on all my devices - oh no it isn't. red flags every where! .. more fool me - I thought I had found a bargin - bought two - bring them home and no OS to run them! maybe better mas a brick to keep the door open -no use as a printer. free ink - great !!! but no OS!",20.1.2.5988,2025-11-13T19:57:00,us,Google Play,2,,
e104f04f-3ee1-45ef-a2e9-5b62fde016cc,Calvin Yong,4,,"Downgrade of app experience after the latest update. More steps to reach the action dashboard, and some loading time after each action selection. Prefer smoothness of previous version",20.1.2.5988,2025-11-13T18:08:40,us,Google Play,0,,
2978887e-ab31-4f30-85fe-6b1465c2b843,Judy Faigle,1,,it wouldn't let me enter my password. it kept glitches and wouldn't let me continue even with a keyboard to type.,,2025-11-13T16:27:28,us,Google Play,0,,
fbde04e1-992a-4a82-a33f-0704a96cba68,Qaisar Ijaz,1,,not god wark,20.1.2.5988,2025-11-13T12:33:31,us,Google Play,0,,
693e9925-e34e-4263-bb85-ff92b4edf6e7,Luke Macdonald,1,,Can't print a document at it's actual size. You would think it could print a large image over a few pages. I've been doing this for years. Also I have to sign into my account just to print a piece of paper. Why do I even have an HP account? Nov 2025 update: still sucks.,20.1.0.5822,2025-11-13T12:02:20,us,Google Play,1,,
31514159-b53d-4787-8d68-44ec52331586,ANDY CLAYTON,1,,unable to access account,20.1.0.5822,2025-11-13T10:36:52,us,Google Play,0,,
4a4a7951-2727-495d-8645-c2320105d3bd,D&D Bell-Hise,1,,"on most review boards, you will see the company's response and advise to steps needed to fix the problem. I find it enlightening that NO WHERE IN ALL THE REVIEWS IS HP REPLYING TO HELP ANYONE WITH THE PROBLEM THEY ARE EXPERIENCING, USING THIS APP OR HP PRINTERS OR INSTANT INK ISSUES OF LOCKING UP YOUR PRINTER. My mind has been made up for me after reading many reviews and finding no responses from HP. I WANT NO PART OF HP OR INSTANT INK. PERIOD THE END. I SUGGEST YOU READ THESE REVIEWS!!",,2025-11-13T10:00:03,us,Google Play,0,,
0d5bdea0-6839-4b8b-b781-45992fb6b167,Anastasia Stan,1,,"my printer dosent work anymore and the app? dosent even tell me what to do exactly, I hate this app.",20.1.0.5822,2025-11-13T09:11:34,us,Google Play,0,,
8c38d3bc-8ad5-4f76-b937-533e690fdccc,Alia Masri,1,,"Hpsmart before much more easy that now update version, i can't print anymore by using connect to my phone",,2025-11-13T08:58:22,us,Google Play,0,,
6de9ebb7-f33d-445b-a9e4-0abee68842a1,Mit Soni,1,,I lost my printer from wifi network and mobile device in new update app. here not re setup in printer 1188fnw to mobile to wifi network.,20.1.0.5822,2025-11-13T08:21:26,us,Google Play,0,,
8975babf-a4df-42f8-bf65-4828a7f25f28,John Heritage,1,,"usually I get a blank screen and have to login to the website, which is not much better. The old app worked well. If it ain't broke...",20.1.0.5822,2025-11-13T08:04:25,us,Google Play,0,,
2740fa0d-1241-482e-b26f-e827a85077b3,Pete Hermosillo,3,,this product works some times and then updates is where the problems begin.,20.1.0.5822,2025-11-13T07:30:04,us,Google Play,1,,
1f63e57d-3d81-489b-90e6-0336d28a4a13,Charles,1,,"App no longer allows scanning with one's smartphone. NOT VERY SMART, HP",20.1.0.5822,2025-11-13T06:39:36,us,Google Play,0,,
1154fdcc-8308-40c3-83f5-672e6537f367,Meghan Nixon,2,,"They updated the app, and it's not a good update. Everything is harder to find and it's really slow now :(",20.1.2.5988,2025-11-13T03:51:16,us,Google Play,0,,
86cf1e69-a478-4d48-a115-560ba1150b56,Ramakrishna Jaami,5,,good,20.1.0.5822,2025-11-13T03:30:20,us,Google Play,0,,
c1fd3be3-94f7-481e-ad66-ab8f2a24bd16,Adam Harp,3,,The Hp 4155e is the least user friendly printer ever made.,20.1.0.5822,2025-11-13T01:25:03,us,Google Play,0,,
37abe519-bc98-456e-a6d4-eaa1bcbf5ca0,Lisa Salandie,4,,"Awesome service, it takes a while to get to the printers status but other than that, super ok.",20.1.0.5822,2025-11-13T00:39:41,us,Google Play,0,,
a15b52da-5cdb-4216-b303-4f5fc20a4ac6,Bipin Chambariya,5,,achha he Sab kuch dhnag se ho jata he,20.1.2.5988,2025-11-12T19:27:59,us,Google Play,0,,
e1e978f7-c30c-40fd-94fe-2813d830d479,Makayla Bates,1,,"Terrible. App doesn't work, their printers don't work either. If their goal here was to fail, they're doing a great job at it. It doesn't let me print, I have to sign in every time I want to print something, it slaps $40 ink cartridges in my face (same price as the entire printer btw), then tells me the ones I brought don't work. I've spent an entire hour trying to get it to work. Even softly cleaned the damn machine for nothing. Don't waste your time with this greedy company. App and all",20.1.2.5988,2025-11-12T17:42:28,us,Google Play,11,,
86cdec07-6156-4e5c-a52b-78f89eecb8d7,Daniel Bollenhagen,1,,they got rid of the hp smart app and now my printer won't connect and the troubleshooting is terrible,20.1.0.5822,2025-11-12T16:30:30,us,Google Play,1,,
