id,author,rating,title,content,version,date,country,platform,vote_count
161d449c-31a6-4f72-bbe9-47401a4447af,Lorna Barnes,1,,still cannot setup printer. This us fraud. This was very easy in the past Now it's ridiculous. I spend hours trying to get it on my phone.,26.1.3.6477,2026-05-14T03:48:31,global,Google Play,0
626a2cdf-2245-4790-b7f5-71ea230b704f,Masquerade Rue,1,,I switched to a different wifi network and now my printer is basically a brick why is it so hard to just switch networks within the app?! It just keeps saying it doesn't connect or my password is wrong,26.1.3.6477,2026-05-14T03:43:46,global,Google Play,0
b0f59828-f255-4908-a909-7a971bd09560,Wokky Minniecon,1,,"This app is just terrible to use. It's very slow and oftentimes bugs out. If I'm attempting to do a batch scan of about 10 pages, it'll get half way through then the app will glitch and I'll have to restart the whole process again. The scan option to a cloud service, OneDrive in my case, will work sometimes and won't other times. The home page has ""popular"" features which consists of camera scan and mobile fax, both of which I've never used so I don't know how they're popular.",26.1.3.6477,2026-05-14T02:41:14,global,Google Play,0
633b47b8-a61b-4448-8cdb-8f15a5ddeae6,CESAR MAZZEi,5,,HP é Primazia sem Comparação !!!,,2026-05-14T02:04:47,global,Google Play,0
3863d230-1fa1-447e-b6e9-428aa70cd8eb,Jacob Kranendonk,1,,"'Installatie (van hp of HP) in behandeling.' Ik ben benieuwd naar wat en naar 'hoelang wachten' HP bedoelt met: binnenkort geïnstalleerd Volgens (naar mijn mening waarschijnlijk) de Google Play Store zou ik nu pas mijn HP-app kunnen openen, naar mijn mening pas na een download-installatie- en behandelingstijd waarin ik vele uren geduld moest hebben die nog voor mij aanvoelen als jaren.",26.1.3.6477,2026-05-14T00:46:37,global,Google Play,0
f8b0d811-df69-4cba-83f3-9679aa05e475,William Smith,2,,2mb file size not big enough,26.1.2.6449,2026-05-14T00:44:03,global,Google Play,0
c54db815-b171-4a7f-ac12-b7a94f7b5155,Mohammed Mizanur Rahman,5,,very good job,26.1.3.6477,2026-05-13T23:41:16,global,Google Play,0
9c8455cd-c127-4ae0-85bb-8f52247f6950,Jamy Jamy,2,,very slow. and lag while opening the app,,2026-05-13T21:54:16,global,Google Play,0
eac48109-0205-4b90-ae6a-6825c1d36198,ravindra gobin,1,,"this is very difficult to set up. too much trouble, printer now showing up etc. total waste of time. honestly",26.1.3.6477,2026-05-13T21:41:47,global,Google Play,0
b3771f21-9cdd-4b38-9b6e-0d745100e143,Josue Torres,1,,HP Printing is scamming their customers. 0-10,26.1.2.6449,2026-05-13T21:28:20,global,Google Play,0
e08ced1d-e97c-491f-9992-898d6ff53542,Sara Ferreira,2,,"Depois da última atualização ficou horrível. Não conecta mais, nem com o wi-fi de casa e nem o dela. Corta todas as impressões.",,2026-05-13T20:31:15,global,Google Play,0
15258c20-5cf6-4ddd-bb2e-3ee5f4182ed4,Fernando Castillo Belinchón (magomerlin61),4,,Con la última actualización ha mejorado.,26.1.3.6477,2026-05-13T20:02:17,global,Google Play,26
41a2007f-7332-44da-ad6f-16c04a4e4a57,Claire McLaren,1,,"I have never experienced so many issues setting up a printer in my life! Between the PC and phone, it took 29,643 tries to just connect to the printer. Now I will be clicking on this link for HP instant ink for the foreseeable future, because every time I do, it takes me back to the home page. I'm already on try number 16,489. Absolutely useless! Please bring back plug and play printers! For all our sakes.",26.1.3.6477,2026-05-13T19:56:14,global,Google Play,0
144d5c0d-3075-489a-9494-2ca743ad16ff,Carlos Chacon,2,,Dell es mejor,,2026-05-13T18:08:32,global,Google Play,0
37b2f09c-8762-4c61-83bd-69117ff4f45e,Joice Freitas,1,,"Pelo notebook, eu simplesmente não consigo imprimir nada. Mas pelo cllr, até que dá certo. Porém, sinto muita falto de um recurso para imprimir frente e verso. Acredito que há muitas coisas para serem melhoradas nesse APP.",26.1.3.6477,2026-05-13T17:50:08,global,Google Play,0
6610502c-92d3-4d84-b45e-7546f1b88110,Andrea D'Ambra,5,,ottima!!,26.1.2.6449,2026-05-13T17:33:56,global,Google Play,0
2f8c850b-4b40-45cc-bd6a-e0dedde179e6,Marie-jeanne NANO (Nano),5,,très bien,26.1.2.6449,2026-05-13T17:14:59,global,Google Play,0
8c122405-71f7-4470-a7bd-67abac98ec1c,A Google user,1,,Doesn't work,26.1.3.6477,2026-05-13T16:23:33,global,Google Play,0
8197bb20-fc20-40f6-a4be-584a6cdf9a3f,khondokar mamun,5,,Fast & Faster,,2026-05-13T15:47:41,global,Google Play,0
e978d61a-7963-42dc-b350-18cf2c977b1e,Joaquim De Sousa n,5,,ótimo,26.1.2.6449,2026-05-13T15:43:39,global,Google Play,0
17f08146-17e7-4f48-8192-e1e209449d04,Onuh Emmanuel,1,,The App is no longer connecting with my printer after the lastest update 😕😔,26.1.3.6477,2026-05-13T15:40:07,global,Google Play,0
5a4b51be-9977-4f48-8966-6fd6b875172a,risingsoul,1,,"Die App hat nicht einmal eine Skalierungsfunktion, lediglich an Seite anpassen, das wars, unbrauchbar.",26.1.2.6449,2026-05-13T15:22:24,global,Google Play,0
6f68c19c-9ce0-4f37-98f0-8a4182f47dc8,Wellington Well,1,,Precisei criar uma conta HP para usar minha impressora que está ao lado do meu computador,26.1.2.6449,2026-05-13T15:05:09,global,Google Play,0
62c150ea-0039-45a6-951b-aaf2e934d6ef,Amin Mohsenzadeh,5,,Perfekt,26.1.2.6449,2026-05-13T14:30:50,global,Google Play,0
3b46a519-b70e-4281-85fb-e7dbc84972a0,Mohammed Aly,1,,"You think you buy HP, but actually they buy you and make decisions for you. I bought HP printer but the PRINTER doesn't accept the compatible ink meanwhile HP stopped producing the ink.",20.2.0.6076,2026-05-13T14:14:02,global,Google Play,0
688344b8-61e4-444c-9594-3c229aec7c02,Paula,1,,"no encuentro mi impresora, no puedo descargar el software",26.1.2.6449,2026-05-13T13:52:55,global,Google Play,0
bc20622d-7ca3-44c0-954e-86d3aec4af81,Nico Sosa,1,,"una cuenta para escanear, una cuenta para imprimir, para que tengo que decirles mi mail si quiero usar el scanmer de la impresora en mi red local?",,2026-05-13T13:39:26,global,Google Play,0
9c06aba3-f25e-414c-bbca-808044c6c2d0,Luca Alimandi,1,,"Ogni volta per stampare è una tragedia sia da PC che da telefono, problemi continui di connessione errori mai più hp",26.1.3.6477,2026-05-13T13:18:41,global,Google Play,0
64b2d2a5-a099-4639-b9f0-050b1fcb1f93,Magda Cruz,1,,no sé las recomiendo,26.1.2.6449,2026-05-13T13:17:04,global,Google Play,0
8561998a-2639-42e4-86e7-9cb3c89da622,Jorge Miguel Justo Oliveira Oliveira,5,,HP é uma excelente marca de impressoras e também de computadores HP é 5 estrelas,26.1.2.6449,2026-05-13T13:10:30,global,Google Play,0
97461522-ae6b-48c4-a54c-3873286a1627,guiton stefan,1,,no marche pas,26.1.2.6449,2026-05-13T13:05:35,global,Google Play,0
2ee0a047-c3c5-4044-9796-0bfaa76de0ef,Raffaele Santagati,1,,horrible experience. the few times that works and doesn't ask you to login again the support it gives you is non existent,26.1.3.6477,2026-05-13T09:48:13,global,Google Play,0
01c898e3-c672-47d8-ae07-e7cda52af140,LaTanya Green,5,,"super easy-to-use, set up, and operate.",26.1.3.6477,2026-05-13T06:55:08,global,Google Play,0
1e23f6e3-edac-4a02-8f9a-f3ef3e97cab1,Kevin M,1,,id rather smash my thumb with a hammer then use my new HP printer,26.1.2.6449,2026-05-13T06:52:51,global,Google Play,0
28886f31-2cae-47f9-9cbe-7322c9283e35,Isa Hxdin,5,,"C'est intéressant d'avoir ça quand notre imprimante rencontre un problème, au moins ca permet de savoir quel est le problème afin de le résoudre",26.1.3.6477,2026-05-13T05:25:06,global,Google Play,0
38125e1d-6d2b-412d-9f3b-e30616ff63bd,Jesùs Aguilar,1,,no merece ninguna estrella pues ka impresora es nueva ne acaba de llegar pero no me permite imprimir nada asi que la devolvére hoy mismo pues nesecitava imprimir y no me lo permimitio y la ayuda que ofrecen es solo apagar y encender y ni asi me dejo imprimir,,2026-05-13T04:06:03,global,Google Play,0
d2f5840a-2abd-4018-b987-b018da237bc8,K QM,1,,al momento de escanear se congela o tarda demasiado y se pierde todo lo escaneado,26.1.3.6477,2026-05-13T03:52:34,global,Google Play,0
4b8dd799-0709-426a-91cf-33611289f8b5,Anita Rayner,1,,Terrible says it will install laserjet printer but doesn't. not very conducive or productive for me.,,2026-05-13T01:53:03,global,Google Play,0
3934a5b3-d707-4155-9524-05aa63086bb7,Joy Kozume,1,,laging nag eeror alpota tapos need always mag sign in,26.1.3.6477,2026-05-13T01:34:54,global,Google Play,0
b2711467-5506-41a6-ad34-740bb3930125,Daniel Sant,5,,sigue siendo una de las mejores aplicaciones,26.1.2.6449,2026-05-13T00:11:40,global,Google Play,0
9abafd8b-5d6e-433f-84e0-81687ff26dbb,Mrs Boocock,2,,This app started off good but lack of maintenance has taken its toll. This app has slowed down ALOT. it's struggles to load anything and at times won't load at all and you have to force close the app and try start again. it takes about 10-15 minutes to do something on this app that should only take a couple minutes if that.,26.1.2.6449,2026-05-12T23:02:47,global,Google Play,1
8e81907a-0f3d-4550-a8a3-4276287716bf,Eva SaCz,1,,"Nunca puedo conectar mi impresora a la aplicación. Se supone que es mediante WiFi pero nunca se conecta aunque el celular y la impresora tengan buena recepción de WiFi. No puedo hacer nada desde el celular, TODO debe ser desde alguna laptop porque en caso contrario no hace nada.",26.1.2.6449,2026-05-12T23:02:38,global,Google Play,0
06d7c306-c12d-45d7-8bc7-9d94dcf397cc,Manoel Maria Oliveira Dias Dias,5,,super recomendo impressora hp,26.1.2.6449,2026-05-12T22:45:32,global,Google Play,0
1c173a0f-2811-4c05-8b4a-bec1d4fc692f,Willie Hammonds,5,,The ease is incredible,26.1.2.6449,2026-05-12T22:06:18,global,Google Play,0
3b21c568-e1d1-4a5c-91a4-1372395e26cf,John Cantalupo (Widmer Wonderland),2,,"This app is barely OK. I don't understand why my preferences are not saved. If I scan a document the default save method should be PDF. I have to change it every time I use it. The file structure always sorts by date, even though I sort from a to z every time I use it. Nothing is remembered. These simple things make this app extremely aggravating to use.",26.1.2.6449,2026-05-12T22:00:39,global,Google Play,1
ac004e87-d181-42ca-89bd-5e18c5973462,Luiz Guilherme,5,,app excelente ❤️,26.1.3.6477,2026-05-12T21:37:49,global,Google Play,0
7e4cf5db-b828-4fb8-ab80-f6448e45eaba,P.J. O Donoghue,1,,useless,26.1.2.6449,2026-05-12T21:15:14,global,Google Play,0
3f162ac5-3a22-4f2e-a910-5381d7f10484,Thiago BG Guarin,1,,"está aplicación es super mala,llevo como 15 días tratando de instalar y no es posible",,2026-05-12T19:51:17,global,Google Play,0
a401cd35-1e15-4d45-b629-db79ac04941d,Livexys Leonardez Mendoza,5,,me encanta,26.1.2.6449,2026-05-12T19:48:27,global,Google Play,0
f3360593-1cb3-4c42-9f6f-f29afecb2c47,Johannes Rendering,2,,"Een misser dat alleen maar foto's en pdf-bestanden via de app geprint kunnen worden. Waarom geen word-bestanden??? De melding dat de printer niet verbonden is, verschijnt wel erg vaak!",26.1.2.6449,2026-05-12T19:11:36,global,Google Play,0
28f7e8f2-97ac-4e77-b319-f50c5e3380c0,Dominik Zeus,1,,"Es ist Klasse das ich eine App installieren muss um Scannen zu können und noch besser das jede einzelne Sache die man bei Einstellungen verändert dich sofort auf eine Website wirft. Da macht die App echt Sinn falls man mal das Internet nicht findet. Und das beste ich kann keinen Pfad hinterlegt, das heißt bei jedem Scann brauch ich mein schei... Handy, anstatt es an eine Email zu senden oder auf einen festen Ordner am PC zu verknüpfen. Extra eine App runtergeladen und keine Einstellmöglichkeit",26.1.2.6449,2026-05-12T17:14:35,global,Google Play,1
70b57663-4bc1-494e-b252-e615bcbf5270,Karlheinz Gross,1,,"Wirklich der letzte Dreck! wenn man eine Rechnung für die Buchhaltung ausdrucken will, muss man sich zweimal (!) anmelden umd gefühlt 50-mal rumklicken. Schon vor dem jüngsten Update waren viele Funktionen umständlich und Glückssache. So bedurfte es einiger Suche, Anmeldung und Klicks, um eine ordentliche Monatsrechnung vom Abo auszudrucken. Nun führt das gleich zu einer Fehlermeldung. Nachtrag: Jetzt läuft es wieder, aber halt nie richtig rund, geschweige denn schnell.",26.1.2.6449,2026-05-12T17:08:07,global,Google Play,0
29cee2a6-98cc-4253-9e22-7856e5577139,Ser Sabio,1,,garbage customer service,26.1.2.6449,2026-05-12T16:22:54,global,Google Play,0
bc5ad11a-34ca-4b37-8533-c5283af17a96,Maria Ester Zuñiga Valenzuela,1,,no me toma wifi para imprimir,,2026-05-12T15:51:48,global,Google Play,0
b0e7304c-58b2-41e9-a6e8-9a0ce1120839,Wolfgang Hahn,5,,Seit 1 1/2 Jahren nutze ich die App einschließlich Drucker mit 3 Handys und 2 Tablett durch 4 Personen und wir sind sehr zufrieden.,,2026-05-12T15:28:11,global,Google Play,0
21bde124-e0be-46e5-aac9-872f5e897ca0,Thomas Steinicke,1,,Das ist so ziemlich die mieseste App die mir untergekommen ist. Die App ist Schrott und funktioniert überhaupt nicht. Bitte überlassen das erstellen von funktionierenden App's den Chinesen. Drucken ist nur vom Notebook im W lan möglich. Auch die Vielfalt der App läßt zu wünschen übrig. Mich wundert es ehrlich nicht das hier eine Patronenhaltbarkeit von bis zu drei Jahren versprochen wird. Der Kasten druckt einfach nicht. Ich Drucken zur Zeit wieder auf meinem alten Samsung 1860 da läufts !,26.1.2.6449,2026-05-12T15:23:54,global,Google Play,1
2a047969-0e61-4a51-9e10-7519e10f931c,Yvan Broux,4,,installation imprimante avec hp smart OK,26.1.2.6449,2026-05-12T14:31:33,global,Google Play,0
10693103-42e1-4c4a-9b30-d5103f83e518,Gleb ES,3,,Very slow. Why do I need to wait for an internet connection to be established to work with the app? Are you using iframes?,26.1.2.6449,2026-05-12T14:29:52,global,Google Play,0
de4082d9-1ddf-4d11-b1f1-873d0144328f,Marcello Usai,2,,"Avrei necessità di fare la pulizia delle testine ma dall'app pare impossibile, il caricamento del comando è infinito e non va mai a buon fine. Ciò mi costringe a non poter stampare a causa di questo disservizio, e non posso sentirmi costretto ad avere un pc per una semplice stampante",26.1.2.6449,2026-05-12T13:59:09,global,Google Play,0
c36754b2-b702-4da1-9d1a-19549d99998b,Bashe Abdille,5,,super,20.2.0.6076,2026-05-12T13:42:55,global,Google Play,0
44cd5894-a21c-4f94-8f12-1cb108efeda9,Robert Kosynsky,3,,kan terug installeren printer installeert niet de Pin van de printer?.,,2026-05-12T12:53:59,global,Google Play,0
68de4511-318b-4da4-a9cd-98c7492bdfd5,Sabin Dimitrov (Karakachan),1,,"Yo, I have no idea what in the whole world you guys did in the last update but I cannot detect my printer and I cannot send faxes or scan things remotely. I don't know what is going on but please fix this.",26.1.2.6449,2026-05-12T11:58:38,global,Google Play,0
e38a17c3-5979-4673-8e36-03a95b6050f3,Jan Douven,1,,Werkt niet meer op telefoon na vakantie App moet elke keer vialaptop geimstaleerd worden voor afdruk,26.1.2.6449,2026-05-12T10:42:16,global,Google Play,1
6d1c5239-5a39-44cd-8024-ce608cd387b2,Elodie Maréchelle,1,,"mon imprimante peut faire du recto verso en manuel, cela fonctionne bien sur pc. Mais ici ce n'est pas proposer. et si je fais plage par plage, j'ai eu un ordre inverse la première fois puis ordre normal la deuxième... du coup mon document est dans le désordre. ce serait utile que le recto verso manuel soit pris en charge pour qu'il n'y ait pas d'erreur. et comme j'ai pratiquement que des docs de plus d'une page, cela ne mérite qu'une étoile pour mon utilisation souhaitée.",26.0.2.6338,2026-05-12T09:10:58,global,Google Play,1
59fd274c-5bfa-4c26-8a48-dd09dfcfd3dc,Syukri Yusoff,3,,cannot find where button for files and photos,26.0.2.6338,2026-05-12T09:06:17,global,Google Play,0
446f7131-3a2a-4b6c-b829-e6c70c667d93,Ariff Nordin,5,,Nice. So easy to use,26.1.2.6449,2026-05-12T07:44:43,global,Google Play,0
32fb133e-9c74-4178-92af-24c856ab62ca,Fabio Gozzoli,1,,non funziona bene,26.1.2.6449,2026-05-12T03:23:00,global,Google Play,0
7dc68c54-124e-4337-922c-31625b39d4fb,Dehiler Gutiérrez,1,,no sirven,26.1.3.6477,2026-05-12T03:17:53,global,Google Play,0
98104082-dcf0-40ce-99ed-21a4689e864f,Susan Knudson,1,,troublesigningin.,,2026-05-12T02:34:47,global,Google Play,0
ff4d3eb3-6fe7-455c-acc6-5075ea5c4d80,Richard Arauz,1,,"Demasiados errores, cuando más ocupo imprimir, no imprime.",26.1.2.6449,2026-05-12T02:05:10,global,Google Play,0
5a1510f8-30cc-48fc-aca0-32e3ff638692,roesler gonçalves,5,,muito bom,26.1.2.6449,2026-05-12T01:06:32,global,Google Play,0
5d19677a-45be-44ee-b547-e9d9173a1230,Dê,1,,Começou o aplicativo a dar erro .,26.1.2.6449,2026-05-12T01:00:59,global,Google Play,0
ea294052-06ed-47d4-9b59-3ac6c883f54e,Francisco Neto,1,,"Que app ruim. Claro que depois da repaginada ficou bem melhor, porém uma coisa que tá me deixando muito irritado é que quando coloco pra imprimir documento as vezes dá pra escolher o tipo de papel (fotográfico, por exemplo) e na maioria das vezes não, o que é isso? Dá umas travadas e as vezes é lento.",26.1.2.6449,2026-05-11T23:51:02,global,Google Play,0
b4e40e90-317d-43ea-b933-96d6f87005b6,J W,1,,"FRUSTRATING!! Trying to print pictures on photo paper. Tells me the paper source is incompatible, picture keeps going to black and white, after selecting print it doesn't print so I need to cancel and start over. Several times after going through all that it just reverts back to the starting page. What absolute hot trash. Made me so freaking angry! Ended up sending the 10 pictures to Walgreens.",26.1.2.6449,2026-05-11T23:33:43,global,Google Play,2
2bd91f48-0ea4-472c-90f0-7ae92eea43a3,Gon FB,1,,"falla constantemente. unos años después, sigue fallando, HP timais a la gente con vuestras impresoras, no se conectan la app no encuentra la impresora, luego si añades por número de serie tampoco valen todas las opciones, será mi última HP, a la basura",26.1.2.6449,2026-05-11T22:13:02,global,Google Play,0
de7e41da-7de4-4962-92ed-2c3cef513b1f,Elissadrina Rodrigues,5,,facilita o acesso. obrigadaaaa,,2026-05-11T20:17:06,global,Google Play,0
4da12d7b-03d1-4d2a-86d2-13add3cb28e6,Acylleconducteur Benkara,5,,"très intuitif, marche super bien",26.1.2.6449,2026-05-11T19:29:01,global,Google Play,0
f8e03364-e61a-4330-9656-b75dcaaaa82a,Yasir Iqbal,5,,needs fixing,26.1.3.6477,2026-05-11T19:16:51,global,Google Play,1
b39bbeeb-eda6-40e7-a9dd-8f458066b4c0,Alejandroo Ga,1,,just can't find the printer no matter what I do,26.1.2.6449,2026-05-11T18:33:20,global,Google Play,0
59c684ed-e843-4db8-b794-a91cc1a30476,Juan Carlos Valbuena Espeso,5,,muy buena app,26.1.2.6449,2026-05-11T18:16:20,global,Google Play,0
4226f3a6-00f5-4a20-83dd-e07645542069,mohamed hicham ennaciri,1,,il marche pas car il veut,26.1.2.6449,2026-05-11T18:02:37,global,Google Play,0
23a5a677-381d-4e4a-b30f-38f99e2c2d7d,Carolyn Doyle,1,,not scanning properly in my fax,26.1.2.6449,2026-05-11T16:41:39,global,Google Play,0
c29d6845-e145-4628-a938-f0e64c06d08b,Eric Estevenon,1,,NE FONCTIONNE PAS,,2026-05-11T16:36:41,global,Google Play,0
904e6aa0-5c41-4e01-aea5-cf18d7d15c9f,J C,5,,cool,26.1.2.6449,2026-05-11T16:18:19,global,Google Play,0
69d51580-429a-445a-8c4e-bf6699eee554,P. René,2,,war schon mal deutlich besser.,20.2.0.6076,2026-05-11T14:42:11,global,Google Play,0
f28cb61a-2bd3-401f-9a43-2d7ad0f8f9a0,Couric Dssign,1,,"One of the most useless and poorly designed apps I've had the displeasure to encounter, makes the printer basically unusable, crashes constantly, the ux is trash...hobestly, not one good word I can find. All they look for is money and more product placement. Embarrassing. I'm giving away a new HP Printer, if anyone is interested, for free.",26.1.2.6449,2026-05-11T14:13:29,global,Google Play,1
3cad6aab-f20d-437d-af6f-ceca4ba42924,MaraCGJ,2,,"nao consigo ir adiante na configuração da impressora. As orientações levam sempre a repetir os mesmos passos, não levam para frente por link. estou com o mesmo status após inumeras tentativas",26.1.2.6449,2026-05-11T14:06:20,global,Google Play,0
fbeb4a77-2231-435e-b8ed-0c6045636af7,Lincoln Lee,5,,Very convinience,20.2.0.6076,2026-05-11T13:33:20,global,Google Play,0
faec89b1-4a88-40d6-8dab-6aee9092356a,jean pierre delava,1,,ne marche pas,26.1.3.6477,2026-05-11T13:20:13,global,Google Play,0
6e9cb6f6-1762-488f-baa5-1a08a201a5c7,tnfcrl,2,,L' app non funziona più e quando vi decidete a provvedere? Una persona non può ritrovarsi a non poter utilizzare la propria stampante per colpa vostra 🤦‍♀️🤦‍♀️🤦‍♀️....Ma non vi vergognate nonostante le recensioni negative a non provvedere a far funzionare nuovamente l'applicazione?? è più di un mese che non funziona🤬🤬🤬🤬.... aggiornamento recessione: Finalmente l' applicazione è tornata a funzionare 🥳,26.1.2.6449,2026-05-11T12:42:38,global,Google Play,0
37259d99-bd53-4120-a9d1-e32664bd371b,Sarah Le Guerinel,1,,On ne peut plus paramétrer le nombre de pages par feuille (exemple 2 pages d'un PDF sur une seule feuille imprimée).,18.10.0.5530,2026-05-11T12:09:38,global,Google Play,0
48fbf1c0-da7c-47b2-ab35-e7315838c0a6,luca,4,,peccato che la mia multifunzione sia solo a caricamento manuale,26.1.2.6449,2026-05-11T11:34:57,global,Google Play,0
0590487a-635f-4662-85f5-9751876d6e59,BOOSHALAA BOOSHALAA,1,,برنامج حقير تافه لا يعمل كلما حاولت الإتصال بالطابعة فشل تام. سىراق,26.1.2.6449,2026-05-11T11:06:02,global,Google Play,0
4fc42b7b-8065-46a6-b22f-c72c4079213b,Andrew Szadkowski,1,,"Jedna z najgorszych, aplikacja widzi stan twojego tuszu (kup instant ink) ale jak chcesz drukować, magicznie nie widzi twojej drukarki.",26.1.3.6477,2026-05-11T09:21:21,global,Google Play,0
ac20e445-d614-4a51-a950-92ad44b3fab9,Dun,1,,"No puedo seleccionar las hojas a imprimir, una decepción, antes si me dejaba pero ahora el menú no baja y no lo permite",26.1.2.6449,2026-05-11T09:02:54,global,Google Play,0
92d9d63f-d626-43fc-ad5b-e292b3497530,K. M.,4,,Langsam...,26.1.2.6449,2026-05-11T09:00:43,global,Google Play,0
eb0a70fd-2c93-4e86-9709-e05f0251054a,Armando Castañeda,1,,te cierra la sesión todo el tiempo y ya no te deja volver a iniciar a menos que descargues Firefox,26.1.2.6449,2026-05-11T07:29:49,global,Google Play,0
7099c84e-ea90-443a-9f81-0dd479318f82,Carl davis,4,,"App in the past was not opening unless I un-installed and re-installed, however since around the 1st of May it has corrected itself and or developer made some adjustments, so far,so good, let's hope it stays consistent and functional, new look is great !!",26.1.2.6449,2026-05-11T05:43:27,global,Google Play,56
fd580664-8cb8-4768-b2b6-ed009885c34e,Diane Fortin,1,,"always getting connectivity problems, error messages , very difficult to manage ...always when I need it. I cancel the print jobs and resend it only to find out it will print out anyway...or partial document...horrible to use",8.9.0.56,2026-05-11T00:09:49,global,Google Play,1
2d8e62e8-8a3b-438f-8182-23b674b61412,Gabi Nogueira,1,,"Ultimamente o aplicativo tem dado cada vez mais erros, mais falhas, me deixou na mão várias vezes.",,2026-05-10T20:47:17,global,Google Play,0
ccca5f49-4b97-4412-a464-d9f2e83da1de,Mark “EliteChaos” Davis,2,,The more HP keeps getting hacked and dug into and all their customers info keeps getting stolen and I think it's something that keeps reoccurring about once a month it just keeps making their products harder and harder to connect to and dealing with all Passwords and numbers and WPS and serial numbers and I tell you what it just took me almost an hour and a half to connect to a little tiny printer that shouldn't have had that many problems and let me tell you guys if you agree to the cartridge,26.1.2.6449,2026-05-10T20:05:53,global,Google Play,1
bcaab9bb-1086-4325-9a22-3523cf260462,Tony Günther,1,,"Ich begreife nicht wieso ich mich in dieser App anmelden muss, wenn ich etwas im Heimnetzwerk drucken will. HP der schlimmste Druckerhersteller für mich. Katastrophale Software.",26.1.2.6449,2026-05-10T19:48:40,global,Google Play,1
dce598eb-78af-472a-88ae-e10126bdca23,LOLITA RUBIS,5,,simple d'utilisation et tellement pratique.,26.1.2.6449,2026-05-10T19:43:09,global,Google Play,0
f4a45031-fa30-4e02-a5fe-e223b1f96b30,Warren Fox,3,,"This is a decent enough printer when it works. Every month or so the printer gets locked up requiring a reboot to fix it. None of the HP help articles will suggest a reboot, instead the blame is put on the user to reboot your router and other unlikely sources of trouble. Just reboot first and remember you bought a cheap item.",26.1.2.6449,2026-05-10T19:32:04,global,Google Play,1
9308fd4f-a286-42ce-ae49-0dfb890ae1c6,Jose De Jong,5,,super Gaat heel snel Ben er blij mee,26.1.2.6449,2026-05-10T18:11:54,global,Google Play,0
ff304b0e-055a-4ed1-902c-1598209fb207,HoooV cz,1,,"penso non esista un servizio peggiore di hd, app non funzionante, servizio clienti inesistente, non parliamo della stampante. una volta funziona 5 volte no. abbonamenti e attivazioni incomprensibili, magheggi per non farti capire nulla. se potessi mettere -1 stella lo farei ora. solo una parola, schifo",26.1.2.6449,2026-05-10T16:53:56,global,Google Play,0
8eaab378-d9fe-4d72-bb8f-a69e5098c591,Sven Weiss,1,,"eigentlich nicht nutzbar, funktioniert zu 80 Prozent nicht",26.1.2.6449,2026-05-10T14:45:36,global,Google Play,1
4a9d5966-17a6-4e26-ac37-ac13a46f7180,RYAN HIDAYAT DAHLAN,1,,there always have a problems,26.1.2.6449,2026-05-10T14:05:12,global,Google Play,0
0290d84d-4c42-4175-aad8-d933853a9228,R Parthasarathy,5,,very nice device very useful for home scan and emergency print,26.1.2.6449,2026-05-10T13:36:25,global,Google Play,1
dd2bb8c2-20e9-449a-a1d5-0c7648ed5d89,Charles Dooley,1,,Does not support my printer,26.1.3.6477,2026-05-10T12:52:02,global,Google Play,9
54d0f0ff-58c4-47e9-be60-dee12f318ff6,Lutz Liebau,1,,sehr schlechte App kein HP wieder,26.1.3.6477,2026-05-10T12:25:49,global,Google Play,1
