id,author,rating,title,content,version,date,country,platform,vote_count
4e81c6d1-86d9-444a-9f29-11f522e1ede2,None,5,,I know it sucks but this is how I got around the crashing part. I just cleaned the cache and storage retyped everything and it connected good again...I know some ppl don't like the trouble... but if you have time it does the trick everytime ...good luck!,26.0.2.6338,2026-03-19T02:13:14,sg,Google Play,5
1f1d2dd4-4d08-4ab2-95da-dd411db8f658,Michael Hasso,3,,"As mentioned earlier, the app never loads. After a few restarts I got into the printer setup, but it’s stuck and the next screen never loads. Is the setup normally fast?",20.2.0.6076,2026-03-19T01:38:26,sg,Google Play,0
dcf73bbc-fdcd-487d-a28c-1148c56dffc0,Jade Bridgwood,1,,"not all that easy to use. lots of back and forth. Just poorly designed. cannot get my head around the fact ive bought and paid for the printer, but the only way I can use it is with a log in, and a mobile device. absolutely recommend doing more research and buying a different brand.",20.2.0.6076,2026-03-19T00:46:45,sg,Google Play,1
d66498ab-b01a-4d1e-b820-2a9b0b37079c,Michael S.,1,,"Die App ist funktioniert sehr unübersichtlich, wenn überhaupt und die Drucker wollen die Druckprogramme nie direkt annehmen. Immer muss man mehrere Minuten warten, Papier rein raus, in der App nochmal rumdrücken, bis man dann mal sein Dokument bekommt",20.2.0.6076,2026-03-19T00:38:19,de,Google Play,0
0aef7b05-f751-4e56-9091-428e8fd73d6d,Jean-Louis LEE,1,,Depuis votre nouvelle modification mon imprimante est inutilisable. Je vais m'empresser d'acheter en URGENCE une nouvelle imprimante... mais chez HP,26.0.2.6338,2026-03-19T00:32:04,fr,Google Play,0
cd9efd51-38d9-4ca1-8542-0d7917c9ad72,P Paoli VIP,5,,J'imprime enfin A3 en couleurs (bug fixé) Cela faisait 1 an que mon imprimante n'imprimait plus en couleur le format A3. c'est maintenant résolu.,26.0.2.6338,2026-03-19T00:05:42,fr,Google Play,3
cd03aeb4-bfde-4f0d-abcf-1c2a19457957,Nataraj C V,3,,good hp,20.2.0.6076,2026-03-18T23:54:59,sg,Google Play,0
bc1b74ec-d9ef-45c5-857c-78d0bc2a6735,Artanis Z.,1,,"this will be the last time I purchase an HP printer. For several years now across a couple different printer models, there's a constant/consistent unresolved problem. It might print for me today a sheet or two, then it will go offline for everyone and every device in the house, HP app doesn't recognize the printer or says it's unavailable even though it just printed a few minutes ago. Experienced even this same issue in another country! it's an hp error and major failure/inconvenience. Fail",,2026-03-18T23:39:13,sg,Google Play,0
5eb469c1-17a6-4496-9579-70df7ae16364,Vinay Gera,1,,very slow and unstable. getting worse day by day,26.0.1.6280,2026-03-18T23:34:15,sg,Google Play,0
2343953a-9352-480f-bdf4-25639e6189f2,alitzel olivares,5,,bien,26.0.2.6338,2026-03-18T21:43:21,es,Google Play,0
5d51e389-e021-4b9c-8fd1-b90cdd1b1659,Mary Villanueva,5,,cambie de impresora funcionaba bien pero con la nueva ha dejado de funcionar,26.0.1.6280,2026-03-18T21:15:05,es,Google Play,0
442d980d-dd28-4479-9b97-d294249ea9a6,Cathy Habgood,3,,"it's fine as long as nothing happens works well enough until you need to connect your printer to a new wifi or device or the ink has an issue as long as there are no issues, it's fine. but printers never don't have issues so good luck finding information to actually help you fix it cuz HP isn't gonna help u",20.2.0.6076,2026-03-18T21:12:54,sg,Google Play,0
dcde85eb-88d2-4425-bca2-486909b4f802,Agente KC,2,,Limitado. Não existe o recurso de imprimir duas ou mais páginas por folha ou livreto. Até no Epson iprint tem esse recurso.,20.2.0.6076,2026-03-18T21:11:30,br,Google Play,0
1a3284b2-19a3-4db4-bc7a-b094a67de647,Brandi Nocera,1,,I'm having the same problems as others. I can't even get my app to open now. 😒,26.0.1.6280,2026-03-18T19:47:16,sg,Google Play,0
c14d013b-75ec-4685-8c9d-e8f4637d8bf8,Gail Timmer,1,,in French! I changed it numerous times. when went to add pairing Code everything comes up French.,20.2.0.6076,2026-03-18T19:46:11,sg,Google Play,0
a46c41fb-47f8-48db-8546-2d39eb674b23,Margie Mangus,1,,Trying to set up for printing is a nightmare.,26.0.1.6280,2026-03-18T18:25:39,sg,Google Play,0
653af7b0-38b6-47c3-ab62-d4b4fcd1150b,Alexander Sion,5,,excelente,20.2.0.6076,2026-03-18T18:10:16,es,Google Play,0
01b41791-f732-4e20-8ba1-29ccf3c4e27a,Viviana,1,,nunca funciona,26.0.2.6338,2026-03-18T16:58:21,es,Google Play,1
ef05bbd9-5c0a-497a-b3e8-f4af93e4cebe,Rayvion Johnson,1,,It just loads,26.0.2.6338,2026-03-18T15:56:46,sg,Google Play,0
98a9fb5c-86ef-4b92-95d9-1227c535a33b,Cícero Afonso,5,,muito bom,26.0.1.6280,2026-03-18T15:50:19,br,Google Play,0
420be77f-6b3d-4363-9037-13f313c0d8b1,Elisha Powley,2,,"Disappointed $10 week for the printer to run, so if you just need it randomly it's just too expensive. it took me forever to save for and we're a special needs family. so I'm off to save for a regular printer. the printer is pretty cool the app was cool a little messy to figure out, it's just not affordable if you are not working from home and have an office.",20.1.0.5822,2026-03-18T15:05:44,sg,Google Play,1
92d4b0db-a382-4eee-9cfc-5544f08261bc,Joanna “Crazontheinside”,2,,it was great but suddenly I can't load it... Just keeps trying to load with blue circle please help so I can fix and do a clean on printer and ill chage your star to 5,26.0.1.6280,2026-03-18T14:43:15,sg,Google Play,1
4b1c92e3-0bb7-4539-a136-a5da392813a6,Claudia Ka,1,,App lässt sich nicht mehr öffnen,26.0.1.6280,2026-03-18T14:42:21,de,Google Play,0
f6b6472e-bc40-459b-b86f-e2f33c08d236,Lorena Eger,5,,Sempre tive HP e sempre me atendeu super bem!,26.0.1.6280,2026-03-18T14:23:07,br,Google Play,0
6d14c21f-f8ec-4fa6-a735-fff3b545eed4,Mohammed Ur Rahman,1,,App not working. Stuck on loading circle after opening,26.0.1.6280,2026-03-18T14:18:59,sg,Google Play,0
7003abbb-6f2c-4faf-84fa-90bdb1e23f3d,Sante Cioccoloni,1,,non si riesce a stampare quando non sono in casa prima stampava anche da lontano pessima. cercate di risolvere il problema. seno cambio stampante. risolvete,26.0.2.6338,2026-03-18T14:01:11,it,Google Play,1
a7de2d7c-a733-46bf-8f3a-e4b058fa1f5e,Alfonso Villanueva,1,,Extremely slow. Difficult to navigate.,26.0.1.6280,2026-03-18T13:47:55,sg,Google Play,0
6173e97c-8d5d-48ea-919c-dd436b5aa0d6,Said Ramirez,1,,se tarda mucho en imprimir y honqueire cobrar por todo,26.0.0.6234,2026-03-18T13:10:57,es,Google Play,0
e1339aea-c5ed-4cd2-8fe6-b53f9a7d3351,michael moreno,1,,"horrible app, company and product. directly because of this app and printer, I will avoid any HP products in the future.",26.0.1.6280,2026-03-18T12:58:20,sg,Google Play,0
64084692-ab68-48e2-b06f-460400962284,Carolina Paez,1,,muy lenta la app para todo un problema y tarda 100millones de horas,26.0.1.6280,2026-03-18T12:54:25,es,Google Play,0
400d74b1-1130-4623-ae80-8ca28851ac6a,naysha hellen,1,,"he comprado una impresora y la aplicación va fatal , es imposible , se desconecta cada segundo.",20.2.0.6076,2026-03-18T11:56:20,es,Google Play,0
2692065a-a2c0-4cf1-8d15-5da9db6369d3,niko rodriguez,2,,Últimamente demora en abrir la aplicación. estando conectado al wifi o datos.,26.0.2.6338,2026-03-18T11:28:14,es,Google Play,2
a4a300f7-c353-4dab-aac0-dc348d4499df,Dariel Alberto Gonzalez,3,,"Muy buen servicio, pero sus garantías y equipos portátiles son un asco.",26.0.1.6280,2026-03-18T10:40:48,es,Google Play,0
37bca8f0-b385-4dd8-98f2-38dcd47b1336,Sebas Fochessatto,5,,esta aplicasion la usa mi mama no voy a dejar de imprimir usarias esta app,20.2.0.6076,2026-03-18T10:35:16,es,Google Play,0
5b2edc43-4492-4ee3-a8c0-05d929cfd6f1,Luciana S Cruz,1,,o que aconteceu com o app???? não funciona mais?,26.0.1.6280,2026-03-18T09:49:40,br,Google Play,0
85bce565-2bfb-4991-b4cd-cedec3615480,Arvind Kumar Sagar,1,,useless,,2026-03-18T09:38:47,sg,Google Play,0
f1837a84-d648-42a2-9dd8-64bea1c7d429,Lucky Bucky,1,,unbelievable. im scanning photos and pressed the button to rotate them and the app gets stuck and refreshes. none of them were save and I have to start again. and when ever I scan a photo it defaults to auto shape and chooses a piece of the phot to save instead of the entire full thing. im about to throw this printer/scanner out the window.,26.0.2.6338,2026-03-18T09:17:22,sg,Google Play,9
f612006f-7ab2-462e-9e33-3e47ab9a5cc7,Alexander Evans,1,,have to make an account to print on a printer locally,20.2.0.6076,2026-03-18T09:02:45,sg,Google Play,0
970b0bc8-a0fd-405d-8e42-9bf8802bb90a,Claudia Tschaensch,1,,"Sehr unzufrieden, Druckaufträge oft ewig in der Warteschlange, oft funktioniert er überhaupt nicht, kopieren ist in Ordnung",20.2.0.6076,2026-03-18T09:02:35,de,Google Play,0
0e7554b4-7e06-4d0d-9af3-b740b6251a95,Anita Gonzales,5,,ok,20.2.0.6076,2026-03-18T07:41:08,es,Google Play,0
9356aad5-337c-431c-971d-acd6c5a589aa,vinith kumar,1,,This app was useful.But the data transfer was very slowly.pls update the transfer speed and modify some options,26.0.2.6338,2026-03-18T07:35:42,sg,Google Play,0
f6dc2643-40f0-4991-bf90-a041743b53f6,Erica Evans,1,,Does not load just a blue dot going in a circle. The all in one printer does not show available 90% of the time. Says it's not connected to wifi when it actually is the list goes on.,26.0.1.6280,2026-03-18T07:30:58,sg,Google Play,1
31efcf1b-f9f7-4be0-af7d-0a11f480e8e2,Karen,3,,"Not a bad app but and offline version would be most welcome. I can't access HP services unless I have wifi, then I have to disconnect from the wifi and connect to the printer wirelessly to print. This means I cannot print directly from the internet. It can be stressing at times",,2026-03-18T07:30:07,sg,Google Play,0
4c071bd3-d658-4c54-9ce1-b2a12c7225e4,Owe Mauritzson,1,,svår att förstå svår att förstå,,2026-03-18T07:02:34,se,Google Play,0
dd8d56c4-308e-41c5-99b8-ae952aebc8bb,Elisabetta Masi,1,,Dopo ultimo aggiornamento l'app non si apre nemmeno più. Come si può risolvere?,26.0.1.6280,2026-03-18T06:40:05,it,Google Play,1
92468487-725b-4269-bf2d-7f8c049d3030,Adm Porto Esmeralda,5,,excelente,20.2.0.6076,2026-03-18T06:39:33,br,Google Play,0
ec9e3cbb-fc66-4fd3-9013-662323ec6514,Linda Burnett,5,,After the latest update when I open the app only get a white screen nothing else. After upgrading to a newer printer this app works sporadically.,26.0.1.6280,2026-03-18T06:23:25,sg,Google Play,0
b8a9188c-4d3f-4bd4-bc4c-3a8b3d97d5c2,Yamila B,1,,hola hp que esta pasando con la aplicación que no anda ya la desinstale e instale 10 veces y queda girando en el inicio y no arranca!,20.2.0.6076,2026-03-18T06:16:37,es,Google Play,0
bb6a0cb2-4f5b-476a-b0e9-f986ba65b2dc,Riccardo Tassinari,1,,"non funziona più, apre l'app ma carica a vuoto per delle ore Peccato, era utilissima",26.0.2.6338,2026-03-18T05:52:35,it,Google Play,0
beb30a29-95af-46b2-87b3-c54f7c183556,Jitendra Padwal,5,,problem with documents.,20.2.0.6076,2026-03-18T05:42:00,sg,Google Play,0
1e271b79-aa66-456f-8ce6-15446eb99be2,Manfred Feischl,1,,Seit dem letzten Update kann ich die App nicht mehr benutzen. 😡🤬,26.0.1.6280,2026-03-18T05:40:38,de,Google Play,1
a7940e76-7c65-4f23-a51a-1653c97b11c6,Silvia Quilici,1,,"sempre più lenta,per fare un operazione ci vuole ina vita",26.0.1.6280,2026-03-18T04:04:09,it,Google Play,0
65380385-b436-4168-b693-944bf12be255,Alberto Gil Rivas,4,,La apiliación bien. La impresora un poco lenta.,20.2.0.6076,2026-03-18T03:44:43,es,Google Play,0
167ea547-7ca4-4000-a9c9-062280ce8955,Suvra,3,,"not very good app..sometimes it's stuck,especially when you update or charge device",26.0.1.6280,2026-03-18T03:20:53,sg,Google Play,0
dbe6d6cd-1afc-4931-95e3-070766aa2539,Benny Tepfer,1,,"Due to a bug on the HP Smart website, I wasn't able to update my payment method for my HP+ subscription. The HP app was even worse as it simply shows an endless spinner. The support desk also could not helpMy subscription expired and the cartridges locked, I burned a couple of hours and we managed to workaround the bug. I have never experieced such a maze of spinners and confusing UI sections. I expect a lot more from HP, you managed to get your logo on an F1 car, but releasing a working app...",26.0.2.6338,2026-03-18T03:13:00,nl,Google Play,1
92eb5eb4-cbe3-4333-92a3-28ad8f4eb6d1,Jens Nolte,1,,"Nach dem heutigen Update läuft sich die App quasi tod. Es dreht sich nur noch der Ladekreis. Ein Zugriff auf den Drucker ist nicht mehr möglich, von keinem meiner Geräte.",26.0.2.6338,2026-03-18T01:22:48,de,Google Play,4
aff365d2-a988-4b4f-98e9-9156dbd03416,cv d,1,,this app is dogshit,20.2.0.6076,2026-03-18T01:05:08,sg,Google Play,0
116bc730-773b-4529-bdd8-6f9a94f556e0,Prince Harpal,1,,Not opening just processing.,,2026-03-18T00:51:05,sg,Google Play,0
e2159fde-2c27-4615-bb3f-fdae66f7e5e2,Andrea Puddu,1,,Perché devo entrare nel browser per fare l'accesso? Non ha alcun senso,26.0.1.6280,2026-03-17T23:29:12,it,Google Play,0
fcbdf5af-a205-4ae0-a14c-babca1934419,Maki Paez,1,,malísima app. tiene muchísimos errores,20.2.0.6076,2026-03-17T21:05:24,es,Google Play,0
a5a9617d-509a-4f93-a963-26f7c61ccabd,Abimael Morales cruz,3,,En mi opinión la aplicación es buena sin embargo aveces falla y te quita la cuenta que ya tienes agregada a la aplicación y al pasar eso tienes que volver a agregar la cuenta y es algo complicada.,20.2.0.6076,2026-03-17T21:00:27,es,Google Play,0
0db4ec88-3315-4c6d-877f-ad63e496fc78,Alicia Hanks,1,,"there is nothing simple about this app. it is awful! I changed my wifi password, got the printer connected to the wifi, however it keeps saying in the app how the printer set up is not complete. it is complete though!",16.0.1.4229,2026-03-17T19:47:52,sg,Google Play,0
5b6e648d-9924-465a-a3f1-7d5ede97c633,Maxime G,1,,"Cette application ne fonctionne pas. L'imprimante est lié à mon compte HP smart sur PC sans aucun problème. Lorsque j'ouvre l'application mobile, l'imprimante apparaît avec une demande de ""Connecter cette imprimante pour utiliser toutes ses fonctionnalités"".",20.2.0.6076,2026-03-17T17:27:28,fr,Google Play,6
29190fde-0297-481c-ba1e-ab50c949fb7e,Rosmer Renzo Piña,2,,"for the automatic doc feeder there should be an option for 2 side doc. It can't be that hard, feed the doc pack take flip feed again and the app know to order them correctly.",26.0.0.6234,2026-03-17T17:17:35,sg,Google Play,1
c212b579-e889-4630-aa8a-cadfe07a495d,Jessica Barona,1,,The app doesn't work,26.0.2.6338,2026-03-17T17:07:13,sg,Google Play,0
bbaae81a-209b-4a88-8453-2399c8925e2e,Ra M SetH,2,,"Une application qu'on ne peut pas critiquer, d'ailleurs Microsoft a supprimé mon avis qui ne lui plaisait pas. C'est sûr, il était négatif. pourtant, je suis un vrai utilisateur d' HP et je suis déçu de cette application non intuitive et qui bug souvent. pourquoi faire compliqué quand on peut faire plus simple. C'est facile d'avoir des 4,7⭐⭐⭐⭐ de notation si vous censurez les mauvais avis. les vrais.",26.0.2.6338,2026-03-17T16:37:56,fr,Google Play,6
ae1c5018-e91d-41e1-8938-edf42ba92b1f,Kenneth Miller,1,,"The app isn't working. I don't have any problems with the printer, but the app is garbage",26.0.1.6280,2026-03-17T16:24:37,sg,Google Play,0
b93c5f59-8c2d-4a67-aecb-75c039270412,Vania Vega,1,,no la abre mi celular,20.2.0.6076,2026-03-17T16:22:33,es,Google Play,0
c89a26ec-8f0c-44ba-a047-23cd39762668,Diane Marks Shirely,1,,cant set up new printer and hp doesn't help. I returned printer after a week of trying to set up this 7602r printer. Horrible. no drive,,2026-03-17T16:06:04,sg,Google Play,0
69814698-ba9a-4741-a08f-e13902e0e9ab,Rose Sorenmann,3,,spinning circle of death. trying to set up printer we've had for years. never works when needed. this app sucks.,16.5.1.4270,2026-03-17T15:44:28,sg,Google Play,0
6fdfff43-7a16-4fc7-8270-066f442466f2,Rosmery Alvarez,5,,"muy buena aplicación, me ayuda mucho con mi impresora",20.2.0.6076,2026-03-17T15:37:36,es,Google Play,0
a6f8bdef-daa4-4f87-a562-43869e02a8bc,Patrice Guillemer,5,,Très très pratique.,26.0.2.6338,2026-03-17T15:33:26,fr,Google Play,0
6f6932fa-c022-44cc-af02-aa286ad19dd1,Wouter Drobnic,1,,sinds de update doet de app niks meer kan niet meer printen.waarom een waardeloze update laat het gewoon zoals het was.nu maar overstappen naar een ander merk.hp verjaagt zijn klanten.,26.0.1.6280,2026-03-17T15:04:10,nl,Google Play,2
cc1ad0b7-0ab7-4816-a451-6807987f9cdd,Brent Jeffrey,1,,horrible,26.0.1.6280,2026-03-17T15:02:34,sg,Google Play,0
82ea1d77-16d8-4b9b-abb2-7c2355895271,Samuel Ickes,1,,terrible. works one out of five times,26.0.1.6280,2026-03-17T14:42:53,sg,Google Play,0
7c6cf24d-027a-494a-a5a4-a108354da046,Vitor,1,,"Não! Usar esta aplicação é um completo sufoco. A maior parte das vezes simplesmente não arranca, fica apenas um cursor às voltinhas infenidamente. Para arrancar é necessário antes limpar a cache e ter esperança que assim a coisa funcione. Sim, às vezes nem assim. Assim é complicado usar a aplicação e usufruir das suas capacidades. Será que vale a pena continuar com a minha fidelização à HP, que dura há mais de 25 anos? Sim pondero sériamente deixar a HP.",26.0.2.6338,2026-03-17T14:08:55,br,Google Play,0
e78e477e-8892-4d65-9afd-5df5e1a6dc81,Dr Sengwayo,2,,"the app makes so many things convenient, but recently it just can't find my printer so it's now useless",26.0.2.6338,2026-03-17T13:10:22,sg,Google Play,0
21e6ecda-b901-4b9e-b290-978783af3acd,Edmond Izijk,5,,perfect!,20.2.0.6076,2026-03-17T13:02:34,sg,Google Play,0
d3a1afb6-4809-4769-85a7-5dbda4e6e898,Gijs Gerritse,1,,"de app super traag,ook na gedwongen stoppen, start deze nog niet",26.0.1.6280,2026-03-17T12:50:55,nl,Google Play,3
48d8311a-47f4-4f79-bc9b-c6330cedabc7,Juan Romero Rey,1,,"Se actualizó y no funciona de ninguna manera, le estoy cogiendo un asco HP ......",20.2.0.6076,2026-03-17T12:46:22,es,Google Play,0
e3dc0b8f-6bc6-4103-8bd9-97730831874c,V,1,,dont get an hp printer,26.0.2.6338,2026-03-17T12:39:03,sg,Google Play,0
f5d16f25-7644-483e-8bf8-ebe712dffa8d,Luca Di Totto,1,,"pessimo, evitate in qualsiasi modo stampanti marchio hp. esperienza di stampa tramite applicazione pessima",26.0.1.6280,2026-03-17T12:23:03,it,Google Play,0
bed31b63-12c7-45a9-91e1-747622ef9f35,HELENNE François,1,,"hp smart zero problème, la nouvelle application ne fonctionne qu'une fois sur deux, écran blanc, puis rien...",26.0.1.6280,2026-03-17T11:39:24,fr,Google Play,1
0ea3a13d-84fb-46ab-9179-2c9e8f344f16,Bazinga Pollino,1,,HP deskjet 2028e stampante pessima! davvero penosa e app a dir poco assurda! non si riesce ad impostare le dimensioni del documento!! lenta come la quaresima! un pessimo acquisto,26.0.2.6338,2026-03-17T11:34:51,it,Google Play,0
a067d4a6-0e29-4b31-aa91-a4d47c1524a8,Cássia Maria Parreira,5,,óptimo!!!,26.0.1.6280,2026-03-17T10:24:59,br,Google Play,0
5ef3bd3c-63c0-4b40-9266-95dd6125e309,Alessandro Ferrari,2,,"Improvvisamente da qualche giorno l'app non vede più la mia stampante. Ho reinstallato l'app ma non è stervito. Ho riavviato il Ruter ma non è servito. Ho resettato la stampante e non solo non è servito, ma non posso più nemmeno ricollegarla tramire app perchè non viene trovata la stampante. Semplicemente frustrante",20.2.0.6076,2026-03-17T09:57:10,it,Google Play,0
d1c8e58b-a35e-4bd2-9338-5864e410f024,Cristina Andrade,1,,não consigo achar a impressora já instalada no not . Parece que querem dificultar,,2026-03-17T09:40:34,br,Google Play,0
7c619399-6e2f-4841-bb79-a4fee046f0c2,Silvia,2,,¿como contacto con el soporte de HP? de repente la app no se abre y no puedo imprimir nada,26.0.1.6280,2026-03-17T08:38:14,es,Google Play,0
e0f59638-3d44-4aab-8a90-ac03e7fa712c,Gert Hoffmann,1,,"diese neue Drucker App ist umständlicher als die alte. Jetzt muss ich erst ein PDF erzeugen, um vom Android Tablett drucken zu können. Schlimmer geht's nimmer!! 😔",20.2.0.6076,2026-03-17T08:27:10,de,Google Play,1
b4f2a567-9d48-4f75-8622-bcb470a1dd63,Tammy Lynn Nawrath,1,,"It's not opening 😕, epic fail! please fix!",26.0.1.6280,2026-03-17T08:11:35,sg,Google Play,0
9508cb2c-b021-4af4-acf9-0b6519fff4cc,Linda Gamblin,3,,can't open my HP app,26.0.2.6338,2026-03-17T08:05:25,sg,Google Play,0
38ebad74-db0d-4282-915c-67836ac69609,Wen Sparks,1,,this app is horrible everytime I open it its just a loading screen and I cant print anything,26.0.2.6338,2026-03-17T08:00:59,sg,Google Play,0
1a99253a-31be-42d9-a4c5-1d1e0f100ca3,Geremia Hlede,1,,dopo l'aggiornamento l'app non funziona più.,26.0.1.6280,2026-03-17T06:49:04,it,Google Play,0
047b7f69-7c93-4fd0-bb6b-e716cfed8a4d,William Doherty,1,,very difficult to use,17.15.0.4720,2026-03-17T06:41:46,sg,Google Play,0
eeb1c547-d7d8-49f4-8fc1-9272a33c123d,Javier Galeano,2,,Casi siempre que voy a abrir la app se queda pensando y me resulta imposible usar el escaner desde mi móvil por poner un ejemplo,26.0.1.6280,2026-03-17T05:46:04,es,Google Play,0
0257aa0c-edc7-45fa-ad3c-473b2b63ee99,Pattamon Prepram,1,,"Faccio la scansione con la stampante per mandarla sul telefono, ma appena finita l'elaborazione della scansione l'applicazione fa ritornare sul menù e non mostra la scansione come dovrebbe. Tutto questo è accaduto nonostante il recente aggiornamento dell'applicazione.",26.0.2.6338,2026-03-17T05:20:51,it,Google Play,0
7b545cdf-dcd3-4232-b519-2a447ab20e01,Deep Bisoi,1,,if you want to use this app you need internet connection and also wifi connect to the printer how someone is supposed to use this because the printer wifi does not provide internet and you need internet to use this app so disappointed from hp,,2026-03-17T04:24:16,sg,Google Play,0
c106f2a9-e6cf-42cc-a9af-1e2072a92ebc,Jerzy Brzozowski,5,,Gut 👍,20.2.0.6076,2026-03-17T04:19:49,de,Google Play,0
7bbf9d10-2e9b-42bb-ace7-34716cb1a203,Wagner Mastroiane,5,,muito boa,20.2.0.6076,2026-03-17T04:12:42,br,Google Play,0
375c4f33-eae6-47f1-9868-17eb0b9104ae,barbara meloni,1,,non riesco a farla funzionare perché non mi permette di creare l'account mi dà un errore,20.2.0.6076,2026-03-17T04:03:38,it,Google Play,0
617f9148-0a07-40d1-9960-aae151e6b79f,Claudia Castilhos,5,,Qualidade excelente de digitalização.,20.2.0.6076,2026-03-17T04:01:01,br,Google Play,0
68d1103a-0dcb-46e3-9342-b7956a47c340,Giovanni Massaro,1,,"Non funziona. Ogni volta una novità. O la password che l'ha cambiata chissà quante volte o il software nuovo da scaricare e non succede un bel niente. Mai che faccia una copia. Se invece scarico un altro software mi fa subito la pagina di prova, ma devo fare l'abbonamento mensile o annuale.",26.0.0.6234,2026-03-17T03:56:20,it,Google Play,0
a019e268-4039-4fc0-9357-f7e6d9f7fd4d,Pier Luigi Ciotoli,1,,Orrendo dover disinstallare e reinstallare il software dedicato perché smette di funzionare.,26.0.1.6280,2026-03-17T03:32:03,it,Google Play,0
7a38842e-cc9f-4539-9541-59e702edf0de,Suzanne “SunnySuz” Stein,1,,always had a problem getting the app and printer to work. I follow all instructions and suddenly I need the ink cart. from when I bought the printer over three years ago. So done with this printer.,20.2.0.6076,2026-03-17T03:28:22,sg,Google Play,0
0f41266e-f88f-4e61-ba61-7c784c35839f,Paolo Fucile,1,,scusate qualcuno sa dirmi perché non funziona più questa applicazione grazie,26.0.2.6338,2026-03-17T02:42:26,it,Google Play,0
de7d6adb-1e9a-48c7-9590-af150f82dfe4,Hans Lohmann,5,,Es ist Einfach Super 👍👍,20.2.0.6076,2026-03-17T02:26:30,de,Google Play,0
b77177ab-0315-47d4-a49b-e6a4353602ad,Michal Davidson,1,,app doesn't open just shows loading endlessly,26.0.1.6280,2026-03-17T01:58:07,sg,Google Play,0
66512255-1e14-437f-89b7-c9b8618893df,L Ell,4,,never had a problem with Hewlett-Packard,,2026-03-17T00:47:08,sg,Google Play,0
847fdbf4-21d8-409f-a302-214f5f90602e,Kassim Bujang,5,,Friendly,,2026-03-17T00:36:06,sg,Google Play,0
784f8fcc-5167-4d7d-964a-8bd7e69c1a71,David,1,,"Disappointed. Followed every instruction and troubleshooting suggestion and still have no mobile or laptop connectivity to the printer. A lot of time and effort wasted. Will keep trying but it's more time taken up in what they claim is 'easy' set up. Next step is to uninstall the app, reinstall and try again.",,2026-03-17T00:09:13,sg,Google Play,0
bc56a1fa-dfe9-4553-986d-a5b305252ed7,Matteo Del Lungo,5,,app utile che serve principalmente per collegarsi alla stampante Wireless e stampare direttamente da cellulare,20.2.0.6076,2026-03-16T23:45:47,it,Google Play,0
fba2114e-d026-43a1-9bb9-947f831b1f34,Marti Mirtillina,1,,è da ieri che ho problemi con l'app. Continua a caricarsi senza aprirsi. La chat- bot è stata inutile: non ha compreso il problema.,26.0.1.6280,2026-03-16T23:05:20,it,Google Play,0
ca259d7d-23a1-4c98-99ac-1c4e5055705e,Josh Pescud,1,,not even opening,26.0.1.6280,2026-03-16T23:00:07,sg,Google Play,0
10472cf6-481b-425a-a5d5-3bcb3d1bcdd7,Thomas Burnam,1,,This is one of the most miserable headaches I have ever had,26.0.1.6280,2026-03-16T21:17:17,sg,Google Play,0
f8e33390-6187-44ca-9eb1-5fffa24062fb,Patricia Tracy,3,,freezes up and does not have factory reset functions its annoying,,2026-03-16T21:12:19,sg,Google Play,0
6b7b794e-40b0-46b4-8301-55b51e72a274,Aaryan Salvi,5,,please add the ongoing print section separate needed please,20.2.0.6076,2026-03-16T21:03:11,sg,Google Play,0
616fc5f3-15c2-41cf-b923-d7b26d942925,Krubha Arunan,1,,"Worst printer and app. After spending on the printer and cartridges, the only printouts that can be taken from this printer is the colorful test printouts and the printer information. Otherwise printer will be offline, setup will be required every time you need to print. Blinkit and Instamart print services are more reliable in comparison honestly.",20.2.0.6076,2026-03-16T20:44:01,sg,Google Play,1
3a7dea7e-5fdc-4de7-8b39-1332aefb43a8,Paula De Jesus Doroteo,5,,excelente aplicación 👌🏽,20.2.0.6076,2026-03-16T20:21:27,es,Google Play,0
