id,author,rating,title,content,version,date,country,platform,vote_count
eb49197e-07fb-4f0d-9e4d-d2d858f109c0,Ben Reay,1,,"all i want is to set up the printer sitting in front of me. so why does HP want my location data. certainly not to find the printer in front of me which i should otherwise have no problem connecting to over bluetooth, but it reduses to unless i agree to send my location data to HP. oh yeah, amd it explicitly tells me that it's making an exception to my privacy settings to send the data to HP so its not even like im being paranoid here, why does HP want to know my location?",,2026-03-12T15:48:22,sg,Google Play,0
9ad6779a-c5b7-4aaf-86b6-0d693ec7dab9,H Roelofs,1,,ik heb me nou 3 keer aangemeld met een nieuw account en wachtwoord. en weer kan ik overnieuw beginnen.,26.0.1.6280,2026-03-12T15:43:11,nl,Google Play,6
09fa1f55-33eb-40d3-9697-9b736a7705e3,Sam,2,,"Über Kamera Scannen funktioniert nur sehr schlecht, Bilder Dokumente werden schlecht verarbeitet",20.2.0.6076,2026-03-12T14:40:54,de,Google Play,0
e7973bfa-c75d-4cea-932d-1d3ff392ca60,Dina Freitas,1,,"app péssimo depois da atualização, não abre o app no celular.",26.0.1.6280,2026-03-12T14:33:45,br,Google Play,0
2c45fb50-dce2-427b-a37a-1cc0dcef2263,Ricus C,2,,"Sadly doesnt work with my new printer. Sure it if my phone worked with it, it work well, but alas...",,2026-03-12T14:33:08,sg,Google Play,0
d6319ffd-8673-4fb7-85a0-861d1a7a705e,Jeff Tondreau,1,,unable to setup printer on app tells me to use hp website. website says to use app. i now have a useless printer that i cant connect to. should have listened to my buddy and avoid all HP products.,20.2.0.6076,2026-03-12T13:39:56,sg,Google Play,0
94134924-df8e-49b6-a65e-bbac5558dc8b,Mike G,1,,new app is horrible,26.0.1.6280,2026-03-12T13:12:55,sg,Google Play,0
0be8312c-e279-488d-ac8d-90a92a8f99c7,Ayagonã Wagner N dos Santos,1,,aplicativo não abre,26.0.1.6280,2026-03-12T13:12:49,br,Google Play,0
87a9059a-3bad-4b49-ae7d-da222e86b05f,Joaquín Sánchez,5,,util y fácil de usar,20.2.0.6076,2026-03-12T12:24:33,es,Google Play,0
63d70446-2ce5-4ec9-a132-06da7061eb13,Heba Almaqouri,5,,sehr Praktisch 😍😍,20.2.0.6076,2026-03-12T11:32:33,de,Google Play,0
d67c07a3-d4e2-4388-821c-6a01376dc2c8,Joao Paixão,2,,não está abrindo o aplicativo faz dias,,2026-03-12T10:52:20,br,Google Play,0
009a14ed-17c0-4083-8a81-a361a012f0f9,Michael Ecker,1,,"so schlecht, ich möchte den Drucker verbinden. Status ist grün, alles passt. ich möchte Drucken, Status sofort auf orange, Drucker ist nicht verbunden. ich möchte scannen, app hängt im Scan fest, nichts wird gescannt.",26.0.1.6280,2026-03-12T10:37:33,de,Google Play,0
bd6464d4-bf09-46c2-84f7-fb2fb66ac51f,Said Bensaadi,5,,très bon produit.,26.0.1.6280,2026-03-12T10:03:23,fr,Google Play,0
64534b95-532e-4282-91c9-eb80fb7bcabc,Anne Gabriele,5,,muito bom e fácil de mexer,20.2.0.6076,2026-03-12T10:00:49,br,Google Play,0
73fa7984-3d3c-4b28-8867-634c10eee677,Akhmad Fauzi Nurulhamzah,1,,the app become too heavy and neead a long time to open,26.0.1.6280,2026-03-12T09:43:12,sg,Google Play,0
3cbe2f31-7dac-4e16-ae08-64d9ab3b04c2,soysoy sibil,1,,l'ouverture de l'application est interminable. la page charge indéfiniment et dois relancer l'application plusieurs fois. OBLIGÉ D'ABANDONNER POUR ENVOYÉ MES DOCUMENTS EN PHOTO !!!!! la précédente application était top.,26.0.1.6280,2026-03-12T08:50:55,fr,Google Play,0
b43a925d-5eeb-4add-8555-5b90209e7b5c,Luis Enrique Gonzalez Gonzalez,1,,no me abre ni carga la aplicación bien se queda bloqueada,26.0.1.6280,2026-03-12T08:32:03,es,Google Play,0
bbbb03e4-c9a3-4b96-bab5-4371598e0e9d,Jose Temis temis,5,,muy buena,26.0.1.6280,2026-03-12T08:23:05,es,Google Play,0
182547f1-491c-4e83-a54a-fd2afe2cd0f1,Ute Weiss,2,,app ist eine Katastrophe. Bis man zur Abfrage der verbrauchten Seiten kommt ist der Weg sehr umständlich. Seit gestern geht die app gar nicht mehr. Bleibt einfach weiß und die Abfrage kann nicht aufgerufen werden. sehr Bediener unfreundlich,26.0.1.6280,2026-03-12T07:31:34,de,Google Play,0
aa2028fd-826a-42a9-8bfe-9350f229d884,Lance Thomas,1,,doesn't open just spinning loading,26.0.1.6280,2026-03-12T06:03:20,sg,Google Play,0
b58e94b5-324e-40ea-871b-9ab0bc92824c,Cheryl Rojo,1,,"This doesn't work anymore. I can't even sign in. Reverse it back to how it was, stop screwing with stuff!",17.10.1.4636,2026-03-12T05:38:37,sg,Google Play,0
9cbbd975-72d0-4574-b096-d26675e64d8d,Kristen,1,,"app sometimes works and sometimes doesn't. very inconsistent printing ability. keeps reverting back to ""fill page"" randomly during the same print job and no way to change the default settings for the printer. waste of time, frustration, paper, and ink. the ink issue is also already a scam. will never be using this company again.",26.0.1.6280,2026-03-12T04:36:34,sg,Google Play,3
4c530e93-c515-4f7b-9623-5bc0e3ca3fa8,Julio Aguiar,5,,exelente,26.0.1.6280,2026-03-12T04:16:52,es,Google Play,0
70b52056-d290-427d-a8b2-ad58b8b76653,nditsheni robert,5,,"Hp never disappointed me, it works 100%,easy to use and scanning in seconds",26.0.1.6280,2026-03-12T04:01:55,sg,Google Play,0
5312d56e-974c-46f7-aeb2-7aa7c532aef9,Ximi Adame,2,,"todo bien con la aplicación, solo que me borra la cuenta y cuando intento volver a iniciar dice que error al iniciar sección",20.2.0.6076,2026-03-12T03:36:12,es,Google Play,0
5f1ffaf9-d9a8-4d93-b8e6-d74db0e3263f,Diego García,1,,"desde la última actualización la app no abre, demora más de media hora y no puedo ingresar",26.0.1.6280,2026-03-12T03:19:05,es,Google Play,1
8db09a6b-174f-4f98-981f-9a81b47404c7,Franky,1,,loading too long,26.0.1.6280,2026-03-12T03:03:43,sg,Google Play,0
e0aee7da-b3ae-4893-9735-9fd467d158b9,compuirv,2,,the setup said to switch to a mobile device. Maybe it's on my phone and tablet but as far as I can see this was just a ploy to collect information. the printer still needs to be installed separately on the laptop. Time wasted.,20.2.0.6076,2026-03-12T00:56:12,sg,Google Play,1
c3038ca8-6591-4d7f-8ee3-9ca2df44d4db,Manohar Ghotekar,5,,mast,26.0.1.6280,2026-03-11T22:33:49,sg,Google Play,0
65cedca0-e2e5-48c5-8fce-9317e5fd734a,Héctor De Céspedes Conde,1,,"Nefasta la aplicación. tarda en cargar para imprimir y siempre me sale el problema de ""la impresora se encuentra desconectada"" cuando DESDE OTRAS APLICACIONES lo hacen perfectamente. no vuelvo a confiar en esta aplicación nunca más",26.0.1.6280,2026-03-11T21:44:25,es,Google Play,1
31848a8e-0eb1-44c9-b0e8-f0a993136e94,Pompeyo Zapater Farches,5,,"Somos, USUARIOS DE LOS SELECTOS Y DISTINGUIDOS artículos de Hawellette Pacard Pompeyo Z.F. 💙",,2026-03-11T21:23:03,es,Google Play,0
5c269c57-7ff5-4b7b-8b7c-3c516de5a994,Ravindra Lakha,4,,nice 👍,,2026-03-11T20:47:01,sg,Google Play,0
cb22b68b-3a77-4659-a92e-5a2f1f0e3c3c,Christian KIEHL,1,,de pire en pire......,20.1.2.5988,2026-03-11T20:44:16,fr,Google Play,1
4b26254b-d6d6-440d-ac23-d08aab8c6bc3,paula cooke,2,,Rarely works and really slow. The previous version was better,26.0.1.6280,2026-03-11T20:09:04,sg,Google Play,1
df6d3337-a3d0-4156-8f52-7e66f1a71f14,Salvatore Salvati,1,,"Ma che razza di aggiornamento avete fatto. Non si apre più l'applicazione, c'è una rotella che gira all'infinito 👎",26.0.1.6280,2026-03-11T19:42:49,it,Google Play,0
56a28802-87f4-43f2-81d4-a18a1f9de648,L Breen,1,,does not connecting yo printer and has no settings for managing print,,2026-03-11T19:25:22,sg,Google Play,0
71ff2dd5-ad8d-4b54-9c87-c5aafec95f30,Nicol Kim,1,,la actualización de la aplicación no me agarra y tengo q estar desinstala y volviendo a instalarlo,,2026-03-11T19:07:46,es,Google Play,0
c9461590-548b-4a10-b849-4fc3ea37d2d9,Gilmara Lopes Vaz,5,,perfeito,20.2.0.6076,2026-03-11T19:02:00,br,Google Play,0
084e98d5-36ad-4d70-9df0-5ce2dd6417b8,Mahoneytheduke Duke,1,,turned my printer on connected easily then printer wanted to print about 3 lines of random letters & symbols wouldn't stop & there was no print jobs on app.,,2026-03-11T18:23:32,sg,Google Play,0
52510232-2316-4291-9f2f-d48411ae286f,Ligia Vi,1,,Não sei por quê fazem isso. A impressora é detectada por qualquer outro app só não é pelo app da Hp. Se não é pra usar não vendam! E depois de muito teco teco começa a funcionar o app e depois não funciona mais 🤯. Parabéns ao desenvolvedor...,26.0.1.6280,2026-03-11T18:23:24,br,Google Play,1
b6c6d021-d0a9-43f7-a5c6-abe93c8ba687,Meeghane,1,,"horrible depuis quelques temps, c'est devenu impossible d'utiliser l'application et d'imprimer, on y passe des heures il serait temps de régler le problème",26.0.1.6280,2026-03-11T18:04:33,fr,Google Play,0
bce72bb7-fec2-494f-a8f0-79b8068885e1,P S,2,,why do the app and printer constantly go blank.? 1 minute gap between each page that's printed. why you need an account to take a print out? why they is no option to protect the privacy and prevent HP from collecting data from the app?,26.0.1.6280,2026-03-11T17:42:40,sg,Google Play,1
a03132b7-19b2-4915-89e5-8329e674c9ed,J. luis,1,,muy mala aplicación. poco intuitiva. malas opciones. no compro más HP.,20.2.0.6076,2026-03-11T17:31:15,es,Google Play,0
c472709f-5e22-496e-be6e-19253a9e86a7,MICHAEL TRUNKS,1,,"I am still waiting for HP to sort out this app and it's others so I can use my printer, unless they don't give a damn? My Envy 120E will no longer print using this app, I have spent hours trying what was suggested by HP in an attempt to get it working but it won't. I know that it is 15 years old but it has not been used heavily and always with my Android smart phone and that's why I have only just discovered the problem.",20.2.0.6076,2026-03-11T17:23:18,sg,Google Play,9
819b7cae-6e36-4f1e-bf22-a626fb15c7e1,Michele V,2,,"L' appuntamento ha funzionato bene fino a qualche settimana fa', ora non mi permette più di stampare da remoto ""Print Anywhere"" tanto acclamato da HP. A nulla sono valsi i vari tentativi di reinstallazione e nuove e interminabili configurazioni. L' assistenza via chat non funzionale direi inutile. Probabilmente hanno un problema con i loro server. Ragazzi della HP datevi una mossa. La nuvola non funziona.....",20.2.0.6076,2026-03-11T17:13:55,it,Google Play,0
7f76e395-b7e9-4bf0-abd1-a69d1881a51f,Roman Rath,1,,"If your printer companion app needs 332mb (!), you have done a bad job.",26.0.1.6280,2026-03-11T16:46:50,sg,Google Play,1
e4579e7c-5d94-4be7-8464-70c34b2bf585,Michael Nosa,5,,good app,26.0.1.6280,2026-03-11T16:40:16,sg,Google Play,0
1a5e9dfe-af6b-40ca-9fb7-fd8e8c679cd3,Úrsula Montes laura,5,,la mejor app de Hp,20.2.0.6076,2026-03-11T16:15:54,es,Google Play,0
2488421c-d725-40bf-bcad-3051920315bd,Estefania Pino,1,,"hace un tiempo que me viene fallando, me tilda la impresora. al principio me funcionó bien pero ahora es un dolor de cabeza todos los días",26.0.1.6280,2026-03-11T15:59:06,es,Google Play,0
356ba46f-4c5e-458e-8fa4-611b13f6aa90,Jeff Whitehurst,1,,This is the most useless app I've ever had It takes an act of God for it to connect and load,,2026-03-11T15:57:58,sg,Google Play,0
091fd981-8f73-4448-a94e-0f184cccf3b9,andres romero,5,,Excelente la herramienta para trabajar.,26.0.1.6280,2026-03-11T15:48:46,es,Google Play,0
8e25b1ff-0e56-46cd-9167-df27c8286094,Rafa,1,,nao acha minha 2600,20.2.0.6076,2026-03-11T15:03:54,br,Google Play,0
e57c618d-468a-43fa-a7a7-16519da53447,Lucus McNicoll,4,,Pleasant experience so far. there are no issues to report.,20.2.0.6076,2026-03-11T14:50:45,sg,Google Play,0
bde7be3c-d133-4ba7-b0d0-a64af34c74ca,Timothy Hill,1,,"Worst app I've ever used. HP has become a laughing stock with this app. Never connects, takes hours when it does work, and constantly spins without opening!",26.0.1.6280,2026-03-11T14:49:16,sg,Google Play,1
b70934b5-a000-4338-b5c7-ec92383f4831,Helfried Ohlsen,5,,habe Schwierigkeiten per Smartphone zu drucken.,26.0.1.6280,2026-03-11T14:26:37,de,Google Play,0
f5d1b27b-be7e-4412-9ae0-148d22b1ca3a,Shyamji Yadav,1,,I will try this then give you star,,2026-03-11T14:25:09,sg,Google Play,0
956cd7af-bbc2-49cd-8796-f1e110e9edc4,Glafio Lima,1,,péssimo,,2026-03-11T13:57:27,br,Google Play,0
8e8b1586-c450-4296-81c7-aac9a7626310,jules Cc,5,,so easy to use and send emails,20.2.0.6076,2026-03-11T13:51:00,sg,Google Play,0
813a1245-7805-40c0-94f4-1dbf57a9cf74,Charles Martin,1,,I always offline.I'm almost impossible to get back online,20.2.0.6076,2026-03-11T13:11:01,sg,Google Play,0
41a8755a-6428-40e5-8402-65a1631717c1,richard kharisma alamsyah,1,,"why need account for using scanner from app ? why you, the company Hewlett Packard need us createuser account so bad ? i buy the printer for personal use and the app force us to create account for using the basic feature like scanning documents via app shame on you",17.25.0.4906,2026-03-11T12:43:57,sg,Google Play,0
4c1f9e7d-8e42-4a95-bcf0-3877c8f4c081,Crystal Mains,1,,The app won't work anymore. It only shows a blank white screen since the last update. I'm a homeschool mom and NEED my printer!!!,26.0.1.6280,2026-03-11T12:05:43,sg,Google Play,0
818eabb8-dbde-45e2-adae-2978d38bff5a,Fiona Clancy,5,,good thanx,26.0.1.6280,2026-03-11T12:02:16,sg,Google Play,0
fd1aa3ed-0813-401a-bacf-fea2205b0210,E F,1,,funkar inte,26.0.0.6234,2026-03-11T11:03:09,se,Google Play,0
fd9b1fb1-7dbf-47c1-baff-774d5260c34b,Bogdan Trajkovic,1,,"trash printers, they never work...",17.30.1.5049,2026-03-11T10:55:15,sg,Google Play,0
b98f0dba-ec51-4738-acd7-74e4e8fdf654,Victoria,1,,app will not let me setup printer it is stuck on trying to find my wifi network which I assure is literally full bars,,2026-03-11T10:30:07,sg,Google Play,0
861f57d2-7d34-4804-b367-555e9bc499ec,Marjolaine GILLOT,1,,"Ça me saoul, depuis la MAJ et fusion HP all in, c'est une catastrophe. Plus rien ne fonctionne.",26.0.1.6280,2026-03-11T10:24:31,fr,Google Play,0
ab7a3463-694a-451e-a74d-2bee9ea74963,Ben Kinane,1,,inexploitable,20.2.0.6076,2026-03-11T10:15:45,fr,Google Play,1
c44e0f38-71bb-4452-8e01-217d05a1544c,Curtis Fraser,5,,A great professional well made app that works great with my HP 6455e printer,,2026-03-11T08:39:10,sg,Google Play,0
f351452f-9095-4d07-959b-67064ef74a75,Sue Barnard,3,,Expensive ink.,26.0.1.6280,2026-03-11T08:02:50,sg,Google Play,0
788c8517-6ab9-437f-988d-5f422b94c566,La'Ree Southern,1,,"I love my printer, but the subscription seems useless so far because when I was running low, they didn't automatically send me any new cartridges. I literally had to request them because I had ran completely out. Then it took over a week for me to get new ink cartridges... That was an inconvenience and unreliable.....",20.2.0.6076,2026-03-11T07:47:11,sg,Google Play,1
6d274ecd-bf78-418d-956f-c2fc5fcc10e7,Franki Carrico,1,,"terrible app, terrible company. much like their printers, ink shipments and customer service lines-this app is excruciatingly slow, when it works at all.",20.2.0.6076,2026-03-11T03:20:30,sg,Google Play,0
6a2d40bf-d374-45de-85b5-c03e99fad987,shailesh Kharade,5,,useful app very nice,20.2.0.6076,2026-03-11T03:14:26,sg,Google Play,0
ced016a5-f550-4929-a2b4-48c306da0a7c,Carmel,5,,"awesome color, works excellent and flawless. no problem setting up to scan at all. I personally love it and I scanned from my phone. 😊 You 🎸",20.2.0.6076,2026-03-11T02:29:10,sg,Google Play,0
1e4c28a4-29a4-4b75-a5b3-b08f96894db8,Tabitha Sullivan,1,,The app won't even open for me. just spins on loading for several minutes.,26.0.1.6280,2026-03-11T02:19:43,sg,Google Play,1
88bb81dc-effe-40f5-9510-023916ce12ed,Pedro Maximo santiago Beltrán jimenez,5,,excelente,26.0.1.6280,2026-03-11T01:02:12,es,Google Play,0
240904a1-b0b7-4562-80fa-542d6c3e592e,Bettina Erlach,3,,leider konnte ich bei dem Drucker die Einrichtung nie abschließen. sonst hat alles funktioniert. durch das unfertige einrichten konnte Instant Ink nicht verwendet werden,20.2.0.6076,2026-03-10T23:36:27,de,Google Play,0
c8db0180-6f96-4baa-b2c3-20af395dfc21,Billy G,1,,"since they've redone the app it's been very complicated to get to settings. they took a good thing we were used to and changed it all around and made it complicated just trying to find the PDF scan, print, and other features I would not consider this app!",26.0.1.6280,2026-03-10T22:42:07,sg,Google Play,1
ab572be5-a7e9-41c7-84c2-c2eede64a92d,Betty BÉRON,1,,"Application inutile, j'ai téléchargé l'ancienne version qui est le TOP!!! Et j'ai désactivé la mise à jour AUTO pour cette application qui me le propose systématiquement, déçu de cette dernière version qui rendait mon imprimante inutilisable!!!! 😡😡😡😡 Pas de rectification à ce jour malgré les différents commentaires des utilisateurs ainsi que sur les forums sur internet !!!! Bien dommage.",,2026-03-10T22:33:14,fr,Google Play,1
1dffed94-2695-4be1-80ac-0d30a4f858a8,wildamoeba4888 5,1,,have not been able to open the app since I downloaded it.,26.0.1.6280,2026-03-10T22:22:50,sg,Google Play,0
0c0c3cdb-9fd9-49ca-a090-9d42b053c017,Ludvig Knagenhjelm,1,,"hard to use, very vague.",20.2.0.6076,2026-03-10T22:20:41,sg,Google Play,0
678c2adc-be43-43b8-9fa3-b933ed553ed9,Cin Kin,1,,HP stinks!. I'm supposed to have an easy to set up printer and it's been 2 hours and still not working!,,2026-03-10T22:18:32,sg,Google Play,0
7ee8c807-1b29-4728-83c4-8e91e42891aa,Edvaldo Sousa,1,,extremamente lento e contra intuitivo. só serve pra quem tem muito tempo livre.,20.2.0.6076,2026-03-10T21:25:43,br,Google Play,0
b34c75e6-0177-4d16-ad07-6e2e135daaf4,Bruce Johnston,1,,terrible app cannot find network printer,26.0.1.6280,2026-03-10T20:59:52,sg,Google Play,0
7b6f1fdf-e005-454a-8822-40bf99f62ae3,Orsolya Kobza,1,,terrible,26.0.1.6280,2026-03-10T20:55:12,sg,Google Play,0
026f9da6-564e-4356-a40a-83eebb699769,David Bernal Vidal,1,,"es una hp, casi nunca abre arreglen es hp......",,2026-03-10T18:34:14,es,Google Play,0
0f81c4f2-a3e6-4be6-b558-54c1f16a0459,Rossen Antonov,1,,I am selling mt HP printer for 1 cent. Why the hell do I need to create an account in order to scan my documents via my own printer in my own network? The question is rhetorical. We all know the answer.,,2026-03-10T18:31:38,sg,Google Play,0
fc0d7fc2-63a1-48ca-8eaf-49c2120b4ea9,giancarlo caon,1,,Drskjet 2800 ieri ha stmpato oggi peccato non funziona più anche da Pc ma perche le modificate se poi non si possono piu usare voi aggiornate e noi cambiamo marca non è assurdo questo comportamento VOI vi volete male 🤷‍♀️,26.0.1.6280,2026-03-10T18:24:18,it,Google Play,0
d5e13093-dc11-4e3d-855c-0eb61ec0bc2a,Gustavo Teo,4,,"la impresora que tengo es la chiquita wifi,no me gusta si se usa poco se bloquea los cartuchos,y si se usa seguido la capacidad de los cartuchos es de 24 impresiones ,sale más económico llevar los PDF del celular y imprimir en un kiosco,,los cartuchos originales salen casi como comprar otra impresora nueva ,mi opinión es ,,,,obsoleto,,,",26.0.1.6280,2026-03-10T18:12:22,es,Google Play,0
9929aafa-c116-4fa6-a546-7d16ba056db2,Nancy Martinez,1,,la app tarda mil años en abrir y reaccionar. lo detesto,26.0.1.6280,2026-03-10T18:08:11,es,Google Play,1
10d31754-029e-432d-be33-80360b5be3b2,3n7y,1,,Spazzatura,26.0.1.6280,2026-03-10T18:07:48,it,Google Play,0
76b17cf3-b03f-4167-8c5e-a82f2cd0f945,morteza khesarat,1,,lots of problem during opening and loading,17.35.0.5115,2026-03-10T17:46:20,sg,Google Play,0
773ff2dd-9eee-4d95-9506-316ef6b1a8f4,Letícia Bernardino,1,,Muita barreira para conseguir escanear um documento. Desisti e desinstalei,,2026-03-10T17:43:48,it,Google Play,0
fde6f302-beea-4975-a12f-75ca8afde182,MG,1,,vraiment plus complexe qu'avant!! énormément de probleme! je regrette d'avoir acheté cette imprimante et de devoir passer par cette application la!,20.2.0.6076,2026-03-10T16:51:43,fr,Google Play,1
ff882ee6-69d5-4a2e-994c-ae9c71780023,vivienne bruggink,2,,"ik word er niet goed van, maakt meestal heel moeilijk verbinding met printer, ik moet van alles doen, printer aan uit aan, modem aan uit aan, tablet of foon aan uit aan, en dan doet ie t soms, duurt úren! ik weet niet waar t aan ligt hoor maar zo makkelijk t lijkt, zo moeilijk het is! mooi klote hoor, zóveel moeite doen voor n scan en n printje pffff",26.0.1.6280,2026-03-10T16:26:22,nl,Google Play,2
eb88d7c2-bafb-4d36-a3b1-6fa2b84daca7,Jesse Q,1,,Fairly useless app,,2026-03-10T16:13:19,sg,Google Play,0
c907c6d2-dd5f-4298-b383-781869730291,Maria da Conceicao Ribeiro,5,,muita boa.,20.2.0.6076,2026-03-10T15:33:20,br,Google Play,0
3c2f770d-e2fb-4eb4-be04-8b0755abd91f,Mithra Invictus,1,,"after the new update they ruined my previous config. Thanks, useless UX team.",26.0.1.6280,2026-03-10T15:26:17,sg,Google Play,0
61e0b19a-91b0-4f31-bd60-c88b1b4569c3,Guillaume Vergnaud,4,,Fonctionnement ok mais manque des fonctionnalités pour faire facilement du recto verso ou autres mise en page,20.2.0.6076,2026-03-10T14:48:56,fr,Google Play,0
acfdcd86-cdd0-4600-b616-61cfaf7b996f,Jean Patrick Desmartin,5,,Super !,26.0.0.6234,2026-03-10T14:29:27,fr,Google Play,0
778f90bb-2a18-40bf-b632-4a6c35a7ea1c,Paul Tophill,1,,rubbish stopped me being able to use my printer.,17.35.0.5115,2026-03-10T14:13:00,sg,Google Play,0
ebe55ce4-db1e-481e-b8fa-cf8da0f59ebd,Madhusudhan Badsheshi,1,,App is struggling to open on my phone even after uninstalling and reinstalling the app,,2026-03-10T13:16:24,sg,Google Play,0
8339b8af-6308-4c86-bdc0-353a38488fbb,Mariella Franco,1,,non riesco ad aprirla,26.0.1.6280,2026-03-10T12:01:55,it,Google Play,0
a458da76-d4b3-4364-88b6-39f77be5a0e1,Pam Holm,1,,I finally updated. Can no longer change the size of my paper.,26.0.1.6280,2026-03-10T11:59:39,sg,Google Play,1
f8d132ee-85f3-46c8-8184-e4aa1bef6d47,Christine CB,1,,impossible de souscrire à mon abonnement j ai raté l'offre instant Ink,26.0.1.6280,2026-03-10T11:49:25,fr,Google Play,0
0c0eab61-12ca-42b3-8587-318fb3b0cd43,Laura,1,,je n'étais déjà pas contente du nouveau visuel qui n'était pas du tout intuitif et je vais réitérer mon insatisfaction parce que là c'est le pompon je ne peux même plus ouvrir l'application pour scanner des documents c'est du grand n'importe quoi franchement j'ai une imprimante que je ne peux pas utiliser. vous devriez avoir honte.,26.0.1.6280,2026-03-10T10:49:27,fr,Google Play,19
e0c07881-1778-442f-a3a5-f5cdd0fe2fad,Sheri Hesse,5,,I love that you can print from almost anywhere,26.0.1.6280,2026-03-10T10:33:17,sg,Google Play,0
10547f2f-085a-45e0-b59d-e15e5b291153,jose rivas,5,,es importante está aplicación,26.0.1.6280,2026-03-10T10:33:16,es,Google Play,0
23ad0e42-2840-4c15-8822-5110af611242,Alinne Sato,5,,"App muito bom e fácil de usar. Na impressão gostaria de ajustar dentro do app o tamanho da imagem que vou imprimir dando zoom direto na tela, é a única coisa que sinto falta em comparação ao app da Epson.",26.0.1.6280,2026-03-10T09:33:49,br,Google Play,4
5b57b817-4f43-42cb-b3e9-db8a1cce3bbf,Mitchy,1,,Application honteuse une heure à chaque fois pour capter mon imprimante. Affichée distante où hors connexion alors qu'elle est allumée.,17.15.0.4720,2026-03-10T09:25:17,fr,Google Play,0
b46b97fe-0070-4e31-8547-469efa2edf51,Hanner Marie,1,,it no longer even opens as an app I just keep getting a loading circle and nothing else. I am fed up of it. then sometimes itll print bits and not the full page. i shouldn't have to keep on resetting my phone and internet to get the printer to work when they already charge me triple the amount for the 2 things that I receive even when its barely on time or turns up when its needed.,26.0.1.6280,2026-03-10T09:19:13,sg,Google Play,4
2184ded1-b059-4117-a6c2-b1ce187cf8d5,Jinay Vora,1,,"my 'printer is not listed' in the app, this text appears every time I try to connect my printer with this app and no appropriate response is given by its AI.",26.0.1.6280,2026-03-10T09:13:40,sg,Google Play,1
ad619c58-1c16-4eef-8333-814a47eda4f3,Vijay Patil,1,,This app itself is useless,,2026-03-10T09:04:13,sg,Google Play,0
4c69a798-901c-4204-b02b-4d5777e03972,Doru Vitalariu,1,,"Terrible ... each time I need to use it from many years in 3 locations ... not finding the printer ... not doing anything... just white screen (Wi-Fi was good, I restarted everithing) ... very bad",26.0.1.6280,2026-03-10T07:53:29,sg,Google Play,1
b5cc2f65-87c0-47e9-a7c7-75d50d5b454b,Igor,1,,freezes at startup,20.2.0.6076,2026-03-10T07:33:03,sg,Google Play,0
839b4692-0ac9-435b-9d8d-f6f93f44eb84,Seniore Mustermann,1,,Wie zuvor ist die Anmeldung nicht möglich!,26.0.1.6280,2026-03-10T06:58:13,de,Google Play,0
3a2cba47-4cd5-4d4b-920b-d9ac2d4b1581,Julieta Rivas,5,,buena,26.0.1.6280,2026-03-10T06:48:01,es,Google Play,0
146e3fec-a571-4386-9ebf-132c64c83d52,Sami _mohammadi,1,,you add the option to find printer with ip in iphone but that option is not available for Android please add that to Android as well 👏👏👏,16.0.0.4184,2026-03-10T06:28:37,sg,Google Play,0
ba04aad2-8d6c-4543-ae55-7357413d3354,Adam Baker,1,,App won't even open now. making me very angry lol. Screw this. Canceling my HP printer subscription.,26.0.1.6280,2026-03-10T04:31:32,sg,Google Play,0
edbbadbe-5760-4134-a75c-cb2751d279ce,Akrawat Siripattanachok,1,,Updated: unable to open this app 😡😡😡,,2026-03-10T04:13:06,sg,Google Play,0
e44e137b-905c-4842-b450-79747a3a63d1,Martin de Jesús Gracia Guerrero,5,,Extraordinaria!!!,20.2.0.6076,2026-03-10T04:01:54,es,Google Play,0
078705ce-b587-497d-89ea-b376b755a3af,bobbie Richardson,1,,won't open,26.0.1.6280,2026-03-10T03:24:22,sg,Google Play,0
4f4e8a19-6599-4fea-ad0a-2347b36dc951,anyelismiguel Ibarra,5,,me parece excelentes,18.5.1.5470,2026-03-10T01:37:58,es,Google Play,0
f5940119-4416-449b-9da5-88d76a2f88e3,Mel Ramos,1,,the app does not work on my phone or my laptop. I have a printer that I can't do nothing with at the moment but collecting dust. this needs to be fixed ASAP,26.0.1.6280,2026-03-10T01:33:01,sg,Google Play,1
