id,author,rating,title,content,version,date,country,platform,vote_count
b060fda3-ba76-45c9-a9a7-53d19df1e582,Costas ZanteKite,1,,Rubbish!!! the only thing that works in this app is how to buy stuff nothing else works no connection no nothing,26.1.4.6508,2026-05-28T17:57:22,global,Google Play,0
4d4d4be6-a2fc-4e58-b3d0-1c2bddd509a7,Christophe PIOLIN,5,,facile d'utilisation.,26.1.4.6508,2026-05-28T17:09:23,global,Google Play,0
fae31557-19a4-4e1f-b3be-f3079f4b1dd5,Constance Vercruysse,1,,frustrating,,2026-05-28T15:59:42,global,Google Play,0
f0df18d6-b779-4386-ba90-a0ab6d434f88,Alfredo Buratti,5,,Ottimo servizio .,26.1.4.6508,2026-05-28T14:39:39,global,Google Play,0
fdaeaa4b-2b37-4e69-9e42-a3eda7b4289c,Georgi Ivanov,1,,"Why I can't use my printer which is connected to my local network??? What is this stupid idea??? Are you dumb or what??? I can hear the printer reacting after sending my documents for printing and after that i get massage, connect to the internet... What is this stupid design??? Can't use the printer on LAN, it needs internet access and for what HP? U want to see my documents or what?",,2026-05-28T14:30:49,global,Google Play,0
70a2a003-2818-4e74-a1fb-419b1f2a0dc0,Revol Tanguy,3,,et que,26.1.4.6508,2026-05-28T13:09:46,global,Google Play,0
e2147a50-60cb-4a7d-9df3-503defd537fb,Donnisha “Don” Parker,3,,This app crashes constantly. I have to uninstall and reinstall a several times a month to get it to act correctly.,26.1.4.6508,2026-05-28T13:04:46,global,Google Play,0
dad91a07-2d39-411c-8f72-017773cce178,Akhil Mugrani,5,,good,26.1.4.6508,2026-05-28T12:25:14,global,Google Play,0
1c01b0d5-3ca4-4578-8e2b-3c7ab0d239bc,Shahid Rasool,5,,good app,26.1.4.6508,2026-05-28T11:52:01,global,Google Play,0
dc5dd91c-599f-4ed7-abcf-709dba992b92,Bernadette,1,,Ne fonctionne plus du tout👎🏼 désinstallé,,2026-05-28T10:27:04,global,Google Play,0
b4c85c43-261b-482c-b0ea-8314a6b9cc13,Rakesh Dakua,5,,very nice,26.1.4.6508,2026-05-28T08:31:50,global,Google Play,0
5aec494f-0a8c-4093-b40c-5b3915db5d79,SarahLeah B,5,,Easy to use!,26.1.4.6508,2026-05-28T07:48:21,global,Google Play,0
b41a45f5-a3ca-4114-bf21-ce71d31474d8,Carlos miguel Lopez vasquez,5,,"no sabía que se podía escanear ,asta que lo descubrí muy buena..",20.2.0.6076,2026-05-28T06:00:01,global,Google Play,0
962dd627-2405-4c41-98ef-3ec7feac2076,manglesh sharma,1,,printing issue,26.1.4.6508,2026-05-28T05:52:36,global,Google Play,0
d221ad38-a6ff-454b-bb67-2beaa5e8f075,Salvatore Antonioli,2,,"L'app è in generale buona. una pecca (riscontrata su tutti i dispositivi Android) è che la stampante scompare e sono costretto a riavviare il cellulare (ho cambiato gestore, quindi modem, ho collegato la stampante alla rete sia tramite WiFi sia su ethernet)",26.1.4.6508,2026-05-28T04:58:19,global,Google Play,0
bf37cd21-05e1-4bb1-83c8-df6414657b57,Jerry,1,,"Worst program ever. Can't find even one of our 3 HP printers in the house, all internet wi-fi and ""approved"" on their list. All connected to the same network. We're so over it we're gonna donate all 3 printers and completely go with another brand because this isn't the first time we've had issues with HP and poorly coded apps and drivers.",,2026-05-28T04:46:30,global,Google Play,0
2e090432-db2e-4a2e-8169-4d145a86bd44,Trease Lane,1,,Hp App is not working properly. Cloud scans will not upload. I have to use three different phones to get my scan. I don't like the update. Gotta to find another printer besides HP,26.1.4.6508,2026-05-28T04:18:46,global,Google Play,0
5464e2ae-93d5-4f76-b659-4269f634889d,anemon taro,1,,suckkkkkkk,26.1.2.6449,2026-05-28T04:06:59,global,Google Play,0
5da1b2bd-a1c8-4dbc-aa60-a935cfd49303,Miguel Alejandro,1,,"entra en mi top 10 de peores apps. está mal optimizada,poca atención al cliente, para cambiar el internet es muy tedioso y rara vez se puede lograr. y algo que olvidé es que también pide cada 5 minutos iniciar sesión es absurdo. entiendo que deben de tener seguridad pero a esos niveles ni los bancos.",26.1.4.6508,2026-05-28T04:06:04,global,Google Play,0
2293e7dd-81c8-481b-8b97-2e17115358a0,Munoz Hermelinda,1,,si hubiera cero estrellas las daría hasta que arreglen esta aplicación de impresora no sirve,26.1.4.6508,2026-05-28T02:09:25,global,Google Play,0
aa5eaa85-9b73-4f22-9160-28f9d9142abf,Luigui 89,1,,es una basura de Apple no me conecta a mi hp,26.1.4.6508,2026-05-28T02:06:42,global,Google Play,0
9d93d990-23a1-4d66-a703-0e2d8e564374,Alejandra Bastero,1,,no imprime,26.1.4.6508,2026-05-28T01:50:51,global,Google Play,0
5ee8508e-9e1e-4ed7-a5f6-a2f843bdbfe6,sergio cardiet,5,,super bueno,26.1.4.6508,2026-05-27T23:35:54,global,Google Play,0
2fbd786b-fdb4-43db-82a3-75f3dcea7f67,lunhita meza,2,,casi siempre no carga se queda en el círculo ahora no me carga lo que quiero imprimir,26.1.4.6508,2026-05-27T23:25:32,global,Google Play,0
8884a098-c9e6-434b-8f14-4d11a416b3a0,angelo gfmesquita,5,,O aplicativo está muito bom,26.1.4.6508,2026-05-27T22:58:55,global,Google Play,0
98782c3f-f7a1-4d81-abc1-8df63d93029e,Carlos arthur Souza,5,,ótimo para imprimir,26.1.4.6508,2026-05-27T22:36:54,global,Google Play,0
0a0c014d-623e-4c47-a3b6-46dc58f4e9d6,Karen Ramirez,1,,"si tienen la oportunidad de comprar una impresora Hp, desaprovechen la, tienes que instalar esta aplicación y la verdad se traba, hace lo que quiere, desde el celular la calidad es nefasta y fea, las impresiones parecen barridas, y si quieres escanear desde la impresora automáticamente te aparece la opción de usarlo desde tu celular, pero aunque lo quieras usar desde la impresora, desde la cuarta hoja se traba o se reinicia y lo que escaneaste no se guardó",26.1.4.6508,2026-05-27T21:07:32,global,Google Play,0
7cbc6832-e96a-49a9-ad1c-965ecdc50923,Enrico Testa,2,,le ultime versioni del software non stampano su alcune stampanti. sono tornato indietro fino alla versione: hp-all-in-one-printer-remote-20-2-0-6106.apk. e con questa ho risolto il problema.,10.0.1.3888,2026-05-27T19:42:13,global,Google Play,0
be397fab-1bcb-44a9-8cae-51d85e1099c5,Giulio B,5,,"funzionamento impeccabile. sono mesi che gestisco tutto da smartphone, anche abbastanza vecchiotto, senza accendere più il PC. utilissima oltre la stampa anche la scansione wireless. estremamente soddisfatto",26.1.4.6508,2026-05-27T18:44:01,global,Google Play,0
9f736464-97bb-4814-8662-f6f4f145649a,Virtuous Attionu,5,,very good,20.2.0.6076,2026-05-27T18:39:25,global,Google Play,0
32169757-f273-499d-8fbf-62945cbc54b5,Molina Valladares Enrique D. (Daramis),5,,espectacular,26.1.4.6508,2026-05-27T18:36:52,global,Google Play,0
7cdf06e7-c09c-477d-a1cd-d3e6f12311f5,nikalish1031,1,,"DO NOT SIGN UP FOR HP Plus Instant ink, literally will make your printer run stupid after you cancel it, they have a chip in the ink and they track how much you print and it's actually quite expensive 🫰 unless I mean it's worth it for your needs.",,2026-05-27T17:02:12,global,Google Play,0
c264b50e-1022-439d-aa82-11aecb1da9fd,Viviane GELIE,5,,"Je découvre, et je suis pour l'instant émerveillée.",26.1.4.6508,2026-05-27T16:43:27,global,Google Play,0
c08e534d-a6de-4bbf-9a35-6efaae057058,agatha mantanes,1,,does not recognize my printer,26.0.2.6338,2026-05-27T16:06:47,global,Google Play,0
22c08ddd-6af1-4f51-ba34-7b528280c57a,Francislena,1,,Perdi duas ou mais horas para descobrir porque essa droga de impressora estava e sempre está off line. Sempre desligo da tomada e quando vou usar não quer funcionar. Horrível CONTINUA PÉSSIMA...,17.10.1.4636,2026-05-27T15:20:57,global,Google Play,0
0df98368-b819-4cac-bb9b-06aea62add97,Anaid Colina,5,,excelente,26.1.4.6508,2026-05-27T13:33:24,global,Google Play,0
2203d6ff-baf2-4b2f-97e6-2cc0e4c150e4,Dominique MERER,4,,scanner hyper facile d'utilisation,26.1.4.6508,2026-05-27T13:30:18,global,Google Play,0
7999d158-e482-46e6-8e72-3847f377333d,Edouardo Licha,5,,Top of the world,26.1.1.6403,2026-05-27T13:20:00,global,Google Play,0
8aa6f3d8-189c-44c8-88eb-841b535e1243,Francesco Avigliano,1,,la stampante stampa una volta sì e 10 no occorre fare i salti tripli mortali per poter stampare una pagina. per stampare dal cellulare grazie al software di ultima generazione occorre continuare a passare dalla connessione dati al WIFI Direct. il risultato è che ci si impiega mezza giornata per stampare un foglio A4. Ah che bei tempi quando si utilizzava il bluetooth un po' più lento ma funzionava sempre!!! non consiglio a nessuno HP!!!!,26.1.4.6508,2026-05-27T13:18:57,global,Google Play,0
90e147ac-304e-4c05-b46e-e75e1755a7c5,Agnès Germain,1,,nul. matériel neuf défectueux,26.1.4.6508,2026-05-27T12:43:58,global,Google Play,0
2523d2fc-7be6-4b4e-a64b-5dfdb7454ab6,Sylvia Carroux,1,,"super déçu je viens juste de l'acheter l'imprimante j'ai pu un imprimé une fois et depuis elle veux plus se connecter a ma wifi . j'ai tout fait vérifier ma correction internet, que tout sois bien branché pour imprimante . rien me change",26.1.4.6508,2026-05-27T09:04:33,global,Google Play,0
3b210f8f-8eec-411f-a676-1bceac2ac77c,Francesco Ciravegna,4,,al momento ho appena installato l'applicazione e quindi non ho esperienza,26.1.4.6508,2026-05-27T08:56:17,global,Google Play,0
eabadd58-4a3c-40dc-bd24-f557e2eb192a,Massimo Morresi,2,,difficile da usare per principianti,26.1.2.6449,2026-05-27T08:36:42,global,Google Play,0
43fca71d-3558-4f5f-b1ab-49d0d08a0682,Mireille Progin,3,,très bien,,2026-05-27T07:39:28,global,Google Play,0
9347f5f7-3177-4240-be66-d52e726a2171,Nicola Argenziano,5,,Eccellente,20.2.0.6076,2026-05-27T07:24:07,global,Google Play,0
b7372718-d7ec-45bd-aa77-3d3c7d884d07,Christian Stolte,1,,Mit großem Abstand die schlechtesten Erfahrungen gemacht. Drucker ist ständig nicht mehr im Netzwerk und kann auch nur schwer wieder erneut eingerichtet werden. Fazit: nie wieder HP Drucker!,26.1.4.6508,2026-05-27T06:33:14,global,Google Play,0
1df1b7f6-99ef-48a8-a5f1-d1d688b6b7d5,Yunus Shaikh,5,,good very easy printout,26.0.1.6280,2026-05-27T06:12:32,global,Google Play,0
212681c2-0def-4492-adc2-dad0b9873432,Anita Labelle,1,,this app sucks,,2026-05-27T05:39:42,global,Google Play,0
429ae6ff-5156-44ca-8f9e-6f8027e5db18,Nisha Singh,2,,"i travel quit a bit so I take my printer with me and everytime I have to reconnect to wifi its a NIGHTMARE. I've been fumbling with the printer and app for 2 hours just to print 8 pages. This isnt the first time. Practically everytime I reconnect to a new wifi or return home to my old wifi, the app and printer send me on an endless loop only reconnecting after some miraculous ritual of repeating the reconnection steps 10+ times. I should t have to rely on just the app to connect to wifi!",26.1.4.6508,2026-05-27T03:25:46,global,Google Play,0
1c58772d-c2e9-43f3-87a8-a7f79b6f89f8,Janis G,1,,My printer is on the Wi-Fi is on. I have done everything possible. And it still will not connect to my printer.,26.1.4.6508,2026-05-27T00:58:08,global,Google Play,0
1be4c961-bc3d-48db-89fd-bd073c16e2b0,Taron Julhakyan,2,,printing doesn't work for HP ENVY Photo 6234,26.1.4.6508,2026-05-27T00:54:28,global,Google Play,0
7b5cba8d-6986-4675-a2c6-a8ec125e9487,Carlos Perez,4,,solo que aveces se traba y tengo que volver a bajar la aplicación para que vuelva a funcionar,26.1.4.6508,2026-05-27T00:52:36,global,Google Play,0
736eee8d-0fdf-429f-ab4e-0e8f9bb4b639,Nancy Saldana,4,,"Andaba bien pero ahora me dice q la impresora no está disponible y no hay forma q funcione,o sea q es la app,xq la impresora funciona perfectamente",26.1.4.6508,2026-05-26T23:09:08,global,Google Play,0
0d7e44d7-c111-4160-b158-59769c78e623,André Guimarães,1,,"Aplicativo cheio de bugs, apresenta poucas opções de configuração da impressão, distorcendo a imagem. Até a interface parece intuitiva, podendo imprimir ao abrir o arquivo ou selecionando pelo app, mas dependendo da maneirque a impressão é iniciada, as configurações são diferentes, tornando o uso confuso. Confiei na possibilidade de impressão via Wi-Fi ao comprar a impressora e no fim precisei mudar o aparelho de local para imprimir via cabo.",26.1.4.6508,2026-05-26T22:53:16,global,Google Play,0
a5accef9-4db6-4712-845b-faafc0823cec,Brian Shumaker,1,,would be really great if I didn't have to restart my printer everytime to get it to connect. maybe make better printers that work 100% of the time,26.1.4.6508,2026-05-26T22:32:12,global,Google Play,0
4c381331-9564-4778-9029-53851329f12e,Jonathan Baer,1,,"Links never load. Have to use FB messenger for live help, and response times are awful.",26.1.4.6508,2026-05-26T22:11:40,global,Google Play,0
57577d4b-2fa2-42fc-a1c2-5c6f50a639ad,william beahm,1,,I got a new Internet service and now I can't connect wirelessly. I just ordered a hard wire for it as there is nothing wrong with the device. I typed in my serial number for my printer and it comes up with a 2755E printer. How can my printer serial number be linked to a printer I don't even have. I am done trying to figure this wireless junk out. Also I am not contacting support to be charged an outrageous fee.,26.1.4.6508,2026-05-26T21:37:01,global,Google Play,0
1e13fab3-d24f-4d9d-8196-6580ad3e8275,ana martinez,5,,amazing tool for all you printing and scanning needs,26.1.2.6449,2026-05-26T21:14:07,global,Google Play,0
e9a2a400-5354-4fb6-9eca-cc884f5aa612,Carmen Castillo,5,,te califico bien pero no sé puede conectar mi celular a mi impresora HP DesKJet Ink Advantage 2900 All-in-One Printer series,26.1.4.6508,2026-05-26T20:49:20,global,Google Play,0
db480e3b-5dc6-4561-8e44-a5145e0be08f,Jorge Carranza,1,,no deberían cobrar por imprimir en mi propia impresora,26.1.4.6508,2026-05-26T20:35:44,global,Google Play,0
539d4f1d-3332-43da-9050-29182774792c,Joseph Esquier,1,,"mise à jour incompréhensible, problèmes de connexion, impossibilité de scanner à distance avec une imprimante HP qui ne fonctionne qu'en wifi...",26.1.4.6508,2026-05-26T18:37:11,global,Google Play,1
387881f2-6b6a-433b-aafc-cb05991f3794,Hilary Crowther,1,,dreadful back to shop you go,26.1.4.6508,2026-05-26T18:20:47,global,Google Play,0
603118c3-fd17-47a3-a820-abe0240728aa,Kevin Yomi,5,,really nice,26.1.4.6508,2026-05-26T18:05:58,global,Google Play,0
9cd5226f-5982-424f-80dc-3ad69c123c05,Omer Zmh,1,,"Forces to sign in.! No thank you! Why do I have to sign in to print my documents with my printer. It might be optional, but no...",26.1.4.6508,2026-05-26T17:56:47,global,Google Play,0
5f0effea-eefd-4278-a424-dfea76be86db,oscar alberto madrid schwarz,5,,"buena aplicación compatible con la impresora, saca de apuros, pero hay que estar cerca y con el aparato prendido, pero tiene otra manera de escaneo sin el escáner en caso estés en la calle y cuadra el documento , pero tiene que cuidar la iluminación ya que es luz, pero es útil",26.1.4.6508,2026-05-26T17:29:47,global,Google Play,0
49197a5e-0b6c-4795-bd66-07c152f57953,Lennart Andersson,1,,funkar inte,,2026-05-26T16:59:42,global,Google Play,0
8a6e0888-de49-46b3-a342-2e24862532dd,Ian Marcus,1,,"Your brand new updated HP app can't find my HP printer. Which means I can't print. Which makes this useless. One star for both app and HP hardware I general. I don't understand how in this day and age, HP can create a printer and app experience so horrible and difficult to use. It's 2026.",26.1.4.6508,2026-05-26T16:26:29,global,Google Play,0
be0c8798-ee27-4b54-b2f3-547991233ddb,Daniel F,1,,Horrible!,26.1.4.6508,2026-05-26T16:08:14,global,Google Play,0
ccf54808-2063-47d5-b6c7-9d979c2b4a04,Luz Guzman,1,,no presta buenas observaciones,26.1.4.6508,2026-05-26T15:53:12,global,Google Play,0
ec84beb9-f8c5-4824-a987-77b29b46ebe7,Zashare Campbell,1,,"worse than HP Smart even though it states the printer is connected you are still unable to print, to scan documents even worse it ask to connect to wifi direct and still you cannot scan HP app are totally useless this new app is way worse due to the switching of network to scan or print when hp discontinue HP Smart its all over there no print or scanning its time to leave HP",26.1.4.6508,2026-05-26T14:55:20,global,Google Play,0
611691d1-fa51-463d-8f4b-442d8ca77947,Misk Sartorato Rodrigues,1,,"Aplicativo HORROROSO, é lamentável a HP fazer um aplicativo tão ruim sendo a empresa do tamanho que é no ramo de tecnologia. Não dá pra usar a impressora sem esse aplicativo só funciona online (simplesmente não funciona em LAN) te obrigam a criar uma conta, aplicativo trava toda hora, diversos erros, o Wi-fi Direct não funciona, nada funciona. Decepcionada com esse aplicativo e com o produto HP que eu comprei!!",26.1.4.6508,2026-05-26T14:31:47,global,Google Play,0
36016542-19ff-4a24-af66-56b8578cefa8,Rocky Dezelle,5,,works for me,20.0.1.5732,2026-05-26T14:06:44,global,Google Play,0
714fe864-edb9-4623-9fe3-ede741c7c981,Lucile B,1,,vous pouvez mettre à jour votre appli? elle est bugué et imprimer un simple document est ÉPROUVANT tellement c'est long et que y a pas un bouton de raccourci simple pour le faire,26.1.4.6508,2026-05-26T13:34:48,global,Google Play,0
33de2098-5a50-4459-80c5-b9d7973e668e,Carre Patrice,1,,"bonjour, je ne parvient pas à imprimer ! quoi faire ?",26.1.4.6508,2026-05-26T13:25:03,global,Google Play,0
1cd01f0c-769c-462a-a85a-57cb17eea6cb,Gwyneth Aivy Creencia,1,,"idk what this app is for, its not working!!! pls fix this shittyvass app right away! waste of time",26.1.4.6508,2026-05-26T13:23:45,global,Google Play,0
e55e6d22-52b3-4095-a82e-6e1e4a1a440f,Erika Rojas (Xinita),5,,lo mejor,26.1.4.6508,2026-05-26T12:25:35,global,Google Play,0
3b25baab-b271-4717-bf02-4a6b832be7a6,Son Goku,1,,"una basura, su wifi es pésimo",,2026-05-26T12:08:39,global,Google Play,0
67c4f987-a86c-4b41-b3ef-04bc71759254,Giammo Costa,1,,uno schifo,26.1.4.6508,2026-05-26T11:38:59,global,Google Play,1
ce5a3e68-77e6-44e6-b2e7-d14c833fd469,Marcos Quinhão,1,,"não consigo conectar a impressora por nada no universo, o app sequer faz a busca de impressoras disponíveis",26.1.4.6508,2026-05-26T11:02:50,global,Google Play,0
8ecec117-9631-4004-b0b6-0b057d2bea62,Maxime83,1,,Aucun intérêt d'obliger a mettre un compte pour imprimer. Surtout qu'il est impossible de retrouver un mot de passe perdu....,20.2.0.6076,2026-05-26T10:09:33,global,Google Play,0
053ec5de-d4ca-46e3-9401-c652f57014cf,p,1,,words cannot express how hateful it is to print over wifi with hp... 🤬,26.1.4.6508,2026-05-26T10:00:59,global,Google Play,0
6bcb484e-dd12-47c1-8f16-3bfc6ba146e4,Johnny,3,,Dopo l'ultimo aggiornamento non si carica la pagina per vedere le pagine rimanenti del mio abbonamento,26.1.4.6508,2026-05-26T09:45:29,global,Google Play,0
fff476a2-cafe-4354-83a2-55bc84032eea,léa royer,3,,enormement de beug...,26.1.4.6508,2026-05-26T07:23:00,global,Google Play,0
7771eb39-d3e4-40e3-a50f-70428596cbb0,Maurizio Coricello,1,,più la uso più fa schifo,26.1.4.6508,2026-05-26T06:09:53,global,Google Play,1
5738d720-3213-4ff2-807c-672aec028be2,John Doe,1,,"Always says not connected despite wifi being fine, restarted everything, done everything I can to fix it but won't work. I've reconnected it everytime i unplug the printer but it doesn't work. even after reconnecting and app telling me it's connected, it won't connect. Works fine on windows app though.",,2026-05-26T05:53:41,global,Google Play,0
8ac82526-3610-411b-9078-df5306b62926,FRANCISCO JAVIER MARTINEZ HERVAS,5,,es de uso fácil e intuitivo,26.1.4.6508,2026-05-26T05:30:23,global,Google Play,0
83119f92-6a73-4a1e-8d47-e11319c45b7d,Nndwakhulu Baldwin Mudau,5,,good,18.5.1.5470,2026-05-26T04:51:48,global,Google Play,0
32a68e28-69ad-40e1-843c-3562ddd77ec2,Cool Robinson Kids,1,,circles to get printer set up,26.1.4.6508,2026-05-26T03:18:01,global,Google Play,0
ad84c2f1-a823-47b2-ae04-4d4d1ceeeaed,James Applegate,5,,its alway reliable when I need it ty HP for making my world 🌎 alot faster and convenient,26.1.4.6508,2026-05-26T01:31:54,global,Google Play,0
8ec0e606-9974-4150-b606-0a1ef0a0ff5c,Keith Thompson,1,,Terrible absolute trash not user friendly at all not even close.,26.1.4.6508,2026-05-25T23:52:34,global,Google Play,0
fbfa1897-3593-404b-8ddb-511fe0cfafb9,Jose Luis Longat Lugo,5,,Excelente,26.1.4.6508,2026-05-25T23:45:45,global,Google Play,0
f5d33505-dc2c-49cb-aabf-5ec05bff84f4,Jason Lehnst,1,,Nothing short of complete garbage. Can print from my laptop with zero problems ever. App has about a 5% success rate.,26.1.4.6508,2026-05-25T23:21:35,global,Google Play,0
8660db11-b7b6-47af-9b43-aea7db295b04,Jorge De Dracia,1,,un kgda,26.1.4.6508,2026-05-25T23:04:43,global,Google Play,0
b9cfd068-8785-4146-8157-d4af56c02fc9,EVELYNE DURIMEL,1,,j ais du mal clavier bloqué déroulement marche a wjivre,,2026-05-25T21:32:52,global,Google Play,0
f0f6ca79-56e2-4804-8e59-7413cf6ff761,Officially53 Smith,5,,love it shame this printer cannot print double side other wise fab,18.10.0.5530,2026-05-25T19:33:53,global,Google Play,0
349d65ea-dc14-4bc4-b645-d32502073687,Ellen Williams,1,,It's not compatible with my device :(,26.1.4.6508,2026-05-25T19:32:52,global,Google Play,0
f6d679f4-1c07-4417-8657-d3f4e254b5ca,MUSC CANT,5,,ótimo,26.1.4.6508,2026-05-25T19:25:18,global,Google Play,0
8c51c547-8d5e-4b78-8eab-a7d206f087d4,Dave DiLena,1,,"Bought a new printer and I incredibly regret it. I have owned the printer for a little over a year and it has never printed from any source except mobile phone. I need to reinstall the software ever time I use it. The App doesn't work, the printer doesn't work... It takes 20 to 40 minutes to get the printer connected to any device. The support is entirely non existent and there is no way to contact anyone. I hope this company goes out of business and I actively tell everyone so.",26.1.4.6508,2026-05-25T19:21:57,global,Google Play,2
b795a878-4e65-48e2-a6b9-9180e46fbff9,Paul Hurst,1,,dreadful. laggy awful useless app,26.1.4.6508,2026-05-25T19:14:28,global,Google Play,0
248b8787-02e9-4525-9959-2442e0837da1,atharv hotelware,1,,very hopeless application can't connect to my printer ... ducking white,,2026-05-25T18:23:33,global,Google Play,0
34dc5135-0dd5-4509-833a-bbc78f3dceee,carlo azzalini,1,,"piena di bug, caricamenti infiniti, impostazioni scarne e che cambiano posto ogni volta. pessima, conaiderando che molti come me pagano l'abbonamento per un tot di stampe al mese ma non si riesce a stampare. ovviamente quando poi sei di corsa e serve stampare qualcosa al volo, puntualmente non funziona",26.1.4.6508,2026-05-25T18:06:07,global,Google Play,0
5fe88186-8604-4598-94b4-029b75a1b25c,marius danca,1,,"app lenta e non completa la configurazione. davvero pessima, soldi buttati",26.1.4.6508,2026-05-25T17:53:34,global,Google Play,0
be2edd3f-1eff-4693-aa03-e8bb8f9d4de0,Rin,1,,honestly don't download this and don't buy their printers,26.1.4.6508,2026-05-25T17:50:19,global,Google Play,0
29162879-41c1-4e5c-ab8a-8f4892462a3e,Etienne Stolze,1,,"HP ist Betrug Der hintere Papiereinzug vom Drucker war schon ab Tag 1 total für die Tonne. Der Flachbetteinzug funktionierte nur 1x, dann war die Funktion aus unerklärlichen Gründen nicht mehr verfügbar. Nun soll ich mich in der App anmelden? Die Manager bei HP sollten die Finger von harten Drogen lassen. Einmal und nie wieder HP🤬",26.1.4.6508,2026-05-25T17:30:31,global,Google Play,0
ee63e725-aa3e-43aa-8895-a8bb30b889bb,Selma Coutinho,1,,não consigo usa a impressora,26.1.4.6508,2026-05-25T17:06:22,global,Google Play,0
df662d38-db29-43e1-8931-a0404062a537,ivanik62,3,,Ho una semplice hp laserjet m140w. Ho spesso necessità di usare la stampante con wifidirect. Le stampe funzionano mentre le scansioni no. È un vero peccato per me in quanto questa funzione mi serviva. Se riuscissero a sistemare sta cosa non esiterei a dare 5 stelle.,26.1.4.6508,2026-05-25T16:26:57,global,Google Play,0
92b366e0-5b13-4604-8318-3c71aa7ff84e,Janice,1,,insisting I subscribe and wants card details. going around in circles here. the support is as much use as a chocolate teapot in a heatwave,26.1.4.6508,2026-05-25T15:40:54,global,Google Play,0
502a4106-9348-4089-8a7f-c8ef75548026,Paulinho Vargas,5,,muito bom facilita bastante,26.1.4.6508,2026-05-25T13:31:20,global,Google Play,0
f8c28e0c-f973-48a8-8a6b-f283287c92f6,Saney Monte,5,,maravilhoso,26.1.4.6508,2026-05-25T13:05:59,global,Google Play,0
4afe390d-8f92-482b-9861-e932e426d70f,Cupidon J,1,,depuis votre mise a jour mon imprimante n'est plus prise en charge de ce fait je ne peux plus me servir de mon téléphone pour imprimer encore une fois c'est de l'abus sa pousse a un nouvel achat alors que mon imprimante fonctionne très bien,26.1.4.6508,2026-05-25T13:00:24,global,Google Play,0
c3f6b01d-0344-4673-b63a-a967cbde46ef,Cipri CATANA,1,,can't use the printer if you cancel the subscription .... horrible company,26.1.4.6508,2026-05-25T12:18:50,global,Google Play,0
8c4d642a-d3b6-46d9-bc4d-a113fa258e30,Champak Banikya Banikya,5,,very good,26.1.4.6508,2026-05-25T12:14:02,global,Google Play,0
3b03ef19-4b99-4dc9-8393-1400cd44680e,Ransome Mutasa,5,,good,,2026-05-25T11:59:27,global,Google Play,0
7d8b5816-003d-4ed9-b538-2644215e8eb6,Kushal Gupta,1,,Doesn't remote print most of the time,26.1.4.6508,2026-05-25T09:30:34,global,Google Play,0
deec8ae2-466b-4e2a-8149-3b57c14e2248,Mwehehe Mwehehe,5,,takes a while to print bc my printer is old and its from hp but I love the app,26.1.4.6508,2026-05-25T07:53:46,global,Google Play,0
78c4b28c-f3fa-4138-8368-3aaeb90e2629,Ahsan,1,,"It's a terrible app. The app can't even detect its own printer when selecting WiFi setup. Even after adding the serial number, you still have to set up the printer manually. I've been trying for the past 2 days, but I still haven't been able to connect the HP Laser 107w. It was working fine about 5 months ago. Then I changed the WiFi password and reset the printer after that, connecting the printer to WiFi has become a complete nightmare.",26.1.4.6508,2026-05-25T07:36:31,global,Google Play,0
12c3fead-3ddd-4467-8ab8-5b0805a87432,Yanto solo,5,,good,26.1.4.6508,2026-05-25T03:23:16,global,Google Play,0
