id,author,rating,title,content,version,date,country,platform,vote_count,reply_content,reply_date
35039291-daf2-4429-ae35-c7d4dca29b4d,natalja storhaug,1,,"Poor reliability and app limitations. The printer has frequent issues, but the main problem is the HP app. Print quality is inconsistent—shipping labels and documents often come out blurry, faded, or incorrectly formatted. From the mobile app, it is not possible to properly fix or control these problems. Important settings are missing or reset, and you must use a PC to access basic functions and achieve acceptable results. This is unacceptable for a modern mobile app unreliable , frustrating",20.2.0.6076,2025-12-18T02:28:41,us,Google Play,3,,
e396095d-ad0d-4d75-92be-fafe3485e0ea,NORSHAMSUL AZLAN BIN MOHD NOR,5,,friendly user,20.2.0.6076,2025-12-17T22:23:19,us,Google Play,0,,
0dee6e2c-5263-4bda-a54d-3901f407c504,Roger York,5,,vertical b difficult to set up printer from my phone phone,20.2.0.6076,2025-12-17T21:13:37,us,Google Play,0,,
5c4d93c7-3f2a-4e01-a485-e127fa721e97,retina storm,5,,good,8.11.2.3,2025-12-17T15:53:26,us,Google Play,0,,
0e9c045e-4781-4a56-8b26-03719a9f4cc7,Dayana Robbins,5,,"so far really like using it, very useful for scans to be saved on mobile device.",20.1.2.5988,2025-12-17T13:12:04,us,Google Play,0,,
e1c6d831-5279-4b69-93ae-28b1bfe472fb,Orlando Rivera,5,,works great,17.35.0.5115,2025-12-17T13:08:11,us,Google Play,0,,
c430fd25-6d3c-49c3-a924-db7c7e740df8,Brent Phillips,1,,You removed the capability to scan from document feeder. My next printer will not be an HP.,20.2.0.6076,2025-12-17T13:07:02,us,Google Play,0,,
5892018c-b1b0-4594-8567-b87e3b2bce4d,Linda George,5,,good work for me,,2025-12-17T12:40:16,us,Google Play,0,,
d88bc71e-21bb-400e-bf31-81de94a02b36,Priscilla Cooper,1,,"app won't open at all. ""No such file or directory.""",20.2.0.6076,2025-12-17T04:55:36,us,Google Play,0,,
66d73b97-cb40-4e76-98c6-338a016412ce,Mukesh Mukesh,4,,ottimo app,20.2.0.6076,2025-12-17T03:24:49,us,Google Play,0,,
3f8cfd1b-174e-46b8-a3e5-a54da3cb1d31,Nathaniel,1,,printing from HP is a horrible experience. always takes hours to set up. never properly works. never buy this garbage printer,20.1.2.5988,2025-12-17T03:05:36,us,Google Play,1,,
41f7ab72-014f-4220-b847-dbe0d51f4d57,Adedamola Oluwagbemi,1,,"As of today 17 December, 2025, if you are coming to download this app for mobile scanning, abort mission. The features has been removed.",20.2.0.6076,2025-12-16T19:28:05,us,Google Play,1,,
4a72416f-c45c-4724-90de-ebd60b262044,Ju P.,5,,not good now!!!!!! stopped working like it did. Has just stopped,20.1.2.5988,2025-12-16T19:02:06,us,Google Play,0,,
c25dea12-154b-4d93-9813-5223dd9dd9b6,Michael A Berry,1,,"Enshitification enters overdrive as this app moves from ""mildly annoying but functional"" to ""a dumpster fire"". It cannot connect to any printers despite being on the same network. The printer itself is no better as it frequently loses connection in the middle of scanning to the app or network. Nothing else on the network experiences issues and the printer has line-of-sight to the wireless access point. I'm done with HP and done with their printers. Never again.",20.1.2.5988,2025-12-16T17:58:49,us,Google Play,98,,
92d59889-e806-4298-90d0-912278d95bbd,Daniel Teoh315,4,,Great,20.2.0.6076,2025-12-16T17:43:16,us,Google Play,0,,
fc3f0342-7406-41f8-b077-a219c1e5ca9d,William Riddle,4,,A waste of time,20.1.0.5822,2025-12-16T17:41:38,us,Google Play,0,,
dd176ecd-3e67-4c9e-a234-cb48fc2f08d3,Silvia,1,,Hair On Fire! What the hockey-puck did HP do? Kindly leave the *print* feature alone! Maddening to deal w/HP.,20.2.0.6076,2025-12-16T16:28:09,us,Google Play,0,,
57d38e66-1dbc-4645-8c63-0e318210f5cf,Christina Alexander,1,,I've downloaded this app so I can use the printable options for like a calendar and stuff like that I've updated the app now it's not loading when I hit on it and I've given up with it multiple times I don't know what to do now.,20.2.0.6076,2025-12-16T11:47:56,us,Google Play,0,,
90b8062a-8aba-4db6-aa88-7fcbca273ca0,Chris Ruggiero,2,,I loved the app before this recent update. it's been a couple months and they haven't gotten the bugs worked out. I'm constantly struggling with getting the app to connect to my printer. when they get the bugs out and it works like it's supposed to it's awesome. especially the camera scan,20.2.0.6076,2025-12-16T11:23:04,us,Google Play,1,,
ad35539d-7f1e-48ed-b743-e4dffb20cd1f,Graeme Walker,2,,difficult to manage and have a scanning printer that will not work with this app.,20.1.2.5988,2025-12-16T09:43:10,us,Google Play,0,,
2271c7b0-4d92-44af-bee0-11b45318f3c4,Leroy Smith Jr,5,,This Is a good website to go to,20.2.0.6076,2025-12-16T09:28:11,us,Google Play,0,,
a54835c6-c390-469b-9049-3541df3d1fda,Mohammed Nashith,1,,"when will it scan , at the day of judgement? . why can't I run it in local WiFi, oh wait🤭. then you won't get our important data , documents , id , art , photo . AI . ahahhaha",20.2.0.6076,2025-12-16T08:49:45,us,Google Play,1,,
1836da86-0faf-40d4-bf0e-145553b64481,Ravindra Shukla,5,,Wow it's good,20.2.0.6076,2025-12-15T21:20:46,us,Google Play,0,,
e7c7403c-38b2-43b3-a3ec-6e4c09720156,Reeses Puffs,1,,"dogshit app, forces you to download an app and sign in just to print, very slow and doesn't load anything unless you have internet but your connected to the printers WiFi so you have to switch everytime. took me 30 mins to print one paper with really bad quality and random colours",,2025-12-15T17:19:05,us,Google Play,0,,
ef959cb1-ad04-4170-9115-a92c4add9808,Joe Senkow,1,,i went in circles trying to get a printer working that was previosly fine until hp locked it out. i absolutely hate hp and all their products. the printer and this app are going in the trash,20.2.0.6076,2025-12-15T16:53:56,us,Google Play,0,,
e6c8e5a2-c7c4-40a3-a646-b84d3bea730c,Danny Lam,4,,"A decent app, keeps you up to date with your printer, but I doubt its ink accuracy",20.1.2.5988,2025-12-15T16:12:12,us,Google Play,1,,
d5f74ae5-c429-4b73-9b57-4890cf8d095e,Elvis Morgan,5,,easy to use.,20.1.2.5988,2025-12-15T15:44:20,us,Google Play,0,,
9a70e7f5-9811-4612-8327-04cf4916eae3,Angelo Elkins,1,,"My printer is held hostage by HP. I signed up for the subscription that would send ink when I need it and was running low. I paid for 4 months of it and printed so little I never needed a ink cartridge to be sent out. I decided I didnt need it any more. I got a notification on my printer that I can not use the printer until I fix my subscription, the one that I never used but paid for, for months. I never thought that a subscription I signed up for, for convenience would be inconvenient!",18.10.0.5530,2025-12-15T15:14:55,us,Google Play,0,,
a9cee33f-730b-4fa2-87ba-3c5fd1ebd9c3,Donna Cannaday,1,,HP quit working with my printer. thanks for screwing it up,20.1.2.5988,2025-12-15T11:23:14,us,Google Play,0,,
7348d99f-ff1e-44e5-9591-bf25682d5e5c,Harley-Dene Russell,1,,so terrible doesn't tell u how to use anything and charges crazy amounts for ink,20.1.2.5988,2025-12-15T09:36:23,us,Google Play,0,,
9f519c7b-df37-4fe7-80d3-32265fae8ff6,Jade Slocombe,1,,"It's appalling that an app from a printer company doesn't have a 100% scaling option. Which means the 'mobile printing compatible' printer I've bought, isn't, since I can't print the primary things (sewing patterns) I bought it for. it's such a basic function that I didn't anticipate having to worry about it.",20.1.2.5988,2025-12-15T08:21:35,us,Google Play,1,,
6a4de732-f9b8-4575-ac30-568e8e58f7ed,awlo des,1,,"One innovation they could consider is developing printers that print. The app sees the printer but won't print. There is a hide printer (what dumbass thought of that) but no uninstall to try to get it to work. The app takes forever to do anything. Do yourself a favor, buy from a company that knows what it is doing.",20.2.0.6076,2025-12-15T08:06:28,us,Google Play,1,,
e9b0ef3f-746c-47e9-9828-6a929228af0a,cat,1,,the only reason why I keep them is because they have an amazing plan but when it comes to update your payment online you won't be able to do it when you call them they don't know what's going on don't ever call them in the app is trash and like I said I keep it cuz they have a good plan when it comes to you as far as printing but as far as customer service or helping you resolve an issue don't ever call them they're trash in that department it is no need to get up here with a comment cuz you're,20.2.0.6076,2025-12-15T07:59:13,us,Google Play,0,,
57dce5a0-2bdb-4e65-8144-bbc31fb37f9c,Tasha Moore,1,,app never works since the update when it finnaly does load my print it just errors out before it prints EVERY SINGLE TIME,20.1.2.5988,2025-12-15T07:08:05,us,Google Play,0,,
657a79d4-6e54-48e7-921c-27a03571713f,Sandy White,1,,I use to be able to scan from HP envy to my Onn tablet using HP Smart app. Now I cannot why is this feature not available now?,20.1.2.5988,2025-12-15T05:19:27,us,Google Play,1,,
1de25804-187d-4a90-a691-157fe3df423c,asmabi shahid,5,,very good 👍😊 Happy,20.2.0.6076,2025-12-15T04:10:53,us,Google Play,0,,
4c3c2e03-7ba9-44b6-87aa-8ce55ea0fe6e,Darshita Samant,1,,Such a nonsense application. The graphics are so attractive but the features are completely useless and slow. It's not my gadgets memory but the programming of this app. Kindly fix it before going any worse,20.1.2.5988,2025-12-15T01:30:50,us,Google Play,0,,
d8bad249-61f1-4033-8e66-3d6fce71c368,Usman 'Uzzi' Khokhar,1,,"The redesign is terrible terribly slow, I should be able to get in and out of the app in less than 3 seconds.",20.2.0.6076,2025-12-14T23:45:39,us,Google Play,0,,
8e31749a-472f-4d14-ad15-b424c71ae4c1,Carla Clemente,1,,Why would you give an option not to create an account or sign in if you will just FORCE the user to create/sign in to experience the features?,20.1.2.5988,2025-12-14T23:43:13,us,Google Play,0,,
1881d123-8263-4f3a-8705-df97f25bc35e,Rika,1,,Spent almost an hour scanning a huge document only for the file to be damaged and unusable. Went back to the app only for it to show only one of the pages. Ever since the update the app hasn't been working right.,20.2.0.6076,2025-12-14T23:05:57,us,Google Play,0,,
efe42b64-b90f-4003-b72c-9937ea4b2c46,Manjeet Kaur,1,,"After the Update of This App, My printer has literally sometimes been a waste of time , Because Everytime it shows a bug , I am using it for the last three years in my home , It was smooth , recently I shifted it to my shop to use It for photocopy and printouts , so now it shows a bug everytime when I fix one the other is already in a queue 😕 And it's such a insult when the customer is standing there and it takes time and waste mine and other persons time as well my Shop well being too",,2025-12-14T22:25:51,us,Google Play,0,,
cf87f2f9-7f86-40af-a6bc-d1ab7e429854,Calvin Ebbert,1,,I quite possibly have never seen a more or less user-friendly app it is so confusing to figure out how to print just one paper on this thing and it is so easy to accidentally download the wrong app and almost give your payment information to the wrong people but why am I not surprised every app is like this anymore who hires these people who's making this get a different job do something else put the fries in the bag or something,20.1.2.5988,2025-12-14T22:14:28,us,Google Play,0,,
cabc9bae-01b2-45bb-a6f5-4903a859150c,Lois Langley,1,,it is not helping my printer print from my Android phone or ipad.,20.1.2.5988,2025-12-14T21:29:27,us,Google Play,0,,
d3673c23-323a-402a-9219-1fce4d964268,Simphiwe Mbhele,5,,very good 😊,20.1.2.5988,2025-12-14T19:46:55,us,Google Play,0,,
f09340ea-1f4a-48b5-9205-6e7f740d6d77,Ashleigh Downie,1,,Legitimately the most useless rage inducing app. Constantly force closes. Can't print more than a few photos at once. Unbelievably slow and glitchy. Makes everything more painful than a simple print/scan needs to be,20.1.2.5988,2025-12-14T19:12:06,us,Google Play,0,,
40a5f795-7764-481d-9c1f-474f94eb7158,Sharon Sayre,1,,can never get anything to print via wifi from my tablet or cell using this app yet!,20.1.2.5988,2025-12-14T16:56:50,us,Google Play,1,,
b5880b06-0a72-4221-bb92-10c1063d9dda,Denise Hudson,5,,Easy,20.2.0.6076,2025-12-14T16:20:06,us,Google Play,0,,
523836ee-b1a9-492b-af0b-82012eb5c8ab,Katrina Sapienza,1,,it says its not compatible with my Chromebook which sucks cause now I cant print any thing off of it I have to send it to my phone then print it,,2025-12-14T11:57:32,us,Google Play,3,,
1d4fe4db-1634-45d7-b95e-2afdfc4390d5,Karla Christina Rodriguez-Howell,4,,love HP!,20.1.2.5988,2025-12-14T10:52:21,us,Google Play,0,,
53645ff5-6831-4866-9bd0-013813821bd1,rikha mudzakir,1,,unfriendly feature. please downgrade it like the old app,,2025-12-14T10:41:44,us,Google Play,0,,
8f139718-5b8a-4a34-9cc4-9994f745239d,Nelida Alvarado Lopez,5,,great way to interact with my printer. very easy to use,20.0.1.5732,2025-12-14T10:15:43,us,Google Play,0,,
f8d98ba5-7db2-470a-9de9-ddd14dcb6708,matsim0,1,,"Ganz mies. Findet Drucker/Scanner, aber beim Scannen sagt die App ""kann Scanner nicht finden"". Testet überhaupt jemand bei HP oder machen sie nur die Benutzeroberfläche?",20.1.2.5988,2025-12-14T08:53:49,us,Google Play,0,,
8cfcaacf-5a65-4b3b-b68a-e729baeee6d6,Tim Applegate,1,,"garbage, new app doesn't do anything for my printer. nice floating animation though. maybe app designer needs an animation job instead.",,2025-12-14T08:34:35,us,Google Play,0,,
4dd44524-9f04-48f8-8b8a-7b315794785e,Alexander Arjoonsingh,2,,"it's fine, but I have to call HP b/c I have to scan on my phone when I want to scan from my Chromebook. I think like I'm using two similar apps.",20.1.2.5988,2025-12-14T08:02:46,us,Google Play,0,,
dda9ab9c-732e-49bc-928a-f147b64be46c,Johanna,1,,"disappointed and done deliberately because this will be my second HP printer all-in-one and every time they do something to block it or something wrong with the app itself so my advice to everybody is do not agree to the terms. don't sign in on the app just go on as a guest call because I find that when you sign in it gives you nothing but headaches, I declined everything terms that they wanted me to agree to I didn't agree to nothing absolutely not and I'm not even downloading the new one.",20.1.2.5988,2025-12-13T23:07:06,us,Google Play,1,,
02081238-8eef-4f2e-938a-7ec1ae558b33,Marty French,1,,Worst experience trying to set this app on my laptop.,20.1.2.5988,2025-12-13T22:02:33,us,Google Play,0,,
1559f9da-5c8d-4a53-92f1-1402495bbaa6,Dornick,1,,requires an account to use (which should by no means be necessary),,2025-12-13T19:27:50,us,Google Play,0,,
ffa3000f-1670-4933-b6b8-6868a3f9ae6a,Robert L Young,5,,great,20.1.2.5988,2025-12-13T17:14:13,us,Google Play,0,,
de8f4921-c4f4-4ea2-b8f2-dd397db4da50,soylent green,1,,garbage: can not even get app to down load on my computer. using HP printers for decades. putting up with no support. NO MORE.,20.2.0.6076,2025-12-13T12:30:21,us,Google Play,0,,
d78e83b1-8778-4a5a-a9a1-5ed1b54cc1ad,pam stevens,1,,cannot get it to work with my chromebook. says I need a phone or another device. I'm going to see if I can send it back.,20.2.0.6076,2025-12-13T10:27:24,us,Google Play,4,,
9c30399c-8565-49b5-95e6-a0db2b6e684a,Amelia Longo,1,,"Demoting to 1 star from 2 because I cannot print at all. my printer stays is connected per the app, but when I got to run diagnostic tools, it says its not connected. chat help is a joke. You cannot tell me this printer or app was made to function.",20.1.2.5988,2025-12-13T09:40:07,us,Google Play,0,,
11025c2b-d75c-4f18-84e8-8f9d30227813,Jaze Grades,2,,The earlier version of HP Smart was perfect!!! So why am I back for another version? (I will know why I erased the app when....????_,,2025-12-13T07:55:39,us,Google Play,0,,
2431ca2e-66f6-4513-bd85-1a83f6be544f,Peter Wivell,1,,absolutely useless,20.1.2.5988,2025-12-13T04:35:57,us,Google Play,0,,
3b26f2d0-fe29-4b5b-b9e9-8e25fb57d08b,mohammed iqbal,1,,try connecting hp printer to your computer via Bluetooth. not possible and note the number of steps to try to connect. hp sold me another printer saying the one I had was no good. a friend suggested using a cable connection. works fine. so much fir hp customer support,17.35.0.5115,2025-12-13T02:17:26,us,Google Play,0,,
12977754-efa5-4932-96c5-c051402e7285,Mahesh Vaishnav,5,,bahut achcha,20.1.2.5988,2025-12-12T22:37:35,us,Google Play,0,,
2b96281e-9d01-42a7-bd01-f3b6a6a16331,Ashley Hill,1,,"WORST CUSTOMER SERVICE EXPERIENCE, I have a gaming laptop within warranty, and over a month now the issue is not yet resolved. there is no one who you can talk to or esclate things. never buy HP. better is Dell no question asked if a part needs to be replaced they will.do it within a week.",20.1.0.5822,2025-12-12T22:29:36,us,Google Play,0,,
00afa5c6-9397-443d-8e7e-873ee20f79e0,irma Berry,2,,I don't have a new. Just trying to reset the one I have. Very frustrating,20.2.0.6076,2025-12-12T21:19:05,us,Google Play,0,,
6ca04c5c-5c57-496b-bb18-f8cc3972e73f,bed King,5,,great images,20.1.2.5988,2025-12-12T17:26:08,us,Google Play,0,,
244832e1-9c4c-4e2a-96d9-131f663e8b6b,Roberto Flores,5,,excellent,,2025-12-12T17:13:59,us,Google Play,0,,
a70ae886-6a6e-448d-a041-2ebb6e2d0554,Rich Jeanes,1,,Can't print or scan using my device on the same network as my phone without creating an HP account. Why?!,,2025-12-12T14:41:37,us,Google Play,0,,
3ea4b7ac-4a63-4d18-a13e-2e9db9bf068f,David Hodgson,1,,"App updated and killed the printer... won't print, won't connect.... we have a paperweight... thank God I cancelled that Instant Ink...",20.2.0.6076,2025-12-12T13:27:11,us,Google Play,0,,
fcb20081-0410-4abc-b098-f04a164ee447,Clyde Hess,1,,"Stay away from HP I bought a new laptop and the app wont work on it so cant print from it , with my old laptop this app sucked anyways always lost the printer and had to keep reinstalling it",17.20.0.4770,2025-12-12T13:12:04,us,Google Play,4,,
d671ad38-770a-4ceb-8c05-637c2d105ec7,Nino Imerlishvili,1,,Very difficult to connect to the printer with wi fi!,20.2.0.6076,2025-12-12T12:59:35,us,Google Play,0,,
c16376c6-f71a-4c92-a2a2-5ead6889f25c,Mike M,1,,New 'HP' version of ho smart has totally broken it and now constantly tells me my wifi password is wrong when trying to connect new device. Old app is still available on windows and this worked first time!,20.1.2.5988,2025-12-12T10:59:16,us,Google Play,0,,
0855f9e3-f943-4941-9c7d-db5119f34602,Quentin Jackson,5,,love this printer 🖨,20.1.2.5988,2025-12-12T10:09:26,us,Google Play,0,,
057b3e64-f543-4341-af60-486a2ada4e5a,Myles Gibbons,1,,"This software is garbage! I am always disappointed with it and it makes me hate having to print anything. I'm constantly getting logged out and then the log in process is a tragedy of errors of having to select to log in, getting sent to the web log in, re-typing my credentials (though remember me is selected), getting sent to another page to re-open the app (which is still open), then watching the app clock attempting to log in...then cancelling that after minutes and doing it all over again.",20.1.0.5822,2025-12-12T09:40:55,us,Google Play,16,,
2155bba8-bcd5-4815-8183-fc671566ce1c,Mark Searcy,1,,very user unfriendly,20.1.2.5988,2025-12-12T09:39:34,us,Google Play,0,,
d28e07b7-b3eb-40d8-b851-c798dd620819,Ruth Tormey,1,,App doesnt work it wont connect to the printer. You go through the steps and then it shows you may have to hit a button on the front of your printer. Not all printers have this button it doesnt search for the printer dont waste your money on HP products its insane they didnt make sure this app worked like the smart app did,20.1.2.5988,2025-12-12T09:01:35,us,Google Play,1,,
93894252-ce22-4a95-9353-3b1a4601149e,Andrea Goettman,1,,"App Is Garbage. It says printer is not connected to wifi, but Xfinity says there is a strong connection. I never had an issue with the old app.",20.1.2.5988,2025-12-12T07:08:03,us,Google Play,0,,
6b9f1ff7-e314-4491-8df1-e57a047fbc3d,A Google user,4,,Please add dark mode to whole app because white backgrounds harm the eyes.,,2025-12-12T06:01:46,us,Google Play,0,,
4b1df323-496d-4fec-8956-61df2ef97480,Gary Corless,4,,works sometimes,17.30.1.5049,2025-12-12T02:04:53,us,Google Play,1,,
949debe1-99ef-48de-ae5b-bf4699ca3653,Olatoyin Pratt,5,,Good!,20.1.2.5988,2025-12-12T00:52:21,us,Google Play,0,,
ace96563-df09-421a-9fa0-b95cb747656f,Daniel Sonntag,5,,so much better! what an incredible upgrade/redo,20.1.2.5988,2025-12-11T19:37:57,us,Google Play,0,,
43380b5d-e4c4-4ff1-ab6a-c762c0f54e76,Brandon DeZonia,1,,Won't even find its printer that's less than a year old and was working just fine on the old Wi-Fi.,20.1.2.5988,2025-12-11T19:04:40,us,Google Play,0,,
75869248-5b39-409d-809a-04d5b9be67ba,Paul Provencher,1,,every month my printer shut down just before my automatic payment is made so I cat print nothing and no support for $16.99 a month hp ink totally sucks,20.1.2.5988,2025-12-11T14:58:00,us,Google Play,3,,
48ee9cc3-639d-4623-9d8a-a395109af66c,Farida Desai,1,,it's not faster,20.2.0.6076,2025-12-11T11:33:16,us,Google Play,0,,
6407938f-59ae-4576-a4ad-3082e6a42e5f,Johnny P Authement,1,,could not load driver to deck top,20.1.2.5988,2025-12-11T11:19:55,us,Google Play,0,,
8522eb97-315d-4c0c-96f2-d17506303a16,Corey A,1,,app was updated and now cannot use the app to just simply print or scan. now it is full of BS please fix this. I should be able to just open the app and start printing or scanning not sit here for an hour trying to figure it out. seriously,20.1.2.5988,2025-12-11T09:55:32,us,Google Play,0,,
9017d35f-a813-4870-9cfe-5302e096bac6,Patricia King,5,,Great,17.35.0.5115,2025-12-11T09:27:44,us,Google Play,0,,
3d540ff1-0f36-4ad1-a67f-3110a56303c7,Cristy Singleton,3,,Scanner works sometimes. I can't choose any additional options or change settings for some reason.,20.1.2.5988,2025-12-11T09:11:39,us,Google Play,0,,
e4f4cacb-6e19-4e69-a56d-566fb55e9750,Wendy Flintoft,2,,Can't connect.,20.2.0.6076,2025-12-11T08:56:31,us,Google Play,0,,
8fc93a4d-c5a6-467e-bf49-0bf9f14c3c83,Cristiano Colangelo,1,,"Terrible update. your software is bad already, why do you worsen it further? you are masochists.",20.1.2.5988,2025-12-11T07:41:38,us,Google Play,0,,
db03651e-a469-4631-84cd-b751bc280357,Candida MENDONÇA,1,,Verdadeira M£πd@ a desktop HP 3700.,20.1.2.5988,2025-12-11T04:38:08,us,Google Play,0,,
6361beeb-e4b6-4da6-b9a1-7d523101b00c,Melissa Briley,5,,efficient,20.1.2.5988,2025-12-11T00:30:50,us,Google Play,0,,
c45327ee-f47a-471b-8c24-ac46f29de3fc,nicola Law,1,,very difficult to install to set up printer to wifi,20.2.0.6076,2025-12-11T00:28:26,us,Google Play,0,,
bf08e9a3-0151-4dda-a30e-6f20e956c56b,Stewart McMinn,1,,"I have had this Officejet pro 9012e printer for a while and it continually shows as unavailable on my phone. Occasionally it works. The same goes for my wifes phone. Both are late model Android, mine is a Samsung hers is a Google. Great idea Hewlett Packard awful operation. Software is pitiful.",20.1.2.5988,2025-12-10T23:37:41,us,Google Play,0,,
34192098-4440-44b9-ba76-e6cd8ef0066f,Anil Anil,5,,good,20.1.2.5988,2025-12-10T23:11:51,us,Google Play,0,,
e855ac1a-532b-4078-b45e-752b273f0ac6,Ashley Holloman,3,,I don't know what has happened to this app but ever since it updated all it keeps telling me is filed not accepted when all I'm simply doing is trying to print a picture. I have never in my life been so frustrated at a printer,17.35.0.5115,2025-12-10T22:07:58,us,Google Play,0,,
06c4621b-8e1b-41ce-ba18-543ff4b57a15,Randall Cheung,1,,Utter trash. Needs to be installed on every device just to print something yet barely works and fails at finding printer. Just give me a USB port,20.1.2.5988,2025-12-10T17:51:44,us,Google Play,0,,
3a891511-b3ad-493b-b7a1-3d8ffd56c444,Treianna Howell,1,,it's not working properly,20.2.0.6076,2025-12-10T15:29:07,us,Google Play,0,,
84680287-1c23-4e2c-bcb2-d70b98e555f2,Austin Mabe,1,,worthless won't even detect my printer,20.2.0.6076,2025-12-10T15:22:20,us,Google Play,0,,
dbfdd609-d863-4794-b3a9-b877f62e5e24,Robert Lee Manis Jr (Robbie),5,,ABSOLUTELY LOVE THIS APP!!,20.1.2.5988,2025-12-10T15:16:49,us,Google Play,0,,
374f4c7e-4bfa-4448-8b86-626303ea84e9,Julie Sullivan,1,,not at all helpful,20.1.2.5988,2025-12-10T10:20:25,us,Google Play,0,,
905377f3-efc9-43d0-a0f2-c66a33ac3e5d,Padma Lokesh,1,,it is not good app and don't recommend this app it is not working properly,20.1.2.5988,2025-12-10T08:31:11,us,Google Play,0,,
0b02d9c3-ab2f-491f-b477-ad1cad4571e5,Rosco,1,,"Painful!!! On the one time per year that I actually want to print something, your app to printer connection just makes life so difficult. ""No printer found...'",20.1.2.5988,2025-12-10T08:00:35,us,Google Play,0,,
acf41d54-0766-4168-a074-08776b451840,Kelly Ward,1,,one of the poorest for user,,2025-12-10T07:25:32,us,Google Play,0,,
8cd0957f-f4ad-48b3-8c15-4a2c2f1f252b,Julie Gavis,1,,"I have a pixel XL 10 Pro, the app will not load it will not move past the Have to agree to use HP INK. This has proven to be a waste of money. The printer will not connect to my computers. This is not the first bad experience I have had with HP printers. I decided to give it a try after 10 years, hoping HP had a decent product by this time. This has proven to be yet again a great disappointment.",20.1.2.5988,2025-12-10T07:02:35,us,Google Play,0,,
6e81c7b5-8afe-480a-ace4-faf374d83d2b,Balaji Marupudi,5,,It is more important to tell about this amazing HP printing device.,20.1.2.5988,2025-12-10T03:10:27,us,Google Play,0,,
654d4c28-09d4-4494-88de-71a932c20ebe,RAMKEWAL,4,,Good,20.1.2.5988,2025-12-10T02:50:27,us,Google Play,0,,
