id,author,rating,title,content,version,date,country,platform,vote_count
597fa0a9-5c49-48dd-951c-3f408ab878d8,Sonny,1,,Leider habe ich seit kurzem Probleme mit der App Sie findet den Drucker nicht erst beim 3 oder 4 öffnen der App dazu sagt die App das Papierfach sei leer - was nicht der fall ist - und sagt weiter - falsches Papier- obwohl ich seit 6 jahren das selbe Papier nutze.... Schade ... vor diesem problem war die App recht gut und einfach in der Handhabung,26.0.2.6338,2026-04-29T19:06:15,global,Google Play,0
6da21de2-9ddc-4aea-a076-0c41da289aab,herve lintz,1,,depuis la mise à jour 3.0.4.0 de mon téléphone Xiaomi Redmi Note 14 Pro+ 5G impossible d'ouvrir l'application ou même d' imprimer un pdf directement depuis mes fichiers. Je pense que votre application n'est pas compatible avec les dernières mises à jour de mon tél. Faîte des corrections pour que ma note change. La seule chose qui marche sans problème c'est le prélèvement mensuel.,26.0.2.6338,2026-04-29T18:42:53,global,Google Play,0
3071a2d3-307e-4388-8865-02240f72f4d2,Catherine's Hideaway,1,,"I've had an HP printer for years that works completely fine. No mechanical issues. Big tech is trying to nickle and dime consumers and forcing us to buy new, claiming drivers aren't supported! Why should I be surprised that HP has done this, when every other tech company does it too. Always needing to push the latest and ""greatest"" product on the market! Welp, my trusty printer, after having ZERO issues, all of a sudden cant be recognized by any device after the latest updates! SHAME!",26.0.2.6338,2026-04-29T18:41:57,global,Google Play,0
f6549311-7b02-43d0-b0c5-e189e0634425,John George,2,,Been waiting for my new printer for 2 months.,20.2.0.6076,2026-04-29T17:19:45,global,Google Play,0
2e4f04f4-09c3-4561-82a3-4a3e4079b546,Musa Saho,1,,app not working,26.0.2.6338,2026-04-29T17:02:40,global,Google Play,0
81577d1b-aacb-4eaa-a504-b0d94a04d11b,Lyn Chalk,5,,very good,20.2.0.6076,2026-04-29T16:49:40,global,Google Play,0
c9d2d098-e9ed-44a1-8766-e5c034373368,Frank Brauer,1,,Funzt wieder nix,26.0.0.6234,2026-04-29T16:01:26,global,Google Play,0
e233fddd-6506-4431-a057-45d725c21a1f,Giulia,1,,Da qualche giorno riscontro problemi. La app carica a vuoto. Inutilizzabile,26.0.2.6338,2026-04-29T15:46:53,global,Google Play,0
36fea1d1-4ca4-45f8-ab3e-43a5a45ad16d,Jeremy Garré,1,,app werkt niet meer. printer zélf wilt ook niet meer printen,26.0.2.6338,2026-04-29T14:35:03,global,Google Play,0
d369f036-d36d-4b28-b981-40a85ba52f21,Rod Mic,1,,"Catastrophique. L'application ne fonctionne pas. Pas moyen de connecter l'imprimante en wi-fi. Impossible d'installer les pilotes en mode USB. De plus, il faut créer un compte chez Hp pour scanner et bien sûr, après l'avoir fait, cela ne fonctionne pas. je vais débarasser cet appareil et acheter une jet d'encre d'une autre marque.",20.2.0.6076,2026-04-29T14:34:04,global,Google Play,0
49f53099-5cd7-4d72-9ed6-1b3b637481de,Letícia Popoli da Silva,1,,"Péssimo, a HP lança uma impressora boa e ridiculamente cara, mas é incapaz de fornecer um aplicativo compatível E funcional. A impressora nunca deu problema, mas o aplicativo, por outro lado, tem que ficar implorando, acendendo velas e rezando para entidades para funcionar, a maior parte dos dias nem carregar o app carrega, fora a falta de funcionalidades do app para impressão que é ridícula dado o produto que compramos que não foi barato.",26.0.2.6338,2026-04-29T13:31:28,global,Google Play,0
80b6857f-4536-4f5b-842a-0503d7238b7e,Danielle SweetieBelle85,1,,It won't even load smh .....,26.0.2.6338,2026-04-29T13:22:13,global,Google Play,0
ef5c1aa1-8710-4d15-9aff-ed5247bcc2ea,Carlos Lucho Schumacher,1,,O driver é americano por isso não consigo manter o papel a4 como principal.,20.2.0.6076,2026-04-29T12:06:27,global,Google Play,0
a9685a55-fecb-4a42-86ff-c53e08919671,Heidrun Gaebel,2,,"App funktioniert nicht mehr, lädt nicht mehr, nur blauer Kreis, der sich dreht. zuvor auch schon nicht mehr richtig verbunden.",26.0.2.6338,2026-04-29T11:35:51,global,Google Play,0
a2898a7d-2077-4fb8-b9fc-0eadba656ac9,Jessy A,1,,l'application est nul je suis passer d'une imprimante qui imprimé rapidement a devoir attendre une plombe que les serveurs répondent pour imprimer en direct c'est long via l'application bah elle tourne dans le vide sans affiché le menu d'origine,26.0.2.6338,2026-04-29T11:25:35,global,Google Play,0
41190e0b-abed-4ea7-8f74-b46b12c8be9e,Jessica Mueller,1,,"nie wieder HP, alles kostet ständig Geld ,also ganz ehrlich dann drucke ich halt alles in meinem DM Markt .",,2026-04-29T11:07:19,global,Google Play,0
366a4a75-9cf7-4616-bd80-59b973a8366e,Emilio Grosso,1,,dall'ultimo aggiornamento l'app non funziona piu. mi rimane la pagina del caricamento e non si avvia nulla. Non riesco ne a utilizzare la stampante né a fare le scansiono con il telefono tramite app,20.2.0.6076,2026-04-29T11:02:16,global,Google Play,0
27fc6d22-2bbc-4b84-9d75-8327fcd79e40,Sefa,1,,"Most useless printer awards goes to 4200e, I have never seen a printer that bad. doesn't connect, doesn't print, doesn't work. whoever designed that piece of miracle deserve a raise.",20.2.0.6076,2026-04-29T10:30:41,global,Google Play,0
0ed65901-76d3-46b3-8612-777dec423fd6,ruby l,2,,vanaf dag 1 alleen maar irritaties. printer niet te vinden. papier dat zogenaamd op is terwijl het er in zit. meerdere keren opnieuw instellen... spijt dat ik de hp deskjet 2900 heb gekocht,20.2.0.6076,2026-04-29T10:25:47,global,Google Play,0
e9bab113-c6b3-46a9-804b-2754c2c97f88,Yann Ren,1,,accès a rien écran blanc du grand niveau HP comme d'hab,20.2.0.6076,2026-04-29T09:58:54,global,Google Play,0
40ec2d47-bc98-460c-924e-1142137da5dd,anju jose,5,,from the morning I am trying to open this app .Its always rounding the circle in my mobile.,26.0.2.6338,2026-04-29T09:13:50,global,Google Play,0
8a7eb8fe-e2fb-487d-875e-4b1af8660106,James Robertson,1,,"And yet again the loading ring of death HP man so many fake good reviews even people at IT hate hp stuff. How hard is to just make a printer work, plug it in and print. NOT spend half a hour settimg up a account and a password to my own dam printer i mean what in case some breaks in to my house to do a sneaky bit of printing??? Do NOT recomend HP. In fact train a pigoen be less headaches. AARRRRHH WHY DO YOU UPDATE AND MAKE IT WORSE !!!!",26.1.1.6403,2026-04-29T08:24:14,global,Google Play,4
59e0cf8b-119f-4692-be56-a7ddb972767a,D,1,,app werkt niet meer sinds update. zeer slecht,,2026-04-29T08:03:37,global,Google Play,0
40970848-2c7f-47e5-a6de-30dd55c5691e,Axel M,1,,"Die App will immer die Einrichtung eines Drucker abschließen, bleibt aber immer hängen. Einfach nur Schrott, wie so viele andere Apps / PC-Software von HP. Die Hardware ist aber immer gut.",20.2.0.6076,2026-04-29T07:40:47,global,Google Play,0
1b822342-f1bb-4004-888f-936ed26b7569,Prashanth Shetty,3,,very slow and not responding some time,20.2.0.6076,2026-04-29T07:31:24,global,Google Play,0
b97c3e70-2668-45d8-a57e-f3a817ce3b97,Omar Eladio Correa Sifuentes,1,,No conecta con mi impresora a cada rato tengo que estar conectando la pero aun así nada,20.2.0.6076,2026-04-29T06:28:20,global,Google Play,0
ed564aa4-7d74-426f-add6-542dbf26eb74,Michael Brown,1,,I don't want to pay monthly for printing in my own house. this sucks.,18.10.0.5530,2026-04-29T02:59:46,global,Google Play,1
1c61da74-250f-455e-bb3c-bc6ab3566faf,Andres Restrepo,5,,good,20.2.0.6076,2026-04-29T02:50:13,global,Google Play,0
2e3912c0-6bbf-4e70-a230-5f641e9b9684,Piyawut Suksai,1,,the worst experience printing app i ever used in my 31 years life,20.2.0.6076,2026-04-29T02:07:16,global,Google Play,1
15ec3363-3636-4038-af3e-eff6727836d6,Felix Juez III,1,,Useless app. I have an HP branded paper weight.,20.2.0.6076,2026-04-29T01:07:26,global,Google Play,1
6fb18ffa-8d4d-4128-95f3-10006820ee02,martha patricia monteros,5,,Muy fácil de seguir,,2026-04-29T00:12:11,global,Google Play,0
97b07399-2917-4342-b6a2-adb97e7807a0,Ana García,5,,excelente,20.2.0.6076,2026-04-28T22:53:48,global,Google Play,0
8a81be2b-20ef-4cd5-9f11-ccad1140dfd2,Neil Nustad,1,,"For some reason the ""BRILLIANT"" devs at HP has decided to make an app not compatible with older devices. For literally no reason at all. It's a PRINTER APP. Should I spend $2000 on a new phone to effing scan documents over to it?",,2026-04-28T22:33:18,global,Google Play,1
14e00501-0ce5-4ed1-a058-3b8476cdc45d,PAI PENSIONES,5,,excelente,26.0.2.6338,2026-04-28T22:30:15,global,Google Play,0
d1b462bc-1683-48c7-ade9-cbd1610a8050,Russell Guyton,1,,"App fails to open. This has happened a few times over the years. And now when I need the app the most to scan important documents, and email the .pdf from my phone in a timely manner it has failed to function. AGAIN! It worked well for a long time, but it has failed to function before. A week later it would work, and Now (again) when I need it ASAP, it has let me down. HP is dropping the ball on keeping this app running properly. And yes, a network test from my DeskJet Pro 8025e passed.",26.0.2.6338,2026-04-28T21:40:29,global,Google Play,0
4007137b-6c3d-4916-82dc-f3e6918adad7,Zahir Walji,1,,"I just purchased a 8128e. A total messed up app to setup the devise. The phone will not allow you to scan until you load up the paper. Once you load the paper, it automatically runs a test page which keeps jamming. You cannot set up the internet connection until the paper tray is set up. What a pile of damn garbage this HP is!!",26.0.2.6338,2026-04-28T21:09:16,global,Google Play,0
99e822a1-00f2-492a-b920-be41a58eb951,Ale Iannello,1,,desde la nueva actualización es una lentísima para imprimir la versión anterior estaba mucho mejor,26.1.2.6449,2026-04-28T21:05:22,global,Google Play,0
b013930f-334c-48e1-b95e-6cc2c59f03f5,Raquel Lossantos,5,,He probado HP Smart y a mí me resulta más fácil usar la versión para PC. Las dos (la del PC y la del móvil) son buenas.,,2026-04-28T19:31:53,global,Google Play,0
616f2f92-5d6f-4853-83a9-099074fb60f2,Cosimo Giosa,3,,"non sta funzionando , e normalmente è lentissima",,2026-04-28T19:30:41,global,Google Play,0
032bab4a-b8f6-46de-bc60-62a22a7b8f07,Tommaso Grimaldi,1,,"dal cellulare la stampa b/n è di colore violacea mentre dal PC è normale, sto utilizzando lo stesso programma HP print sia per PC che per Android",20.2.0.6076,2026-04-28T19:13:45,global,Google Play,0
32e9f37e-a8dc-4f34-b36a-4ee5a1fbd0da,Steffen,4,,"""Drucken von Überall"" Print Anywhere ist bei mir nicht möglich. Obwohl alles aktiviert ist. Warte jedes Update ab, doch es funktioniert schon seit 1 Jahr nicht...Heute im April 26 eine Nachricht über HP Smart erhalten das die Funktion aktiviert ist. Und siehe da es geht. Drucken von Überall funktioniert!!! Bin begeistert",26.0.2.6338,2026-04-28T16:44:44,global,Google Play,2
fc9689af-1992-485d-9c6d-f1bef96a846b,Tanja Valkin,1,,it doesn't work any more. only shows the spinning circles,26.0.2.6338,2026-04-28T16:42:08,global,Google Play,0
5ae25cb2-8cb5-48ba-8fe2-1a078ac5e08c,Peter Deffet,1,,"Terrible app, terrible printer. Literally has one job and can't complete that. HP used to be a respected brand. Garbage.",20.2.0.6076,2026-04-28T16:19:45,global,Google Play,0
d309a4c5-04f2-4b7b-ab2c-8f03f2f8433a,Leandro Nascimento,1,,"um caminhão de lixo. é o resumo que tenho a falar da experiência do uso deste aplicativo. como pode uma empresa deste porte ter tanto lixo pra enlouquecer seus usuário. acredito que deveria ter uma bula de remédio pra falar dos efeitos colaterais do uso deste aplicativo. estresse, raiva, descontrole emocional... não dá pra usar um aplicativo de uma impressora e ficar tão furioso assim. desconecta toda hora, é difícil de usar, só dá pra usar se vc tiver a conta de email em todos celular da CS..",,2026-04-28T16:17:01,global,Google Play,0
a38d1653-ad2c-4f0b-997e-030d8832ff63,SAVANN PITH,5,,Best print quality and great electronic devices. service is excellent towards customers.,26.1.2.6449,2026-04-28T15:37:11,global,Google Play,0
01d2e046-3689-42ef-b4b9-4a7d2d1b1546,Tiffanie Troutman,1,,Horrible customer service. Representative do not understand what your needs are or how to resolve. This experience is very frustrating. I only called to inquire about my bill on 4/28/26. 1st caller frustrated me so I asked to speak to his supervisor- he left me on hold for about 25 minutes until I just hung up. I called back and refused to give detail but kindly asked to speak to a supervisor and that representative HUNG UP ON ME. Called back a 3rd time and was placed on hold for 30 mins.,,2026-04-28T15:28:00,global,Google Play,0
77ecf6aa-7084-469d-b4a1-3ef49288a61b,Miguel Angel Torres salas,5,,buenas impresiones,20.2.0.6076,2026-04-28T14:58:37,global,Google Play,0
6f040536-1265-4b92-beff-3a4fb354425c,Frederick Woods,1,,this is a trash app now doesn't even open from the app I'm going to move to another printing service,26.0.2.6338,2026-04-28T14:48:21,global,Google Play,0
437341f4-3311-404d-90f8-3d15fbda46ad,Elaine Soh,1,,The HP smart app takes very long to open,26.0.2.6338,2026-04-28T14:19:29,global,Google Play,0
04831d36-0307-42ac-b145-8c6292b3b0be,Veli „VeMo“ Morina,2,,einfach nichts funktioniert... die App startet nicht einmal... ich bekomme keine Patronen rechtzeitig zugeschickt... der Service ist richtig schlecht geworden,26.0.2.6338,2026-04-28T12:25:14,global,Google Play,1
dd772f4c-7442-46af-8c7a-3ec2cf103962,Luis Torrealba,1,,no sirve,20.2.0.6076,2026-04-28T11:56:53,global,Google Play,0
b69db23b-0cf2-495e-8eeb-c7c8814ec2a3,Markus Calka,2,,Die App macht was sie will. Mal geht sie an mal nicht. Reines Glücksspiel... wenn sie sich fängt ist sie ok aber ansonsten regt sie einen tierisch auf.,,2026-04-28T11:46:16,global,Google Play,1
4d28d765-e0af-4471-abc6-cf59da423611,Manuel Martín Malagón,1,,"200 MB de aplicación para escanear un documento. Espectacular. Edito y añado: ahora resulta que necesito de una cuenta de HP para escanear. Lástima no poder poneros 0 estrellas. O menos infinito, total, os da exactamente igual.",20.2.0.6076,2026-04-28T11:03:57,global,Google Play,0
567b7728-9819-4b54-b52a-5a64ddfd011f,Shibilys Tech,5,,"I initially faced several issues with the app, but I was able to resolve them myself. Everything is now working perfectly. I’m very satisfied with the performance and really enjoy using my HP M111w printer.😍",20.2.0.6076,2026-04-28T10:52:18,global,Google Play,0
43be0ac8-aee9-425a-849f-260ed770d256,Günni w.,5,,funktioniert wieder Super musste es neu installieren,26.0.2.6338,2026-04-28T09:51:11,global,Google Play,0
a5563024-4abf-4f7b-b35b-9f1e2c5668c5,M S,2,,"Trop de problématique, trop de mises à jour, depuis que l'icône ""prêt"" a disparu, normal m'a dit HP au téléphone ! Que des soucis de mises à jour,les copie via Android sortent à moitié, de toute façon, elles sont conçues pour disfonctionner, au bout de 1 ans! Et panne,Fini . Par contre,le service client est très utile,et sympa, sinon hors garantie, après 1 ansil faut payer 28€ pour que HP prend la main sur votre pc pour régler votre imprimante. Perso,fini HP,trop de galère. impossible téléphone,",26.1.2.6449,2026-04-28T09:21:30,global,Google Play,6
5ec00e0d-9c9b-4931-9914-dd167e2b9f6b,Doriane Erndt,1,,comment faire je doit scanner mais application ne s'ouvre pas,,2026-04-28T08:59:31,global,Google Play,0
a7a95eff-ef2e-4106-bd49-a8c5180c5e77,LG,1,,"ne fonctionne pas, Bug depuis la mise à jour.",,2026-04-28T08:32:30,global,Google Play,0
d3cf9106-e883-40fc-a668-ab34ea189874,Ingrid Witte,1,,"na update werkt de app niet meer, zo te zien uit de andere reviews wordt er niets aan gedaan.",26.0.2.6338,2026-04-28T06:25:03,global,Google Play,0
8812bba2-0c1a-4c05-9065-e2aaf9995c37,Alexandre Augustus,1,,péssimo,,2026-04-28T04:51:05,global,Google Play,0
07386f88-8fa1-4d86-a3a5-913db6350c16,Abraham Escalante Sosa,2,,"me ha estado fallando la app, cuando quiero entrar tarda mucho en cargar y tengo que desinstalar y volver a instalar para poder entrar a la app.",26.0.2.6338,2026-04-28T03:26:42,global,Google Play,1
a134e814-ba76-4060-9618-a27990debe19,Whitney Schlamp,1,,glitchy and I have had to unistall and reinstall a few times now due to not opening properly,18.5.1.5470,2026-04-28T01:46:08,global,Google Play,0
2ec91040-bec0-4976-930f-e0b7625ea67d,Thomas Evans,1,,"You cannot use an hp printer without this app, and if you remove or archive it, your printer becomes a dead weight.",20.2.0.6076,2026-04-28T01:16:52,global,Google Play,0
f1919ee6-1a5f-4882-9dd7-4591bd91128d,Achal Gyan Anand,5,,Very easy and simple function,20.2.0.6076,2026-04-28T00:03:45,global,Google Play,0
7f40566d-2797-4ca9-a2f9-aa5ad36c0da1,Maryse Lohier,5,,parfois beaucoup de mal pour la connexion avec mon téléphone,26.0.2.6338,2026-04-27T23:40:54,global,Google Play,0
bd587d39-639f-4507-834e-075b72eba79b,Apps,3,,"La app se queda pestañeando en la carga cuando vas a compartir el escaneo al correo establecido en la impresora. Por lo demás, está muy bien...",20.2.0.6076,2026-04-27T22:40:13,global,Google Play,0
3759e3b0-c454-4897-bd59-07cd02493c06,michelle lett,1,,app is frozen!,26.0.2.6338,2026-04-27T22:33:52,global,Google Play,0
00b56fb9-76fe-4651-a12d-9de89e87a560,Kathleen Gardner,1,,sorry no good does not work,,2026-04-27T22:27:35,global,Google Play,0
83f3cfed-3571-4b1e-97f1-8c528532bba1,Lexi,1,,"Genuinely worthless app. Pure garbage. There's no other way to put it. You either get stuck on a permanent loading screen or, thank your lucky stars, you somehow actually get the app to load... It might not print on the first try. Or at all! And don't even BOTHER trying to scan something. You have a better chance of winning the lottery than getting it to work. Horrid. Absolutely horrid.",20.2.0.6076,2026-04-27T21:49:19,global,Google Play,0
9642d8f1-2747-4a71-acf0-bf518e6e78b2,Izzy Gonzalez,1,,"wifi print from android now broke, wifi from desktop fine. please fix!!",26.1.2.6449,2026-04-27T21:18:10,global,Google Play,0
2e72fee4-e3e6-48f5-86c5-524377e220d0,ANGELO JES Da SILVA JOSÉ,2,,"não consegui usar o wi-fi e nem fazer reset de fábrica na impressora Hp LaserJet 4203dw, após o técnico da fibra mudar só o nome da rede wi-fi com a mesma senha.",,2026-04-27T21:12:25,global,Google Play,0
8c3e60ac-091c-467c-9026-c28485e75089,Ralph Anderson,1,,App hasn't opened in over a month@,26.0.2.6338,2026-04-27T20:48:30,global,Google Play,0
8e4a238d-f11d-487f-b1c8-58777755e71f,Ferhi Rabeh,5,,Une application à apprécier,9.6.1.3718,2026-04-27T19:48:31,global,Google Play,0
33df98be-5320-4c54-aa9a-bf25400349c5,Steve Wright,1,,wont long just white screen,26.0.2.6338,2026-04-27T19:28:58,global,Google Play,0
110e216e-2f36-49a7-b776-340245427ffe,Mats Hagberg,1,,inte enkelt att installera en hp skrivare,20.2.0.6076,2026-04-27T19:17:00,global,Google Play,0
bf4e19c9-77c2-42ea-98d1-f905eb99b67d,Kristina Skoruppa,1,,"Diese App ist viel schlechter als die frühere Smart App. Viel unübersichtlicher, dauernd muss man sich neu anmelden, wenn man verschiedene Dienste anwenden will. Furchtbar.",26.1.2.6449,2026-04-27T18:42:27,global,Google Play,1
37a21c95-fd1f-4532-b399-fec9bf2fbfaa,Prénom Nom,1,,Si je pouvais je mettrai moins cinq étoile ! L'application est devenu absolument abject il faut absolument créer ou se connecter avec un compte mail pour pouvoir imprimer. Cela rend l'expérience utilisateur absolument horrible ! vraiment je déconseille à toute personne souhaitant acheter une imprimante HP ! Depuis quand avons-nous besoin de donner notre adresse mail pour pouvoir imprimer un simple PDF ? Fuyez vers la concurrence peut être elle sera mieux !!!,20.2.0.6076,2026-04-27T18:37:44,global,Google Play,2
37d13f1e-7aed-44f7-962e-0fe1078c826b,Joseph B,1,,"If you're reading this, take back your printer h p products, our absolute garbage. spend the extra hundred dollars and get something actually usable.",20.2.0.6076,2026-04-27T18:22:25,global,Google Play,1
dbd806b9-034e-4f19-b2d5-026b6eb4690c,Jorge Lievano,2,,"cumple con su función, pero te obliga a vincular una cuenta para todo además que tus archivos escaneados primero van a los servidores de hp eso implica que si un día tienes problemas con acceso a internet no podrás hacer mucho aún estando en la misma red local.",20.2.0.6076,2026-04-27T18:15:12,global,Google Play,0
a7b3b7dc-4c91-4afb-b64e-8093ad562fba,Sandi Sweetland,1,,Not compatible with Chromebook.,,2026-04-27T17:58:36,global,Google Play,0
d5ff15a7-efa6-4072-b7fe-fa87f16c5522,vijay kumar,1,,App not working. Its not opening up,26.0.1.6280,2026-04-27T17:54:12,global,Google Play,0
7f9e6014-f862-430b-87d2-82b83ff84b8b,Jens,1,,Mehr müll passt in keine App,17.5.1.4552,2026-04-27T15:57:01,global,Google Play,0
6ef2bb4e-6ff0-4e5b-883b-49f4645c5737,Fernando Augusto Aquino Lopes,5,,Excelente...,,2026-04-27T15:56:31,global,Google Play,0
bc37899c-5340-4f07-8daa-2b495cb5c5bd,Weckerle Chantal,1,,impossible d'ouvrir l'application depuis la mise a jour c'est une vraie catastrophe impossible de faire quelque chose !!,26.0.2.6338,2026-04-27T15:03:42,global,Google Play,0
6110b0d6-ec7e-4012-9a42-1a24db152d29,Florian Buser,4,,Es hat gut geklappt. 😃😃,20.2.0.6076,2026-04-27T14:19:19,global,Google Play,0
12ab6a97-a2b6-4464-9a97-b5fcd892385a,Jose Torrealba (Ruspap Venezuela),5,,Buenas app,,2026-04-27T14:11:28,global,Google Play,0
651559f4-8114-48ca-9155-d7df148020db,Jhon Laiche,5,,lo máximo es te app,,2026-04-27T14:00:24,global,Google Play,0
a3ca4d9e-163d-465a-8d28-9b9702eed05a,Noble one,2,,"The app has worked for a long time, but now it no longer works. It just won't load; it spins as if it's loading, but it won't come on. It's offline. I've tried everything. Please fix it. Thank you.",26.0.2.6338,2026-04-27T12:53:37,global,Google Play,1
c0820c73-fee9-41b4-9fe0-77b16c5e963b,Fergus McIntosh,1,,doesn't load,20.2.0.6076,2026-04-27T12:48:47,global,Google Play,1
7c1f997f-b3d9-4b2e-b4c6-aa08116b5e74,John Manalo,1,,can't even connect to my wifi router lol,20.2.0.6076,2026-04-27T12:03:48,global,Google Play,1
1c7b94ee-da5c-44ec-a5cb-7c9a6e0d9154,David,1,,HP détient des données personnelles alors que je leur demande de les supprimer puisque leur service clientèle m'a fait partir ailleurs que HP,,2026-04-27T11:15:50,global,Google Play,0
79fec6d9-4c08-44f2-9126-2ae60ad5c318,holaxikos,1,,"iba bastante bien todo. hasta que dejó de funcionar en este celular, no puedo iniciar sesión y tampoco puedo imprimir sin tener una. desagradable",,2026-04-27T11:09:17,global,Google Play,0
41aa08bc-4f6e-4b4c-b9a5-84a32386f31d,Cassandra Ronk,2,,I constantly have issues with my printer disconnecting and having to call customer service on multiple occasions. also I can barely even open the app because as I try to open the app I just get a constant loading circle. It happens like every three times I try to sign in! And then when I try to call customer service will contact customer service the phone hangs up saying to sign into the app to rectify it however I can't sign into the app. very exhausting constantly experiencing the same issues,26.0.2.6338,2026-04-27T10:55:42,global,Google Play,2
18c9319b-3827-47a6-8149-aeee0c3b1a62,Ob b,1,,"fonctionnement impossible si pas connecté, fuyez! Pour les developpeurs de cette appli: beaucoup de travail reste à faire",,2026-04-27T10:19:28,global,Google Play,0
7ed322eb-48eb-4ab2-bd26-eae79f51820c,Jeroen,1,,Twee dagen op bezig om de printer opnieuw te connecten met mijn telefoon. Hij wil geen IP adres ophalen. Ik dacht het aan mijn printer lag of aan mijn wi-fi modem blijkt gewoon de app gewoon niet meer te werken.,20.2.0.6076,2026-04-27T10:17:05,global,Google Play,0
08a5156d-f2c7-4922-a669-e2069c40fd0b,En av Googles användare,1,,"appen startar inte längre, bara laddar och laddar och inget händer",26.0.2.6338,2026-04-27T09:35:21,global,Google Play,0
23d3e1bd-1bf1-4a92-9882-02b35e6e6260,Teddy Hofer,1,,"Nul, on ne peut plus rien faire.",26.0.2.6338,2026-04-27T09:16:40,global,Google Play,0
5062b94d-7c78-4a89-8d24-18bc47e8b683,Yashoda Kumawatgģ वफपमठप हसहबूसयह त,1,,it is a time waste app,20.2.0.6076,2026-04-27T08:54:52,global,Google Play,1
6f9e8269-d899-4110-8706-21ffb56449c7,Valentina Accoto,1,,Già era lenta e quasi ingestibile prima. Adesso non si avvia nemmeno e resta in caricamento continuo. Complimenti agli sviluppatori perché era davvero difficile riuscire a fare di peggio!,26.0.2.6338,2026-04-27T07:03:28,global,Google Play,0
9dc23d30-413e-4015-a9b5-cb27544d1dd4,Ragid Danial,5,,sehr gut App,,2026-04-27T06:24:52,global,Google Play,0
184b4f0f-3645-4b12-99ba-53112db3c5c6,Nice “GordoBaztard” Guy,2,,"HP, PLEASE JUST STOP",,2026-04-27T05:28:39,global,Google Play,1
fbf3cd3a-f7b5-4f05-ab74-824da2445080,Asma Gul,1,,Not even working properly...... why I always waste my time on this useless app.....,,2026-04-27T05:24:40,global,Google Play,1
8deb641e-9cbe-4203-98d9-7b1f084fccd8,arxy lisa,1,,keep loading..not respons.. don't know why,26.0.2.6338,2026-04-27T05:22:53,global,Google Play,1
6fb10efb-08b9-4f29-ab98-772ba8368454,Hortencia m,2,,a pain to use,26.0.2.6338,2026-04-27T03:17:09,global,Google Play,1
85dca24a-d7e5-4369-8b1e-b7eef2b2b22a,Gianluca,1,,nunca funciona,26.0.2.6338,2026-04-27T01:08:41,global,Google Play,0
2efd8295-2c4d-436d-afd5-f5b8fefea304,Jason MacEmcy,1,,"Worst printers I've used in my life. I've aligned the print heads, it has new ink, I ran diagnostics, and it still prints blocks instead of text. I'm never buying an HP anything ever again. I can not wait for the open source printer to launch.",26.0.2.6338,2026-04-27T00:48:41,global,Google Play,1
3d9591d2-1198-4d49-9952-e80c1a576af8,Leandro Franco,1,,me detectaba la impresora WiFi enviaba la impresión pero nunca salia y quedaba en enviando.,10.0.0.3877,2026-04-26T23:39:23,global,Google Play,0
