id,author,rating,title,content,version,date,country,platform,vote_count
14112724923,cristianogiustozzi,1,Terribile,Questa app mi ricorda l'inefficienza di iTunes: la difficoltà di far funzionare una stampante mi terrà lontano da questo marchio per sempre. Mai più HP nella mia vita!,26.1.3,2026-05-27T11:00:41-07:00,global,iOS App Store,0
14112724707,100% Pumas,5,Love my HP printer,Do not need something extra extravagant just with my HP OfficeJet 5258 gets the job done,26.1.3,2026-05-27T11:00:36-07:00,global,iOS App Store,0
14112321818,ShadowOfTheBeast,4,Bella ma problema con sfondo scuro,"Con l’ultima versione della app e con sfondo scuro, spariscono le scritte nel menu dí configurazione dei parametri di stampa.",26.1.3,2026-05-27T08:48:08-07:00,global,iOS App Store,0
14112069359,Vikjamin,1,Limited Print Options,You can’t print more than one photo per A4 page and it keeps throwing out print error but still prints the photos!!,26.1.3,2026-05-27T07:30:46-07:00,global,iOS App Store,0
14111921865,P.Barousse,5,Application Simple,Tout parfait,26.1.3,2026-05-27T06:46:04-07:00,global,iOS App Store,0
14111825633,Cfun fd,1,Scandaleux,pensez vous que tout le monde a les moyens de s’offrir des cartouches originales HP ? Bloquer les fonctionnalités de l’imprimante pour utilisation d’adaptable est scandaleux !!! Votre chiffre d’affaires ne doit pas être suffisant … médiocre,26.1.3,2026-05-27T06:16:18-07:00,global,iOS App Store,0
14111701824,frank keaves,5,Excelente herramienta,De útil ayuda,26.1.3,2026-05-27T05:36:57-07:00,global,iOS App Store,0
14111651094,Le J c'est le S sort le RS,1,Franchement nul,Si vous voulez une imprimante qui marche une fois sur 48 n’hésitez pas foncez,26.1.3,2026-05-27T05:20:08-07:00,global,iOS App Store,0
14111641182,Jacqui212,5,Camera Scan very useful,The camera scan on this app works very well and has been extremely useful for us. There is no logo or watermark left so we were able to use it for legal documents.,26.1.3,2026-05-27T05:16:52-07:00,global,iOS App Store,0
14111628310,DitchesHurt,1,Auto update made app useless,"Well it was working perfect then they couldn't leave well enough alone. Now all it shows is white text on a white background and then sits in a spinning icon of death and fails to print. Congratulations vide-coders....you screwed it up. Leave the coding to those that actually understand the underlying responsibility of the code they write, not AI bots that are training off their own slop.",26.1.3,2026-05-27T05:12:34-07:00,global,iOS App Store,0
14111587723,Luisja19,5,Muy útil y gratuita.,Es la forma más rápida de generar PDF gratuitos,26.1.3,2026-05-27T04:58:44-07:00,global,iOS App Store,0
14111278877,Rik Westra,5,Prima printtool,Ik heb eindelijk een goede HP printtool gevonden via ChatGPT.,26.1.3,2026-05-27T03:01:18-07:00,global,iOS App Store,0
14111188796,El gato del roof,5,Awesome,This app it’s very helpful for my small business Thank you guys,26.1.3,2026-05-27T02:21:41-07:00,global,iOS App Store,0
14111112078,Love_!God,1,Wireless connection,Won’t keep wireless at all,26.1.3,2026-05-27T01:46:17-07:00,global,iOS App Store,0
14111092867,A. Morgen,1,Beperkt,"Slechts een beperkt aantal pagina’s (100) zijn toe te voegen aan één bestand, waardoor grote bestanden verdeeld moeten worden over twee of meerdere bestanden.",26.1.3,2026-05-27T01:37:10-07:00,global,iOS App Store,0
14111008997,marckmar73,1,Problemi!! Non visualizzo le voci fronte retro e altre voci,Problema!! con app quando vado a stampare non mi fa visualizzare le opzioni fronte retro e altre voci,26.1.3,2026-05-27T00:57:20-07:00,global,iOS App Store,0
14110990114,Flomarto,2,Mode sombre HS,L’appli ne gère pas bien le mode sombre : on ne peut plus lire les menus quand le mode sombre est activé et qu’on lance une impression directement depuis le document,26.1.3,2026-05-27T00:48:11-07:00,global,iOS App Store,0
14110989853,Gireash,5,No scan printer option observed,"I am unable to find scan using printer button, only camera scan options are shown on the app dashboard

My Printer is 4900 series and had built in scanner, what's happening?",26.1.3,2026-05-27T00:48:04-07:00,global,iOS App Store,0
14110823480,Virginia3744,5,Changement,"Utilisation pratique, je regrette seulement de ne plus avoir accès au support si besoin d’aide
et à la commande de cartouche aussi facilement qu’avant",26.1.3,2026-05-26T23:26:26-07:00,global,iOS App Store,0
14110678244,Erwin M.K.,2,Keine Scanfunktion,".Über WLAN Keine Scanfunktion —iPad Air M4—an meinem HP 3520, vom Windows 11 PC funktioniert es einwandfrei. Die alte App war deutlich besser",26.1.3,2026-05-26T22:14:31-07:00,global,iOS App Store,0
14110537226,Momio0205,1,Complicado el agregar impresora,"Super complicado agregar la impresora en varios dispositivos vía wifi , me arte y la cambié por otra",26.1.3,2026-05-26T21:06:56-07:00,global,iOS App Store,0
14110362268,Violetatorres,5,Escanear,"Para ser mi primera ves estuvo muy fácil 

Como escanee",26.1.3,2026-05-26T19:48:14-07:00,global,iOS App Store,0
14110308679,SylviaY71,1,Printer and app not to recommend,"The app doesn’t really work well with iPhone OS. When using OS to use HP app there are options without actual words or letters.
DeskJet 2700 after less then 100 pages it doesn’t print right anymore even with new cartridges.
It only shows stripes",26.1.3,2026-05-26T19:25:31-07:00,global,iOS App Store,0
14110227844,Robb0711,2,Restricted ink,Restricted ink doesn’t work for me. I can get much cheaper cartridges but I’m forced to buy genuine HP,26.1.3,2026-05-26T18:52:20-07:00,global,iOS App Store,0
14109968066,Alex03mv,5,Satisfecho,Me ha funcionado y ayudado bastante su entorno es muy amigable y facilita mucho la impresión de trabajos de manera inalámbrica,26.1.3,2026-05-26T17:07:31-07:00,global,iOS App Store,0
14109967176,howala33,5,Easy and fast,I was having a hard time wireless printing so I decided to try the app. It works great and fast,26.1.3,2026-05-26T17:07:10-07:00,global,iOS App Store,0
14109875556,serviceimmobilier.com,5,HP Scanne,Très satisfait et matériel très fiable dans le temps 😉👍,26.1.3,2026-05-26T16:29:38-07:00,global,iOS App Store,0
14109844180,BrewsterNS,1,An app to sell you more stuff!,"This app forces you to make an account. It wants to track every little thing that you do. It offers no support for printer issues. All it does is try to 
a) sell you more ink
b) sell you a new (garbage) printer.

HP used to make decent products. It really is a shame.",26.1.3,2026-05-26T16:16:41-07:00,global,iOS App Store,0
14109813270,Donald 123380,1,Garbage. HP is terrible.,5 year old printer and it is now junk because this app cant connect and the company wont support it. HP sucks!,26.1.3,2026-05-26T16:04:05-07:00,global,iOS App Store,0
14109804553,Johffcvhssz,1,Scan set up,Why can’t you make setting up scanning from my printer easier? It’s lunacy. We are not all tech geeks. Don’t you want regular Joe’s to buy your products? Insane BS trying to get scam set up on my 7600r hp printer,26.1.3,2026-05-26T16:00:35-07:00,global,iOS App Store,0
14109532447,hiya28324£15&2852582852752583,1,Slow,Doesent work,26.1.3,2026-05-26T14:11:48-07:00,global,iOS App Store,0
14109326790,johannenr,5,Gracias,Excelente,26.1.3,2026-05-26T12:55:35-07:00,global,iOS App Store,0
14109262602,Dieu2333,5,Hp,At was very good app to use,26.1.3,2026-05-26T12:32:34-07:00,global,iOS App Store,0
14109056152,Badiss Lyon,5,Simplicité HP,Simple et pratique ! Et en plus très intuitif,26.1.3,2026-05-26T11:20:49-07:00,global,iOS App Store,0
14108944483,Lorijo,3,It’s unfortunate that you have to go to your phone to scan,Printer works fine. Low on capabilities. You have to go to the app on your phone in order to scan anything. I bought it because it was small. But I would get a more powerful printer next time.,26.1.3,2026-05-26T10:43:00-07:00,global,iOS App Store,0
14108864630,Loveydove318,5,So convenient!,"No one makes it easier than HP, and that’s the God’s honest truth. From scanning to printing to ordering ink at unbelievable, reasonable price, to even being able to scan and Mobley fax to offices digitally, which is pretty freaking cool if you ask me and I grew up in the digital age and that’s something new I learned because of HP they are the best clearly thank you HP and keep doing what you’re doing!",26.1.3,2026-05-26T10:16:41-07:00,global,iOS App Store,0
14108836201,Bs,1,Crasht bij maken van tekst in formulier,"Leuke app, maar crasht bij het tekst invoegen op het maken van een pdf-formulier. Dus leuk om alleen te scannen en printen. Jammer!",26.1.3,2026-05-26T10:07:19-07:00,global,iOS App Store,0
14108830087,Big Bethy B,5,Hp deskjet,I was able to print what I needed from my phone! Easy to use!,26.1.3,2026-05-26T10:05:20-07:00,global,iOS App Store,0
14108677810,Mesperyian,2,Printer and app problems,"Every time I want to use my printer I have to reset everything, it makes me put back in all the information previously put in place and wastes a lot of paper. I would go back with an old fashioned printer if I had to buy another one.",26.1.3,2026-05-26T09:16:05-07:00,global,iOS App Store,0
14108557461,ratchet2012a,1,Problemi gravi di stampa,Durante la stampa di un documento tutte le importazioni della stampa ( compreso numero di copie e qualità della stampa) sono in carattere bianco su sfondo bianco e pertanto non è possibile leggere nulla. Ciò crea gravi problemi con l uso dell app per la stampa,26.1.3,2026-05-26T08:38:31-07:00,global,iOS App Store,0
14108372051,"Sorry, This Username Is Taken",1,Not Intuitive At All,How does this app have such a high rating? Every single time I use this app (for whatever reason) it is frustrating. It's difficult to find simple things like how many pages are left in the subscription... It's not intuitive and the chatbot is truly useless.,26.1.3,2026-05-26T07:42:15-07:00,global,iOS App Store,0
14108318131,Frannnnnnnnnnnnnnnnnnnnnce,1,Disgusting money hungry,I think it’s disgusting that you expect customers to only get ink from you with a monthly service. Do better as a company that’s disgusting.,26.1.3,2026-05-26T07:26:09-07:00,global,iOS App Store,0
14107997596,Try Liam,2,Connection Problems,Ever since we purchased this printer we have had wireless connectivity issues. Sometimes it works and sometimes it doesn’t! With our previous HP printer this was never an issue.,26.1.3,2026-05-26T05:47:45-07:00,global,iOS App Store,0
14107826051,surfchris,1,HP SUCKS,Worst printer company ever. They hold you hostage with the ink now. I don’t print that much. Sometimes not for over a month. Then when I need to print multiple pages it won’t let me because I didn’t pay for the ink I don’t need. It also routinely disconnects from the internet and I have to do a set up all over again. Terrible company.,26.1.3,2026-05-26T04:51:03-07:00,global,iOS App Store,0
14107787013,Dan13.08.,1,Direkt Druck nicht möglich,Man muss immer die App nutzen. Bei meinem 10Jahre alten HP Drucker war das nicht notwendig.,26.1.3,2026-05-26T04:37:34-07:00,global,iOS App Store,0
14107361512,Kosha030,1,Druckt nicht,"Der Drucker druckt nicht! Obwohl alles richtig eingestellt wurde, totale Katastrophe!!!!",26.1.3,2026-05-26T01:41:49-07:00,global,iOS App Store,0
14106755132,Lt. Mex,5,Easy to use!,Great and easy to read,26.1.3,2026-05-25T20:41:25-07:00,global,iOS App Store,0
14106718667,Not a fan of the latest update,1,Hate this update,The newest firmware update forces you to print through the HP app..,26.1.3,2026-05-25T20:24:47-07:00,global,iOS App Store,0
14106615405,Rosiele Evangelista,5,Gosto,"Bom, as vezes a parte de digitalizar dá um pouco de trabalho, não aparece a impressora , ou quando aparece n digitaliza, diz q tá ocupado e por aí vai, mas dura uns 5 minutos o estresse e passa, n sei se é o app ou a impressora, ou os dois. Mas no geral gosto do custo benefício",26.1.3,2026-05-25T19:39:35-07:00,global,iOS App Store,0
14106559141,Nikkicocolattecaffe,5,Compliments,Very efficient way of scanning any documents,26.1.3,2026-05-25T19:16:02-07:00,global,iOS App Store,0
14106482914,md_burch,1,New app is not good,So after updating the app it no longer can provide ink status for my “old” HP printer.  LOL — I’ll be canceling my instant ink subscription as a result.  I’m also rethinking my HP printing solution entirely. The app previously pushed me to buy a new printer complaining about errors — but these errors are the app’s issue!  Frustrating.,26.1.3,2026-05-25T18:44:59-07:00,global,iOS App Store,0
14106382545,Kara L H,1,Doesn’t work well,Not intuitive. Doesn’t work from laptop. Real pain. Very unhappy.,26.1.3,2026-05-25T18:04:32-07:00,global,iOS App Store,0
14106317283,BreannaPorchia,1,App Doesn’t Work,App doesn’t work. I have to constantly reconnect the printer and the printer does not connect. There has been several times of frustration trying to get this printer to work. The app doesn’t allow to optional printing techniques such as choosing 1 or 2 printed documented on the same paper. It’s just print and doesn’t even print,26.1.3,2026-05-25T17:38:03-07:00,global,iOS App Store,0
14106180321,Mytude,1,A nightmare Printer,"I have been a lousy HP customer for as long as I can remember. I recently bought HP 8135e. It was a nightmare to setup. Then it would connect to WiFi. Then another random problem would show up, and it would not scan. I consider myself savvy at technology. So your AI chick Jade really irritated me. Hello??? I already did the plug unplug and any other troubleshoot I could. Jade insisted “we troubleshoot” two or three times. By then I’m into this process countless hours. Finally I speak to a human and was delivered another printer with the same darn problems! I lost a ton of work trying talking to tech support. Finally the printer was set up, the scanner still doesn’t work unless you scan from the app. If you try scanning from the printer some other QR code pops up. Here we go again! Another hour googling how to fix. The scanner also does not scan more than 4or5 pages. If I tried 10 or 20,  I had to stand there and feed the first page. So I still DO NOT HAVE A FULLY FUNCTIONING SCANNER. I am a full real estate broker! THE I BOUGHT TWO HP 8120 printers for my employees on Amazon!!! Guess what? They are a nightmare too. The worse part is I had a well cared for older model that has never given me one problem. AND I GAVE IT TO A FRIEND! By the way, it’s not me. I did not install the other too!! Your humans were great. Jade needs to be fired. Oh, another lovely piece of info. The HP 8035e would not take the ink from the other printer. They were brand new. THEN I SEE $183.00 ink bill. THE PRINTERS CAME WITH 3 MINTHS FREE INK!!!!!!!!!!!!!!! All printer will be return after I go down the Jade ride!!!😡",26.1.3,2026-05-25T16:42:09-07:00,global,iOS App Store,0
14106130420,Drainna,1,Won’t print,Does not print or scan paper comes out blank,26.1.3,2026-05-25T16:21:38-07:00,global,iOS App Store,0
14105799925,gsmjunior,1,Não consigo fazer impressão,Sinceramente muito difícil fazer uma silmples impressão. A impressora não funciona como deveria,26.1.3,2026-05-25T14:10:13-07:00,global,iOS App Store,0
14105473730,Mcmurdy1980,2,New update is bad,The new interface is bad. I want it the way it use to be. The reason you removed smart is because this app became less smart.,26.1.3,2026-05-25T12:12:47-07:00,global,iOS App Store,0
14105226464,GauravJainMacBookProM2,1,Scanner option missing in ios,Cant see scanner option in ios interface but can see it in Android. Pathetic! Also never connects to iphone via internet wifi. Needs only direct connect. Highly uncomfortable,26.1.3,2026-05-25T10:50:42-07:00,global,iOS App Store,0
14104694438,Ruim demais ao dobro,2,Complicado,Poderia ser mais fácil,26.1.3,2026-05-25T08:07:40-07:00,global,iOS App Store,0
14104651072,0justanumber0,2,Ridiculously slow,"What was once an amazing app that would load up and allow you to quickly use your printer for scans has now transformed into something that takes minutes after opening the app for you to be able to use anything. There are no other problems with my tablet, and it is, as of this review, the latest iPad Air available. I have no trouble with any other apps on my tablet.",26.1.3,2026-05-25T07:55:02-07:00,global,iOS App Store,0
14104619756,"Hirsch&Heide Hillesheim, Eifel",5,Große Arbeitserleichterung,"Warum, weiß der liebe Himmel, hatte ich bisher immer Drucker einer anderer Firma und habe mich ständig nur geärgert!!!!!! Ich bin so froh, dass ich mir nun diesen HP Drucker Smart Tank 5105  gekauft habe!!! Die Einrichtung war mithilfe der HP APP VÖLLIG PROBLEMLOS und er druckt, scannt und kopiert einwandfrei. So macht das Arbeiten im Büro wieder Freude!",26.1.3,2026-05-25T07:45:53-07:00,global,iOS App Store,0
14104600478,BNM Workshop Inc.,1,To arresting & diffcult!!,Every other month there is a print prob. NOT due to payment. Constantly having to contact HP tech who have no location in my time zone! Too difficult to simply print and copy! Why do I have a Home Printer,26.1.3,2026-05-25T07:40:18-07:00,global,iOS App Store,0
14104487314,SAM_Sayed,3,langsam,Lang,26.1.3,2026-05-25T07:07:33-07:00,global,iOS App Store,0
14103906811,KalElW7,1,It never works when you need it to,The printer and the app are essentially useless. It’s like starting from scratch every time I try to print something. No settlings change. It just decides not to show our printer when we need it and then after an hour of trying suddenly it will appear and work,26.1.3,2026-05-25T03:57:19-07:00,global,iOS App Store,0
14103137801,will never order caviar avain,1,Absolutely ridiculous,Absolutely ridiculous you need an app to use a printer. Get a life bozos.,26.1.3,2026-05-24T22:04:09-07:00,global,iOS App Store,0
14103097341,Sad review person,1,Sad,Took 2 hrs to set up 30 minutes to print 2 pages bad bad and sad and I am not glad and I feel like this was a fad aren’t u a bad lad haha gad had,26.1.3,2026-05-24T21:44:27-07:00,global,iOS App Store,0
14102901857,Bridget1507,5,12 von 10 Sternen!,Funktioniert einwandfrei,26.1.3,2026-05-24T20:12:58-07:00,global,iOS App Store,0
14102793928,hotColdd,5,Exceptional Performance,Great service. Thanks for being dependable.,26.1.3,2026-05-24T19:26:08-07:00,global,iOS App Store,0
14102517511,VinATS,1,Printing and scanning set ups,"When a printer sees your computer and phone, it should not be complicated. Some settings and screen options on the printer itself are not working properly. Still can’t figure it out.",26.1.3,2026-05-24T17:32:21-07:00,global,iOS App Store,0
14102442181,majsaja,3,Not reliable,"Sometimes trying to connect to the printer is so difficult, or trying to connect the printer to the internet is an impossible task.",26.1.3,2026-05-24T17:01:20-07:00,global,iOS App Store,0
14102262610,Josie Boy Mom,5,Worth it!,So much more I can do for my life.,26.1.3,2026-05-24T15:46:23-07:00,global,iOS App Store,0
14102195675,chip752,5,Ease of Use,"Usually use/buy HP printers.  Tried an Epson to compare.  Epson software is complicated and unreliable, even after Best Buy Geek Squad made a home visit.",26.1.3,2026-05-24T15:19:00-07:00,global,iOS App Store,0
14101942038,nicolas25!,5,Grazie,Fantastico,26.1.3,2026-05-24T13:40:01-07:00,global,iOS App Store,0
14101933171,susywong19,3,Can’t print,"All of a sudden nothing is printing from my iPhone and can’t work out why, hp says I’m fine for ink, everything was fine before all this",26.1.3,2026-05-24T13:36:44-07:00,global,iOS App Store,0
14101841829,Abel hankel,5,Great,I love it,26.1.3,2026-05-24T13:03:00-07:00,global,iOS App Store,0
14101710193,Hijklmnop.,1,Sucks,Printer never works paying for a subscription and always have to unplug and plug backing in in order to print what I need to horrible service.,26.1.3,2026-05-24T12:16:08-07:00,global,iOS App Store,0
14101671589,Hdysjzhs,5,Utilità,Utilissima e molto bella,26.1.3,2026-05-24T12:02:48-07:00,global,iOS App Store,0
14101622526,j.dehos,1,Ich finde diese App lässt noch viel zu wünschen übrig!!!,"Ich als absolute Laie bräuchte mehr offensichtlichere hinweise und Unterstützung.
Habe die Papier Größe überall geändert und trotzdem erkennt er sie nicht an und ich muss jedesmal manuell den Druck starten wofür habe ich dann einen wlan Drucker",26.1.3,2026-05-24T11:46:05-07:00,global,iOS App Store,0
14101542221,Blackfireg8gt,5,HPSmart/7800Envy. Printer,"Great home office/school
Support",26.1.3,2026-05-24T11:19:05-07:00,global,iOS App Store,0
14101359463,MalibuPeaches,3,Printing size,"I love this printer, except I’m having issues being able to adjust the print size or the font But other than that, it’s a great printer.",26.1.3,2026-05-24T10:19:25-07:00,global,iOS App Store,0
14101328711,jflutes1985,1,Sucks,"App sucks, and so does the fact that you have to pay for every paper printed out. Highway robbery",26.1.3,2026-05-24T10:09:49-07:00,global,iOS App Store,0
14101194546,Xiao Baobei,3,Hard to connect to wifi,Hard to connect to wifi,26.1.3,2026-05-24T09:27:43-07:00,global,iOS App Store,0
14101128275,mochamom2,5,Easy access,Great and easy to use!,26.1.3,2026-05-24T09:07:27-07:00,global,iOS App Store,0
14100891506,Loracline,1,Ne marche plus sur iPhone,Le bouton numériser a disparu. On ne peut donc plus numériser des documents posés dans l’imprimante à distance en utilisant l’app HP du téléphone . Le bouton diagnostic ne marche plus non plus. Merci de corriger cette version de l’application,26.1.3,2026-05-24T07:57:44-07:00,global,iOS App Store,0
14100663754,Blake10125,4,Issues with Mobile Fax,I have issues with mobile fax on the app. I need to exit the app and then go back in for my document that I scanned to appear.,26.1.3,2026-05-24T06:49:59-07:00,global,iOS App Store,0
14100218428,Estevaomasson,1,Imagens,Não é possível fazer varias fotos diferentes na mesma folha,26.1.3,2026-05-24T04:20:57-07:00,global,iOS App Store,0
14098774332,Joeyr1,5,Easy to navigate,"The UI is easy to understand and every option I need is presented. Think what you want about their business practices but solely from an app standpoint, HP has it figured out.",26.1.3,2026-05-23T18:04:41-07:00,global,iOS App Store,0
14098108059,boubomber,1,overcomplicated setup and why do you not recognize my account as the registered account,"overly complicated setup, doesn’t even detect my printers mobile",26.1.3,2026-05-23T13:38:35-07:00,global,iOS App Store,0
14098089327,Y jk,1,Mala conexión,Muy mala conexión pésima,26.1.3,2026-05-23T13:31:27-07:00,global,iOS App Store,0
14097650220,No nickname 1357,1,Why the app?,Why do I have to get the app to use my printer!?,26.1.3,2026-05-23T10:58:12-07:00,global,iOS App Store,0
14097511570,Patman34000,2,Les paramètres ne s’affichent plus,"Lorsque je lance une impression, je ne peux plus voir les options d’impression comme par exemple le format à disposition la finition le recto verso, je navigue à l’aveugle. Il faut appuyer sur le flèche de droite pour rentrer dans le menu, et enfin voir ce qui est coché par défaut.  Pas pratique !",26.1.3,2026-05-23T10:13:36-07:00,global,iOS App Store,0
14097337369,Wksip,1,Not printing,Did not work,26.1.3,2026-05-23T09:19:11-07:00,global,iOS App Store,0
14097295984,Kirkland peanut butter,1,Printing is off,"I wanted to print one page…HP PRINTED 3 pages.
1st page was correct…Then 2 more blank pages came through. I am charged for each page.
Now I will be charged for 3 pages when only one page is what I should have been charged for

THIS IS TOTALLY UNETHICAL!",26.1.3,2026-05-23T09:06:42-07:00,global,iOS App Store,0
14097092159,Luca.On,5,Rappresentazione app,Grafica minimalista ma ottimale,26.1.3,2026-05-23T08:06:54-07:00,global,iOS App Store,0
14096865551,Noah-0971,5,Incroyable,L’application n’a jamais crash cela est très fluide,26.1.3,2026-05-23T07:01:25-07:00,global,iOS App Store,0
14096839300,Mumakil,1,There’s nothing Smart about this app,Terrible app. Followed all instructions and connected to wifi ok. Then app sat there for ages saying Registering Printer. Eventually it gave up and now every time I open app is says no printers detected yet the printer has a steady wifi light. How am I suppose to connect and use my new printer?,26.1.3,2026-05-23T06:53:42-07:00,global,iOS App Store,0
14096793153,KiSu87,2,Verbindung,Sehr langsam,26.1.3,2026-05-23T06:40:01-07:00,global,iOS App Store,0
14096034282,Mudanzas Dorling,1,Lo peor,Malo,26.1.3,2026-05-23T02:03:24-07:00,global,iOS App Store,0
14096020237,char1.1,5,Useful tool,It’s so very useful for my small business,26.1.3,2026-05-23T01:57:24-07:00,global,iOS App Store,0
14096008536,Pleiadeslepus,1,Disappointed,"Not connecting, need 3 times the amount of time to print a simple document",26.1.3,2026-05-23T01:52:16-07:00,global,iOS App Store,0
14095827118,Factor TV,5,Excelente!,Felicidades por eficacia y fácil de usar.,26.1.3,2026-05-23T00:33:28-07:00,global,iOS App Store,0
14095546192,Anina natikar,1,Not proper WiFi connectivity,Irritated printer,26.1.3,2026-05-22T22:28:33-07:00,global,iOS App Store,0
14095375538,paujazmin,5,Hp impresora,Me gusta que tiene muchas impresiones lindas y funciones que te sirven 👍,26.1.3,2026-05-22T21:11:58-07:00,global,iOS App Store,0
14095275426,Rythmtalk,1,iPhone compatibility,Not working facing lot of issue while printing from iPhone,26.1.3,2026-05-22T20:29:05-07:00,global,iOS App Store,0
14095180360,Bersita,5,Hp,Lo mejor 100% good,26.1.3,2026-05-22T19:49:50-07:00,global,iOS App Store,0
14095118253,Crop-hopper,5,Great,Great God Almighty,26.1.3,2026-05-22T19:24:52-07:00,global,iOS App Store,0
