id,author,rating,title,content,version,date,country,platform,vote_count
14183739249,Wendy Minteh,1,Fkn complicated for no reason,All I fkn wanted to do was attach my new iPhone 17 and it took 2 hrs to figure out how.. it was harder to use on new phone then the og set up .. horrible experience,26.1.3,2026-06-14T17:30:11-07:00,global,iOS App Store,0
14183540144,triviette,1,No App support,"Printer never works and always always always has connection issues and won’t connect to WiFi can’t add printer to app it’s always something and you can only
Communicate with bots it’s so far and there is no way to get live app support I have tried all the troubleshooting options and nothing works I am beginning to think this is on purpose so you will upgrade to a new printer",26.1.3,2026-06-14T16:10:14-07:00,global,iOS App Store,0
14183060822,ArviCV,5,perfect app for prints,the best app i used from HP,26.1.3,2026-06-14T13:10:08-07:00,global,iOS App Store,0
14183027038,Reading Maven,1,Printer connection Rip off,This was a horrible experience trying to connect my new iPad to our HPPrinter. We connected our Android phones no problem. After spending a hour found out I have to pay $65 year for privilege of printing and if I hadn’t chosen yearly and opted for weekly it was $10 per week or $350 per year.  What kind of rip off is this?!,26.1.3,2026-06-14T12:58:34-07:00,global,iOS App Store,0
14182900761,mr2302,4,Gute App mit ausgeprägter Start-Schwäche,"Aller Anfang ist schwer. Das gilt vor allem für diese App. Denn sie startet extrem schwer schlecht, manchmal auch gar nicht. Das ist nervig. Wenn sie aber dann läuft, ist sie wunderbar zu bedienen und wirklich sehr gut. Die Startschwäche kostet einen Stern.",26.1.3,2026-06-14T12:16:31-07:00,global,iOS App Store,0
14182823504,LinThoms,5,Guide,"A really good app that guides you around with what you need to have done with your printer, such as mirror a picture, scan a picture, fix colors, this and that and what not. Like it.",26.1.3,2026-06-14T11:51:44-07:00,global,iOS App Store,0
14182577137,Snorkling  printers . Com,1,Doesn’t want to do simple tasks,"My printer don’t like doing single prints per page it wants to so 100 page blue prints rather than a singular , because it likes wasting ink so I have to buy more , adding more money in the ceo pocket and leaves me skint with a printer floating at the bottom of my pool because it can’t do simple functions",26.1.3,2026-06-14T10:34:31-07:00,global,iOS App Store,0
14182556687,Flies34,5,Easy to use,To connect shutdown printer and turn back on,26.1.3,2026-06-14T10:28:15-07:00,global,iOS App Store,0
14182541909,Cavaslete,1,Impressora e conexão app/iphone,"A impressora não conecta nem com o app nativo, nem com o telefone e acaba por não imprimir nada",26.1.3,2026-06-14T10:23:44-07:00,global,iOS App Store,0
14182424238,Blue-Jay-007,2,Scan function missing,"The old scan function (use the printer to scan a file) is missing on the new app update for the HP 9120 series printer and only allows scan to HP Cloud. This type of scan only allows a JPEG file to be created and you must use the small printer keypad display to type the file name not your mobile device. On my HP 9010 series printer the original scan function still exists and I’m able to scan documents and save them as a PDF file on my mobile device . Please return the old scan to a file function. 
I’m using app version 26.1.3",26.1.3,2026-06-14T09:47:54-07:00,global,iOS App Store,0
14182061480,Nincs4567,1,Langsam,Lassú,26.1.3,2026-06-14T08:00:15-07:00,global,iOS App Store,0
14181916873,Gaurav Kariya,1,Worst experience,"After every print I have to press power off and power on button to make my next print, extremely frustrating...",26.1.3,2026-06-14T07:17:26-07:00,global,iOS App Store,0
14181788859,Gotaspin,1,Printing photosg from desktop,Difficulty printing photos from desktop,26.1.3,2026-06-14T06:38:43-07:00,global,iOS App Store,0
14181525854,rhadipour,1,Schlechte Verbindung und schlechte Hardware,"Ich drücke normalerweise einmal pro Monat und jedes Mal fast 5-10 Minuten bin ich beschäftig um meinem Drucker online bringen, davor muss ich mindestens zweimal die Drucker aus und anschalten. Ich will unbedingt eine andere Mark kaufen.",26.1.3,2026-06-14T05:13:25-07:00,global,iOS App Store,0
14181386011,hungryman2022,1,Horrible Update,"I use to use HP Smart, but they now updated it to this new version. This is absolutely the most useless app. Rarely works and is almost impossible to find and add your printer.",26.1.3,2026-06-14T04:22:33-07:00,global,iOS App Store,0
14181127667,Kassettdäksreparatören,4,HP- appen,"Bra, men vore önskvärt om man kunde skriva ut direkt från appen Pages, som bara tillåter AirPrint",26.1.3,2026-06-14T02:38:48-07:00,global,iOS App Store,0
14180752158,LayerGold,4,Dispiaciuto,"Vedo che a distanza di tempo, nonostante segnalai il problema, non avete ancora preso provvedimenti. Purtroppo se non si è collegati in Wi-Fi e collegata in rete una stampante HP, non si riesce a disporre dei propri file salvati sull’account HP, e quindi nemmeno condividerli via email e questa non è una bella cosa.",26.1.3,2026-06-13T23:59:06-07:00,global,iOS App Store,0
14180405307,Beady88,1,Keep it simple,"Have had an HP envy for 10 years.  Just bought a new one and want to scan to my iMac. It used to be so simple, place document on printer, scan and it appeared in documents.  Now, I need shortcuts and it seems there is no option to send scanned item to the iMac. If there is, please tell me.",26.1.3,2026-06-13T21:25:17-07:00,global,iOS App Store,0
14180255105,J Wingfield,1,I can’t get it to print from my computer and it will not tell me why,"Too hard to use, it prints sometimes and other times it just sits and want print at all very frustrating",26.1.3,2026-06-13T20:21:29-07:00,global,iOS App Store,0
14180142713,Jfesquinca,5,Best product & quality,Saving time and very easy to use from my mobile,26.1.3,2026-06-13T19:36:05-07:00,global,iOS App Store,0
14179984277,D in Toledo,5,Camera scan,Thumbs down,26.1.3,2026-06-13T18:34:19-07:00,global,iOS App Store,0
14179961835,Insta-ink sucks,2,Overcharging,"The printer works great. Really enjoy the app. My complaint is that I should not have to pay HP for every page I print. That’s ridiculous, and it gets expensive. It’s just another way for HP (and other like-companies) to suck the common person dry while raking in the billions. It was never like this growing up. I bought the printer, paper, and ink, and printed my hearts desire until the paper or ink ran out. 

And I realize that’s still an option, but the ink cartridges you sell in the store are expensive and only last about 50 pages and they’re done! You basically give me no choice but to sign up for your insta-ink BS because in the long run it actually ends up being a little cheaper than buying the cartridges, which isn’t saying much. 

All I want HP to do is sell me a printer and ink and then I’ll go my merry way. I don’t want to be hooked on your insta-ink dependency chain.",26.1.3,2026-06-13T18:25:38-07:00,global,iOS App Store,0
14179616361,Kentyon,1,Can’t get it to print,To confusing,26.1.3,2026-06-13T16:07:55-07:00,global,iOS App Store,0
14179560960,Child of God - John 3:16,1,Frequent Printer Connection & Ink Account Issues,I always have frequent Printer Connection & Ink Account Issues. It’s always so difficult to print. It’s either i have paid for a year instant ink/print and then my account shows that I haven’t and then I can’t print and then my time is wasted along with my money. This is tiring,26.1.3,2026-06-13T15:46:49-07:00,global,iOS App Store,0
14179372096,No thanks HP!,1,SO frustrating!!!,What happened to the days when you could just plug in your printer to your computer and have it be recognized rather than they have to go through a proprietary app which is not intuitive and very frustrating I will never buy another HP product in my life!!!,26.1.3,2026-06-13T14:34:49-07:00,global,iOS App Store,0
14179262158,Stan2077,5,Great Printer,Easy set up is superb printing,26.1.3,2026-06-13T13:53:41-07:00,global,iOS App Store,0
14179239673,Trava demais 2,1,Difícil,"Não tem senha pra
Wi-Fi impressora se perde e não conecta com a mesma Wi-Fi",26.1.3,2026-06-13T13:45:26-07:00,global,iOS App Store,0
14179207763,Its Ant with an A,2,Since the most recent update dohh,"All the previous app updates were fine but since the demise of the smart one, i am unable to see or connect with my iPhone at all, it refuses to see my ink tank device, says it is not on wi-fi. However, my laptop can see it as can my Android phone - which runs the old HP app.
Done every thing even the ip address but still does not. I have not changed and Wi-Fi component, or password. If there was anything wrong with either, then my android phone, which is 28 months old, and my laptop which is 3 years old would not be able to connect to it.",26.1.3,2026-06-13T13:33:47-07:00,global,iOS App Store,0
14179106546,Veri Shari,5,New Printer,Like the sleek look of device. Easy to set up.,26.1.3,2026-06-13T12:58:16-07:00,global,iOS App Store,0
14179055577,Mark E T,1,Very difficult!!,To connect printer using app.,26.1.3,2026-06-13T12:40:31-07:00,global,iOS App Store,0
14178896832,Momolafrite2010,1,Obliger de s’inscrire,Je suis obliger de m’inscrire pour numériser encore des pub sur ma boîte mail pour rien,26.1.3,2026-06-13T11:47:02-07:00,global,iOS App Store,0
14178828369,JoChenje,1,No connection,The app hasn’t worked like it should. I regret purchasing this printer. It has made simple printing tasks more complicated,26.1.3,2026-06-13T11:24:12-07:00,global,iOS App Store,0
14178566837,LDF!,1,Terrible,"Never works, never connects, always need to restart, the worse App and printer I’m ever had",26.1.3,2026-06-13T10:00:31-07:00,global,iOS App Store,0
14178331752,benedetto.cesaretti,1,Deprimente,"Non so chi possa lasciare recensioni così positive!!! L’app è deprimente, il codice sembra scritto da un bambino di 3 anni!!! Ad ogni aggiornamento l’app peggiora in prestazioni e funzionalità…. Spero qualcuno in ho si decida a fornire ai propri clienti qualcosa di, almeno, decente!!!!!",26.1.3,2026-06-13T08:49:32-07:00,global,iOS App Store,0
14178141954,vickybghj,5,Amazing and faster than clicking on pinter,You can just do it in ur phone even when ur not that near it just amazing and easier to read and manage your printer,26.1.3,2026-06-13T07:53:49-07:00,global,iOS App Store,0
14178119705,DaniMelo5,1,Decepcionante,É impressionante que um aplicativo desse nível não permite uma simples impressão de várias páginas numa mesma folha!,26.1.3,2026-06-13T07:47:21-07:00,global,iOS App Store,0
14178117049,Mahbub83,1,Alignment issue,There’s alignment issue!!! I can’t solve it,26.1.3,2026-06-13T07:46:35-07:00,global,iOS App Store,0
14177429006,Opal792,5,Great toner,Really quick to arrive and very easy to set up and get printing . Highly recommend,26.1.3,2026-06-13T04:10:16-07:00,global,iOS App Store,0
14176788066,dompasdestom,4,Difficultés,"Parfois très difficile de connecter mes imprimantes en wifi …
Réinitialisation des périphériques et du PC souvent nécessaires !!!! J’ai failli mettre que 3 étoiles …",26.1.3,2026-06-12T23:47:01-07:00,global,iOS App Store,0
14176565117,Sangy!,1,Scan,It keep blacking out the pages,26.1.3,2026-06-12T22:09:42-07:00,global,iOS App Store,0
14176555849,peedee12,1,Worst after sales service,After purchasing the Hp printer I assure you that it was the worst after sales services . Assurances as on-site are shallow are merely false in nature . Buy Canon instead,26.1.3,2026-06-12T22:05:48-07:00,global,iOS App Store,0
14176321722,FrustratedPrinter,1,Wasting money,I bought a new printer.  Can’t get it to print photos.  Keeps flipping the print on the wrong side of the photo paper.  Getting frustrated and the help is useless.,26.1.3,2026-06-12T20:24:35-07:00,global,iOS App Store,0
14175984129,Sidekick Fran,1,App. Difficult to sign on,Refuse to accept password,26.1.3,2026-06-12T18:13:02-07:00,global,iOS App Store,0
14175890065,Stuckeya,1,Just a complete pain in the backside,"Why do I need to logon using Google account on my apply phone to use a HP scanner. The HP app suggests I use my phone instead of my HP printer/scanner. ?? Recommending themselves out of business
Great strategy",26.1.3,2026-06-12T17:36:42-07:00,global,iOS App Store,0
14175692442,brescale,5,Bien,Bien,26.1.3,2026-06-12T16:18:44-07:00,global,iOS App Store,0
14175577789,Ital84,4,Registrazione obbligatoria account,"L’app funziona perfettamente, do 4 stelle solo perché per stampare tramite telefono è necessario registrarsi con un account e se la stampante è utilizzata da più persone, tutti devono registrare un account personale. Per il resto è un’ app eccellente.",26.1.3,2026-06-12T15:32:49-07:00,global,iOS App Store,0
14175371639,TechKid23,1,Horrible,"Terrible connectivity issues, never wants to work, always takes forever to connect and therefore print. 

Couldn’t rate it less low",26.1.3,2026-06-12T14:13:16-07:00,global,iOS App Store,0
14175351053,ugysguycaehiu,5,Printing,So sigma,26.1.3,2026-06-12T14:05:42-07:00,global,iOS App Store,0
14175258963,joey joey o o,5,Great printer app,"HP printer app is awesome! Easy to use, quick and efficient. I love it.",26.1.3,2026-06-12T13:32:41-07:00,global,iOS App Store,0
14175102975,Samara224,1,Won’t connect to WiFi to my printer,I’ve looked up so many different ways to connect my printer to wifi and it keeps bringing me back to the app without actually helping me connect it at all. Each different link I clicked on for help just kept telling me to go to the app but the in app help didn’t give me any direction on how to connect it to the wifi. It basically expected me to already have it connected with each link. We’ve had this printer for years and never struggled to connect it until this app bs.,26.1.3,2026-06-12T12:39:00-07:00,global,iOS App Store,0
14174614174,NaxMax95,3,Rubrique invisible,L'appli est bien modéliser. Néanmoins il reste un bug d'affichage sur iPhone. Lorsque je veux imprimer la rubrique de sélection (couleur ou autres etc...) Est tout simplement invisible avec seul des traits noir et flèches de sélection qui nous guide mais aucune affichage d'écriture apparaît.,26.1.3,2026-06-12T10:02:22-07:00,global,iOS App Store,0
14174607836,No fed up,1,Rubbish,Whole system is poor,26.1.3,2026-06-12T10:00:27-07:00,global,iOS App Store,0
14174552449,APPetiteStan,5,Dependable,I’ve Had my HP Envy Photo 7155 printer for many years now.  It has served us well.  My next printer will be an HP.,26.1.3,2026-06-12T09:43:47-07:00,global,iOS App Store,0
14174394938,Acquallapippa,5,Ottima,Un ufficio a casa senza spendere molto,26.1.3,2026-06-12T08:58:11-07:00,global,iOS App Store,0
14173944913,Devender thukral,5,Hi,Nice experience,26.1.3,2026-06-12T06:59:10-07:00,global,iOS App Store,0
14173925801,MomB&A,5,Hp officejetpro,"Works well, does what I need it to do and I’m getting my jobs done nice and easy!!",26.1.3,2026-06-12T06:54:08-07:00,global,iOS App Store,0
14173650638,Chema 74,5,Ciencia Ficción,"Qué decir, cuando soy de la generación que innovó con los primeros PCs…una impresora que desde el segundo cero y con sencillez, me permite imprimir desde la App del móvil o desde mi PC y todo sin cables. Un diez!",26.1.3,2026-06-12T05:31:57-07:00,global,iOS App Store,0
14173383327,D.k 71,5,Skanning,Funkar hur bra som hälsr,26.1.3,2026-06-12T04:01:06-07:00,global,iOS App Store,0
14173161831,Ray Stafford,5,Great app,Excellent app,26.1.3,2026-06-12T02:32:21-07:00,global,iOS App Store,0
14173125786,Mutrams,4,Memory errors,All doing good. But while I scan through apple iPhone for continuous documents it is sending a message saying out of memory,26.1.3,2026-06-12T02:16:29-07:00,global,iOS App Store,0
14172824077,Ricky 80,5,Ottimo prodotto,Qualità prezzo imbattibile,26.1.3,2026-06-11T23:58:17-07:00,global,iOS App Store,0
14172635024,oberly,1,Awful,"Not better, worse",26.1.3,2026-06-11T22:29:11-07:00,global,iOS App Store,0
14172276447,Keesoftpaws,5,Best Printer Ever!,"I bought my printer back in 2018 and it is still working exactly like it was from day one. I pay a little over $3 a month for the instant ink. I never have to worry about running out. When it gets low, more is shipped to me before I run out. If this one ever gives up on me, I’ll be replacing it with another HP printer.",26.1.3,2026-06-11T19:49:54-07:00,global,iOS App Store,0
14171989306,BeeICBL,5,Easy,Easy to use,26.1.3,2026-06-11T17:55:28-07:00,global,iOS App Store,0
14171564207,@NerdsPod,1,Horrible,The fact I have to push a button on the app on my phone and not on the actual printer to scan a document doesn’t make any sense,26.1.3,2026-06-11T15:02:11-07:00,global,iOS App Store,0
14171470845,Roxy Leigh Serra,1,This app is terrible!!!!,This app is absolutely terrible…. zero help or support options… the steps they provide do not work!!,26.1.3,2026-06-11T14:26:24-07:00,global,iOS App Store,0
14171433434,Tho'!,1,À la traîne,"Ergonomie d’un autre âge pour configurer une imprimante sans écran, j’ai l’impression de retourner 15/20 ans en arrière à chaque changement de réseau. 
Et alors la nécessité de partager sa position GPS pour paramétrer le wifi d’une imprimante…",26.1.3,2026-06-11T14:12:49-07:00,global,iOS App Store,0
14171426494,Anahma2010,1,Impossible.,This app is so impossible to use. I struggle so many times cause it disconnects my wifi and it’s a pain to reconnect it. When I print it doesn’t work too.,26.1.3,2026-06-11T14:10:21-07:00,global,iOS App Store,0
14171175364,mme coupan,3,Avis client,"Très bonne application. Point à améliorer : numérisation et impression recto verso, et pouvoir numériser un document recto verso sur la même feuille par exemple pièce d’identité",26.1.3,2026-06-11T12:44:54-07:00,global,iOS App Store,0
14171166913,Hari65638,4,Very much useful app,This app is very useful. I used for multiple documents scanning and it helped me a lot. It would be even better if the processing of scanning can be quicker.,26.1.3,2026-06-11T12:42:16-07:00,global,iOS App Store,0
14171126796,Ann_8813,5,HP,"Sehr gut,schnell und einfach 👍🏻",26.1.3,2026-06-11T12:29:44-07:00,global,iOS App Store,0
14171046929,Pediotakis,1,Cher et nul,"Je paie un abonnement pour imprimer.
L’imprimante refuse souvent de scanner avec l’app HP.
La lenteur pour voir son compte instant ink est la même que celle de l’imprimante quand on tente d’imprimer.
HP premier vendeur mondial d’imprimante et tout aussi médiocre que ça soit sur la qualité du service ou le prix de leurs abonnements (cartouches)",26.1.3,2026-06-11T12:04:50-07:00,global,iOS App Store,0
14171045255,KatLee777,5,Size,I wish the app would allow us to choose random sizes,26.1.3,2026-06-11T12:04:21-07:00,global,iOS App Store,0
14170923808,Joebrunk,1,Can only print from my phone.,"I can only print from this app, it sucks I hate it",26.1.3,2026-06-11T11:27:41-07:00,global,iOS App Store,0
14170810912,Paaresh,5,Best app,"Great app
I like it",26.1.3,2026-06-11T10:54:14-07:00,global,iOS App Store,0
14170691472,Lexdodlin,1,Cochonnerie de HO,Vos imprimante sont toujours de la marde à connecter.  Je vais la retourner,26.1.3,2026-06-11T10:18:23-07:00,global,iOS App Store,0
14170684686,AEPO99,1,Problemas al imprimir,Me está pidiendo un cable para conectarme a la impresora para poder actualizar los drivers pero el cable no fue incluido en la compra. Además e intentado imprimir multiple veces y no e podido porque la impresora no quiere imprimir desde mi computadora.,26.1.3,2026-06-11T10:16:18-07:00,global,iOS App Store,0
14170625573,@lplalitpathak,5,Lalit Pathak,7,26.1.3,2026-06-11T09:58:41-07:00,global,iOS App Store,0
14170523114,Gat_2,1,Lentissima,Lentissima. Si avvia con un minuto di tempo letteralmente,26.1.3,2026-06-11T09:28:06-07:00,global,iOS App Store,0
14170271027,The broken leg,5,Great app,"Some app ask for subscriptions and nonsense I have two hp printers and they work great but why sell me on apps that don’t work well.
This app isn’t that.
It works great and how it should keeping it simple",26.1.3,2026-06-11T08:14:24-07:00,global,iOS App Store,0
14170119756,sa81788,2,Would not recommend,Literally the most frustrating and annoying air printer I’ve ever used in my life. The app is wildly inconvenient and faulty.,26.1.3,2026-06-11T07:30:42-07:00,global,iOS App Store,0
14170068542,G-Sharp2020,5,Fantastic,Love this feature!!,26.1.3,2026-06-11T07:15:49-07:00,global,iOS App Store,0
14170047071,Bolacha verde,2,Bug for dark mode,On dark mode when you try to print the app opens with the texts not showing up. As if the text was white and the cell background is also white.,26.1.3,2026-06-11T07:09:33-07:00,global,iOS App Store,0
14170011173,//Moxon,1,hp desk jet 2810e,"worked fine until warranty expired then just refused to print shows status as off line 
reset several times pc detected printer goes through setup process and then goes off line last ho printer i buy",26.1.3,2026-06-11T06:58:59-07:00,global,iOS App Store,0
14169584766,Ranjeetrpr,5,Awesome,Wonderful experience,26.1.3,2026-06-11T04:45:53-07:00,global,iOS App Store,0
14169532688,George  I G,5,App,Excellent,26.1.3,2026-06-11T04:27:47-07:00,global,iOS App Store,0
14169191911,IanSh,1,Useless,"Does not permit camera scan printing on any European paper size other than A4.  And if you use A4, chops the bottom of the image off,",26.1.3,2026-06-11T02:10:58-07:00,global,iOS App Store,0
14169184835,ajav1981,1,couldnt use it without creating a hp account,If I bought it I should be able to use it without giving my data to hp,26.1.3,2026-06-11T02:07:49-07:00,global,iOS App Store,0
14169133466,Alfiedog12,1,Random,"My HP printer is like a petulant child; sometimes it does as it’s told and others not. 
There is no obvious harbinger to suggest when an episode of indolence is about to occur, rather, it simply refuses to operate (usually when it is most required) without warning. 
If I was a member of The Who I would be chucking HP printers out of hotel windows in place of television sets.",26.1.3,2026-06-11T01:44:31-07:00,global,iOS App Store,0
14169035100,User web.de Club,1,Druck,"Eigentlich „0“ Sterne.

Druckauftrag wird ohne erkennbaren Grund nicht entgegengenommen.",26.1.3,2026-06-11T00:58:51-07:00,global,iOS App Store,0
14168794057,Foxmulder2,2,Lenta e non intelligente,Da app che serviva per utilizzare una stampante Hp è diventata una specie di hub ai dispositivi Hp. Ma se la usi solo per stampare e scansionare rallenta molto il tuo flusso di lavoro. Inoltre il riconoscimento automatico dei bordi in fase di scansione non funziona quasi mai e propone ritagli incoerenti con il documento scansionato che escludono ampie porzioni di testo (anche quando si imposta il formato di scansione A4 di un foglio quasi completamente pieno),26.1.3,2026-06-10T23:04:24-07:00,global,iOS App Store,0
14168724248,RosaElisabeth,5,Maravillosa,"Súper fácil de instalar, muy rápida y excelente calidad.",26.1.3,2026-06-10T22:31:35-07:00,global,iOS App Store,0
14168520385,tgblrmom,1,Terrible app,Not intuitive to use. Cumbersome. Wastes ink and time. I don’t plan to buy another HP printer again.,26.1.3,2026-06-10T20:57:53-07:00,global,iOS App Store,0
14168376405,Este 10,5,GRATEFUL,It’s so helpful,26.1.3,2026-06-10T19:54:40-07:00,global,iOS App Store,0
14168299837,steph5353,1,N’imprime rien!,"L’imprimante écrit qu’elle est connectée, mais impossible d’imprimer",26.1.3,2026-06-10T19:22:44-07:00,global,iOS App Store,0
14168276157,Infinite Empire,5,Awesome App!,I don’t know how old my printer is but it is still seems to be up to date,26.1.3,2026-06-10T19:13:14-07:00,global,iOS App Store,0
14168178950,Challenging ￼,1,Not easy to set up,"There is software for the printer, software for the scanner, don't connect your computer to the printer, using the USB port, if you want the skin to go to your computer, good luck!",26.1.3,2026-06-10T18:34:19-07:00,global,iOS App Store,0
14168092856,vitovar,5,Amazing,We love you 😍,26.1.3,2026-06-10T17:59:54-07:00,global,iOS App Store,0
14168087332,HP Hater No.2,1,Frustrating,Wouldn’t buy anything HP ever again. The attempt to automate everything over complicated what should be a straightforward process and support is ai and useless.,26.1.3,2026-06-10T17:57:43-07:00,global,iOS App Store,0
14167952988,modelsein,1,Hotrible,No use,26.1.3,2026-06-10T17:04:04-07:00,global,iOS App Store,0
14167768477,Ysoquiett,5,Decent,Was slow at first didn’t know what I was doing but it’s good now,26.1.3,2026-06-10T15:49:01-07:00,global,iOS App Store,0
14167719534,kjkj123456654321,1,Horrible app,Never works. Why would I want to print the same page 3 times and the other pages none?,26.1.3,2026-06-10T15:29:23-07:00,global,iOS App Store,0
14167507329,Vanillawafers101,1,bad,connection is terrible always with printing takes forever,26.1.3,2026-06-10T14:07:27-07:00,global,iOS App Store,0
14167461678,gaushriv,1,Scan feature disappeared,"As sson as the app updated i cant scan using this app 
why are you hell bent on people to give up hp",26.1.3,2026-06-10T13:50:28-07:00,global,iOS App Store,0
14167441388,ckeen,5,HP App works when iOS Print does not,"I was pulling my hair out trying to print something directly from my iPhone, but an article from Google suggested using the HP app. It worked!",26.1.3,2026-06-10T13:43:05-07:00,global,iOS App Store,0
14167107319,Carame7o,5,Genial,Con la opción de scanner desde el teléfono es muy fácil el proceso. 10/10,26.1.3,2026-06-10T11:48:40-07:00,global,iOS App Store,0
