id,author,rating,title,content,version,date,country,platform,vote_count
14082218266,Montjma,5,Sehr gut,Sehr gut,26.1.3,2026-05-19T07:31:08-07:00,global,iOS App Store,0
14082003136,RevCc,5,First time success,"The process of setting up my printer HP App etc was a bit daunting but somehow everything fell into place and within minutes I printed off a document from my photos.
Brilliant very pleased",26.1.3,2026-05-19T06:23:13-07:00,global,iOS App Store,0
14081985415,Robtief,1,Kein PlugIn & Play,"Mühsames Einrichten, Seltsam: wifi funktioniert nicht, da der 5GHz-Kanal 64 von Radarsystemen benutzt wird. Kein Netzwerk-Betrieb also. Nur nerviges WiFi-Direct.",26.1.3,2026-05-19T06:17:36-07:00,global,iOS App Store,0
14081962578,It’s terrible like really,1,It’s terrible,The printer is brand new barely works and the app is just plain terrible.,26.1.3,2026-05-19T06:10:17-07:00,global,iOS App Store,0
14081892974,Dauriphort,5,Simple et parfait d’utilisation,Dommage consommables extrêmement chers ( encres et pièces de rechange) 😢,26.1.3,2026-05-19T05:47:21-07:00,global,iOS App Store,0
14081769079,CTO Big Saas Company,1,Opción escaneo a doble cara,No viene para hacer escaneo de lotes a doble cara,26.1.3,2026-05-19T05:05:14-07:00,global,iOS App Store,0
14081372416,I won’t dangerous,5,about app and printer,If i give it 20 pages it prints so fast everything is going so well and the app is no trouble. It is so easy to use,26.1.3,2026-05-19T02:23:13-07:00,global,iOS App Store,0
14081143173,François1988,3,Casi todo bien,"Funciona perfectamente per gran NO : tener que crear una cuenta, por ??? Simplemente quiero escanear algo y ya está. En fin… 🤦‍♂️🤦‍♂️🤦‍♂️",26.1.3,2026-05-19T00:26:17-07:00,global,iOS App Store,0
14080878431,Sumeet Sisodiya,5,Nice & easy to operate,The Ui is very easy to use and it make all thing easy and Wonderful,26.1.3,2026-05-18T22:08:11-07:00,global,iOS App Store,0
14080768027,S HD if I z,1,HP Sucks,They stoped supporting my printer.,26.1.3,2026-05-18T21:11:43-07:00,global,iOS App Store,0
14080364768,DoorDash 5 star,5,Happy,Easy to use easy to scan easy networking love it,26.1.3,2026-05-18T18:10:44-07:00,global,iOS App Store,0
14080321276,Coltsmann,1,Terrible,Hp is the most difficult printer ever!!!!! Avoid at all cost….,26.1.3,2026-05-18T17:52:25-07:00,global,iOS App Store,0
14080042602,ufvprof,1,Problems,Can’t get the instant ink / get supplies option to work. Just goes to a blank screen. No help from HP,26.1.3,2026-05-18T15:54:49-07:00,global,iOS App Store,0
14079928563,Cs051977,4,HP&Smart App,"Schade dass die Apps zusammen gelegt wurden!Eine App für alles ist zwar gut. Aber durch das zusammenfassen wird jetzt in der App nur noch die Kamera vom Handy zum Scannen angezeigt, und nicht mehr Scan am Drucker. Habe dies fast täglich mit Stapel Scans vom ADF-Fach gemacht. War einfacher als jedes Blatt einzeln mit der Kamera zu Scannen und ging deutlich schneller!!!",26.1.3,2026-05-18T15:06:50-07:00,global,iOS App Store,0
14079674891,IPASSEZ,5,M140w,It’s an excellent product,26.1.3,2026-05-18T13:25:07-07:00,global,iOS App Store,0
14079637450,Franck bean,1,Compatibilité apple,"Impossible de supprimer des pages. 
Il faut à chaque fois remettre les paramètres du recto verso.
Pas de possibilités d’utiliser le driver imprimé apple",26.1.3,2026-05-18T13:10:53-07:00,global,iOS App Store,0
14079533796,LATG_,2,Mejorable,"Cuando se puede acceder, es una maravilla, funciona perfectamente; cuando no es capaz de cargar en unos pocos segundos, entra en bucle infinito. Reinstalar la aplicación no soluciona nada.",26.1.3,2026-05-18T12:32:37-07:00,global,iOS App Store,0
14079533439,Wasted money so far,1,Disappointed,Want print,26.1.3,2026-05-18T12:32:29-07:00,global,iOS App Store,0
14079532943,SailorKrypton,1,Terrible,"Aside from HP deleting honest reviews, this app is terrible. It does not allow you to print multiple photos on one piece of paper nor adjust the size for the photos. I wanted three 4x6 and can only choose the full page. I could do that without an account and without this app. Useless. Rip off. last HP product I’ll ever own.",26.1.3,2026-05-18T12:32:17-07:00,global,iOS App Store,0
14079484329,"8382!,$",1,Ink sucks,Printer sucks. Ink cartridges never print well. So frustrating. I’ve tried every method of cleaning and it still has terrible print quality.,26.1.3,2026-05-18T12:14:41-07:00,global,iOS App Store,0
14079451187,Luisking82,1,iPhone 17 pro,"Non funziona correttamente. È sempre stata perfetta ma da qualche settimana dà problemi. Non mostra tutte le opzioni di stampa, restano bianche",26.1.3,2026-05-18T12:02:51-07:00,global,iOS App Store,0
14079361879,AnaMPino,1,Falla conexión,Falla mucho y no encuentra la impresora,26.1.3,2026-05-18T11:31:14-07:00,global,iOS App Store,0
14079168778,norvy.nb,1,N’ACHETEZ PAS LEURS PRODUITS,"L’application bug tout le temps, les imprimantes n’en parlons pas. Et en plus il faut payer l’abonnement pour pouvoir imprimer. C’est une arnaque n’achetez pas leur produits je ne recommande pas.",26.1.3,2026-05-18T10:24:11-07:00,global,iOS App Store,0
14079118194,Simplyeevee3,1,Never registers photo paper,Hate HP printers. Never registers photo papers no matter the brand. Waste of money.,26.1.3,2026-05-18T10:07:01-07:00,global,iOS App Store,0
14079097930,Judah Jibrin,5,Awesome,Amazing product. Easy to set up,26.1.3,2026-05-18T10:00:10-07:00,global,iOS App Store,0
14079060428,PISTACH-ONE,1,HP needs a software/management update,HP is frugal and they are behind the times.  They have discontinued the their recycling program and they do not honor their word.  They are a second or third class company.,26.1.3,2026-05-18T09:47:40-07:00,global,iOS App Store,0
14079005094,Macalious2001,5,It’s Amazing!!!,"I can’t say enough about this product! It’s everything you need all in one. There’s not a day where I’m not using it for daily use, college papers, mobile faxing documents for doctors offices or realtors etc. It’s so easy to use and I’m happy to have it.",26.1.3,2026-05-18T09:29:33-07:00,global,iOS App Store,0
14078961056,Bob Alberts,2,Envelopes,Why when I follow all directions it continuously tells me there is no paper?,26.1.3,2026-05-18T09:15:14-07:00,global,iOS App Store,0
14078816744,marleennnnn,2,Horrible UI,Ever since the update that changed the UI navigating the app has become so complex,26.1.3,2026-05-18T08:29:13-07:00,global,iOS App Store,0
14078613880,wldsteve,5,Works great,I had to stop using my laptop and start using my tablet. Had no way to scan docs to tablet and email them. Until I started using up app. It has made my life easier. Finally getting full use of printer and loving it. Should have done this when I originally bought it.,26.1.3,2026-05-18T07:26:13-07:00,global,iOS App Store,0
14078521378,MPT viewer,1,Poor Connectivity,"This update to the HP Smart app has terrible issues with connecting to my phone. Never encountered this in the old app. Once connected, it operates very well and is very useful.",26.1.3,2026-05-18T06:57:48-07:00,global,iOS App Store,0
14078520728,Light Yagami01,5,.,.,26.1.3,2026-05-18T06:57:35-07:00,global,iOS App Store,0
14078262860,Evejen001,1,Options and controls ARE BLANKED OUT,Since this last update we are UNABLE to see ANY of the controls.   The print options page is BLANK. Please FIX THIS!!! Once fixed I will edit my ZERO rating of 1 star!!,26.1.3,2026-05-18T05:34:42-07:00,global,iOS App Store,0
14077949080,Fqnch,1,Connexion obligatoire pour scanner,Devoir créer un compte HP pour pouvoir utiliser la fonction scanner de mon imprimante personnelle est une chose que je trouve scandaleuse. Ca devrait être interdit. Une politique d'utilisation plus que discutable !,26.1.3,2026-05-18T03:38:46-07:00,global,iOS App Store,0
14077948495,Patrocli,1,Lenta,Muy lenta,26.1.3,2026-05-18T03:38:31-07:00,global,iOS App Store,0
14077653917,iphiana,1,Des voleurs,L'imprimante ne fonctionne jamais. Je paye tous les mois et ne reçois plus de cartouches.,26.1.3,2026-05-18T01:19:53-07:00,global,iOS App Store,0
14077480321,ted12344567,5,Increasingly frustrated with tech Gen X,So simple to use thank you,26.1.3,2026-05-17T23:50:37-07:00,global,iOS App Store,0
14077428153,Lucky Lindy 45,3,Not as good as I hoped,"Works when it wants to.  I spend a lot of time trying to get it to print.  A  two minute task can take up to two hours to print.  My best advice.  Hold your breathe
and cross your fingers that the printer will be in a mood to print.",26.1.3,2026-05-17T23:23:33-07:00,global,iOS App Store,0
14077207895,Rely cool and awesome,1,works maybe,This is the biggest piece of junk.  I literally was able to only print on Apple devices because you can’t seem to integrate with windows well.  Well now i can’t print on any of my devices.   I have reset the entire home network and all the decides.  The printer is hooked up to the network print jobs go through but never print.  HP doesn’t have any problems playing you commercials but can’t seem to have a working long term product. Never again will i buy HP for me or my fortune 400 company.,26.1.3,2026-05-17T21:29:41-07:00,global,iOS App Store,0
14076929698,The Comforts of Apple,5,A huge help,The fella Shaw was extremely professional and very helpful patient and knowledgeable. Thank you,26.1.3,2026-05-17T19:18:07-07:00,global,iOS App Store,0
14076850823,WickEncrypt® DevOps Engineer ,1,Update • Critical Failure,"Latest update doesn’t display any controls on main print screen, even after uninstalling it and reinstalling it nothing is visible!! Come to find out all devices are doing the same thing which indicates it’s an HP update coding error. This is why I should have just stayed with Canon. They don’t just release updates until they are thoroughly vetted. At the very least open TestFlight beta slots before doing random updates! Unbelievable!!",26.1.3,2026-05-17T18:44:07-07:00,global,iOS App Store,0
14076541578,Luigiboy26,5,Falla mucho.,"No me deja abrir la configuración de la impresora y al intentar imprimir un documento desde WhatsApp, aparecen los menús sin letras.
Además, los documentos de varias páginas se tienen que imprimir de una en una, porque si no, se traba.",26.1.3,2026-05-17T16:32:00-07:00,global,iOS App Store,0
14076394043,gggfd472bdf,1,Is an App necessary?,It is ridiculous you have to download an app and spend 30 minutes figuring out how to just print a paper. I will never buy HP again.,26.1.3,2026-05-17T15:28:38-07:00,global,iOS App Store,0
14076358309,Sancocho67@$&,1,Demasiado trabajo,"Es muy complicado conectarla con mi computadora, con sus app y todo eso",26.1.3,2026-05-17T15:13:46-07:00,global,iOS App Store,0
14076261879,Darth Shawn,1,Horrible,Horrible,26.1.3,2026-05-17T14:33:56-07:00,global,iOS App Store,0
14076258229,87ship,1,Issuers,Having trouble setting up printer will not print,26.1.3,2026-05-17T14:32:29-07:00,global,iOS App Store,0
14076178747,indian falls,5,New to this,Very user friendly I love it and the shipment is fantastic,26.1.3,2026-05-17T14:01:07-07:00,global,iOS App Store,0
14076170249,instruz,1,Bad app and connection,Not able to change network,26.1.3,2026-05-17T13:57:50-07:00,global,iOS App Store,0
14076000706,Kasparov's nana,1,Useless instructions,Had issues setting up brand new printer . Instructions & customer support absolutely pointless. Managed to resolve my issues by watching 3rd party videos on YouTube .none of the information ( that resolved issues ) they gave is available from HP . Won’t recommend HP to anyone,26.1.3,2026-05-17T12:55:04-07:00,global,iOS App Store,0
14075876307,Harish1996,5,Hp scanner app,Very easy to use,26.1.3,2026-05-17T12:11:33-07:00,global,iOS App Store,0
14075642343,Marlboro Touch,1,Per carità!,Configurare una stampante è un impresa cosmica,26.1.3,2026-05-17T10:53:56-07:00,global,iOS App Store,0
14075607406,Celien Joi,5,Nice,Nice,26.1.3,2026-05-17T10:42:35-07:00,global,iOS App Store,0
14075578156,new moves,1,Sucks,The printer is hard to set up will not print from phone or laptop,26.1.3,2026-05-17T10:33:15-07:00,global,iOS App Store,0
14075548970,PeteHe,1,Sinnlos,Welchen Sinn hat diese App wenn ich mich immer wieder im Web neu anmelden muss um mein Abo einzusehen? Oder einfach nur Infos zur Druckerpatrone. Allein diese App ist ein Grund sich gegen einen HP Drucker zu entscheiden.,26.1.3,2026-05-17T10:23:59-07:00,global,iOS App Store,0
14075515400,Rumplestilzkin,3,Slow,Connection,26.1.3,2026-05-17T10:13:20-07:00,global,iOS App Store,0
14075264461,baby v 30,1,Won’t print,Horrible won’t connect to phone,26.1.3,2026-05-17T08:56:20-07:00,global,iOS App Store,0
14075257458,bengtlil,4,App,Mycket bra app.,26.1.3,2026-05-17T08:54:14-07:00,global,iOS App Store,0
14075224538,Yari Figueroa,5,Servicio,Super buen servicio,26.1.3,2026-05-17T08:44:19-07:00,global,iOS App Store,0
14075159498,Mike Camen,5,Never disappoints,"I am a HP dedicated customer!
Why? Over the years I haven’t had any issues whatsoever with my desktop, laptop, printers & service! HP assistants have always showed courtesy & professionalism! A hard thing to come by in the world today! Job well done!",26.1.3,2026-05-17T08:24:53-07:00,global,iOS App Store,0
14074875655,MRTSCB23,1,Beroerd,Vind mijn net gekochte printer niet eens en kan het dus niet gebruiken. Lekker dan... Koop geen HP printer met wifi want de app werkt niet eens.,26.1.3,2026-05-17T07:01:03-07:00,global,iOS App Store,0
14074614886,Pmug,5,Fixed!,"A recent upgrade has obviously fixed the remote printing problem, so glad I didn’t have to change printers!",26.1.3,2026-05-17T05:39:52-07:00,global,iOS App Store,0
14074589647,locavness,5,Scanning,Very efficient,26.1.3,2026-05-17T05:31:30-07:00,global,iOS App Store,0
14074500071,1001##,1,Schlechteste App,"Ständig geh5 irgendwas nicht. Scannen fehlt auf Übersicht.
App öffnet nicht selbstständig, muss immer erst kurz auf Konto gehen.
Von HP App echt den Kanal voll.",26.1.3,2026-05-17T05:01:01-07:00,global,iOS App Store,0
14074491294,Lena de Osasco,5,Passo a passo,Ótima,26.1.3,2026-05-17T04:57:53-07:00,global,iOS App Store,0
14073737833,Favian Vaz,5,Printer,Very good,26.1.3,2026-05-16T23:43:32-07:00,global,iOS App Store,0
14073019848,Kelasa,1,Dumbest Worst Printer,Hate this printer. Hate this printer.,26.1.3,2026-05-16T18:30:09-07:00,global,iOS App Store,0
14072616898,Nonabase,5,Perfeito,Perfeito👹,26.1.3,2026-05-16T15:42:46-07:00,global,iOS App Store,0
14072475106,RYANFINCH,3,Printer connection is unstable,Printer is great when it’s working but it can be unstable and often get disconnected from the network. When it does it’s not easy to re-connect it (confusing instructions).,26.1.3,2026-05-16T14:43:09-07:00,global,iOS App Store,0
14072286591,ACNH FANNNNN,1,Bad,"Had full WiFi. Reset the modem. Didn’t even work. App kept saying that my phone wasn’t connected to internet when I was trying to sign in, but when I browsed as guest it was working and connecting. Finding a 3rd party app now.",26.1.3,2026-05-16T13:28:42-07:00,global,iOS App Store,0
14072278748,WBB75,5,Pratique administrative !!,Je suis satisfaite quelques beug mes la situation est devenu superbe,26.1.3,2026-05-16T13:25:44-07:00,global,iOS App Store,0
14072272262,elliedanno,1,HP turning purchased devices into subscription-based “services” is bollucks.,"Seriously, a sneaky little ‘firmware upgrade’ that now forces users to purchase supplies ONLY from HP to use their own printers … will end up in class action litigation. 

And that, rightly so.",26.1.3,2026-05-16T13:23:14-07:00,global,iOS App Store,0
14072270380,GhorleyA,1,Half the time it works half the time it doesn’t,"I tried to print multiple pictures and it will do maybe two pictures and then time itself out. I have it on the same network, same printer, and it continually stops.",26.1.3,2026-05-16T13:22:32-07:00,global,iOS App Store,0
14072040958,Fredault,1,Soyez simple svp,"Trop limiter dans les réglages. Je passe par l’application HP je mets du papier photo A4, et quand je souhaite imprimer ma photo je ne trouve pas comment dire que c’est du papier photo HP. Il y a noté papier ordinaire ?!?
Hey les mecs faites tester vos app par des personnes lambda avant de les sortir pour le grand public et faite en sorte que ce soit simple de prima bord et ensuite si quelqu’un veut des réglages de pro alors une seconde interphase serait disponible.",26.1.3,2026-05-16T11:58:27-07:00,global,iOS App Store,0
14072027759,lacdoo,3,No va bien la impresora,La impresora no coge el papel,26.1.3,2026-05-16T11:53:53-07:00,global,iOS App Store,0
14071968451,Servpro Man,1,Sucks,As usual no one knows how to make a printer that works,26.1.3,2026-05-16T11:33:29-07:00,global,iOS App Store,0
14071763333,Reenie 321,1,Connectivity issues,HP wants you to constantly buy new warranties and subscriptions. You can’t just buy the printer and use it. It kicks you off the Wi-Fi and you can’t reconnect if you don’t buy the subscriptions.,26.1.3,2026-05-16T10:25:34-07:00,global,iOS App Store,0
14071705498,krishna Lohani,1,Ho,Not fast enough,26.1.3,2026-05-16T10:07:09-07:00,global,iOS App Store,0
14071474178,Snakeyes2010,1,No control options displayed,Cannot see any of the control options in latest update. Have to hunt and peck to figure out where the correct option is located. Why did you fix (actually break) what was not broken?!!!,26.1.3,2026-05-16T08:56:08-07:00,global,iOS App Store,0
14071398167,really 43901,1,Not happy,I was charged $43 and Im not certain why.  Two previous charges were $2.64 and it was for ink and paper.  The app will not let me sign in so I can contact someone to discuss this $43 unauthorized charge.  What is the contact information for customer service. As far as the printer it can become a hassle whenever the printer decide to stop printing. I have top of the line wifi service so HP should not have so many glitches.,26.1.3,2026-05-16T08:33:31-07:00,global,iOS App Store,0
14071367272,Strongberg,1,New printer keeps losing WiFi,"As above , had to factory reset printer and now can only print through app",26.1.3,2026-05-16T08:24:25-07:00,global,iOS App Store,0
14070859324,Alê werner,5,HP Smart Tank,"Impressionante a quantidade da impressão, realmente recomendo.",26.1.3,2026-05-16T05:54:57-07:00,global,iOS App Store,0
14070752073,Bonn Feuer,5,"Major improvements, functionality restored.","Finally, full and all 🤞normal services resumed, after the past year or so of intermittent access from iPad to 5200 All in ONE, and no access to scanner features 😡. I felt that HP were trying to persuade me to replace my 8 year old printer/scanner which was still fully functional when plugged into my 14 year old laptop, neither of which I can afford to replace. 
Thank you.",26.1.3,2026-05-16T05:20:46-07:00,global,iOS App Store,0
14070702051,ChrisRae79,1,How does this app have high reviews,I have a printer that’s only a few months old and it won’t locate it. I’ll have to get rid of it and purchase a different brand.,26.1.3,2026-05-16T05:04:08-07:00,global,iOS App Store,0
14070605375,P24ligali,2,Pas assez de propositions,Sa ne propose pas d imprimer recto verso cela est bien dommage,26.1.3,2026-05-16T04:30:30-07:00,global,iOS App Store,0
14070538340,Munirah Almazrou,3,Scanning feature is not there anymore!!,"I’ve been using this app since two years in my iPad, and I was using it mainly for drawings scanning.
Now they came up with a new feature, which is camera scanning and stopped the printer scanning!! Nothing compared to printer, scanning stability and clarity. I want to cry now!",26.1.3,2026-05-16T04:05:56-07:00,global,iOS App Store,0
14070486350,Septre,5,Overall rating,"A good quality printer that easily connects to phones, laptops etc. Cheap to initially buy but the inks are very expensive. If you print regularly, focus on ink costs.",26.1.3,2026-05-16T03:46:01-07:00,global,iOS App Store,0
14070221545,Vvngbmuh,1,App moet veel te lang zoeken naar verbinding,Matig was ooit beter,26.1.3,2026-05-16T01:55:58-07:00,global,iOS App Store,0
14070211577,Verkö,5,HP forever,HP funkar bra och har bra support.,26.1.3,2026-05-16T01:51:45-07:00,global,iOS App Store,0
14070200307,Nessa2187,1,Utilisation compliquée,J’ai du mal avec la configuration,26.1.3,2026-05-16T01:46:55-07:00,global,iOS App Store,0
14070163191,Ercules,5,Hp Envy 5032,Funziona tutto!,26.1.3,2026-05-16T01:30:58-07:00,global,iOS App Store,0
14070115748,caribe!!,1,La impresora es nueva e imprime cuando le da la gana,No manda bien la información,26.1.3,2026-05-16T01:10:26-07:00,global,iOS App Store,0
14069997810,LuisaLopand,5,Hp smart tank 583,"Me gustó mucho!! Es súper práctica de instalar, y lo mejor de todos ahorradora! La ameeeeeee",26.1.3,2026-05-16T00:18:23-07:00,global,iOS App Store,0
14069887547,HP Junk 1.0,1,Hardly ever connects,Only connects wirelessly if you restart the printer every time you want to print. Horrible!,26.1.3,2026-05-15T23:28:55-07:00,global,iOS App Store,0
14069875853,Moreawesomethanyouloserlol,1,awful,pointlessly complicated design: a printer needing wifi that somehow still constantly has connection issues and different ink cartridge types that have no functional difference,26.1.3,2026-05-15T23:23:26-07:00,global,iOS App Store,0
14069809332,cc-cruiser,1,Seit update auf ios26 nicht mehr nutzbar,"seit dem letzten iOS-Update (iOS 26.x) sind in der HP Smart App auf dem iPhone se (3) in der Ansicht der Druckaufträge sämtliche Beschriftungen in den Auswahlmenüs (z. B. Druckqualität, Anzahl der Kopien, Einstellungen, Skalierung usw) fehlen. Dadurch ist die App aktuell nicht nutzbar.",26.1.3,2026-05-15T22:52:32-07:00,global,iOS App Store,0
14069607691,Assigntech,1,Unpleasant experience,"It’s complicated to use the hp printer now from App, it was easy before . Simply scan from printer button and it’s goes straight to your email. Not user friendly anymore..",26.1.3,2026-05-15T21:18:15-07:00,global,iOS App Store,0
14069431551,bstew331,1,I will never buy another HP,It’s amazing how a company can make worse and worse products and apps to use with it.,26.1.3,2026-05-15T20:00:40-07:00,global,iOS App Store,0
14069426638,gjrew,1,Need drivers license scanning function,Can’t scan front and back on one page,26.1.3,2026-05-15T19:58:31-07:00,global,iOS App Store,0
14069367939,C. Déborah,5,HP a melhor!,"Gosto e recomendo. E o app fácil de usar, tem recursos interessantes. Desejo evolução constante. Obrigado!",26.1.3,2026-05-15T19:34:03-07:00,global,iOS App Store,0
14069060123,P. G. A,1,CONTROL,"These home printers are ridiculous, trying to nickel dime you on ink, also how much you print, there is no bypass to use the printer if you decide you don’t  want to be bothered with their ink service, it’s easier to register a $60,000 car then it is to register $133 printer",26.1.3,2026-05-15T17:32:11-07:00,global,iOS App Store,0
14068895549,lynnstroud,3,Freezes too much,I prefer the older version,26.1.3,2026-05-15T16:25:21-07:00,global,iOS App Store,0
14068877904,Jay@9!,1,Scan,The scanner is not scanning correctly,26.1.3,2026-05-15T16:18:11-07:00,global,iOS App Store,0
14068811167,Never*HP*Again,1,Doesn’t work,Trying to add a new printer and keeps telling me that “something went wrong”. The only thing that went wrong is buying an HP printer in the first place.,26.1.3,2026-05-15T15:50:32-07:00,global,iOS App Store,0
14068799824,Amr 01,5,Cool app and printer,The printer and the app are really easy to use and deal with,26.1.3,2026-05-15T15:45:53-07:00,global,iOS App Store,0
14068738952,kei fields,4,HP Printer,It is very bringer friendly and easy to use,26.1.3,2026-05-15T15:20:56-07:00,global,iOS App Store,0
14068597318,Laura Mora F.,1,No funciona,"No me deja imprimir mis archivos, es lenta e ineficiente",26.1.3,2026-05-15T14:23:24-07:00,global,iOS App Store,0
14068260928,LHP FL Person,5,Great,I preferred the old setup which allowed print to scan text,26.1.3,2026-05-15T12:15:39-07:00,global,iOS App Store,0
14068098639,Work saver for tax season,5,Simplicity,"The best mid cost printer I’ve used
Good quality and easy setup",26.1.3,2026-05-15T11:17:38-07:00,global,iOS App Store,0
14067877759,anyjardim,5,Top,10,26.1.3,2026-05-15T10:02:39-07:00,global,iOS App Store,0
14067660702,Heloisa.Rosa1945@gmail. com,5,Acrescentar impressora,"Demorei bastante mas consegui. 
Gosto muito desta impressora (HP Smart Tank 581)",26.1.3,2026-05-15T08:53:29-07:00,global,iOS App Store,0
14067635535,AditiLila,1,Horrible service,"No one to attend to case ID , horrible service , if issue comes up you will be stuck with a new printer as well , nobody calls back or reverts . Frequent issues come up with best of printers",26.1.3,2026-05-15T08:45:43-07:00,global,iOS App Store,0
14067538470,ChawklateK,1,poor,doesn’t work well at all,26.1.3,2026-05-15T08:16:23-07:00,global,iOS App Store,0
14067515609,"en el 4""",4,Ayuda trabajos,Documento Ok,26.1.3,2026-05-15T08:09:36-07:00,global,iOS App Store,0
14067433101,COjay719,2,Used to be good,Now it’s very glitchy all the time,26.1.3,2026-05-15T07:45:04-07:00,global,iOS App Store,0
14066804663,Gyhem,1,Ultra compliqué et peu fiable,"L’appli probablement la plus mauvaise jamais conçue, nous ne pouvons imprimer qu’en redémarrant l’imprimante… bref nul",26.1.3,2026-05-15T04:28:08-07:00,global,iOS App Store,0
14066795002,Shopping Qu33n,3,Ständig keine Verbindung,"An sich ist die App gut aufgebaut. Aber ständig findet es keine Verbindung zum Drucker. Das ist völlig random, mal geht’s, mal nicht. Je nach Laune.",26.1.3,2026-05-15T04:24:46-07:00,global,iOS App Store,0
