id,author,rating,title,content,version,date,country,platform,vote_count
14094990611,Csonidmd,5,Love this printer!,"This printer has been amazing. And the printer cartridges even better. I ordered the Evo ink cartridge’s and it makes me so happy that ordering those ink cartridges the money goes towards planting trees. And I ordered 4 ink cartridges and helped plan 7 trees! ❤️

It works great! And I love printing remote from my devices! It is so convenient! Recommend it to everyone!",26.1.3,2026-05-22T18:34:49-07:00,global,iOS App Store,0
14094296734,pogopidet,2,Organized crime,"HP is nothing more than organized crime. 
They hold your printer hostage they don’t care if it shuts down your business or your livelihood. 
They’ll shut your business down for $.99 they are predatory and they suck.",26.1.3,2026-05-22T13:56:52-07:00,global,iOS App Store,0
14094259183,AngryCustomer Worthless App,1,"The app isn’t all that impressive, and neither are HP’s products these days…","The app is not that great.  The most frustrating thing is the incessant sales pushing, but what makes it worse is an HP printer it won’t detect even though it’s a network printer and hardwired. 🙄 HP has really went downhill over the last couple of decades.",26.1.3,2026-05-22T13:42:17-07:00,global,iOS App Store,0
14094226907,Dave Unhappy With Prime,1,User,The software gives me problems often.  And I absolutely hate the subscription.,26.1.3,2026-05-22T13:29:57-07:00,global,iOS App Store,0
14094024219,deenie1956,5,The joy of ease,I am away from home for an extended period of time helping my mother recover. It is a joy I can still help run our company and print documents to our office from my out of state location. Thank you!,26.1.3,2026-05-22T12:15:27-07:00,global,iOS App Store,0
14093892523,Bittencourt Danielly,3,Minha impressora muitas vezes está dando erro,Erro na impressão,26.1.3,2026-05-22T11:29:04-07:00,global,iOS App Store,0
14093843157,Trujillo44,1,Scangone from my printer I've used it on for years,"So scam is now removed from my app, making scan worthless.  I can't update my email on the printer to send it that way, ridiculous that it's become impossible to use an expensive product I paid for.  Even worse that when you click app support in the App Store here, you can't even send an email to the developers, it just takes you to their worthless customer community page.",26.1.3,2026-05-22T11:12:07-07:00,global,iOS App Store,0
14093799658,epicuro,1,Cada vez peor,"Aparte de tener que ceder mi e-mail porque los HP quieren para imprimir mis propios documentos en mi propio domicilio y para uso particular, la aplicación funciona fenomenal para sacarte perras y suscripciones. Si quieres hacer uso de las herramientas para cosas tan absurdas como limpiar los cabezales, se queda pensando y se queda pensando. 
Y no voy a decir más porque no puedo.",26.1.3,2026-05-22T10:57:29-07:00,global,iOS App Store,0
14093782870,Doc'sDad,5,Where is the manual?,Have never gotten anything to print through “HP”.,26.1.3,2026-05-22T10:51:47-07:00,global,iOS App Store,0
14093727706,Vaaruca,1,It terrible,It’s terrible,26.1.3,2026-05-22T10:33:07-07:00,global,iOS App Store,0
14093561551,antennaevelynharry,1,Worst app ever,The loading screen takes forever and there is even no exit button on the loading screen. What a terrible UX,26.1.3,2026-05-22T09:38:46-07:00,global,iOS App Store,0
14093527335,Rombone,5,I love the product,"Once I got over the warranty not covering my 8030 OfficeJet printer, which was working fine, I am happy with the newer technology of my 8139e OfficeJet pro!!! The price what’s very competitive with other products.",26.1.3,2026-05-22T09:27:53-07:00,global,iOS App Store,0
14093486421,Cosmic017,1,What’s the Google Account to HP app issue?,I can give it no stars right now I would. I have not been able to send a mobile fax from the app using my Google Drive for months now. It’s not an issue on my end and no one has been able to find a resolution. Why pay for a service that I don’t have full access to.,26.1.3,2026-05-22T09:15:03-07:00,global,iOS App Store,0
14093386196,Camnis,4,Me gusta pero…,"Me gustaría que cuando quiero imprimir algo pequeño o de mitad de página, pudiéramos poner manualmente el tamaño y no estar perdiendo el tiempo tratando de ajustar un tamaño 2x2 in o el tamaño que sea ! 
Lo demás está genial",26.1.3,2026-05-22T08:43:58-07:00,global,iOS App Store,0
14093362025,movemy,1,Mise à jour pas cool du tout,Impossible de numériser depuis l imprimante. Seul une numérisation depuis photo m’est proposée. Et aucune solution dans aide et contact ..votre robot ne comprend pas les questions.,26.1.3,2026-05-22T08:36:33-07:00,global,iOS App Store,0
14093336185,DjCartel95,5,Great App,"Once I got the printer set up, everything was a piece of cake ! Thanks HP",26.1.3,2026-05-22T08:28:41-07:00,global,iOS App Store,0
14093197158,amykmarks,1,"Terrible app, service and printer. Don’t buy.",HP printers are the worst. Worst setup and server.,26.1.3,2026-05-22T07:47:18-07:00,global,iOS App Store,0
14093169827,Miz Teena,5,Excellent,"This service meets my needs above and beyond 
Thanks HP",26.1.3,2026-05-22T07:39:07-07:00,global,iOS App Store,0
14093160950,Fabri2022,5,Amazing Production,Love,26.1.3,2026-05-22T07:36:27-07:00,global,iOS App Store,0
14093056449,Michou56100,1,Nul,Nulle,26.1.3,2026-05-22T07:05:33-07:00,global,iOS App Store,0
14092990123,Witeric,1,Mise en route sans WIFI,Beaucoup de difficulté à installer sans WIFI,26.1.3,2026-05-22T06:45:47-07:00,global,iOS App Store,0
14092974604,melissadsvjg,1,Déçu,"Je paie un abonnement tous les mois en fonction du nombre de pages imprimées, mais mon imprimante HP fonctionne très mal. Elle imprime parfois dans le vide, parfois seulement la moitié des lettres du document. Résultat : je perds des pages de mon abonnement et je paie pour rien.

Le plus frustrant, c’est qu’il est quasiment impossible de joindre le service Instant Ink. J’ai du mal à comprendre s’il s’agit d’un défaut de l’imprimante ou d’un problème lié au service, surtout que l’impression fonctionne correctement de temps en temps.

Très déçue du service et du manque d’assistance.",26.1.3,2026-05-22T06:41:03-07:00,global,iOS App Store,0
14092969013,Maite Gis,5,Hp,Excelente app funciona muy bien aun estoy conociendo sus beneficios,26.1.3,2026-05-22T06:39:23-07:00,global,iOS App Store,0
14092840932,haieidjsjjwkw,2,How do you change settings???,Nothing seems to change them!,26.1.3,2026-05-22T05:59:46-07:00,global,iOS App Store,0
14092476424,Tony2753,1,Terrible,HP locks you into a invasive poor quality app in order to use the print you purchased,26.1.3,2026-05-22T03:52:40-07:00,global,iOS App Store,0
14092447045,G xxxxxxxx,1,HP sells cartridges not printers remember,The printer may not be expense but it burns through ink cartridges like nothing seen before. I have to change them every few prints !,26.1.3,2026-05-22T03:40:57-07:00,global,iOS App Store,0
14092311785,Majathi,3,Un peu compliqué,Pas si intuitif que ça,26.1.3,2026-05-22T02:43:04-07:00,global,iOS App Store,0
14092064057,ws141,1,Logga in för att skanna,Varför måste jag logga in för att skanna ett dokument med appen. Verkar helt idiotiskt. Sluta låsa funktionalitet bakom inloggning!,26.1.3,2026-05-22T00:43:52-07:00,global,iOS App Store,0
14092019475,Susi2526,5,Seamless,"This is such an awesome upgrade tot he precious app. Being able to scan and review the document and edit before it gets printed is fantastic. It saves paper, toner and time.",26.1.3,2026-05-22T00:21:26-07:00,global,iOS App Store,0
14091866168,Daniel  J King,5,Accidente,Worst magnificent to,26.1.3,2026-05-21T23:03:47-07:00,global,iOS App Store,0
14091780335,lillew8808,3,It’s Probably the operator,"Im probably getting old, and technology has always been a problem for me. But it seems as though it’s getting more and more complicated.",26.1.3,2026-05-21T22:20:35-07:00,global,iOS App Store,0
14091623135,Lopes Raissa,1,Nao conecta via Wi-Fi horrível,Estou a 3 horas tentando conectar com Wi-Fi e não funciona sendo que comprei nova a impressora,26.1.3,2026-05-21T21:02:40-07:00,global,iOS App Store,0
14091573594,roblimver,5,Excelente,Muy buena aplicación,26.1.3,2026-05-21T20:38:23-07:00,global,iOS App Store,0
14091190774,Ray17986,1,Doesn’t work. Doesn’t even allow me to view the set up instructions,Terrible app for a terrible product. Shame on you.,26.1.3,2026-05-21T17:52:06-07:00,global,iOS App Store,0
14090772045,A11n1ckn4mesaretaken,1,Horribly annoying.,"Connecting, printing, using diagnostic tools, everything is a huge pain and either never loads or works for a week and then you have to “go through the motions” again like you just bought it.",26.1.3,2026-05-21T14:56:57-07:00,global,iOS App Store,0
14090497355,sillysweet16,1,APP SUCKS,Title says it all. Planned obsolescence is the name of the game. Printer rarely connects. To heck with these guys. When my toner is all used up. I’ll switch to a different brand.,26.1.3,2026-05-21T13:08:08-07:00,global,iOS App Store,0
14090450482,AB Lifestyle,5,Scannen,Gaat niet snel maar werkt wel super via de app. Scherp beeld!,26.1.3,2026-05-21T12:50:26-07:00,global,iOS App Store,0
14090317077,ekelks44,1,hate it,have to go through an advert rubbish to open up a document. ugh,26.0.0,2026-05-21T12:01:17-07:00,global,iOS App Store,0
14090098067,Otilia1391,1,Hard to connect,Most complicated printer,26.1.3,2026-05-21T10:43:57-07:00,global,iOS App Store,0
14090080860,The boy Dan,1,Shocking,Printers not the best hard to work,26.1.3,2026-05-21T10:38:08-07:00,global,iOS App Store,0
14090046625,GPMtz,1,Scan WiFi set up,"Can’t get scanner started on MacBook Pro. Downloaded app, but only is for set up printer. 
WiFi would not set up through app.",26.1.3,2026-05-21T10:26:34-07:00,global,iOS App Store,0
14090002451,International couple,2,Stop camera scan,"Please disable camera scanner on my Smart Tank printer. I purchased the flat bed scanner for a reason. Now your app pushes me to camera scanner. This should be a choice, don’t force the camera on me.",26.1.3,2026-05-21T10:11:40-07:00,global,iOS App Store,0
14089971211,Wok anda,5,It is moderate,The printer work so slowly and has less feature is applicable,26.1.3,2026-05-21T10:01:12-07:00,global,iOS App Store,0
14089885862,EzzraS,5,Essential,This is one of my most essential apps when it comes to scanning documents.,26.1.3,2026-05-21T09:33:12-07:00,global,iOS App Store,0
14089617662,Mrs HRT,1,Printer,Very hard to get anything to print. Not user friendly. You should be able to tap print but instead there are different steps before printing and most of the time you can’t print.,26.1.3,2026-05-21T08:07:28-07:00,global,iOS App Store,0
14089596454,akulsoni100,1,Scanning,The app has been crashing for the past several weeks when you try to scan id cards.,26.1.3,2026-05-21T08:00:49-07:00,global,iOS App Store,0
14089434792,ellismommy,5,Printer review,Loooovvvveeee this printer it is peeerrrrfect!!!!!,26.1.3,2026-05-21T07:11:27-07:00,global,iOS App Store,0
14089262418,Ebertnel,5,Buena herramienta,Muy practica,26.1.3,2026-05-21T06:17:49-07:00,global,iOS App Store,0
14088835759,jxy0,1,Verbrechen an der Menschheit,Nutzerfeindlicher geht es kaum,26.1.3,2026-05-21T03:49:10-07:00,global,iOS App Store,0
14088550771,Ghgnhii,5,Gggh,Hggg,26.1.3,2026-05-21T01:39:57-07:00,global,iOS App Store,0
14087916242,pooja.u24,1,Never works,Waste of money and time . I am switching the printer,26.1.3,2026-05-20T20:22:47-07:00,global,iOS App Store,0
14087911798,el toro de acero,5,Excelente,Muy buena,26.1.3,2026-05-20T20:20:46-07:00,global,iOS App Store,0
14087894353,NYC Way wannabee,4,HP Envy,"It’s a good product for wfh. The app that goes with it is a bit clunky, but the printer itself (including its scanner) are excellent.",26.1.3,2026-05-20T20:12:51-07:00,global,iOS App Store,0
14087675848,Slycour,1,Bloquage constant,Je reçois un avis de blocage de papier à repetition et il n’y a rien qui bloque,26.1.3,2026-05-20T18:39:11-07:00,global,iOS App Store,0
14087619601,LegSOS,5,Fax,Wow awesome to be able to fax from this printer. Thanks HP truly the best in one place.,26.1.3,2026-05-20T18:16:17-07:00,global,iOS App Store,0
14087604051,Lashays Custom creations,1,Not happy,"I make shirts and create things so I’m always printing, but sometimes I’m not printing every time I go back to print after a few days I have to restart reprogram is always something wrong. I asked them was this the right printer for me when I had a home business they say yes it’s loud to make a lot of noise make a lot of movement just printing out one paper and it takes a while a very long time.",26.1.3,2026-05-20T18:10:02-07:00,global,iOS App Store,0
14087602161,Naramas22,4,Día 2,Parece fácil solo es cuestión de leer,26.1.3,2026-05-20T18:09:14-07:00,global,iOS App Store,0
14087225653,chrissy1975452020,5,Hp printer,This is by far the best printer I’ve ever own,26.1.3,2026-05-20T15:32:47-07:00,global,iOS App Store,0
14087130071,Lenisansal,1,Inútil,"De Smart això no té res.... Volen modernitzar les impressores i acaba sent una merda com un piano. No em deixa escanejar de cap manera i ho he provat tot. Es connecta amb l'ordinador quan li ve de gust, una total pèrdua de temps. Espero que acabeu amb aquesta aplicació del dimoni",26.1.3,2026-05-20T14:53:13-07:00,global,iOS App Store,0
14087124157,MarkusJackson,1,Scammers,"Do not buy this printer, or any HP printer that ends in an ""e"" (like the 8015e), unless you want your hardware held hostage by a monthly subscription.I signed up for their ""Instant Ink"" program, paid my monthly fees, and they shipped me ink cartridges. When I decided to cancel the membership, HP literally sent a remote signal over my Wi-Fi to digitally lock the physical cartridges inside my machine.I am currently staring at full ink cartridges that I paid for, but the printer refuses to print a single drop because HP blocked them. They don't sell you ink; they rent you the ""right to print pages."" The moment you stop paying their monthly fee, your ink becomes useless plastic trash.To make this printer work again, I either have to bow down and give HP my credit card to restart the subscription, or throw these perfectly full cartridges in the garbage and spend another $50+ on standard retail ink.This behavior should be illegal. Avoid HP at all costs. Buy a cartridge-free tank printer from Epson or Canon instead. HP has lost a customer for life",26.1.3,2026-05-20T14:50:47-07:00,global,iOS App Store,0
14086914366,我是瑞瑞虎,5,惠普打印机,非常好,26.1.3,2026-05-20T13:27:36-07:00,global,iOS App Store,0
14086838918,User9872047563,1,Horrible,This printer is not with buying.  Difficult to keep running and forces you to use their ink.  Stay away,26.1.3,2026-05-20T12:59:15-07:00,global,iOS App Store,0
14086602384,Rsmendes123,5,Impressora hp deskjet 2874,"Excelente, recomendo!!!",26.1.3,2026-05-20T11:34:22-07:00,global,iOS App Store,0
14086556708,Csalvo56,2,Perplesso,"Francamente pensavo che si adattasse meglio a Apple.
Drive non disponibili per MacOS. Non si adatta a l’ultimi aggiornamenti.
Da iPhone non riesco a centrare la stampa.",26.1.3,2026-05-20T11:18:27-07:00,global,iOS App Store,0
14086509332,abs tours,1,Bad app,"Bad app and hard to connect to printer,scanning facility is nightmare",26.1.3,2026-05-20T11:02:05-07:00,global,iOS App Store,0
14086475619,r921 Lark,1,Frustrated,Why can’t this brand new printer print?!,26.1.3,2026-05-20T10:50:31-07:00,global,iOS App Store,0
14086294047,mimì 75,5,MITICA!,App fantastica! Funziona benissimo e mi salva sempre quando mi ritrovo all’ultimo a dover stampare. In nemmeno un minuto avrai la tua fotocopia perfetta e pronta all’utilizzo.,26.1.3,2026-05-20T09:49:42-07:00,global,iOS App Store,0
14086284711,Aaodao,2,Unable to print from phone app,Difficult to use and temperamental app,26.1.3,2026-05-20T09:46:37-07:00,global,iOS App Store,0
14086270720,SargentCamelPup21,1,Overly complicated,See title,26.1.3,2026-05-20T09:42:00-07:00,global,iOS App Store,0
14086253061,Merco27400,1,Application nule,Nouvelle application Nule nous ne pouvons plus scanner normalement,26.1.3,2026-05-20T09:36:16-07:00,global,iOS App Store,0
14086233800,Maxi1002,3,Naja,Braucht ewigkeiten bis sie geladen ist Update macht es nicht besser,26.1.3,2026-05-20T09:29:58-07:00,global,iOS App Store,0
14086208406,lizbballin,5,Love it!!,This app is awesome! Makes it so convenient and easy to print and scan from a phone.,26.1.3,2026-05-20T09:21:41-07:00,global,iOS App Store,0
14086175381,Vikassh1234,1,Crash,App crashes if more than 50-60 pages scanned at once,26.1.3,2026-05-20T09:11:04-07:00,global,iOS App Store,0
14086174486,DisgruntledS,5,Great printer,The printer will cope with the thick card that I use for card making. Very responsive.,26.1.3,2026-05-20T09:10:47-07:00,global,iOS App Store,0
14086087418,hahnpezi,4,Gut aber geht noch besser,Funktioniert fast alles sehr gut. Beim Drucken von EMail Anhängen nur über App drucken vom IPhone aus möglich,26.1.3,2026-05-20T08:42:54-07:00,global,iOS App Store,0
14086027539,Terri Pedano,5,Scan & Fax,"So easy, even I can do
THANKS!!",26.1.3,2026-05-20T08:24:08-07:00,global,iOS App Store,0
14086023118,Balalalala👊🏻,5,Handy!,The amount of times I have used the camera scan is wild! It works so well when needing to quickly scan and email documents. Love that I have this ability when somewhere without a scanner!!,26.1.3,2026-05-20T08:22:48-07:00,global,iOS App Store,0
14085838096,Goto99$,1,Hp Dumb App,Pathetic primitive and complete garbage. I need to buy a laptop to configure WiFi on this dumb printer. Reason need a cable and laptop to configure it. User left miserably to super over smart HP developers. Why can’t you it easy to use. It’s better to go for canon.,26.1.3,2026-05-20T07:26:09-07:00,global,iOS App Store,0
14085725427,gailchet,4,Works well,Works well   Don’t know why says Load Paper when full?,26.1.3,2026-05-20T06:52:04-07:00,global,iOS App Store,0
14085708336,SadiPadReturner,1,no visible text on print settings menu,complete failure of an app. hp printers are the worst but also the only ones i can afford,26.1.3,2026-05-20T06:46:46-07:00,global,iOS App Store,0
14085596112,Da g baby,5,Useful,When ever I need to print something and someone else can’t do it I just go here and do it,26.1.3,2026-05-20T06:11:51-07:00,global,iOS App Store,0
14085568511,o caro,5,Perfeito,Excelente! Muito boa mesmo!!,26.1.3,2026-05-20T06:03:11-07:00,global,iOS App Store,0
14085451854,ThiagoMarchesi,4,App slow on opening,"It just takes time for the app to open. Sometimes I have to put my phone on airplane mode for the app to open. 
Otherwise, the app is great.",26.1.3,2026-05-20T05:25:25-07:00,global,iOS App Store,0
14085310489,Antoine 222,1,Mauvaise app,Application qui fonctionne très mal,26.1.3,2026-05-20T04:37:23-07:00,global,iOS App Store,0
14085296984,VS022,1,Honest review,How does this app show 5 stars? It doesn’t print if app is minimised on the phone. It reformats the MS doc so doesn’t print columns and margins are skewed. It’s clunky. It’s no way near five stars.,26.1.3,2026-05-20T04:32:34-07:00,global,iOS App Store,0
14085216402,Music is my love!,5,MobileOfficeJet250,"I ordered a mobile HP 250 printer, scanner copier. Perfect to travel with and amazing for flexible entrepreneurs and business owners",26.1.3,2026-05-20T04:03:21-07:00,global,iOS App Store,0
14085121181,MyNamePeter,2,Selten Drucker Benutzer,Wenn man wenig bzw. selten druckt hat man immer zuerst das Problem das der Drucker die Verbindung verloren hat und danach stellt man fest das die Druckerpatrone eingetrocknet ist - für wenig Drucker kann ich das Gerät von HP nicht empfehlen!,26.1.3,2026-05-20T03:25:36-07:00,global,iOS App Store,0
14084969264,Looklite,5,Very good,Very good,26.1.3,2026-05-20T02:18:29-07:00,global,iOS App Store,0
14084949295,Next's 1,5,Satisfecho,"Estoy muy contento con la app, tengo varios equipos, pero tengo gran descontento con los escáner que realiza, lo haga con el móvil o directamente desde cualquier dispositivo, las imágenes quedan movidas y poco legibles",26.1.3,2026-05-20T02:08:59-07:00,global,iOS App Store,0
14084935495,loreen2112@,1,Compliquée,"Application compliquée. Connexion à mon réseau wifi aléatoire. On nous martèle d’achats dé consommables. L’imprimante ne scanne pas, on est obligé de faire par écran de téléphone ce qui rend le document de mauvaise qualité.",26.1.3,2026-05-20T02:02:21-07:00,global,iOS App Store,0
14084805761,Aldrig mer HP!,1,Aldrig mer HP,Alltid super struligt och näst intill omöjligt att installera HP skrivare. Sista gången jag köper en HP. Finns heller ingen support att ringa. Så trött på HP!!!!!!,26.1.3,2026-05-20T00:58:16-07:00,global,iOS App Store,0
14084798137,Mimiozaa,2,Bizar instabiel qua printen,"Print soms wel, soms niet. Net waar die zin in heeft. Zelfde handelingen, zelfde wifi sterkte. Het maakt allemaal niks uit. Blijft wonderbaarlijk dat anno 2026 er geen stabiliteit in printers is.",26.1.3,2026-05-20T00:54:22-07:00,global,iOS App Store,0
14084388546,Shataya<3,5,The purchase,Great quality easy set up fast and reliable,26.1.3,2026-05-19T21:28:13-07:00,global,iOS App Store,0
14084387181,Gibrand10,5,La mejor marca,Excelente aplicación! 10/10,26.1.3,2026-05-19T21:27:31-07:00,global,iOS App Store,0
14084382195,barryctocket,1,Save your money and time,No help you need an Internet to be connected to this router. It will not answer questions and it’s just downright hideous.,26.1.3,2026-05-19T21:25:03-07:00,global,iOS App Store,0
14084311620,galvan p0w3r,5,The best printer,"Hello, how it prints",26.1.3,2026-05-19T20:50:25-07:00,global,iOS App Store,0
14084120989,Radray78,1,Horrible,"I setup a new printer after my last one couldn’t get out of a HP instant ink error loop. 
I tried printing a picture and it would only show Black and White. I tried adjusting the color option but it would show up on one picture and then missing the next. Also there was network issues.",26.1.3,2026-05-19T19:23:02-07:00,global,iOS App Store,0
14084085910,chalm01,1,Confusing,Oddly confusing. I'm not old but this made me feel old,26.1.3,2026-05-19T19:07:52-07:00,global,iOS App Store,0
14083906918,surgerY9881,5,Escaneo en hp smart tank 530,Funcional al 100%,26.1.3,2026-05-19T17:53:17-07:00,global,iOS App Store,0
14083888197,0227K,5,Great resource,It makes life a lot simpler.,26.1.3,2026-05-19T17:45:32-07:00,global,iOS App Store,0
14083724199,Wellzie70,5,Great app,Perfect for all your needs and easy to use,26.1.3,2026-05-19T16:36:45-07:00,global,iOS App Store,0
14083635483,Lucas22bolsonaro,4,Show,Muito boa,26.1.3,2026-05-19T15:59:11-07:00,global,iOS App Store,0
14083601760,High_on_candi,1,this company needs to be sued,"not only are they charging you just to use a printer that you purchased otherwise the printer won’t work, but they also make it impossible for you to update any information. I’ve been trying to update my address in my payment method for months now and the website does not work neither does the app. I really hope someone files a lawsuit against this company.",26.1.3,2026-05-19T15:44:46-07:00,global,iOS App Store,0
14083511442,mookzmom,5,So far so good!,"This app seems to be the only way to get my printer to print. Haven't used it much, but so far OK.",26.1.3,2026-05-19T15:06:52-07:00,global,iOS App Store,0
14083300800,Filtrino82,5,Semplice,Chiara e facile da usare,26.1.3,2026-05-19T13:42:09-07:00,global,iOS App Store,0
14083265812,Scrutator#1470,1,Have does not correctly show print ink status,I replaced a low black ink cartridge on my HP printer. The app continue to show the same low ink level as before.. The app on the browser showed the correct ink level. No way to refresh the iPhone app and get the correct information.,26.1.3,2026-05-19T13:28:34-07:00,global,iOS App Store,0
14083027436,Ahdhdjbchhd,1,Bad,Very bad experience with hp printer 2989. Very diff to connect and very irregular in connection.,26.1.3,2026-05-19T12:00:00-07:00,global,iOS App Store,0
14082926113,rrb19791998,5,HP APP,Reliable and very user friendly,26.1.3,2026-05-19T11:23:53-07:00,global,iOS App Store,0
14082886954,Chilin out,3,Buggy,"On servers devices fails to connect, printer is on WiFi  but refuses to connect",26.1.3,2026-05-19T11:10:14-07:00,global,iOS App Store,0
14082627846,constyyyy,5,Trabajo,Excelente aplicación,26.1.3,2026-05-19T09:42:00-07:00,global,iOS App Store,0
14082590422,junkapp4321,1,Won’t print,Cannot make this junk print anything,26.1.3,2026-05-19T09:29:33-07:00,global,iOS App Store,0
14082518643,Sir Seraphim,5,This is awesome,Very easy to use! I was scanning in no time. This is an all around app for my printer! Thanks,26.1.3,2026-05-19T09:06:07-07:00,global,iOS App Store,0
14082293951,KGFNP,5,KG the FNP🩺,"I’m you don’t have this HP sprinting… You’re missing out on an AMAZING service!
Get it NOW!  
I never have to go to the store to get ink cartridges or paper.  It all comes right to my door!… and, it’s waaay less!  Plus, the HP app lets me know when my ink and paper are low, and ship it to me according to my plan option.  If I’m traveling and need to print or scan something back at home, puff done just like that!  
GET IT NOW! 😊💕",26.1.3,2026-05-19T07:54:46-07:00,global,iOS App Store,0
14082232194,xanidue,5,HP Printer,"I have had this printer since forever at least 15+ years and have not had a problem with it printing. The print plan that I have is excellent I do go over my 20 pages because I teach Sunday School as well as Bible study so research and printing takes me well over 20 pages but it’s alright I can’t complain .
Thank you HP that makes products that last the rest of time.",26.1.3,2026-05-19T07:35:30-07:00,global,iOS App Store,0
