id,author,rating,title,content,version,date,country,platform,vote_count
13889230826,thjkjvc,1,App Doesn’t Connect,Spent a couple hours trying to get the app to recognize the printer in the dashboard. This Wahl calls with their tech-support team which will do everything they can or route you to their AI assistant. It’s a lot of work to actually get support anymore. Ultimately my printer never showed up in the dashboard. Returned to Costco.,26.0.0,2026-03-26T07:55:40-07:00,us,iOS App Store,0
13888774599,Azpicky,1,Difficulty in print jobs,"This printing process is unwieldy! Not user friendly. Too many steps. When I set this up it was a matter of making sure the Wi-Fi connection work and I could easily print with one basic click…however, today, I had to create an account, on the preview I couldn’t eliminated any pages I didn’t need..so I ended up with wasted pages and ink..I’m not happy with the many steps involved that weren’t there originally!",26.0.0,2026-03-26T05:28:49-07:00,us,iOS App Store,0
13887664898,Angry printer is so difficult,1,Difficulty,Difficulty,26.0.0,2026-03-25T20:49:45-07:00,us,iOS App Store,0
13887580193,Cuteeyes2222,5,Love it,Great,26.0.0,2026-03-25T20:08:56-07:00,us,iOS App Store,0
13887401586,☪️yesse,5,Excelente,😊😊,26.0.0,2026-03-25T18:49:42-07:00,us,iOS App Store,0
