id,author,rating,title,content,version,date,country,platform,vote_count
13917046629,Cindy@137,5,Hp打印机,我使用HP打印机后，非常喜欢，操作简单方便，功能性好，推荐大家使用！👍,26.0.0,2026-04-03T01:13:46-07:00,us,iOS App Store,0
13916601917,IsaacccArcos,5,Easy great to use,"Love this system, has worked perfectly, never had any problems of course beginning you have to learn about the whole app but once you got it, it's perfect",26.0.0,2026-04-02T21:32:27-07:00,us,iOS App Store,0
13915995638,get abother brandd,1,Cheap printer,I can’t get the damned scanner to work.,26.0.0,2026-04-02T17:02:52-07:00,us,iOS App Store,0
13915820188,msctalex,1,Works - doesn’t work,The wireless printing - print from anywhere works sometimes and sometimes it doesn’t - have to turn printer on/off to get connectivity even though printer is in same room as modem/router and I have the fastest and latest internet service the Comcast offers so there should not be any signal issues.,26.0.0,2026-04-02T15:46:28-07:00,us,iOS App Store,0
13915791742,Fattypack24,1,Scan,I thought I was able to scan the documents from printer to computer but that’s not happening for me,26.0.0,2026-04-02T15:34:11-07:00,us,iOS App Store,0
13915695471,Joeelito,1,Non Responsive,This is by far the worst printer I’ve ever dealt with. HP Deskjet 2827e is a total waste of money,26.0.0,2026-04-02T14:52:48-07:00,us,iOS App Store,0
13915676594,G Restoration,5,Great copies,Easy to work with HP!! Exelente!!,26.0.0,2026-04-02T14:44:47-07:00,us,iOS App Store,0
13915537727,"Yes, the Eyes Have It",5,First time setup with HP 7000,It took only 20 minutes to do the initial setup for my new printer.  I am not a technical expert by any means.  I love things that work well and are user friendly.  Thanks HP!,26.0.0,2026-04-02T13:47:01-07:00,us,iOS App Store,0
13915391181,PuddyPal,1,WTF,It shouldn’t be this hard! Brand new printer. Brand. New cartridges. Printing blank papers. Why can’t someone just talked to me. I’ve tried all the online fixes. Nothing works and it’s frankly pissing me off. Wasted time wasted money. You really should consider a phone number We can call free of charge. I’m taking the printer back now. I’ll never buy another HP computer.,26.0.0,2026-04-02T12:49:15-07:00,us,iOS App Store,0
13915168552,Señora Fortaleza,1,My own ink,Why you not let me print with my own ink?,26.0.0,2026-04-02T11:26:05-07:00,us,iOS App Store,0
13915051800,Chief Boyardee,1,Authorisation Errors,Error 4Ø1: deleted_client keeps surfacing like hæmorrhoids.  No clue ‘if’ other users face authorisation errors when connecting their ‘Google Drive.’,26.0.0,2026-04-02T10:44:43-07:00,us,iOS App Store,0
13914475670,Goobe67,1,Envy,Cannot change paper size from 5x7 to 4x6,26.0.0,2026-04-02T07:35:49-07:00,us,iOS App Store,0
13914265281,cccfffooww,2,Not user friendly and printing is light,Not user friendly and printing is light in color.,26.0.0,2026-04-02T06:29:45-07:00,us,iOS App Store,0
13913983426,ghavvard,5,Hp,this was a easy setup on my phone need to get another computer but great so far,26.0.0,2026-04-02T04:55:19-07:00,us,iOS App Store,0
13913097665,Mrdeelow,1,Updated app sucks,"New UI is not good, HP SMART, was way better and also took better scans which is about all I used it for.",26.0.0,2026-04-01T22:07:43-07:00,us,iOS App Store,0
13912921350,Emljim,5,Good app,Good app,26.0.0,2026-04-01T20:40:35-07:00,us,iOS App Store,0
13912869789,Fun yet too expensive,5,One Stop Shop!,"So far, so good. The app seems to function properly, and you can do almost anything—copy, ink, paper, order paper, printers, you name it, not to mention all these printing tools. They have a lot of options, you name it. Overall, I am impressed so far, though there’s a subscription involved. Other than that, give it a shot. What do you have to lose?",26.0.0,2026-04-01T20:16:24-07:00,us,iOS App Store,0
13912853672,patronisurs,5,Can do Errthang,"Love it , can do everything and get all printing , scanning and copying done in app👍🏼",26.0.0,2026-04-01T20:08:58-07:00,us,iOS App Store,0
13912416054,Drwnx.x,1,Pure hate,"I hate HP, expensive ink, monthly services for printing and ink, their printer had a lot troubles and you never know what is happening. The app always has troubles. Right know I have 1 hour trying to print something because they decided to update something that was working before.",26.0.0,2026-04-01T17:03:36-07:00,us,iOS App Store,0
13912134962,Marh21,5,Enjoying,"Enjoying the new printer so far.  Setup process is rather convoluted, and required a couple of phone calls.",26.0.0,2026-04-01T15:03:09-07:00,us,iOS App Store,0
13912117586,TellyTt 988,5,Happy,Amazing printer!,26.0.0,2026-04-01T14:55:43-07:00,us,iOS App Store,0
13911966436,$&8835?21&(7,3,The problem,It’s not the hardware(printer) is great it’s the forced cost of the ink. I can’t afford to use the printer !,26.0.0,2026-04-01T13:53:27-07:00,us,iOS App Store,0
13911925120,Master517,1,Horrible,"App does not want to work with basic functionality essentially acting just like a printer when it does. It’s slow, takes it time to load nothing and will say the printer isn’t connected to a network when it is.",26.0.0,2026-04-01T13:37:04-07:00,us,iOS App Store,0
13911867565,Fran Mike,3,Complicated,"What did you change? I used to be able to click on the icon to print and bingo it would print. Now I have to click on various notes, messages, icons to get a print. Now I also have to wait for the image to download. This is not acceptable! I want to be able click and print without going through all these add ons. I am not a happy camper!",26.0.0,2026-04-01T13:14:39-07:00,us,iOS App Store,0
13911280607,SVau2023,2,Stopped working,I was able to print sporadically for two weeks then all of a sudden my phone my computer couldn’t find the printer. I updated the information and still no progress. Very frustrating. Needed documents.,26.0.0,2026-04-01T09:46:14-07:00,us,iOS App Store,0
13911234742,Brea Bill,3,HP Smart Tank 3200,"Enjoying our new printer, but wish it had a USB port to plug in and pull documents and wish it could scan directly to my laptop without having to use an app on my phone. Also wish it had a higher scan feature above 300 to at least 600 dpi.",26.0.0,2026-04-01T09:31:14-07:00,us,iOS App Store,0
13909364622,Bleepless in Bellingham,1,Genuine HP ink cartridge not good enough for HP,"Bought a genuine HP ink cartridge, I used it to print a couple pages, and HP suddenly bricked it for being “HP Protected on another printer.” Clearly some sort of malfunction, but a pretty ridiculous “protection” feature, HP. And now I’ve lost half an hour troubleshooting this nonsense.

So, let’s get this straight—if I had purchased HP ink and my printer broke, and I bought another HP printer to use that same ink cartridge in (because the ink cartridges cost almost as much as a new printer, and why would I want to trash a brand new ink cartridge?), HP would refuse to use that cartridge because another HP printer had used it? That doesn’t “protect” anything but HP’s profits. 

Fellow consumers, when you think corporate greed, think HP. Gross way to treat your customers. Wasteful way to treat your product. Is it worth degrading yourself like this so you could pay your CEO $23 million dollars last year?",26.0.0,2026-03-31T21:33:40-07:00,us,iOS App Store,0
13908799976,aplusdrywall,5,"Easy, effective",Love it on computer or table,26.0.0,2026-03-31T17:37:15-07:00,us,iOS App Store,0
13908727431,Person CD12,2,Not intuitive,"Nothing is simple. Nothing is an obvious tap of the obvious button for the job you want. Recommend reading every piece of instructions they offer you, and even then you might not get it right.",26.0.0,2026-03-31T17:08:43-07:00,us,iOS App Store,0
13908585630,Kathy 4181,3,Internet connection,"I’ve had my printer a year and have loved it. Until this past week. I was in the middle of printing a project and it suddenly said unable to print- offline. I have been trying everything to get it working again - the HP site, Verizon’s site, my kids, you tube. I tried again doing the same things I had been doing and it started working - sort of. The blue internet light quit flashing but it still wouldn’t print. I was looking at different places in the printer program trying to see what to do next and it just started printing the same picture I had been trying to print for the last 5 days. I don’t know what I did so if this happens again, I won’t know how to fix it. Very frustrating.",26.0.0,2026-03-31T16:10:29-07:00,us,iOS App Store,0
13908510735,Grulla345,1,Can no longer access printers scanner,Through the app the option is completely gone and only allows scanning via your phones camera. Lame.,26.0.0,2026-03-31T15:39:14-07:00,us,iOS App Store,0
13908253120,$meowside,5,A printer,Stop asking for reviews nobody cares,26.0.0,2026-03-31T13:53:26-07:00,us,iOS App Store,0
13907943942,I in Ok,5,So easy to use and handy,"This app holds my small business together. I am able to print, scan, email and save important documents at any given moment. Im thankful for this handy solution HP provides.",26.0.0,2026-03-31T11:58:57-07:00,us,iOS App Store,0
13907887835,User this morning,1,HP app,"i just needed to scan a document in a hurry  instead this new app forced me to go through pages of ads, tried to get me to let hp collect info on what im scanning !  and then made it very very difficult to find the scan button.   its annoying and frustrating, and makes me want to buy a different printer

Once again I needed to use the app to scan and once again it was nearly impossible to find the button to scan by printer.  You perversely hid it like you were designing some video game.   Please put a visible scan button on page 1 of the app.",26.0.0,2026-03-31T11:39:23-07:00,us,iOS App Store,0
13907858179,LMR11,1,Trying to print,It’s ridiculous we have to pay for a subscription to print … then you can’t even print half the items you need,26.0.0,2026-03-31T11:29:15-07:00,us,iOS App Store,0
13907712391,OJAjayi,5,Functional,I’m happy with my purchase,26.0.0,2026-03-31T10:39:02-07:00,us,iOS App Store,0
13907180204,Retiredguy63,1,Too much,Asking for too much data and overly complex for casual user,26.0.0,2026-03-31T07:45:59-07:00,us,iOS App Store,0
13905568842,Eger/what my nickname is,1,Screw this printer,This printer sucks dude seriously,26.0.0,2026-03-30T20:11:18-07:00,us,iOS App Store,0
13905505024,DASRuffTuff,5,Laser Printer,Awesome printer. Does everything expected,26.0.0,2026-03-30T19:41:32-07:00,us,iOS App Store,0
13905359498,Leoulshume,5,Hp,Good,26.0.0,2026-03-30T18:37:20-07:00,us,iOS App Store,0
13905344760,Glorinette,1,Terrible Update,This is my first time ever writing a review on an app… I had HP since 2020 whoever designed the update for the current app 2026 its awful. There’s no nice way of putting this… why does the app navigate you to the website!?Doesn’t that defeat the purpose of an app!?,26.0.0,2026-03-30T18:31:03-07:00,us,iOS App Store,0
13905278780,Jprox79,1,HP Sucks,I just recently bought a HP printer and followed all the instructions to set this printer up and I still can’t connect or print. So to hell with HP and their product because they suck. I am so angry wihh th this printer I am going to just throw away. Waste of my time and money. F—- HP,26.0.0,2026-03-30T18:02:46-07:00,us,iOS App Store,0
13905270461,Dupped2,4,Difficult to add fingerprint on iPad,"Having to login manually, the ability to save password flashes away. Otherwise, a pretty good app.",26.0.0,2026-03-30T17:59:12-07:00,us,iOS App Store,0
13905015997,Juansegol,1,HP always disappointing!,I’m force to use HP products due to my company policies but printer are always same or poor quality than previos one and app as well as user experience so awful as always! HP incredible that you are still running business!,26.0.0,2026-03-30T16:08:50-07:00,us,iOS App Store,0
13904861831,Ohyeah2018,1,HP printer/scanner,Clunky and annoying,26.0.0,2026-03-30T15:01:27-07:00,us,iOS App Store,0
13904815504,Platita rápido,1,No responde la impresora,No ayuda en nada todo lo complica a pesar q compre ya las tintas originales,26.0.0,2026-03-30T14:41:32-07:00,us,iOS App Store,0
13904785798,Al97816,1,Garbage,The worst printer I’ve ever bought,26.0.0,2026-03-30T14:28:58-07:00,us,iOS App Store,0
13904742634,Sariope,1,Problem with fax,"I have used this app for mobile fax for years without problems. Since the latest update, I scan my documents with my phone camera and when I go to send the fax, there are no documents attached. I scan them again and now they are attached twice and I have to delete the second copy. This happens every time. Please fix this!!!",26.0.0,2026-03-30T14:11:04-07:00,us,iOS App Store,0
13904691763,AR-32,3,Ok,Sometimes it doesn’t want to connect,26.0.0,2026-03-30T13:50:21-07:00,us,iOS App Store,0
13904380633,Pacheco123,5,Hp,Good job hp,26.0.0,2026-03-30T11:50:45-07:00,us,iOS App Store,0
13904180525,Jackie Ohm,5,The best,Helps with all home office and administrative needs.,26.0.0,2026-03-30T10:40:07-07:00,us,iOS App Store,0
13904179763,nicolebush08,1,Nicole,Terrible the printer has never worked properly and I had to buy a new one for my business,26.0.0,2026-03-30T10:39:51-07:00,us,iOS App Store,0
13904088414,Apollo_Ace,5,Wifi Connection,"Hello
Printer & laptop(mobile phone too) are connected to my wifi & every time I need to print the printer never receives the print job right away. All devices show ‘Connected to HP officejet’ but I have to fit the printer to print. It’s beyond annoying.",26.0.0,2026-03-30T10:09:01-07:00,us,iOS App Store,0
13903739087,Joe Peapod,1,Update hosed scanning from printer. Bring back old app.,Update hosed scanning from printer. Bring back old app.,26.0.0,2026-03-30T08:13:11-07:00,us,iOS App Store,0
13903655156,bumperx2,5,Fantastic,Love it,26.0.0,2026-03-30T07:46:15-07:00,us,iOS App Store,0
13902654765,Zanagoca,5,Muy contento con esta adquisición HP buen trabajo.,Creo k tengo lo k nesecito Felicidades por permitirnos hacer nuestro trabajo más fácil. Gracias HP,26.0.0,2026-03-30T01:17:54-07:00,us,iOS App Store,0
13902507318,Urbana mom,1,Never again!,Never in a million years did I think it would be so difficult to get a small printer to connect to Wi-Fi and to print! It’s impossible to get it to stay connected to the Internet and it will not print any jobs from the HP printer app on my phone! Garbage and  waste of money!,26.0.0,2026-03-29T23:59:00-07:00,us,iOS App Store,0
13902265687,Yoummjj,1,Not easy to connect,This printer sucks,26.0.0,2026-03-29T21:45:19-07:00,us,iOS App Store,0
13902103416,ChellJones3,5,HP PRINTER,OMG! This app works soooo great. I love it already knowing I can print whatever in the presences of my own home yessssss! I’m in heaven right now. Thank you lord I’m grateful🙌🏽💜🩵💛,26.0.0,2026-03-29T20:20:48-07:00,us,iOS App Store,0
13901928477,LindorChris,1,dont get,you need a subscription to use your own printer that you paid for mind you,26.0.0,2026-03-29T18:58:30-07:00,us,iOS App Store,0
13901578817,Fuggit1,1,Picture size,It won’t let me resize my pics to make stickers,26.0.0,2026-03-29T16:23:53-07:00,us,iOS App Store,0
13901507575,Reyna_ySra,5,Mi favorita,Es la marca que más me ha gustado es mi favorita llevo 10 años dos diferentes modelos y nunca fallan ♥️,26.0.0,2026-03-29T15:52:28-07:00,us,iOS App Store,0
13901240734,😘🤪mmzm🤪😘,5,Amazing,You can see everything of your printer and very easy to use,26.0.0,2026-03-29T14:00:39-07:00,us,iOS App Store,0
13900971573,Fhreudbrh,1,Don’t buy hp printers,I don’t know if HP doesn’t have developers but the process to connect a printer can only be the result of the laziest people that have ever existed.,26.0.0,2026-03-29T12:19:48-07:00,us,iOS App Store,0
13899676959,Disappointed HP User 2,1,Frequently loses wi-fi connection,We’ve owned several HP printers. This is the first that frequently loses its will-fi connection. It also turns itself off on a daily basis. Disappointed with its performance.,26.0.0,2026-03-29T05:21:52-07:00,us,iOS App Store,0
13899470052,troybell1975,5,Printer,Excellent app for maneuvering your way for printing ideas,26.0.0,2026-03-29T04:02:25-07:00,us,iOS App Store,0
13898843697,Goodusername1234,1,HP LaserJet M182nw,"HP LaserJet M182nw 

Fails to detect printer on mesh Wi-Fi (Eero). Requires manual workaround not documented in app.",26.0.0,2026-03-28T23:09:50-07:00,us,iOS App Store,0
13898751416,Pearlicious29,5,Excellent printer,"I really love this digital remote printer. Most everything is done on my phone app. For color it takes a little while, but it’s reliable.",26.0.0,2026-03-28T22:22:42-07:00,us,iOS App Store,0
13898266361,amjice,4,iOS App (Updated),"App keeps getting better and better: the ability to select a 2-sided scan is great, thank you!

While the laptop version of the app is more robust, and understandably so,at I request that a 600 DPI scan control option be made available from within the app?

Firstly, the iOS app is far more convenient to control the scanner than it is to boot up the Windows laptop and use the more robust control interface.

Secondly, more and more travelers and security professionals recommend saving a digital copy in a folder structure in iOS and 600 DPI seems to be the norm for important documents like passports, driver licenses, birth certificates, etc. to capture the fine security details and other official imprints. 

It would only make sense, then, to use the iOS app and save directly into the iPhone / iPad than to separately boot up a laptop and then have to transfer it to the smartphone.

Thanks for your consideration of this important, often overlooked feature!

OLD: Would be great if the iOS Smart app can scan _both_sides_ from the document feeder like it already can using the Windows version of the app.  I can't imagine that would be a difficult feature to make available.",26.0.0,2026-03-28T18:42:55-07:00,us,iOS App Store,0
13897998667,booty2021,1,This sucks,This is not working and it want cut off when pushing the off button.,26.0.0,2026-03-28T16:52:11-07:00,us,iOS App Store,0
13897977970,Wormie- Ernie,5,Easy to use,User friendly!,26.0.0,2026-03-28T16:43:25-07:00,us,iOS App Store,0
13897861538,JaegerJedi,1,Pay Pay Pay,Spend $300 for printer and everything you do on it costs money. It’s like you rent the printer and don’t own it.,26.0.0,2026-03-28T15:54:11-07:00,us,iOS App Store,0
13897754719,Ásdís Sveins,1,Terreble,When you want to print a card it always asks me to change to photo paper 10x15 but not the size I want,26.0.0,2026-03-28T15:09:28-07:00,us,iOS App Store,0
13896955492,Jesúseneigma,5,Good,Perfect tools,26.0.0,2026-03-28T10:15:04-07:00,us,iOS App Store,0
13896800124,Popporez,3,HP7975 scan to email setup,Poor to no explanation on how to do this.  I want a shortcut on the printer control panel.  Directions are aimed at using a phone or tablet.  Not what I want,26.0.0,2026-03-28T09:25:58-07:00,us,iOS App Store,0
13896524644,xzabia1999,1,More work than necessary,"EVERY SINGLE TIME I have to use these printers there is some sort of issue. I have unplug re-plug and reprint several times. This is not efficient or worth the cost. 
It is 2026 technology should be smarter than this. 
Never mind the price of ink! 
If musk can blow up satellites from the desert, I should be able to print from my living room!",26.0.0,2026-03-28T08:02:29-07:00,us,iOS App Store,0
13895315755,MsByrd1,1,NO LONGER WORKS!,App no longer works to send faxes. It was previously fully functioning but not anymore.,26.0.0,2026-03-28T00:27:48-07:00,us,iOS App Store,0
13894820855,Pinky432432,1,"Hate, Hate, Hate It!","Printing a photo from my iPad, using this app is like an Act of Congress. There are way too many steps, it takes waaaayy too long and sometimes it works and sometimes it doesn’t. It’s extremely frustrating and unreliable. Hp has been disappointing across the board, to be honest. Live support has a 1 hour hold time only to get a rude rep in India you can barely understand. Oh how the mighty have fallen.",26.0.0,2026-03-27T20:22:16-07:00,us,iOS App Store,0
13894658193,Silvybar,1,Frustration,"I don’t have AirPrinter but I guess I do. Apparently I need an IP, which I don’t have to get off of AP. It’s sporadic when it pops up & it’s usually when I need to print.",26.0.0,2026-03-27T19:12:45-07:00,us,iOS App Store,0
13894411695,Lyndsey O,3,App,Can be a little difficult to use sometimes,26.0.0,2026-03-27T17:33:35-07:00,us,iOS App Store,0
13894369421,nancy 210,5,Impresora HP,Fácil de accesar y resultados excelentes,26.0.0,2026-03-27T17:16:38-07:00,us,iOS App Store,0
13894129912,Dry chicken,1,Horrible,Painful.,26.0.0,2026-03-27T15:39:24-07:00,us,iOS App Store,0
13893775073,La'Qual Mela,5,Simplicity At Its Finest,"This gadget is so easy to use, particularly for those who aren’t very tech savvy. It was very inexpensive, about $60 is my memory serves me well. I have the option of purchasing the fax feature, so my home office is very well equipped due to the simplicity of this printer/ scanner/ fax machines, the trinity, triple threat! You need to get this. I got mine from Walmart. It even has an app so I can print remotely!",26.0.0,2026-03-27T13:19:08-07:00,us,iOS App Store,0
13893668208,Zazaies,5,Easy set-up,Wonder ease in setting up printer,26.0.0,2026-03-27T12:39:35-07:00,us,iOS App Store,0
13893488660,Fv:/,1,Printer,"I have a lot of issues with this printer, never wants to connect and issues with printing quality, new cartridge in it and it prints streaky",26.0.0,2026-03-27T11:33:32-07:00,us,iOS App Store,0
13893003890,Papa Miguel Chou,1,Paper tray is a joke,Very difficult to get letters setting,26.0.0,2026-03-27T08:49:51-07:00,us,iOS App Store,0
13893000347,pdrph,1,Problem with connection,I always have to add my printer to the app in order to scan something,26.0.0,2026-03-27T08:48:43-07:00,us,iOS App Store,0
13891209815,Alright 123,1,Printer connection,Very difficult to use very difficult to connect,26.0.0,2026-03-26T20:17:48-07:00,us,iOS App Store,0
13891099759,Sad I bought this 4,1,Scanning and Copy options,"Very disappointed. There is no way to scan double sided documents to email, or copy 2 sided to 2 sided documents. 
It was difficult to configure the scan to email settings which required many calls to tech support, both from my protection plan as well as HP. Both were unsuccessful. I used AI to do it myself. 
I wish I knew the scan and copy options before I bought this printer. If I had known I never would have purchased.",26.0.0,2026-03-26T19:27:52-07:00,us,iOS App Store,0
13891099484,",(&473$:",1,Endless hell loop,"Endless loop of malfunction if it doesn’t get the printer setup right the first time and then it keeps spamming you to sign up for ink service so you can’t fix whatever has gone wrong.

Great job guys!",26.0.0,2026-03-26T19:27:44-07:00,us,iOS App Store,0
13890802530,Dee B Full,5,Severely Easy to Use,"The fact that I can scan and send a document, pdf-ready on my phone is extremely convenient. I love this app. I can’t express how this solves those on-the-fly problems. Thank you!",26.0.0,2026-03-26T17:24:17-07:00,us,iOS App Store,0
13890727326,highlifeja420,1,Hp deskjet 2827e,This printer sucks,26.0.0,2026-03-26T16:53:44-07:00,us,iOS App Store,0
13890529754,Mad as a b,1,Garbage products,HP deskjet 2855e is textbook designed obsolescence. So frustrating to set up I’d rather eat rotten trash than interact with this insultingly poor piece of equipment.,26.0.0,2026-03-26T15:32:38-07:00,us,iOS App Store,0
13890474965,changeit back i hate it here,1,Challenging,"I find the entire experience with the hp printer, the printer app, and computer absolutely terrible. I could email my local library the printing and drive 20 minutes to pick it up. Return home and still have less time involved.",26.0.0,2026-03-26T15:10:34-07:00,us,iOS App Store,0
13890397323,Auntie vintage,1,Printer fails every time I use it,Always something quirky. Every time,26.0.0,2026-03-26T14:39:47-07:00,us,iOS App Store,0
13890386728,Riverstreet,5,Works Great,"Seems to work as advertised so I am pleased about that. However, I wish I could save the scanned document directly to a file on my laptop.",26.0.0,2026-03-26T14:35:35-07:00,us,iOS App Store,0
13889802457,wsop reyna,5,Scanning with my HP DeskJet 4155e,Easy peasy.,26.0.0,2026-03-26T11:03:40-07:00,us,iOS App Store,0
13889705316,Jcre2026,1,Frustrating,"Purchased new printer.
Did not work out of the box. Hours of support 3 weeks new printer arrival. Now I cannot get my 1 year of ink on it.
Whole reason I purchased.",26.0.0,2026-03-26T10:30:34-07:00,us,iOS App Store,0
13889579368,Asia hhh,1,Printer says it’s connected to internet but isn’t,Printer says it’s received document and says it will print but then does nothing. DO NOT BUY HP PRINTERS,26.0.0,2026-03-26T09:48:56-07:00,us,iOS App Store,0
13889553567,Ywinters,1,Disgusted,"I spent so much money on this HP computer printer you have to buy the app. You have to buy their paper and you have to buy their ink from them even when you’re not out of ink or paper and you can get the paper for a fraction of what they charge and then they charge you per seat for every copy over 50 pages so I end up owing them $50 a month after paying for the printer and I own it I should be able to make as many copies as I want stay away from these printers. I don’t care about the Quality. It’s all the other Scam that they’re doing to us consumers and you can’t get out out of it. You cannot use the printer or the scanner if you do not pay a monthly subscription, it does not",26.0.0,2026-03-26T09:40:25-07:00,us,iOS App Store,0
